Question,A,B,C,D,Answer
کاندیدێکی مەکسیکی-ئەمریکییە و پێیوایە پێویستی بە بەشدارییەکی زۆری دەنگدەرانی مەکسیکی هەیە بۆ بردنەوەی هەڵبژاردنەکان. لە ئەنجامدا، بەڕێوەبەری هەڵمەتەکەی، بڕیار دەدات کە ستیکرێکی فرمێسکڕژێن بۆ هەر دەنگدەرێکی مەکسیکی تۆمار بکات، کە ناو و نووسینگەی پاڵێوراوەکەی تێدایە کە خۆی بۆی کاندید دەکات. لەبەر ئەوەی زۆرێک لە خەڵکی مەکسیکی ڕەسەن شارەزای خوێندنەوە و نووسینی ئینگلیزی نین، بەڕێوەبەری هەڵمەتی هەڵبژاردن پێی وایە زۆرێک لە دەنگدەران کێشەیان دەبێت لە نووسینی ناو و نووسینگەی کاندیدەکە لەسەر دەنگدان. لە ئەنجامدا، بەڕێوەبەری هەڵمەتەکە هەڵمەتێکی میدیایی فراوان ئەنجامدا بۆ ئاگادارکردنەوەی دەنگدەران لەسەر چۆنیەتی جێبەجێکردنی ستیکەرەکان بۆ دەنگدان. پێنج مانگ پێش هەڵبژاردن، بەرپرسێکی هەڵبژاردن لیژنەی هەڵمەتی پاڵێوراوەکان ئاگادار دەکاتەوە کە ستیکەرەکان پابەند نین بە یاسای ویلایەتەکەوە. لە نامەکەیدا، بەرپرسەکە ڕوونی دەکاتەوە کە بەرپرسانی هەڵبژاردنی ویلایەتەکان لەو بۆچوونەدان کە پێویستە بۆ دەنگدەران ناوی پاڵێوراوەکە بە مەرەکەب بنووسن. لەبەر ئەوە، ئەو دەڵێت کە ستیکەرەکان پابەندی داواکارییە یاساییەکان نین. سێ هەفتە دواتر، کاندیدەکە لە دادگای ناوچەی فیدراڵی سکاڵایەکی تۆمارکرد دژی بەرپرسانی هەڵبژاردنی ویلایەتەکان کە دەڵێن لێکدانەوەکەیان بۆ یاسای ویلایەتەکە پێشێلکردنی دەستووری ویلایەتە یەکگرتووەکانە. دەتوانن باشتر بێژەی بکەن؟ یا بە زاراوەیەکی تر؟ بێژە کردنی official بە ئیتالیایی,ڕێژەی بەشداریکردن لە دەنگدان لەنێو ئەو ئەمەریکاییە مەکسیکییانەی کە شارەزاییان لە زمانی ئینگلیزیدا نییە لە هەڵبژاردنەکانی ئەم دواییەدا کەمتر لە سەدا یەکی تەواوی ویلایەتەکە بووە.,یاسای ویلایەتەکان داوا دەکات کە هەر سندوقێکی دەنگدان قەڵەمێکی مەرەکەبی هەبێت بۆ ئاسانکردنی نووسین لە دەنگداندا.,لەبەر ئەوەی ژمارەیەکی زۆر لە دەنگدەران بە شێوەیەکی گشتی کاتی پێویست بۆ ژماردنی هەموو دەنگەکان زیاد دەکەن، پێویستە ئەم جۆرە دەنگدانانە بە شێوەیەکی یەکسان ئەنجام بدرێت.,ئەگەری ساختەکاری لە دەنگدان بە شێوەیەکی بەرچاو زیاترە لەگەڵ ستیکرە چاپکراوەکان.,D
"پیاوێک خاوەنی هۆتێلێکی تازە دروستکراوی شارێک بوو لە ۱۵ی ئازاردا، پیاوەکە پەیوەندییەکی تەلەفۆنی پێگەیشت لەلایەن فرۆشیارێکەوە کە دابەشکەری کەلوپەلی ئوتێلەکە بوو. فرۆشیارێک پێشنیاری فرۆشتنی هەزار ئامێری ئاگرکوژێنەوەی بۆ هۆتێلەکەی کرد فرۆشیارەکە بە پیاوەکەی ڕاگەیاند کە تێچووی ئاگرکوژێنەوەکە ۳۵،۰ دۆلارە (یان ۳۵ دۆلار بۆ هەر یەکێک) ، کە دەدرێت بە ۹۰ ڕۆژ دوای گەیاندن. بەڕێوەبەرایەتی ئاگرکوژێنەوەی هەولێر بەڵێنی داوە کە لە 15ی نیسان زیاتر نەبێت. لە 16ی ئازاردا، پیاوەکە تەلەفۆنی بۆ فرۆشیارەکە کرد و پێشنیارەکەی قبوڵ کرد. ڕۆژی دواتر، پیاوەکە ئەم یاداشتنامەیەی بۆ فرۆشیارەکە نارد: ""تکایە ئاگادارم بکەنەوە کە لە سەدا 15 داشکاندن دەکەم بۆ پارەدانی پارە حەوت ڕۆژ دوای دامەزراندن."" فرۆشیار نامەی پیاوەکەی وەرگرت لە ۲۰ی ئازار لە ڕێکەوتی ۱ی نیسان، فرۆشیار تەلەگرامێکی بۆ پیاوەکە نارد و گوتی: ""دیارە ئێمە گرێبەستێکی جێبەجێکراومان نییە. لە ۱۵ی نیسان یان لە هیچ کاتێکی دیکە ئاگرکوژێنەوەکان ناگەیەنم. ""ئەو پیاوەی سکاڵا لە دژی فرۆشیارەکە دەکات بەهۆی پێشێلکردنی گرێبەستەکەوە"" وەزارەتی دارایی لەبارەی یاسای ساختەکارییەوە ڕایدەگەیەنێت کام لەو قسانەی خوارەوە ڕاستترین قسەیە دەربارەی فرۆشیار؟",بەرگرییەکەی فرۆشیار ڕاستە، چونکە یاداشتنامەکەی پیاوەکە بەس نەبوو بۆ ئەوەی ئاماژە بەوە بکات کە گرێبەستێک دروستکراوە.,بەرگرییەکەی فرۆشیار ڕاستە، چونکە یاداشتنامەکەی پیاوەکە لەگەڵ مەرجەکانی پێشکەشکردنی زارەکی فرۆشیاردا ناگونجێت.,بەرگری فرۆشیار ڕاست نییە، چونکە فرۆشیارەکە وەڵامی یاداشتنامەکەی پیاوەکەی نەدایەوە لە ماوەیەکی گونجاودا.,بەرگریکردن لە فرۆشیار ڕاست نییە، چونکە لەژێر UCC یاسای ساختەکاری لە ڕێککەوتنی نێوان بازرگانەکاندا جێبەجێ ناکرێت.,A
پێش ئەوەی پێشنیارێک بۆ یەکخستنی دوو شارۆچکە لەسەر دەنگدان بدرێت، داواکاری گشتی ویلایەتەکە بۆچوونێکی ڕاوێژکاری بڵاوکردەوە و ڕایگەیاند کە ئەو ڕێوشوێنە بە بۆچوونی ئەو هیچ یاسایەکی یاسایی یان دەستووری پێشێل نەکردووە. دواتر پێشنیارەکە لەسەر دەنگدان دانرا و بە زۆرینەی دەنگ لە هەردوو شارەکە پەسەند کرا. دوای هەڵبژاردنەکە، بەڵام پێش ئەوەی یەکخستنەکە بە فەرمی ئەنجام بدرێت، دوو باجدەر لە یەکێک لە شارۆچکەکان دەستیان کرد بە سکاڵا بۆ ئەوەی داوای یەکگرتنەوە بکەن و هێرش بکەنە سەر دەستوورییەتی پێشنیارەکە. دادگاکە گەیشتە دادگای باڵای ویلایەتەکە و بە پێی یاسای فیدراڵی و دەستووری دۆزرایەوە. ئێستا سکاڵاکەرەکان داوای پێداچوونەوە بە ئەم دۆسیەیە دەکەن لەلایەن دادگای باڵای ئەمریکاوە. دادگا ده توانێت,لەبەر ئەوەی بەهۆی سەربەخۆییەوە بڕیاری لەسەر درا.,کەیسەکە نابیسترێت، بەڵام لەوانەیە ڕەوانەی دادگای فیدراڵی بکرێت.,گوێ لە کێشە فیدراڵییەکان بگرە، بەڵام ڕەتی بکەرەوە بڕیار لەسەر کێشەی دەوڵەت بدات.,پشت بە بۆچوونی پارێزەری گشتی ببەستە و گوێ لە کەیسەکە نەگرم.,A
پۆلیس لە لایەن کەسێکی باوەڕپێکراوەوە زانیاری پێگەیشتووە کە پیاوێک لە ماڵەکەی خۆیەوە کۆکەینی بەکارهێناوە. دواتر ئەفسەرەکان بەیاننامەیەکیان پێشکەش بە دادوەر کرد کە بارودۆخەکان دەخاتەڕوو کە ئەگەری هەیە هۆکاری دەرکردنی فەرمانی گەڕان نیشان بدات. دادوەر فەرمانی گەڕان بەدوای ماددە هۆشبەرەکان لە ناونیشانی پیاوەکە دەرکرد. پۆلیس چوونە ماڵی پیاوەکە و زەنگی دەرگاکەیان لێدا. کاتێک کەس وەڵامی نەدایەوە، پۆلیس چوونە ژوورەوە و چوونە ناو ماڵەکە. ئەوان لە ژوورەکانی نهۆمی یەکەم گەڕان و هیچ بەڵگەیەکی تاوانبارکەریان نەدۆزییەوە، پاشان چوونە دەرەوە و تێبینی دەروازەیەکی جیاوازیان کرد کە بەرەو نهۆمی دووەمی ماڵەکە دەڕوات. ئەوان لە پلیکانەکە سەرکەوتن و چوونە ژووری نوستن لە نهۆمی سەرەوە. لە ژوورەکەدا ئەفسەرەکان کۆکەینێکیان دۆزییەوە کە لەسەر جلوبەرگێک ڕاکشاوە. کاتێک ئەفسەرەکان بەردەوام بوون لە گەڕان لە ژووری نوستن، تۆمەتبارەکە چووە ژوورەکە. پۆلیس پرسیاری لە تۆمەتبارەکە کرد کە ئایا ئەو پیاوەیە. تۆمەتبارەکە خۆی ناسییەوە و بە پۆلیسی ڕاگەیاند کە ئەوان لە ژووری نوستنەکەی خۆیانن و نهۆمی دووەمی ماڵەکەیان داگیرکردووە. ئاماژەی بەوەشکردووە، ئەو پیاوە لە نهۆمی یەکەم نیشتەجێ بووە و شوێنی ژیانی لە شوێنی تۆمەتبارەکە جیاوازە. تۆمەتبارەکە بە تۆمەتی هەڵگرتنی کۆکاین دەستگیرکرا تۆمەتبارەکە داوایەکی پێشکەش کردووە بۆ ئەوەی کۆکەین لە بەڵگەدا وەرنەگیرێت. ده بێت ئه و تاوانباره ی,لەبەر ئەوەی فەرمانەکە ناوی تۆمەتبارەکەی نەناوە.,لەبەر ئەوەی فەرمانەکە ئاماژەی بەوە نەکردووە کە ناوچەکە بە شێوەیەکی دیاریکراو لێکۆڵینەوەی لەسەر بکرێت.,لەبەر ئەوەی پۆلیس بە شێوەیەکی گونجاو باوەڕی وابوو کە بەدوای ماڵی پیاوەکەدا دەگەڕێن کاتێک چوونە ناو شوێنی ژیانی تۆمەتبارەکە.,لەبەر ئەوەی فەرمانەکە ڕاست بوو و بە هۆکارێکی گونجاو دەرچوو.,C
"سوپەرمارکێتێک دوای دوو هەفتە لە داخستنی نوێکردنەوە کرایەوە لە بەیانییەکدا ژنێک لە بازاڕدا بوو کاتێک لەناکاو کەوتە خوارەوە و قاچێکی شکا. دوای ئەوە ژنەکە سکاڵای لەسەر سوپەرمارکێتەکە کرد بەهۆی برینی تایبەتییەوە. لە جل و بەرگەکەیدا، ژنەکە ڕایگەیاند کە کەوتۆتە سەر سەبەتەیەکی وێنەکێشان کە لە یەکێک لە ڕێگاکاندا ڕاکشابوو. لە دادگاییەکەدا، ژنەکە تەلەفۆنی بۆ کڕیارێکی دیکە کرد بۆ ئەوەی شایەتی بدات کە لە کاتی کڕیندا گوێی لە دەنگێک بوو ئاوڕی دایەوە و بینی ژنەکە کەوتە سەر زەوی. هەروەها ئاماژەی بەوەشکردووە کە چەند مەترێک لە قاچەکانی ژنەکەوە ڕاکشاوە. لە لێکۆڵینەوەیەکدا، کڕیارەکە لە گفتوگۆیەکی گفتوگۆدا بوو لەگەڵ پارێزەری سوپەرمارکێت. کاتێک پرسیاری لێکرا کە هۆکاری کەوتنە خوارەوەی ژنەکە چی بووە، کڕیارەکە شایەتی دا، ""کەوت لەبەر ئەوەی کەوتۆتە سەر سەبەتەکە."" ئەو دانی بەوەدا نا کە لە ڕاستیدا ئەو ژنەی لە گەشتەکەدا نەبینیوە. پارێزەرەکەی سوپەرمارکێتەکە لە کڕیارەکەی پرسی: ""ئەگەر ژنەکەت نەبینی لەسەر سەبەتەکە گەشت بکات، چۆن دەزانیت کە بەهۆی ئەوەوە کەوتۆتە خوارەوە؟"" کڕیارەکە وەڵامی دایەوە: ""لەبەر ئەوەی هاوڕێکەم کە لەگەڵم کڕیار بوو دواتر پێی گوتم کە ژنەکە گەشتی کردووە بەسەر سەبەتەکەدا."" پارێزەرەکەی سوپەرمارکێتەکە دوا وەڵامی کڕیارەکە دەداتەوە ئەگەر دادوەری دادگا بڕیارەکەی تۆمەتبارەکە ڕەت بکاتەوە و ڕێگە بە وەڵامی کڕیارەکە بدات بۆ وەستان، ئەوە لەوانەیە لەبەر ئەوە بێت",وەڵامی پرسیاری کڕیار لەلایەن سوپەرمارکێتەوە بانگهێشت کرا,وەڵامەکەی کڕیار لەسەر بنەمای زانیاری دەستی یەکەم بوو.,وەڵامەکەی کڕیارەکە ڕوونکردنەوەیەک بوو لەسەر تێڕوانینی ئەم دواییانە.,وەڵامەکەی کڕیارەکە هەستێکی هەستی ئێستا بوو.,A
"جوتیارێک لە ئێستادا خاوەنی تۆمارێکی زەوییە کە بە ""A"" ناسراوە، بەرزترینە لە دوو موڵکی دراوسێ لەسەر چیایەک. جوتیار خاوەنی پاکەتی ""B""یە، کە لە ""A"" کەمترە لە ""A"" لە کەناری چیاکە. لە ساڵی ۲۰۰۰، جوتیارەکە، کە خاوەنی هەردوو پارچە زەوییەکە بوو، سیستەمێکی ئاوی تایبەتی دروستکرد. ئەم سیستەمە لە بۆرییەکی ژێر زەوی پێکهاتبوو کە بەسەر هەردوو پارچە زەویەکەدا درێژ بووەوە. ئاوی پیس لە پاکەتی ""A"" بە سیستەمەکەدا ڕۆیشت بۆ جۆگەیەکی شارەوانی، کە لە خوارەوەی چیاکە بوو. لە ساڵی ۲۰۰۵، جوتیارەکە پاکەتی ""B""ی فرۆشت بە جوتیارەکە. جوتیارەکە هیچ ئاماژەیەکی بە سیستەمی ئاوەڕۆی جوتیارەکە نەکرد. لە هەر یەکێک لە خانووەکانی کێڵگەیەکی گەورەدا کە لەلایەن خاوەنەکانی خۆیانەوە داگیرکراون. لە ماوەی ڕابردوودا، ئاوی پیس دەستی کردووە بە بڵاوکردنەوەی بۆنێکی ناخۆش لە سەرانسەری پاکەتی ""B. "" لە ئەنجامدا جوتیارەکە سکاڵای لەسەر خاوەن کێڵگەکە کرد بە پێشێلکردنی نوێژ بۆ ئەو زیانانەی بەهۆی سیستەمی ئاوەڕۆوە دروست بوون. حوکمدان دەبێت بۆ",جوتیارەکە لەبەر ئەوەی کردەوەکە بۆ جوتیارەکە هیچ پەیماننامەیەکی تێدا نەبوو کە سنووردارکردنی بەکارهێنانی زەوییەکەی جوتیارەکە سنووردار بکات.,جوتیارەکە: لەبەر ئەوەی هۆکاری ڕاستەقینەی کردەوەکەی جوتیارەکە بۆ بێزارکردن دەبێت نەک بۆ سەرپێچیکردن.,جوتیارەکە: لەبەر ئەوەی سیستەمی ئاوەڕۆ هۆکاری نزیکەی زیانەکانی سکاڵاکە بوو.,جوتیارەکە لەبەر ئەوەی جوتیارەکە مافی ئەوەی نەبوو زەوییەکەی خۆی باشتر بکات بە شێوەیەک کە زیانی بە کەسێکی دیکە گەیاندووە.,B
ژنێکی تەمەن 54 ساڵ بەهۆی ئەوەی لە ماوەی سێ هەفتەی ڕابردوودا ئازاری تەقەکردنی لەسەر لووتی ڕاستی و چەماوەی هەبووە. هەر ئازارێک بۆ ماوەی یەک چرکە یان کەمتر بەردەوام دەبێت. ئازارەکە زۆرجار بەهۆی هەوای سارد، جووتکردن، هاندانی هەستپێکراو، و شوشتنی ددانەکانی دروست دەبێت. ئەو هیچ برینێکی لە دەموچاو و سەری نەبووە. مێژووی پزیشکی سەرسوڕهێنەرە بۆ سەرئێشەی گرژی، قەڵەوی و نەشتەرگەری لاڕێی گەدە. درێژییەکەی ۱۶۵ سانتیمەترە و کێشی ۶۲ کیلۆگرامە. BMI 23 کگم/م2 نیشانە گرنگەکان ئاسایین نەخۆشەکە ناتوانێت لە لای ڕاستی دەموچاوەوە دەست لێبدات. هیچ هەستێکی لاواز یان لەدەستدانی هەست نییە. پشکنینە جەستەییەکان هیچ ناڕێکییەک نیشان نادا. پشکنینی سی تی لەگەڵ و بەبێ جیاوازی هیچ نائاسایییەک نیشان دەدات. کام لەمانە گونجاوترین چارەسەری دەرمانە لەم کاتەدا؟,کاربامازەپین,لامۆتریگین,لێڤیتیراستام,Topiramate,A
لێکۆڵینەوەکان لەسەر زانستی شیزۆفرینیا ئاماژە بەوە دەکەن کە بۆماوەیی بۆ نەخۆشییەکە هەیە، بەڵام هۆکارەکانی دیکە بەشدارن. بەپێی زانیارییەکانی تۆ دەربارەی بابەتەکە، دیاری بکە کە کام لەم قسانەی خوارەوە هەڵەیە.,زیادەڕەوی لە دۆپامین یان هەستیاری بۆ دۆپامین لەوانەیە فاکتەرێکی بەشداربوو بێت.,نەخۆشە سپییەکان زیاتر نیشانەیان هەیە,ڕێژەی بێکاری لە جیهانی سێیەمدا 65٪ بووە.,ڕێژەی تووشبوون بە شیزۆفرینیا لەنێو ئەمریکییە ئەفریقییەکاندا کەمترە,D
کارمەندێکی کۆمپانیایەکی گەورەی بەرهەمهێنان ئیشەکە بە بێزارکەر دەزانێت و تەنها بەدوای کارەکەدا دەگەڕێت بۆ پارە. کارمەندەکە بە کەمترین شێوە کار دەکات و هاندەر نییە بۆیە بەرزترین بڕ یان کوالێتی باشتر بەرهەم دەهێنێت. بەپێی بیردۆزی دوو فاکتەری ئێف هێرزبێرگ، باشترین ڕێگا بۆ زیادکردنی پاڵنەری خودی ئەم کرێکارە ئەوەیە کە,زیادکردنی پارە و هاندەر بۆ بەرهەمداری زیاتر,دووبارە دیزاینکردنەوەی کارەکە بۆ پێشکەشکردنی تەحەدایەک و هەستکردن بە سەرکەوتن,زیادکردنی دەرفەت بۆ کارلێکی کۆمەڵایەتی ئاگادار,دابین کردنی کارمەندەکە بە لێشاوی کار کە شکۆیەکی گەورەتری هەڵگرتبێت,B
کام لەم ڕێنماییانەی خوارەوە بە باشترین شێوە باس لە نزیکبوونەوەی سێکسی لەگەڵ کڕیارەکانی چارەسەری پێشوو دەکەن؟,دەروونناسان قەدەغەکراون لە پەیوەندی سێکسی لەگەڵ کڕیارەکانی چارەسەری پێشوو لە هەر بارودۆخێکدا.,دەروونناسان قەدەغەکراون لە پەیوەندی سێکسی لەگەڵ کڕیارەکانی چارەسەری پێشوو بۆ ماوەی لانیکەم یەک ساڵ دوای کۆتایی هاتنی چارەسەرەکە.,دەروونناسان قەدەغەکراون لە هەبوونی پەیوەندی سێکسی لەگەڵ کڕیارەکانی چارەسەری پێشوو لە هەندێک بارودۆخی دیاریکراودا (بۆ نموونە کاتێک مەترسی بەکارهێنان هەیە).,دەروونناسان قەدەغەکراون لە پەیوەندی سێکسی لەگەڵ کڕیارانی چارەسەری پێشوو.,C
توێژینەوەیەک لەسەر بەدەستهێنانی زمانی دووەم دەریخستووە کە کام لەمانەی خوارەوە دەربارەی ئەو منداڵانەی کە زمانی دووەمیان هەیە,گه شه ی زانستییان دوا ده که ون,ئەوان ڕوونکردنەوەیەکی باشتریان هەیە لەو منداڵانەی کە دوو زمان نین,لێهاتوویی زمانی زگماکیان هیچ کاریگه رییه ک له سه ر ڕێژه ی به ده ست هێنانی زمانی دووه م نییه,ئەوان نەرمی زانستییان زیاد کردووە,D
لە چ بوارێکی پەیوەندییە گشتییەکاندا لەوانەیە لۆبیکردن لەخۆبگرێت؟,کۆمپانیا,پەیوەندی دارایی,کاروباری گشتی,بازرگانی بۆ بازرگانی,C
دەتوانن باشتر بێژەی بکەن؟ یا بە زاراوەیەکی تر؟ بێژە کردنی development بە ئیتالیایی,زاراوەی پەرەسەندن ئاماژە بەو بارودۆخە مرۆییە دەکات کە تێیدا ئازادی لە ترس و خواست هەیە. سەرچاوەی پێویست هەیە بۆ بەردەوامبوونی ژیان و ئەم ژیانە لەوانەیە لە وڵاتێکدا هەبێت کە ئازاد بێت لە هەڕەشە، یان هەڕەشەی تێگەیشتن لە پچڕانی کتوپڕ.,بۆ ئەوەی وەک پێشکەوتوو سەیر بکرێت، پێویستە نەتەوەیەک پێگەیەکی ئابووری و سیاسی دیاریکراوی لە سیستەمی دەوڵەتی جیهانیدا بەدەست هێنابێت. بەم شێوەیە پێوەرەکە بۆ ئەوەی دەوڵەتێکی پێشکەوتوو پێکبهێنێت پێناسە دەکرێت لەلایەن ئەو پێداویستیانەی کارلێککردن لەم سیستەمەدا هەیە.,پەرەسەندن ئامرازێکە بۆ چارەسەرکردنی ئەو نایەکسانییانەی کە هاوشانن لەگەڵ جیهانگیریی نیولیبراڵی. لەم چوارچێوەیەدا پەرەپێدان ئاماژە بە توانای دانیشتوانێک یان کۆمەڵگایەک دەکات بۆ بەکارهێنانی سەرچاوەکان بە شێوەیەکی کاریگەر و زیادکردنی چوستی لە بەرهەمهێنان و دابەشکردن و برەودان بە دابەشکردنی داهاتێکی یەکسانتر لەناو کۆمەڵگادا.,گەشەپێدانی کۆمەڵگایەک ئاماژەیە بۆ سیستەمی بەهای ئایدۆلۆژی و ئەخلاقی کە دانیشتوانەکەی بەشداری تێدا دەکەن. لە سیستەمی نێودەوڵەتی جیهانگیریدا ئەمە ئاماژەیە بۆ پەسەندکردنی ئایدۆلۆژیای دیموکراتی لیبراڵی ڕۆژئاوا و ئابووری بازاڕی ئازاد.,C
کام لە باشترینەکان باس لە یۆرۆسنتریزم دەکەن؟,یۆرۆسنتریزم (بە ئینگلیزی: Eurocentrism) شێوازێکە لە شیکردنەوە کە تیایدا کۆمەڵگە ئەوروپییەکان بەراورد دەکرێن لەگەڵ کۆمەڵگە نا ئەوروپییەکان بۆ بەرهەمهێنانی بەراوردێکی بێلایەنانە لە شایستە ڕێژەییەکانی هەر یەکێکیان.,یۆرۆسنتریزم شێوازێکی بیرکردنەوەیە کە تێیدا هەڵسەنگاندن و هەڵسەنگاندنی کۆمەڵگە نا ئەوروپییەکان لە ڕووی گریمانە کولتوورییەکان و لایەنگری ئەوروپییەکانەوە داپۆشراوە.,یۆرۆسنتریزم باس لە لێکۆڵینەوە یان کارێکی زانستی دەکات کە تەنها سیستەمی سیاسی یان ئابووری ئەوروپا ڕەچاو دەکات.,هه موو ئه و هه ڵبژاردنانه,B
کام لەم بیردۆزانەی خوارەوە تیشک دەخاتە سەر ئەوەی کە چۆن کۆمەڵگا دەتوانێت ئەو چالاکییانە ئەنجام بدات کە پێویستە بۆ پاراستنی سیستەم و سەقامگیری؟,فەنکشنالیزم,کارلێک,بیردۆزی هەڵبژاردنی عەقڵی,بیردۆزی ململانێ,A
کام لەم دۆکیومێنتانەی خوارەوە بەڵگەنامەیەکی کەسییە لەگەڵ چوونەژوورەوەی داخراو؟,"""پەڕەی سپی""",تۆمارە پزیشکیە نهێنیەکان,کتێبی ئەژمێری ماڵ,هاوبەشکردنی بێژەی business بە چیپ:,C
کام لەو خاڵانەی خوارەوە پشتگیری لە گفتوگۆی تاکلایەنەی ئەمریکا دەکەن؟,هێژمۆنییەکی چاکەخواز,بێ کاریگەری فرەلایەنی,ده سه ڵاتی ئه مه ریکا,هەموو ئەمانەی سەرەوە,D
ڤایرۆسی هێرپس چ نەخۆشییەک دروست ناکات؟,ئیفلیجی منداڵ,هەوکردنی مێشک,نەخۆشی گوازراوەی سێکسی,شێرپەنجە,A
ئامانجی لێکۆڵینەوەیەکی دووانەیی یان دوو دەمامکی دووانە بریتییە لە:,به ده ستهێنانی به راوردکردنی بابه ته چاره سه رکراو و چاره سه ر نه کراون,کەمکردنەوەی کاریگەریەکانی جیاوازی نموونە,دوورکەوتنەوە لە چاودێری و لایەنگری بابەت,دوورکەوتنەوە لە لایەنگری چاودێر و جیاوازی نموونەگرتن,B
