Question,A,B,C,D,Answer
"Gáleysi ökumanns við akstur slasaði annan ökumann alvarlega. The motorist var vitnað til að ferðast í röngum akrein og greitt sekt. Ökumaðurinn hafði stefnumörk aðeins $ 15,000 vegna ábyrgðar þriðja aðila á vátryggingarskírteini sínu. Eftir að hafa látið vátryggjanda ökumannsins í té fulla sjúkraskýrslu, alla sjúkrareikninga, sjúkraskrár og aðrar nauðsynlegar sannanir fyrir tjóni, krafðist tjónþoli vátryggingarmarkanna. Kröfuhafi tilkynnti að krafa um slæma trú yrði lögð fram ef stefnumörkin væru ekki greidd strax. Tryggingafélagið neitaði greiðslu án skýringa. Kviðdómur dæmdi hinum slasaða umsækjanda 200.000 dollara. Tjónþoli fékk undirritað framsal frá ökumanni af gáleysi sem veitti kröfuhafa öll réttindi sem ökumaðurinn kann að hafa haft gagnvart vátryggjanda sínum. Mun dómstóllinn líklega neyða tryggingafélagið til að greiða alla fjárhæð dómnefndar úrskurðar til slasaðs manns samkvæmt þessum staðreyndum?","Vátryggingarmörkin eru $ 15,000 og það er allt sem hægt er að innheimta af slasaða einstaklingnum, það er engin aðgerð vegna slæmrar trúar á vátryggingarsamningi.",Vátryggingafélagið braut í bága við undirskilinn sáttmála um góða trú og sanngjarna viðskiptahætti sem felst í hverjum vátryggingarsamningi og verður að greiða alla fjárhæð dómsins.,Slæm trú er persónuleg fyrir vátryggðan aðila og vátryggjanda hans að framsalið var ógilt og hinn slasaði á enga kröfu á að knýja vátryggjanda til greiðslu.,Tjónþoli verður að framfylgja öllum dómi sínum gegn ökumanni og má aldrei stefna vátryggjanda fyrir þá fjárhæð.,C
"Húsnæðisfélag átti landsvæði. Húsfélagið útbjó þróunaráætlun um að skipta lóðinni í 100 lóðir og búa til íbúðabyggð á reitnum. Sáttmálsyfirlýsingin stofnaði húseigendafélagið, stjórnsýslueiningu sem átti að sjá um og framfylgja þeim reglugerðum og takmörkunum sem sáttmálarnir kváðu á um. Ein af takmörkununum sem settar eru fram í sáttmálsyfirlýsingunni hljóðar svo: ""Það má aldrei nokkurn tíma reisa, leyfa eða viðhalda á neinum hluta landareignarinnar mannvirki sem hönnuð eru fyrir eða notuð sem krá eða staður til sölu eða framleiðslu á malti, vínríkum eða áfengum áfengum."" Sáttmálsyfirlýsingin var tilhlýðilega skráð og var innifalin í verkinu sem kennari tók þegar hann keypti lóð 62 í þróuninni. Kennarinn skráði strax verk sitt. Kennarinn leigði bókasafnsfræðingi húsnæði sitt til eins árs. Leigusamningurinn fól í sér sömu takmarkanir og fram komu í sáttmálayfirlýsingunni og í afsali kennarans. Bókavörðurinn byrjaði strax að selja áfengi í húsnæðinu í vikulegum ""eftirvinnutíma"" veislum. Húseigendafélagið höfðar mál gegn bókasafnsfræðingnum til heimtu skaðabóta. Hver af eftirfarandi eru bestu rökin fyrir bókasafnsfræðinginn?",Reglan í máli Spencers kemur í veg fyrir að bókavörðurinn sé ábyrgur.,Bókavörður er ekki í samningi við húseigendafélagið.,Bókavörðurinn er ekki í samskiptum við kennarann.,Aðrar framleiðslueiningar í næsta nágrenni eru notaðar í viðskiptalegum tilgangi.,B
"Til að hvetja til innritunar í háskóla veitir ríki undanþágu frá $ 200 fyrir skatta ríkisins fyrir þá sem eru í fullu námi við framhaldsskóla innan ríkisins. Kvenkyns námsmenn sem mæta í hálft starf hafa enn heimild til 100 $ undanþágu frá skatti, en karlkyns nemendur sem mæta í hálft starf hafa ekki lengur heimild til undanþágu frá skatti. Hver af eftirfarandi dregur nákvæmlega saman rétta reglu stjórnskipunarréttar varðandi skattfrelsi ríkisins fyrir nemendur sem skrá sig í hálft starf?",Undanþága frá skatti yrði ógilt sem synjun um réttmæta málsmeðferð.,Skattundanþágan yrði ógilt þar sem hún bryti í bága við jafnréttisákvæðið.,Skattamálinu yrði haldið uppi eins og það væri innan efnislegrar málsmeðferðar.,Skattamálinu yrði haldið uppi sem á valdi sveitarfélags til að skattleggja mismunandi stéttir manna ójafnt.,B
"Þessi lögsaga hefur eftirfarandi refsilög í gildi: ""Maður ber ekki ábyrgð á refsiverðri háttsemi ef hann skortir verulega getu til að meta óréttmæti háttsemi sinnar eða laga háttsemi sína að kröfum laga. "" Einn eftirmiðdaginn var ákærði að passa fimm ára frænda sinn. Þegar þeir hafi verið að leika sér fyrir utan hafi ákærði kastað boltanum yfir höfuð frænda síns og hann hafi runnið í götuna. Ósjálfrátt hljóp frændinn á eftir boltanum en hrasaði um ræsið og féll í götuna. Þegar hann hrasaði tognaði frændinn alvarlega á ökkla og gat ekki staðið upp. Andartaki síðar bakkaði stór sorpbíll og ók yfir frændann og drap hann. Þrátt fyrir að ákærði hafi séð vandræði frænda síns gerði hann enga tilraun til að bjarga honum. Í kjölfarið var ákærði ákærður fyrir manndráp af gáleysi. Við réttarhöldin bar ákærði að honum hefði verið svo brugðið þegar hann sá frænda sinn detta nálægt sorpbílnum að hann fraus og gat ekki hreyft sig fyrr en það var um seinan. Í framhaldi af framburði ákærða bar sérfróður vitni fyrir verjanda að viðbrögð af því tagi sem ákærði lýsir séu ekki óvenjuleg þegar sannarlega átakanlegur atburður á sér stað. Ef kviđdķmur trúir vitnisburđi sakbornings og sérfræđivitnis hans er besta vörn sakbornings hver af eftirfarandi?",Ákærði þjáðist af stundargeðveiki.,Ákærða skorti nauðsynlegt andlegt ástand til að fremja glæpinn.,Athafnaleysi ákærða hafi ekki verið af fúsum og frjálsum vilja.,Refsiábyrgð stefnda hafi fallið niður hjá ökumanni vörubifreiðarinnar.,C
"Frambjóðandi sem skrifar inn er mexíkósk-amerískur og er þeirrar skoðunar að hann þurfi mikla aðsókn mexíkóskra kjósenda til að vinna kosningarnar. Í kjölfarið ákveður kosningastjóri hans að senda öllum skráðum mexíkóskum kjósendum rifinn límmiða með nafni frambjóðandans og embættinu sem hann býður sig fram fyrir. Þar sem margir innfæddir Mexíkóar eru ekki færir í að lesa og skrifa ensku telur kosningastjórinn að margir kjósendur muni eiga í erfiðleikum með að skrifa nafn og skrifstofu frambjóðandans á kjörseðilinn. Í kjölfarið hefur kosningastjórinn ráðist í umfangsmikla fjölmiðlaherferð til að upplýsa kjósendur um hvernig eigi að setja límmiðana á kjörseðilinn. Fimm mánuðum fyrir kosningar tilkynnir kosningafulltrúi kosninganefnd frambjóðandans að rifnir límmiðarnir séu ekki í samræmi við lög ríkisins. Í bréfi sínu útskýrir embættismaðurinn að kosningafulltrúar ríkisins séu þeirrar skoðunar að nauðsynlegt sé fyrir væntanlega kjósendur að skrifa nafn frambjóðandans með bleki. Því kemst hún að þeirri niðurstöðu að límmiðarnir uppfylli ekki lögbundnar kröfur. Þremur vikum síðar höfðaði frambjóðandinn mál í alríkishéraðsdómi gegn kosningafulltrúum ríkisins þar sem því var haldið fram að túlkun þeirra á lögum ríkisins bryti í bága við stjórnarskrá Bandaríkjanna. Hvert af eftirfarandi, ef það er staðfest, setur fram sterkustu stjórnskipulegu rökin sem styðja túlkun kosningafulltrúans á lögunum?",Kjósendaþátttaka meðal skráðra mexíkóskra amerískra kjósenda sem skortir enskukunnáttu hefur verið minna en 1% af heildarfjölda ríkisins í nýlegum kosningum.,Lög ríkisins krefjast þess að hver kjörklefi sé búinn blekpenna til að auðvelda ritun atkvæða.,Þar sem mikill fjöldi innskriftaratkvæða lengir yfirleitt þann tíma sem þarf til að telja öll atkvæði er nauðsynlegt að greiða slík atkvæði með samræmdum hætti.,Möguleikinn á kosningasvindli er verulega meiri með forprentuðum límmiðum.,D
"Maður nokkur var eigandi nýbyggðs hótels í borg. Þann 15. mars fékk maðurinn símtal frá sölumanni sem var dreifingaraðili hótelbúnaðar. Sölumaðurinn bauðst til að selja manninum 1.000 slökkvitæki fyrir hótelið sitt. Sölumaðurinn sagði manninum að kostnaður við slökkvitækin væri $ 35,000 (eða $ 35 stykkið), sem greiðist 90 dögum eftir afhendingu. Sölumaðurinn lofaði að láta setja upp slökkvitækin eigi síðar en 15. apríl. Þann 16. mars hringdi maðurinn í sölumanninn og samþykkti tilboðið. Daginn eftir sendi maðurinn eftirfarandi minnisblað til sölumannsins: ""Vinsamlegast athugið að ég skal taka 15 prósent afslátt af staðgreiðslu sjö dögum eftir uppsetningu. "" Bréf sölumannsins barst manninum 20. mars. Þann 1. apríl sendi sölumaðurinn skeyti til mannsins þar sem hann sagði: ""Það er augljóst að við erum ekki með aðfararhæfan samning í gildi. Ég mun ekki afhenda slökkvitækin 15. apríl eða á öðrum tíma. ""Maðurinn höfðar mál gegn sölumanninum fyrir samningsbrot. Sölumaðurinn fullyrðir vörn laga um svik samkvæmt UCC. Hver af eftirfarandi er nákvæmasta fullyrðingin varðandi varnir sölumannsins?",Málsvörn sölumannsins er réttmæt þar sem minnisblað mannsins nægði ekki til að gefa til kynna að til samnings hefði verið stofnað.,Málsvörn sölumannsins er gild þar sem minnisblað mannsins var ekki í samræmi við skilmála munnlegs tilboðs sölumannsins.,Málsvörn sölumannsins er ekki gild þar sem sölumaðurinn svaraði ekki minnisblaði mannsins innan hæfilegs tíma.,"Vörn sölumannsins er ekki gild, því samkvæmt UCC gilda lögin um svik ekki í samningum milli kaupmanna.",A
"Áður en tillaga um sameiningu tveggja bæja var borin undir atkvæði gaf ríkissaksóknari út ráðgefandi álit þar sem fram kom að ráðstöfunin bryti að hennar mati ekki í bága við ákvæði laga eða stjórnarskrár. Eftir það var tillagan borin undir atkvæði og hlaut yfirgnæfandi meirihluta atkvæða hjá kjósendum í báðum bæjum. Eftir kosningarnar, en áður en sameiningin hafði formlega farið fram, höfðuðu tveir skattgreiðendur frá einum bæjarins mál til að samþykkja sameininguna og réðust þannig gegn stjórnskipulegu gildi tillögunnar. Málið fór til hæstaréttar ríkisins og reyndist vera stjórnarskrárbundið bæði samkvæmt ríkis- og alríkislögum. Stefnendur leggja nú fram kröfu um að fá málinu áfrýjað til Hæstaréttar Bandaríkjanna. Dómstóllinn getur","ekki heyra málið, vegna þess að það var ákveðið á sjálfstæðum forsendum ríkisins.","ekki taka málið fyrir, en gæti fengið það flutt til alríkishéraðsdóms.","heyra sambandsmálin sem um ræðir, en neita að úrskurða um ríkismálið.",treysta á ráðgefandi álit ríkissaksóknara og ekki taka málið upp á eigin forsendum.,A
"Lögreglu barst ábending frá áreiðanlegum heimildarmanni um að maður væri að selja kókaín af heimili sínu. Lögreglumenn lögðu síðan fyrir sýslumann yfirlýsingu þar sem settar voru fram aðstæður sem sýndu líklegt tilefni til útgáfu leitarheimildar. Lögreglustjórinn gaf út leitarheimild vegna fíkniefna á heimilisfangi mannsins. Lögreglumenn fóru að heimili mannsins og hringdu dyrabjöllunni. Þegar enginn svaraði braust lögreglan inn og fór inn í bústaðinn. Þeir leituðu í herbergjunum á fyrstu hæð og fundu engin saknæm sönnunargögn, gengu síðan út og tóku eftir sérinngangi sem lá upp á aðra hæð íbúðarinnar. Þeir fóru upp stigann og inn í svefnherbergi á efri hæðinni. Inni í herberginu fundu lögreglumennirnir birgðir af kókaíni liggjandi á kommóðunni. Þegar lögreglumennirnir héldu áfram leit sinni í svefnherberginu fór ákærði inn í herbergið. Lögreglan spurði ákærða hvort hann væri maðurinn. Ákærði bar kennsl á sig og sagði lögreglu að þau væru í svefnherbergi hans og hann á annarri hæð íbúðarinnar. Ákærði skýrði frá því að maðurinn byggi á fyrstu hæð og vistarverur hans væru aðskildar frá vistarverum ákærða. Engu að síður var ákærði handtekinn og ákærður fyrir vörslu kókaíns. Ákærði hefur lagt fram kröfu um að kókaínið verði ekki lagt fram sem sönnunargagn. Tillaga stefnda ætti að vera","veitt, vegna þess að heimild ekki nafn stefnda.","veitt, vegna þess að heimildin tiltók ekki með sérstökum hætti svæðið sem leita á.","neitað, þar sem lögreglan taldi sig hafa verið að leita á heimili mannsins þegar þeir komu inn í vistarverur sakbornings.","hafnað, vegna þess að handtökuskipunin var gild og gefin út með sennilegri ástæðu.",C
"Stórmarkaður var nýbúinn að opna aftur eftir tveggja vikna lokun vegna endurbóta. Að morgni enduropnunar var kona að versla þegar hún féll skyndilega og fótbrotnaði. Í kjölfarið kærði konan matvörubúðina fyrir líkamstjón. Í jakkafötunum hélt konan því fram að hún hefði hrasað um málningarfötu sem hafði legið á einum ganginum. Við réttarhöldin hringdi konan í annan viðskiptavin til að bera vitni um að á meðan hann var að versla hafi hann heyrt dynk, snúið sér við og séð konuna falla á gólfið. Hann bar einnig fyrir dómi að hann hefði séð tóma málningarfötu liggja nokkra metra frá fæti konunnar. Við yfirheyrslur lenti viðskiptavinurinn í rifrildi við lögmann stórmarkaðarins. Þegar viðskiptavinurinn var spurður álits á því hvað olli falli konunnar svaraði hann: ""Hún datt vegna þess að hún datt á fötuna."" Hann viðurkenndi hins vegar við yfirheyrslur að hafa í raun ekki séð konuna hrasa á fötunni. Lögfræðingur matvörubúðarinnar spurði viðskiptavininn síðan eftirfarandi spurningar: ""Ef þú sást ekki konuna hrasa á fötunni, hvernig veistu að hún datt vegna þess?"" Viðskiptavinurinn svaraði: ""Vegna þess að kærastan mín sem var að versla með mér sagði mér seinna að hún hefði séð konuna hrasa um fötuna. "" Lögfræðingur stórmarkaðarins reynir að slá síðasta svar viðskiptavinarins. Ef dómarinn hnekkir tillögu stefnda og leyfir svari viðskiptavinarins að standa, mun það líklega vera vegna þess að",Svari viðskiptavinarins var boðið með spurningu lögmanns stórmarkaðarins.,Svar viðskiptavinarins var byggt á fyrstu hendi þekkingu.,Svar viðskiptavinarins var yfirlýsing um nýlega skynjun.,Svar viðskiptavinarins var núverandi tilfinning.,A
"Búgarður er nú eigandi landspildu sem er tilnefnd sem ""A."" Það er hærra af tveimur nálægum eignum á fjalli. Bóndi er eigandi spildu ""B"" sem er neðar en ""A"" í fjallshlíðinni. Árið 2000 byggði búgarðurinn, sem átti báðar landspildurnar, einkarekið frárennsliskerfi. Þetta kerfi samanstóð af neðanjarðarleiðslu sem náði yfir báðar landspildurnar. Skólp frá landspildu ""A"" rann í gegnum kerfið í fráveitu sveitarfélagsins sem var staðsett neðst í fjallinu. Árið 2005 seldi búgarðurinn landspildu ""B"" til bóndans. Í afsalinu til bóndans var hvergi minnst á frárennsliskerfi bóndans. Staðsett á hverri bögglunum eru stór heimili í búgarðsstíl sem viðkomandi eigendur búa í. Undanfarið hefur skólpræsið byrjað að gefa frá sér óþægilega lykt yfir spildu ""B."" Í kjölfarið kærði bóndinn búgarðinn í leyfisleysi og bað um skemmdir af völdum frárennsliskerfisins. Dómur ætti að vera fyrir","Búgarðurinn, vegna þess að afsalið til bóndans innihélt enga sáttmála sem takmörkuðu notkun búgarðsins á landinu.","bóndinn, vegna þess að réttur málstaður bóndans væri til óþæginda, frekar en óleyfi.","bóndans, vegna þess að frárennsliskerfið hafi verið nærtæk orsök tjóns stefnanda að lögum.","bóndinn, vegna þess að búgarðurinn hafði ekki rétt til að bæta eigið land sitt á þann hátt sem olli öðrum skaða.",B
"54 ára gömul kona kemur á skrifstofuna vegna þess að hún hefur haft slitróttan verk yfir hægri kinn og kjálka undanfarnar 3 vikur. Hver þáttur af sársauka varir í 1 sekúndu eða minna. Sársaukinn er oft af stað með köldu lofti, tyggja, áþreifanleg örvun, og bursta tennurnar. Hún hlaut enga áverka á andliti eða höfði. Sjúkrasaga er merkileg fyrir spennuhöfuðverk, offitu og magahjáveituaðgerð. Hún er 165 cm (5 fet 5 tommur) á hæð og vegur 62 kg (137 lb); BMI er 23 kg / m2. Lífsmörk eru eðlileg. Sjúklingurinn þolir ekki snertingu hægra megin í andliti. Það er engin andliti máttleysi eða tap á tilfinningu. Afgangurinn af læknisskoðuninni sýnir engin frávik. Tölvusneiðmynd af höfði með og án birtuskila sýnir engin frávik. Hver af eftirfarandi er heppilegasta lyfjameðferðin á þessum tíma?",Karbamazepín,Lamótrigín,Levetiracetam,Tópíramat,A
Rannsóknir á orsökum geðklofa bentu erfðafræðilega tilhneigingu til ástandsins en aðrir þættir taka þátt. Út frá þekkingu þinni á viðfangsefninu skaltu bera kennsl á hver af eftirfarandi fullyrðingum er röng.,Umfram dópamín eða næmi fyrir dópamíni gæti verið samverkandi þáttur.,Hvítir sjúklingar eru með meiri einkenni.,Fyrirgefning frá ástandi í þriðja heiminum er 65%.,Lægra hlutfall geðklofa greindust meðal Afríku Bandaríkjamenn.,D
Starfsmanni stórs framleiðslufyrirtækis finnst vinnan leiðinleg og sækist aðeins eftir starfinu fyrir peningana. Starfsmaðurinn stendur sig í lágmarki og er ekki áhugasamur svo framleiða hæsta magn eða betri gæði. Samkvæmt tveggja þátta kenningu F. Herzberg væri besta leiðin 10 til að auka sjálfshvatningu þessa starfsmanns að,bjóða launahækkun og hvatningu til að auka framleiðni,Endurhannaðu starfið til að veita áskorun og tilfinningu fyrir árangri,auka tækifæri til upplýstra félagslegra samskipta,veita starfsmanni starfsstraum sem ber meiri álit,B
Hver af eftirfarandi lýsir best siðferðilegum leiðbeiningum varðandi kynferðisleg samskipti við fyrrverandi skjólstæðinga meðferðarinnar?,Sálfræðingum er undir neinum kringumstæðum óheimilt að eiga kynferðisleg samskipti við fyrrverandi skjólstæðinga meðferðarinnar.,Sálfræðingum er óheimilt að eiga kynferðisleg samskipti við fyrrverandi skjólstæðinga meðferðar í a.m.k. eitt ár eftir að meðferð lýkur.,Sálfræðingum er óheimilt að eiga kynferðisleg samskipti við fyrrverandi skjólstæðinga meðferðar við ákveðnar aðstæður (t.d. þegar hætta er á misneytingu).,Sálfræðingum er ekki bannað að eiga kynferðisleg samskipti við fyrrverandi skjólstæðinga meðferðarinnar.,C
Rannsóknir á máltileinkun annars máls hafa sýnt hvað af eftirfarandi um börn sem tileinka sér annað tungumál,Vitsmunaþroska þeirra er seinkað,Þeir hafa betri liðleika en börn sem eru ekki tvítyngd,Móðurmálskunnátta þeirra hefur engin áhrif á hraða þess að tileinka sér annað tungumál,Þeir hafa aukið vitrænan sveigjanleika,D
Á hvaða sviði almannatengsla er líklegt að hagsmunagæsla feli í sér þrýstihópa?,Sameiginlegur,Fjárhagsleg tengsl,Opinber mál,Viðskipti til fyrirtækis,C
"Í samhengi hnattvæðingar, hvernig getum við best skilgreint hugtakið ""þróun""?","Hugtakið þróun vísar til mannlegs ástands þar sem er frelsi frá ótta og löngun; Það eru nægar auðlindir til að viðhalda lífi og þetta líf getur þrifist í ástandi sem er laust við ógn, eða skynjaða ógn, um skyndilega truflun.","Til að teljast þróuð verður þjóð að hafa náð ákveðinni efnahagslegri og pólitískri stöðu innan hins alþjóðlega ríkiskerfis; Viðmiðunin fyrir hvað telst vera ""þróað"" ástand er þannig skilgreind út frá þessum kröfum um víxlverkun í þessu kerfi.",Þróun er leið til að takast á við ójöfnuðinn sem fylgir hnattvæðingu nýfrjálshyggjunnar. Í þessu samhengi vísar þróun til getu íbúa eða samfélags til að nýta auðlindir á skilvirkan hátt og auka skilvirkni í framleiðslu og dreifingu og stuðla að réttlátari tekjudreifingu innan samfélagsins.,Þróun samfélags vísar til hugmyndafræðilegra og siðferðilegra gildiskerfa sem íbúar þess eru áskrifendur að. Í hnattvæddu alþjóðakerfi er átt við upptöku vestrænnar frjálslyndrar lýðræðishugmyndafræði og frjálsrar markaðshagfræði.,C
Hvað af eftirfarandi lýsir Eurocentrism best?,Eurocentrism er greiningarstíll þar sem evrópsk samfélög eru borin saman við samfélög utan Evrópu til að fá fram óhlutdrægan samanburð á hlutfallslegum kostum hvers og eins.,Eurocentrism er hugsunarstíll þar sem mat og mat á samfélögum utan Evrópu er sett fram með tilliti til menningarlegra forsendna og hlutdrægni Evrópubúa.,Eurocentrism lýsir rannsóknum eða fræðilegum verkum sem fjalla aðeins um evrópsk stjórnmála- eða efnahagskerfi.,Allir þessir valkostir.,B
Hver af eftirfarandi kenningum beinist að því hvernig samfélaginu tekst að framkvæma þær athafnir sem nauðsynlegar eru til að viðhalda reglu og stöðugleika?,Fúnksjónalismi,Víxlverkun,Kenning um skynsamlegt val,Átakakenning,A
Hvað af eftirfarandi er persónulegt skjal með lokuðum aðgangi?,"""Hvítbók"" stjórnvalda",Sjúkraskrár sem eru trúnaðarmál,Bókhaldsbók heimilis,hlutabréfaskrá fyrirtækis,C
Hvert af eftirfarandi atriðum styður rökin fyrir einhliða stefnu Bandaríkjanna?,Góðviljað forræði,Árangursleysi fjölþjóðlegs samstarfs,Bandarískt vald,Allt ofangreint,D
Hvaða sjúkdómi valda herpes veirur ekki?,Lömun hjá börnum,Heilabólga,Kynsjúkdómar,Krabbamein,A
Tilgangur tvíblindrar eða tvíblindrar rannsóknar er að:,Ná samanburðarhæfni meðhöndlaðra og ómeðhöndlaðra einstaklinga,Draga úr áhrifum breytileika í sýnatöku,Forðastu hlutdrægni áhorfenda og þátttakenda,Forðastu skekkju áhorfenda og breytileika í sýnatöku,B
 Klassíski textinn Daodejing er þekktur undir hvaða titli á ensku?,Klassískt af breytingum,Klassískt af leiðinni og kraftinum,Klassík kvenna,Klassísk heimspeki,B
 Communidades de Base tengist hverju af eftirfarandi?,Oscar Romero biskup,Viðnám og endurnýjun,Reisn allra manna,Allt ofangreint,D
Dómsmálaráðherra er yfirmaður hverrar eftirtalinna aðila?,Dómsmálanefnd öldungadeildarinnar,Dómsmálaráðuneytið,Utanríkisráðuneytið,Lögfræðingur dómara,B
Segulsviðið línur um straumburðarvírform,Hringi,geislamyndaðar línur,Eddy straumar,orku lykkjur,A
"Hugtakið ""chili con carne"" vísar til chili með hverju?",Baunir,kjöt,ostur,chilipipar,B
Hvert af eftirfarandi lýsir best aðstæðum eftir að verð er hækkað á vöru sem hefur óteygjanlega eftirspurn?,Magnið sem krafist er breytist ekki.,Magnið sem krafist er mun aukast.,Heildartekjur munu lækka.,Heildartekjur breytast ekki.,A
