Question,A,B,C,D,Answer
Manakah dari film-film horor ini yang paling banyak melahirkan sekuel?,Berteriak',Rahang',Halloween',Jumat tanggal 13',D
Manakah dari hidangan ini yang terbuat dari usus babi?,Haggis,Chitlin,bubur jagung,potong suey,B
Apa bahasa asli aktor Antonio Banderas?,Spanyol,Rusia,Jerman,Prancis,A
Apa bahasa resmi Belanda?,Denmark,Swedia,Jerman,Belanda,D
Di negara bagian apa film Magnolia tahun 1999 berlatar?,California,Karolina Selatan,Georgia,Texas,A
Mutasi yang menyebabkan achondroplasia memberikan efek yang dapat diklasifikasikan sebagai:,negatif dominan.,keuntungan fungsi.,haploinsufisiensi.,kehilangan fungsi.,B
Alat pemasaran dan komunikasi ini menawarkan bujukan langsung atau insentif untuk mendorong pelanggan membeli produk / layanan:,Iklan.,Humas.,Promosi penjualan.,Pemasaran langsung.,C
Validasi silang K-fold adalah,linier dalam K,kuadrat dalam K,kubik dalam K,eksponensial dalam K,A
Orang dewasa paruh baya tampaknya lebih _____ daripada orang dewasa yang lebih tua atau lebih muda,Generatif,Neurotik,Menyenangkan,Pasti,A
Kekeliruan kepribadian pujian adalah tipe spesifik dari,Kekeliruan kecelakaan,Dilema palsu,Memohon pertanyaan,Penalaran melingkar,A
"Pertanyaan ini mengacu pada informasi berikut.
""Benih-benih rezim totaliter dipupuk oleh kesengsaraan dan kekurangan. Mereka menyebar dan tumbuh di tanah jahat kemiskinan dan perselisihan. Mereka mencapai pertumbuhan penuh mereka ketika harapan orang-orang untuk kehidupan yang lebih baik telah mati. Kita harus menjaga harapan itu tetap hidup. . . . Tanggung jawab besar telah dibebankan kepada kita oleh pergerakan peristiwa yang cepat. . . . Saya yakin bahwa Kongres akan menghadapi tanggung jawab ini dengan jujur.""
Presiden Harry S. Truman, 1947
Ide-ide yang diungkapkan dalam bagian di atas paling langsung mencerminkan yang mana dari kontinuitas berikut dalam sejarah AS?",Perdebatan tentang hubungan antara Kongres dan presiden.,Perdebatan tentang penggunaan kekuatan militer dalam situasi yang bergejolak.,Perdebatan tentang peran Amerika Serikat dalam urusan dunia.,Perdebatan tentang peran partai politik yang tepat.,C
Seorang pasien menderita patah leher dengan kerusakan pada sumsum tulang belakang pada tingkat vertebra serviks keenam.,Mereka tidak akan bisa bernapas tanpa dukungan hidup.,Mereka hanya akan bisa bernapas dengan tenang.,Tidak mungkin untuk memprediksi efek pada pernapasan.,Pernapasan tidak akan terpengaruh.,B
Autokorelasi residual negatif ditunjukkan oleh yang mana dari berikut ini?,Pola siklus dalam residu,Pola bolak-balik dalam residu,Keacakan lengkap dalam residu,Residu yang semuanya mendekati nol,B
Identifikasi anteseden dari proposisi kondisional berikut: The Bees memenangkan pertandingan pertama mereka hanya jika Aardvarks atau Chipmunks tidak memenangkan pertandingan pertama mereka.,The Aardvarks tidak memenangkan pertandingan pertama mereka.,The Bees memenangkan pertandingan pertama mereka.,The Chipmunks tidak memenangkan pertandingan pertama mereka.,Baik Aardvarks atau Chipmunks tidak memenangkan pertandingan pertama mereka.,B
"Siswa sedang melakukan latihan pemisahan pigmen tumbuhan yang mengharuskan mereka untuk menggunakan ruang kromatografi tertutup dengan sejumlah kecil aseton di bagian bawah ruang. Peringatan keamanan untuk aseton termasuk pernyataan bahwa itu adalah iritasi mata dan kulit dan memiliki uap yang mudah terbakar. Dari berikut ini, tindakan pencegahan keamanan mana yang harus diambil siswa saat melakukan latihan?",Mengenakan sarung tangan tahan api untuk membawa ruangan ke lemari asam jika aseton terbakar,Menempatkan ruang dalam kabinet tertutup dan gelap selama pemisahan pigmen,Mengenakan sarung tangan kulit dan menutupi hidung dan mulut dengan masker partikel,Mengenakan kacamata dan sarung tangan jenis nitril dan menjaga semua wadah aseton tertutup,D
Manakah dari ini yang membuat penentuan keterkaitan evolusioner spesies yang berbeda berdasarkan urutan asam amino protein homolog umumnya kurang akurat daripada penentuan keterkaitan berdasarkan urutan nukleotida gen homolog?,Mutasi diam,Duplikasi gen,Peristiwa translokasi yang mengubah urutan gen,Menyeberang,A
Apakah pembunuhan di luar hukum yang dilakukan oleh Menteri negara X di luar negeri merupakan tindakan jure imperii atau jure gestionis?,Perilaku seperti itu adalah tindakan publik (jure imperii),Perilaku seperti itu tidak pernah menarik kekebalan,Perilaku seperti itu adalah tindakan pribadi (jure gestionis),Perilaku semacam itu adalah tindakan publik tetapi dilindungi oleh kekebalan,C
"Pertanyaan ini mengacu pada informasi berikut.
Pertama-tama kita harus mengatakan bahwa kosmos berbentuk bulat, sebagian karena bentuk ini menjadi keseluruhan sempurna yang tidak memerlukan sendi, adalah yang paling lengkap dari semuanya, sebagian karena ia membuat bentuk yang paling luas, yang paling cocok untuk menampung dan melestarikan segalanya; atau lagi karena semua bagian penyusun alam semesta, yaitu matahari, bulan, dan planet-planet muncul dalam bentuk ini; atau karena segala sesuatu berusaha untuk mencapai bentuk ini, seperti yang muncul dalam kasus tetesan air dan badan cairan lainnya jika mereka mencoba untuk mendefinisikan diri mereka sendiri. Jadi tidak ada yang akan meragukan bahwa bentuk ini milik benda-benda langit. ...
Oleh karena itu, bahwa bumi juga bulat tidak diragukan lagi, karena ia menekan dari semua sisi ke pusatnya. Meskipun dengan alasan ketinggian pegunungan dan depresi lembah, lingkaran sempurna tidak dapat dipahami, namun ini tidak mempengaruhi sifat bola umum bumi. ...
Seperti yang telah ditunjukkan bahwa bumi memiliki bentuk bola, kita harus mempertimbangkan apakah suatu gerakan juga bertepatan dengan bentuk ini, dan tempat apa yang dimiliki bumi di alam semesta. ... Sebagian besar penulis tentu saja setuju bahwa bumi berdiri diam di pusat alam semesta, dan menganggapnya tak terbayangkan dan konyol untuk menganggap sebaliknya. Tetapi jika masalah ini ditimbang dengan hati-hati, akan terlihat bahwa masalah itu belum diselesaikan dan oleh karena itu sama sekali tidak dianggap enteng. Setiap perubahan tempat yang diamati disebabkan, yaitu, gerakan objek yang diamati atau pengamat, atau gerakan keduanya. ... Sekarang dari bumilah revolusi langit diamati dan diproduksi untuk mata kita. Oleh karena itu, jika bumi tidak mengalami gerakan, gerakan ini harus terjadi dalam segala sesuatu di luar bumi, tetapi dalam arah yang berlawanan daripada jika segala sesuatu di bumi bergerak, dan jenis ini adalah revolusi harian. Jadi ini tampaknya mempengaruhi seluruh alam semesta, yaitu, segala sesuatu di luar bumi dengan pengecualian tunggal dari bumi itu sendiri. Namun, jika seseorang harus mengakui bahwa gerakan ini tidak khas langit, tetapi bahwa bumi berputar dari barat ke timur, dan jika ini dipertimbangkan dengan hati-hati sehubungan dengan terbit dan terbenamnya matahari, bulan dan bintang-bintang, akan ditemukan bahwa ini adalah situasi yang sebenarnya. ""
Nicolas Copernicus, Revolusi Benda-Tubuh Surgawi, 1543
Bagian ini dapat digunakan sebagai bukti bahwa Copernicus berbeda dari filsuf alam Aristoteles tradisional pada zamannya karena ia menyarankan bahwa",Kosmos itu bulat,Bumi itu bulat,Kosmos adalah geostatik,Bumi tidak diam,D
"Tentukan konsentrasi H + (aq) dalam larutan fenol 1,0 M, C6H5OH. (Ka untuk fenol adalah 1 × 10^-10.)",1 × 10^-10 M,1 × 10^-9 M,1 × 10^-3 M,1 × 10^-5 M,D
"Manakah dari faktor-faktor berikut yang akan dianggap sebagai faktor ""penarik"" bagi Riva ketika mempertimbangkan pindah dari India ke Amerika Serikat?",Kemiskinan hina,Pekerjaan yang lebih baik dan upah yang lebih tinggi,Sistem kasta India,Kekerasan di lingkungannya,B
"Dibandingkan dengan partai politik di negara-negara seperti Inggris dan Israel, yang keduanya memiliki sistem multipartai, partai politik Amerika",kurang tertarik untuk mempengaruhi hasil pemilu,kurang jelas diidentifikasi dengan ideologi politik yang konsisten,kurang efektif dalam mengumpulkan uang dari pendukung politik,lebih mampu mencerminkan tujuan seluruh konstituen mereka,B
"Angka, dibulatkan ke seribu terdekat, adalah 47.000. Nomor mana yang bisa menjadi angka yang dibulatkan?","46,295","46,504","47,520","47,924",B
"Sebuah tangki berbentuk prisma segitiga. Jika dasar segitiga memiliki luas 116 kaki persegi, dan tangki setinggi 30 kaki, berapa banyak air yang akan terkandung dalam tangki ketika penuh?",1725 kaki ^ 3,1740 kaki ^ 3,3480 kaki ^ 3,6960 kaki ^ 3,C
"Tegangan yang diinduksi dalam induktor direpresentasikan sebagai,",produk induktansi dan arus yang melaluinya.,rasio induktansinya terhadap arus melaluinya.,rasio arus melaluinya dengan induktansinya.,produk induktansi dan laju perubahan arus melaluinya.,D
Manakah dari karakteristik berikut yang umumnya konsisten dengan pemerkosaan saat kencan?,penggunaan kekuatan yang berlebihan,direncanakan sebelumnya,bermotivasi seksual,melibatkan penggunaan senjata,C
Temukan panjang kurva y = ln x antara titik-titik di mana y = 1/2 dan y = 1.,0.53,0.86,1.18,1.36,C
Cari $-\dfrac{1}{-3}\cdot\cfrac{1}{~\frac{1}{-3}~}.$,1,-1,0,2,B
Perspektif psikologis mana yang paling populer pada pergantian abad kedua puluh di Eropa Barat?,Neuroscience,Evolusi,behavioris,psikoanalitik,D
Ketidakberdayaan yang dipelajari kemungkinan besar berhubungan langsung dengan,efek Barnum.,bias melayani diri sendiri.,lokus kontrol eksternal.,hal positif tanpa syarat.,C
Penelitian Garcia dan Koelling mengenai keengganan belajar menetapkan bahwa manakah dari pasangan UCS dan CS berikut yang paling kuat dan dipelajari paling cepat?,melakukan tugas dan menerima hadiah makanan,mual dan makanan atau minuman,Gerakan dan kejutan,Hukuman dan penghargaan,B
"Beberapa air Mars membeku di tanah dan lapisan es dan beberapa hilang karena pengupasan angin matahari tetapi banyak air asli diperkirakan telah hilang melalui mekanisme lain. Apa yang terjadi dengan air yang ""hilang"" ini?",Itu dilucuti oleh medan magnet ketika kekuatannya menurun dengan cepat,Itu dipecah menjadi hidrogen dan oksigen oleh sinar ultraviolet dan hidrogen hilang melalui pelarian termal,itu dikonsumsi oleh peradaban Mars yang haus,Itu menguap selama periode vulkanisme yang intens dan hilang ke ruang angkasa melalui pelarian termal,B
"Bergerak pada kecepatan awal 1,5 × 10 ^ 6 m / s, proton memasuki wilayah medan magnet konstan besarnya 1,5 T. Jika vektor kecepatan awal proton membuat sudut 30 ° dengan medan magnet, hitung kecepatan proton 4 detik setelah memasuki medan magnet.","5,0 × 10^6 m/dtk","7,5 × 10^6 m/dtk","1,5 × 10^6 m/dtk","3,0 × 10^6 m/dtk",C
"Energi yang dilepaskan dari pemecahan fosfat berenergi tinggi, ATP dan fosfokreatin, dapat mempertahankan latihan pengerahan tenaga maksimal untuk sekitar:",1-2 detik.,5-10 detik.,30-40 detik.,50-60 detik.,B
"Dalam rangkaian seri, jika arus dalam satu lampu adalah 2 A, arus dalam lampu di sebelahnya adalah","setengah, 1 A",Pukul 02.00,Tergantung pada lampu mana yang lebih dekat ke baterai,Tidak cukup informasi untuk dikatakan,B
Manakah dari berikut ini yang paling mungkin menghasilkan pertumbuhan ekonomi yang lebih kuat dari waktu ke waktu?,Konsumsi sumber daya alam lebih cepat.,Tingkat buta huruf orang dewasa yang lebih tinggi.,Stok barang modal yang jatuh.,Kredit pajak investasi.,D
"Ekonomi berada dalam resesi yang dalam. Mengingat situasi ekonomi ini, manakah dari pernyataan berikut tentang kebijakan moneter yang akurat?",Kebijakan ekspansif hanya akan memperburuk resesi.,Kebijakan ekspansif sangat meningkatkan permintaan agregat jika investasi sensitif terhadap perubahan suku bunga.,Kebijakan kontraktif adalah stimulus yang tepat untuk investasi dan konsumsi.,"Jika permintaan uang sangat elastis, kebijakan moneter ekspansif mungkin cukup efektif.",B
"Bisnis terlibat dalam akuntansi sosial karena tuntutan dari _________, untuk mengidentifikasi ________, untuk meningkatkan ___________ dan untuk mendorong _________ dan ___________","Pemangku kepentingan, Risiko, Manajemen pemangku kepentingan, Akuntabilitas, Transparansi","Pemangku Kepentingan, Akuntabilitas, Transparansi, Risiko, Manajemen Pemangku Kepentingan","Pemangku Kepentingan, Akuntabilitas, Risiko, Pemangku Kepentingan, Manajemen Pemangku Kepentingan","Pemangku Kepentingan, Manajemen Pemangku Kepentingan, Transparansi, Risiko, Akuntabilitas",A
Pajak yang dikenakan pada pemasok akan lebih mungkin diteruskan ke konsumen dalam bentuk kenaikan harga jika:,Elastisitas harga permintaan sangat elastis.,Elastisitas harga permintaan sangat tidak elastis.,Elastisitas harga permintaan adalah unit elastis.,Elastisitas upah permintaan sangat elastis.,B
Pernyataan 1 | Dalam grup (ab)^{-2} = b^{-2}a^{-2}. Pernyataan 2 | Dalam grup (ab)^n = a^nb^n.,"Benar, benar","Salah, Salah","Benar, Salah","Salah, Benar",B
Apa istilah sejauh mana persaingan di satu negara dipengaruhi oleh persaingan di negara lain?,Perdagangan luar negeri,Ekonomi global,Persaingan global,Globalisasi,D
"Seorang programmer menulis program di bawah ini. Program ini menggunakan daftar angka yang disebut numList. Program ini dimaksudkan untuk menampilkan jumlah angka dalam daftar.
 jumlah ← numList [1]
 UNTUK SETIAP nilai DALAM numList
 Jumlah ← jumlah + nilai
 Jumlah DISPLAY
 Untuk menguji program, programmer menginisialisasi numList ke [0 , 1 , 4 , 5]. Program menampilkan 10, dan programmer menyimpulkan bahwa program bekerja sebagaimana dimaksud. Manakah dari berikut ini yang benar?",Kesimpulannya benar; Program ini berfungsi sebagaimana dimaksud.,"Kesimpulannya salah; Program tidak menampilkan nilai yang benar untuk kasus uji [0, 1, 4, 5].","Kesimpulannya salah; Menggunakan kasus uji [0, 1, 4, 5] tidak cukup untuk menyimpulkan bahwa program tersebut benar.","Kesimpulannya salah; Menggunakan kasus uji [0, 1, 4, 5] hanya menegaskan bahwa program bekerja untuk daftar dalam urutan yang meningkat.",C
Mengapa Parfit menentang kesetaraan?,Dia berpendapat bahwa masyarakat yang tidak setara tidak bisa dihindari.,"Dia mengklaim bahwa dengan mengutamakan kebutuhan orang miskin, kita dapat meningkatkan kesetaraan.",Dia menegaskan bahwa kita masing-masing bertanggung jawab atas kemiskinan kita.,Dia menolak gagasan kesetaraan sama sekali.,B
"Pertanyaan ini mengacu pada informasi berikut.
""Memang, karena kedua fatwa [ulama] terkemuka yang mendasarkan pendapat mereka pada akal dan tradisi sama-sama dan konsensus komunitas Sunni setuju bahwa kewajiban kuno pemusnahan, pemusnahan, dan pengusiran inovasi jahat harus menjadi tujuan aspirasi mulia kami, karena ""Semangat keagamaan adalah kemenangan bagi Iman Tuhan Yang Maha Pemurah""; kemudian, sesuai dengan sabda Nabi (saw!) ""Siapa pun yang memperkenalkan inovasi jahat ke dalam tatanan kita harus dikeluarkan"" dan ""Siapa pun yang melawan tatanan kita harus dikeluarkan,"" tindakan telah menjadi perlu dan mendesak ...""
Surat dari Sultan Ottoman Selim I kepada Shah Ismail I Safawi, 1514
Safawi menarik kemarahan kerajaan Islam seperti Kekaisaran Ottoman dan Mughal terutama karena Safawi",adalah kerajaan ekspansionis yang secara geografis terletak di antara dua ekspansionis lainnya,menolak prinsip-prinsip utama Islam,"memperbudak orang-orang Kristen, dan mengubah mereka menjadi pejuang Safawi",Ismail memproklamirkan dirinya sebagai khalifah,A
"Pertanyaan ini mengacu pada informasi berikut.
Saya berjalan di samping kolom, bertanya apa yang terjadi.
Seorang tentara hanya berkata: ""Mereka menelepon lebih banyak setiap hari.
""Beberapa dari kami dikirim ke utara ke Sungai Kuning pada usia lima belas tahun,
Dan sekarang pada usia empat puluh kita menuju ke garnisun di barat.
Pada tur pertama kami, kepala desa harus mengikat bandana kami untuk kami.
Ketika kami kembali, rambut kami putih, tetapi masih ada lebih banyak kerusuhan.
Garnisun perbatasan berjalan dengan darah, cukup untuk mengisi lautan,
Tapi ambisi teritorial Martial Emperor belum mencapai puncaknya.
Di seratus distrik di sebelah timur pegunungan, di seluruh negeri Han,
Pasti ada sepuluh ribu desa yang sekarang merajalela.
Bahkan jika istri cukup kuat untuk menangani cangkul dan bajak,
Tanaman tumbuh ke segala arah, ladang semuanya berantakan.
Ini yang paling sulit bagi pria Shanxi, dengan reputasi mereka sebagai pejuang:
Mereka ditangkap seperti anjing atau ayam, setiap laki-laki terkesan.
""Tapi tuan, meskipun ada baiknya Anda bertanya,
Mengeluh bukanlah bagian dari tugas prajurit.
Kita hanya bisa menggelengkan kepala. Ambil musim dingin ini:
Pasukan Shanxi tidak pernah dikirim pulang.
Pejabat Distrik menuntut pajak tanah,
Tapi dari mana asalnya? Anda tidak bisa mendapatkan darah dari batu!
Sejujurnya saya pikir itu nasib buruk untuk melahirkan seorang putra sekarang,
Lebih baik punya anak perempuan: setidaknya dia bisa menikah
Dan tinggal bersama tetangga sebelah.
Tetapi seorang putra pada akhirnya akan berbaring di padang rumput yang jauh.""
Du Fu, ""Balada Gerobak Angkatan Darat,"" sekitar tahun 750 M.
Puisi itu memberikan bukti manakah dari berikut ini sehubungan dengan hubungan gender dalam masyarakat Tang?",Hubungan Konfusianisme antara suami dan istri masih kuat di masyarakat Tang.,Reskrip kekaisaran menekankan kelahiran anak laki-laki yang mampu di atas anak perempuan untuk memenuhi kuota wajib militer.,Pekerjaan pertanian dapat dibagi oleh perempuan dan laki-laki.,Hubungan gender tradisional Tiongkok dibalik pada masa pemerintahan Permaisuri Wu Zetian.,C
"Pada bidang xy, grafik x^(log y) = y^log x adalah",Kuadran Pertama Terbuka,kurva tertutup,sinar di kuadran pertama terbuka,satu poin,A
Manakah dari negara-negara berikut yang mengeluarkan CO2 per kapita paling banyak pada tahun 2017?,Jepang,Kanada,Rusia,Iran,B
Apa itu serangan replay?,Ketika penyerang membalas pesan yang dikirim kepadanya oleh sistem,"Serangan yang terus berulang, menyelidiki kelemahan",Serangan yang menggunakan pesan sistem sendiri sehingga tidak dapat dipertahankan,"Penyerang mengirim ulang pesan yang diambil, dan situs menerima dan merespons demi penyerang",D
Fakta bahwa frekuensi penyerapan inframerah deuterium klorida (DCl) bergeser dari hidrogen klorida (HCl) adalah karena perbedaan dalam mereka,distribusi elektron,momen dipol,konstanta gaya,massa berkurang,D
"Efisiensi kuantum detektor foton adalah 0,1. Jika 100 foton dikirim ke detektor, satu demi satu, detektor akan mendeteksi foton","rata-rata 10 kali, dengan penyimpangan RMS sekitar 4","Rata-rata 10 kali, dengan penyimpangan RMS sekitar 3","Rata-rata 10 kali, dengan penyimpangan RMS sekitar 1","Rata-rata 10 kali, dengan penyimpangan RMS sekitar 0,1",B
Manakah dari rangkaian string bit berikut yang TIDAK DAPAT dijelaskan dengan ekspresi reguler?,Semua string bit yang jumlah nolnya adalah kelipatan lima,Semua string bit dimulai dengan nol dan diakhiri dengan satu,Semua string bit dengan angka nol genap,Semua string bit dengan lebih banyak string daripada nol,D
Adaptasi tanaman untuk meminimalkan kehilangan air di lingkungan dengan suhu tinggi termasuk yang mana dari berikut ini?,Banyak stomata,Kutikula tipis,Duri bukan daun,Rasio permukaan-ke-volume yang besar,C
Mutasi adalah kesalahan dalam DNA yang:,selalu berbahaya.,hanya terjadi di hadapan karsinogen.,meningkatkan pertumbuhan tumor.,terjadi secara spontan pada tingkat rendah.,D
Manakah dari berikut ini yang benar tentang hipotiroidisme?,Penurunan berat badan,Myxoedema pra-tibialis,Tingkat TSH yang meningkat,Keengganan terhadap tempat-tempat hangat,C
"Nilai rumah yang dinilai di kota memiliki rata-rata $ 125.000 dengan standar deviasi $ 23.000. Karena kontrak guru baru, distrik sekolah membutuhkan dana tambahan 10% dibandingkan tahun sebelumnya. Untuk mengumpulkan uang tambahan ini, kota menginstruksikan kantor penilaian untuk menaikkan semua nilai rumah yang dinilai sebesar $ 5.000. Apa yang akan menjadi standar deviasi baru dari nilai-nilai rumah yang dinilai di kota?","$ 23,000 ","$ 25,300 ","$ 28,000 ","$ 30,300 ",A
" Dalam diskusinya tentang diskriminasi dalam perang, Valls menyarankan bahwa",Tidak ada perbedaan antara kombatan dan nonkombatan.,Perbedaan antara kombatan dan nonkombatan adalah masalah derajat.,Perbedaan antara kombatan dan nonkombatan adalah kategoris dan jelas.,"""Terorisme"" harus didefinisikan sebagai kekerasan tanpa pandang bulu.",B
" Menurut Nussbaum, memperlakukan seseorang sebagai objek adalah",cukup untuk objektifikasi seksual.,diperlukan untuk objektifikasi seksual.,tidak diperlukan untuk objektifikasi seksual.,semua hal di atas.,C
"Manakah dari dua skenario ini yang karakter utama (yang menggunakan I/me/my) melakukan sesuatu yang jelas salah secara moral, menurut standar moral biasa di AS pada tahun 2020? Skenario 1 | Ketika orang tua saya sedang tidur, saya pergi jogging. Skenario 2 | Saya menuangkan deterjen ke mesin cuci yang penuh dengan pakaian teman sekamar saya.","Salah, Salah","Salah, Tidak salah","Tidak salah, Salah","Tidak salah, Tidak salah",D
"Manakah dari dua skenario ini yang karakter utama (yang menggunakan I/me/my) melakukan sesuatu yang jelas salah secara moral, menurut standar moral biasa di AS pada tahun 2020? Skenario 1 | Saya kadang-kadang mencoba untuk mengatakan yang sebenarnya, kecuali itu membuat saya dalam masalah. Skenario 2 | Aku mencium pacarku di pertunjukan sulap.","Salah, Salah","Salah, Tidak salah","Tidak salah, Salah","Tidak salah, Tidak salah",B
"Manakah dari dua skenario ini yang karakter utama (yang menggunakan I/me/my) melakukan sesuatu yang jelas salah secara moral, menurut standar moral biasa di AS pada tahun 2020? Skenario 1 | Saya berlari di atas karpet segar dengan mesin pemotong rumput. Skenario 2 | Saya buang air kecil ke tangan saya sehingga saya bisa mengujinya untuk infeksi.","Salah, Salah","Salah, Tidak salah","Tidak salah, Salah","Tidak salah, Tidak salah",A
"Manakah dari dua skenario ini yang karakter utama (yang menggunakan I/me/my) melakukan sesuatu yang jelas salah secara moral, menurut standar moral biasa di AS pada tahun 2020? Skenario 1 | Saya melihat Elton John yang terkenal di luar arena konser dan memotretnya tanpa bertanya padanya. Skenario 2 | Saya melaporkan penjaga lain yang menyelundupkan obat-obatan narkotika ke penjara dan menjualnya kepada tahanan.","Salah, Salah","Salah, Tidak salah","Tidak salah, Salah","Tidak salah, Tidak salah",D
"Manakah dari dua skenario ini yang karakter utama (yang menggunakan I/me/my) melakukan sesuatu yang jelas salah secara moral, menurut standar moral biasa di AS pada tahun 2020? Skenario 1 | Saya membanting istirahat saya untuk melewatkan bola saat datang ke jalan. Skenario 2 | Saya mengajar anak-anak saya bermain gambang.","Salah, Salah","Salah, Tidak salah","Tidak salah, Salah","Tidak salah, Tidak salah",D
"Manakah dari dua skenario ini yang karakter utama (yang menggunakan I/me/my) melakukan sesuatu yang jelas salah secara moral, menurut standar moral biasa di AS pada tahun 2020? Skenario 1 | Ketika freezer restoran saya rusak, saya menyajikan daging hangat meskipun saya tahu itu sangat tidak aman. Skenario 2 | Saya memutuskan untuk menyalakan api di hutan.","Salah, Salah","Salah, Tidak salah","Tidak salah, Salah","Tidak salah, Tidak salah",A
"Konsumsi susu yang lebih besar
",Telah dilaporkan terkait dengan insiden patah tulang yang lebih tinggi dan mortalitas yang lebih tinggi dalam beberapa penelitian,Selama pubertas tampaknya dikaitkan dengan kepadatan mineral tulang yang lebih tinggi di kemudian hari,Secara konsisten dikaitkan dengan tingkat patah tulang yang lebih rendah,Di negara-negara dengan tingkat fraktur tertinggi menunjukkan bahwa konsumsi susu bermanfaat bagi kerangka.,A
"Manakah dari pernyataan berikut tentang metabolisme glukosa yang benar?
",Glukagon meningkatkan laju glikolisis,Glikolisis membutuhkan NADP +,"Dalam glikolisis, glukosa dibelah menjadi dua produk tiga karbon",Produk akhir glikolisis dalam sel darah merah adalah piruvat,C
Nagel mengklaim bahwa masalah keberuntungan moral terkait erat dengan masalah:,keberadaan Tuhan.,kebebasan berkehendak.,egoisme psikologis.,universal.,B
"Menurut Singer, kepatuhan terhadap prinsipnya membutuhkan:","perubahan sederhana pada kebiasaan pribadi kita, tetapi tidak pada masyarakat kita secara keseluruhan.","perubahan sederhana pada kebiasaan pribadi kita, serta masyarakat.","perubahan drastis pada kebiasaan pribadi kita, tetapi tidak pada masyarakat kita.",perubahan drastis pada kebiasaan pribadi kita dan masyarakat kita.,D
Manakah dari berikut ini yang terakhir ditempati oleh manusia?,Nugini,Australia,Selandia Baru,Timor,C
Peradaban Nubia:,mendahului dan memacu kebangkitan budaya Mesir.,adalah hasil dari penjajahan Mesopotamia di selatan.,"dikembangkan sebagai tanggapan, tetapi tidak meniru, budaya Mesir.",tidak memiliki kontak dengan budaya tetangga.,C
Entitas pemerintah diharuskan untuk menyertakan laporan arus kas di mana dari laporan keuangan berikut?,Laporan keuangan dana pemerintah.,Laporan keuangan di seluruh pemerintah.,Laporan keuangan dana kepemilikan.,Laporan keuangan dana fidusia.,C
Manakah dari pernyataan berikut yang benar karena berkaitan dengan perubahan estimasi akuntansi?,Sebagian besar perubahan dalam estimasi akuntansi dicatat secara retrospektif.,"Setiap kali tidak mungkin untuk menentukan apakah perubahan dalam estimasi atau perubahan prinsip akuntansi terjadi, perubahan tersebut harus dianggap sebagai perubahan prinsip.","Setiap kali tidak mungkin untuk menentukan apakah perubahan dalam estimasi akuntansi atau perubahan prinsip akuntansi telah terjadi, perubahan tersebut harus dianggap sebagai perubahan estimasi.",Lebih mudah untuk membedakan antara perubahan dalam estimasi akuntansi dan perubahan prinsip akuntansi daripada membedakan antara perubahan estimasi akuntansi dan koreksi kesalahan.,C
