Question,A,B,C,D,Answer
أي من أفلام الرعب هذه أنتجت معظم التتابعات؟,الصراخ',فكي,هالوين',الجمعة 13',D
أي من هذه الأطباق مصنوع من أمعاء الخنازير؟,هاغيس,كيتلينز,الحصي,تشوب سوي,B
ما هي اللغة الأم للممثل أنطونيو بانديراس؟,الإسبانية,الروسية,الألمانية,الفرنسية,A
ما هي اللغة الرسمية في هولندا؟,الدانماركية,السويدية,الألمانية,الهولندية,D
في أي حالة تم تعيين فيلم ماغنوليا عام 1999؟,كاليفورنيا,ساوث كارولينا,جورجيا,تكساس,A
الطفرات التي تسبب الودانة لها تأثير يمكن تصنيفه على النحو التالي:,السلبية المهيمنة.,كسب الوظيفة.,هابلوينكفاي.,فقدان الوظيفة.,B
 تقدم أداة التسويق والاتصال هذه حافزا مباشرا أو حافزا لتشجيع العملاء على شراء منتج / خدمة:,الاعلان.,العلاقات العامة.,ترويج المبيعات.,التسويق المباشر.,C
التحقق المتقاطع من K هو,خطي في K,تربيعي في K,مكعب في K,الأسي في K,A
يبدو أن البالغين في منتصف العمر أكثر ____ من البالغين الأكبر سنا أو الأصغر سنا,توليدي,العصبيه,مقبوله,متأكد,A
مغالطة شخصية الثناء هي نوع محدد من,مغالطة الحادث,معضلة كاذبة,استجداء السؤال,الاستدلال الدائري,A
"يشير هذا السؤال إلى المعلومات الآتية.
""إن بذور الأنظمة الشمولية يغذيها البؤس والعوز. إنها تنتشر وتنمو في تربة الفقر والصراع الشريرة. إنهم يصلون إلى نموهم الكامل عندما يموت أمل شعب في حياة أفضل. يجب أن نبقي هذا الأمل حيا. . . . لقد تم وضع مسؤوليات كبيرة على عاتقنا من خلال الحركة السريعة للأحداث. . . . أنا واثق من أن الكونغرس سيواجه هذه المسؤوليات بشكل مباشر"".
الرئيس هاري ترومان ، 1947
تعكس الأفكار المعبر عنها في المقطع أعلاه بشكل مباشر أي من الاستمرارية التالية في تاريخ الولايات المتحدة؟",مناقشات حول العلاقة بين الكونغرس والرئيس.,مناقشات حول استخدام القوة العسكرية في المواقف المتقلبة.,مناقشات حول دور الولايات المتحدة في الشؤون العالمية.,مناقشات حول الدور المناسب للأحزاب السياسية.,C
مريض يعاني من كسر في الرقبة مع تلف في الحبل الشوكي على مستوى الفقرة العنقية السادسة.,لن يكونوا قادرين على التنفس بدون دعم الحياة.,سيكونون قادرين فقط على التنفس بهدوء.,من المستحيل التنبؤ بتأثير على التنفس.,لن يتأثر التنفس.,B
يشار إلى الارتباط الذاتي المتبقي السلبي بأي مما يلي؟,نمط دوري في المخلفات,نمط متناوب في البقايا,عشوائية كاملة في المخلفات,المخلفات التي تقترب جميعها من الصفر,B
حدد سابقة الاقتراح الشرطي التالي: يفوز النحل بمباراته الأولى فقط إذا لم يفز خنزير الأرض أو السنجاب بمبارياته الأولى.,لا يفوز خنزير الأرض بمباراته الأولى.,النحل يفوز بمباراته الأولى.,السنجاب لا يفوز بمباراته الأولى.,إما أن خنزير الأرض أو السنجاب لا يفوزون بمبارياتهم الأولى.,B
يقوم الطلاب بإجراء تمرين فصل الصباغ النباتي الذي يتطلب منهم استخدام غرفة كروماتوغرافيا مغلقة مع كمية صغيرة من الأسيتون في قاع الغرفة. تتضمن تحذيرات السلامة الخاصة بالأسيتون بيانا بأنه مهيج للعين والجلد وله أبخرة قابلة للاشتعال. ما هي احتياطات السلامة التي يجب على الطلاب اتخاذها أثناء إجراء التمرين؟,ارتداء قفازات مقاومة للحريق لحمل الحجرة إلى غطاء دخان إذا اشتعلت النيران في الأسيتون,وضع الحجرة في خزانة مغلقة ومظلمة طوال مدة فصل الصباغ,ارتداء قفازات جلدية وتغطية الأنف والفم بقناع الجسيمات,ارتداء نظارات واقية وقفازات من نوع النتريل وإبقاء جميع حاويات الأسيتون مغلقة,D
أي مما يلي يجعل تحديد العلاقة التطورية للأنواع المختلفة بناء على تتابع الأحماض الأمينية للبروتينات المتماثلة أقل دقة بوجه عام من تحديد العلاقة بناء على تتابعات النيوكليوتيدات للجينات المتماثلة؟,الطفرات الصامتة,الازدواجية الجينية,أحداث النقل التي تغير تسلسل الجينات,العبور,A
هل القتل غير المشروع الذي يرتكبه وزير البلد X في الخارج هو عمل إمبريالي بحكم القانون أو بحكم القانون؟,مثل هذا السلوك هو عمل عام (بحكم القانون),مثل هذا السلوك لا يجذب الحصانة أبدا,هذا السلوك هو عمل خاص (jure menttionis),وهذا السلوك هو عمل علني ولكنه محمي بالحصانة.,C
"يشير هذا السؤال إلى المعلومات الآتية.
أولا يجب أن نلاحظ أن الكون كروي في الشكل ، ويرجع ذلك جزئيا إلى أن هذا الشكل هو كل كامل لا يتطلب أي مفاصل ، هو الأكثر اكتمالا على الإطلاق ، جزئيا لأنه يصنع الشكل الأكثر رحابة ، وهو الأنسب لاحتواء كل شيء والحفاظ عليه. أو مرة أخرى لأن جميع الأجزاء المكونة للكون ، أي الشمس والقمر والكواكب تظهر بهذا الشكل ؛ أو لأن كل شيء يسعى جاهدا للوصول إلى هذا الشكل ، كما يظهر في حالة قطرات الماء والأجسام السائلة الأخرى إذا حاولوا تعريف أنفسهم. لذلك لن يشك أحد في أن هذا الشكل ينتمي إلى الأجرام السماوية. ...
لذلك فإن كون الأرض كروية أيضا أمر لا جدال فيه ، لأنه يضغط من جميع الجهات على مركزها. على الرغم من أنه بسبب ارتفاعات الجبال ومنخفضات الوديان ، لا يمكن فهم دائرة كاملة ، إلا أن هذا لا يؤثر على الطبيعة الكروية العامة للأرض. ...
كما ثبت بالفعل أن الأرض لها شكل كرة ، يجب أن نفكر فيما إذا كانت الحركة تتزامن أيضا مع هذا الشكل ، وما هي المكانة التي تحتلها الأرض في الكون. ... تتفق الغالبية العظمى من المؤلفين بالطبع على أن الأرض لا تزال في مركز الكون ، ويعتبرون أنه من غير المعقول والسخف افتراض عكس ذلك. ولكن إذا تم تقييم المسألة بعناية ، فسوف يتبين أن المسألة لم تتم تسويتها بعد ، وبالتالي لا يمكن بأي حال من الأحوال النظر إليها باستخفاف. كل تغيير في المكان يتم ملاحظته يرجع ، أي إلى حركة الجسم المرصود أو المراقب ، أو إلى حركات كليهما. ... الآن من الأرض يتم ملاحظة ثورة السماوات ويتم إنتاجها لأعيننا. لذلك إذا لم تخضع الأرض لأي حركة ، فيجب أن تحدث هذه الحركة في كل شيء خارج الأرض ، ولكن في الاتجاه المعاكس مما لو تحرك كل شيء على الأرض ، وهذا النوع هو الثورة اليومية. لذلك يبدو أن هذا يؤثر على الكون كله ، أي كل شيء خارج الأرض باستثناء واحد للأرض نفسها. ومع ذلك ، إذا كان على المرء أن يعترف بأن هذه الحركة لم تكن خاصة بالسماء ، ولكن الأرض تدور من الغرب إلى الشرق ، وإذا تم النظر في ذلك بعناية فيما يتعلق بالشروق والغروب الظاهري للشمس والقمر والنجوم ، اكتشاف أن هذا هو الوضع الحقيقي "".
نيكولاس كوبرنيكوس ، ثورات الأجرام السماوية ، 1543
يمكن استخدام المقطع كدليل على أن كوبرنيكوس اختلف عن الفلاسفة الطبيعيين الأرسطيين التقليديين في عصره لأنه اقترح ذلك",الكون كروي,الأرض كروية,الكون جيوستاتيكي,الأرض ليست ثابتة,D
أوجد تركيز H+(aq) في محلول 1.0 M من الفينول، C6H5OH. (كا للفينول هو 1 × 10 ^ -10.),1 × 10^-10 م,1 × 10^-9 م,1 × 10^-3 م,1 × 10^-5 م,D
"أي من العوامل التالية يمكن اعتباره عامل ""جذب"" لريفا عند التفكير في الانتقال من الهند إلى الولايات المتحدة؟",الفقر المدقع,وظائف أفضل وأجور أعلى,النظام الطبقي في الهند,العنف في حيها,B
بالمقارنة مع الأحزاب السياسية في دول مثل إنجلترا وإسرائيل ، وكلاهما لديه أنظمة متعددة الأحزاب ، فإن الأحزاب السياسية الأمريكية,أقل اهتماما بالتأثير على نتائج الانتخابات,أقل وضوحا مع الأيديولوجيات السياسية المتسقة,أقل فعالية في جمع الأموال من المؤيدين السياسيين,أكثر قدرة على عكس أهداف دوائرهم الانتخابية بأكملها,B
"الرقم ، مقربا لأقرب ألف ، هو 47,000. أي عدد يمكن أن يكون العدد الذي تم تقريبه؟","46,295","46,504","47,520","47,924",B
دبابة على شكل منشور مثلث. إذا كانت القاعدة المثلثة مساحتها ١١٦ قدما مربعا، وكان طول الخزان ٣٠ قدما، فما كمية الماء التي سيحتوي عليها الخزان عندما يكون ممتلئا؟,1725 قدم ^ 3,1740 قدم ^ 3,3480 قدم ^ 3,6960 قدم ^ 3,C
يتم تمثيل الجهد المستحث في المحث على النحو التالي ،,نتاج محاثه والتيار من خلاله.,نسبة محاثه إلى التيار من خلاله.,نسبة التيار من خلاله إلى محاثه.,ناتج محاثه ومعدل تغير التيار من خلاله.,D
أي من الخصائص التالية تتفق بشكل عام مع الاغتصاب في موعد غرامي؟,استخدام القوة المفرطة,مع سبق الاصرار,دوافع جنسية,ينطوي على استخدام سلاح,C
أوجد طول المنحنى y = ln x بين النقطتين حيث y = 1/2 و y = 1.,0.53,0.86,1.18,1.36,C
ابحث عن $-\dfrac{1}{-3}\cdot\cfrac{1}{~\frac{1}{-3}~}.$,1,-1,0,2,B
ما هو المنظور النفسي الأكثر شعبية في مطلع القرن العشرين في أوروبا الغربية؟,علم الاعصاب,تطوري,السلوكية,التحليل النفسي,D
من المرجح أن يكون العجز المكتسب مرتبطا بشكل مباشر ب,تأثير بارنوم.,التحيز لخدمة الذات.,موضع تحكم خارجي.,احترام إيجابي غير مشروط.,C
أثبت بحث Garcia و Koelling فيما يتعلق بالنفور المكتسب أن أي من أزواج UCS و CS التالية هي الأقوى والأكثر تعلما بسرعة؟,أداء مهمة والحصول على مكافأة غذائية,الغثيان والطعام أو الشراب,الحركة والصدمة,العقوبات والمكافآت,B
"تم تجميد بعض مياه المريخ في التربة والقمم الجليدية وبعضها فقد بسبب تجريد الرياح الشمسية ولكن يعتقد أن الكثير من المياه الأصلية قد فقدت من خلال آلية أخرى. ماذا حدث لهذه المياه ""المفقودة""؟",تم تجريده من المجال المغناطيسي عندما انخفضت قوته بسرعة,تم تقسيمه إلى هيدروجين وأكسجين بواسطة الأشعة فوق البنفسجية وفقد الهيدروجين من خلال الهروب الحراري,استهلكتها حضارة المريخيين العطشى,تم تبخيره خلال فترة من البراكين الشديدة وفقد في الفضاء من خلال الهروب الحراري,B
بالانتقال بسرعة ابتدائية مقدارها 1.5 × 10 ^ 6 م / ث ، يدخل البروتون منطقة ذات مجال مغناطيسي ثابت مقدارها 1.5 T. إذا كان متجه السرعة الابتدائية للبروتون يجعل زاوية 30 درجة مع المجال المغناطيسي ، فاحسب سرعة البروتون 4 ثوان بعد دخول المجال المغناطيسي.,5.0 × 10^6 م/ث,7.5 × 10^6 م/ث,1.5 × 10^6 م/ث,3.0 × 10^6 م/ث,C
يمكن للطاقة المنبعثة من انهيار الفوسفات عالي الطاقة ، ATP والفوسفوكرياتين ، أن تحافظ على أقصى قدر من الجهد لحوالي:,1-2 ثانية.,5-10 ثواني.,30-40 ثانية.,50-60 ثانية.,B
في دائرة كهربية موصلة على التوالي، إذا كان التيار المار في مصباح واحد يساوي 2 أمبير، فإن شدة التيار المار في المصباح المجاور له تساوي,نصف ، 1 أ,2:00 صباحا,يعتمد على المصباح الأقرب إلى البطارية,لا توجد معلومات كافية لقولها,B
أي من الآتي من المرجح أن ينتج نموا اقتصاديا أقوى بمرور الوقت؟,استهلاك أسرع للموارد الطبيعية.,ارتفاع معدلات الأمية بين الكبار.,انخفاض مخزون السلع الرأسمالية.,الإعفاءات الضريبية للاستثمار.,D
الاقتصاد في حالة ركود عميق. بالنظر إلى هذا الوضع الاقتصادي ، أي من العبارات التالية حول السياسة النقدية دقيقة؟,ولن تؤدي السياسة التوسعية إلا إلى تفاقم الركود.,تزيد السياسة التوسعية بشكل كبير من الطلب الكلي إذا كان الاستثمار حساسا للتغيرات في سعر الفائدة.,السياسة الانكماشية هي الحافز المناسب للاستثمار والاستهلاك.,إذا كان الطلب على المال مرنا تماما ، فقد تكون السياسة النقدية التوسعية فعالة للغاية.,B
تشارك الشركات في المحاسبة الاجتماعية بسبب طلبات _________ ، من أجل تحديد ________ ، وتحسين ___________ وتشجيع _________ ___________,"أصحاب المصلحة, المخاطر, إدارة أصحاب المصلحة, المساءلة, الشفافية","أصحاب المصلحة, المساءلة, الشفافية, المخاطر, إدارة أصحاب المصلحة","أصحاب المصلحة, المساءلة, المخاطر, أصحاب المصلحة, إدارة أصحاب المصلحة","أصحاب المصلحة, إدارة أصحاب المصلحة, الشفافية, المخاطر, المساءلة",A
من المرجح أن يتم تمرير الضريبة المفروضة على المورد إلى المستهلك في شكل زيادة في الأسعار إذا,مرونة سعر الطلب مرنة للغاية.,مرونة سعر الطلب غير مرنة للغاية.,مرونة سعر الطلب مرنة وحدة.,مرونة الأجور للطلب مرنة للغاية.,B
البيان 1 | في مجموعة (ab)^{-2} = b^{-2}a^{-2}. البيان 2 | في مجموعة (ab)^n = a^nb^n.,صحيح، صحيح,"خطأ, خطأ",صواب، خطأ,خطأ، صحيح,B
ما هو المصطلح الذي يشير إلى مدى تأثر المنافسة في بلد ما بالمنافسة في البلدان الأخرى؟,التجارة الدولية,الاقتصاد العالمي,المنافسة العالمية,العولمة,D
"كتب مبرمج البرنامج أدناه. يستخدم البرنامج قائمة من الأرقام تسمى numList. يهدف البرنامج إلى عرض مجموع الأرقام في القائمة.
 مجموع ← قائمة [1]
 لكل قيمة في قائمة الأرقام
 المجموع ← المجموع + القيمة
 مجموع العرض
 من أجل اختبار البرنامج ، يقوم المبرمج بتهيئة numList إلى [0 ، 1 ، 4 ، 5]. يعرض البرنامج 10 ، ويخلص المبرمج إلى أن البرنامج يعمل على النحو المنشود. أي من الآتي صواب؟",الاستنتاج صحيح. يعمل البرنامج على النحو المنشود.,الاستنتاج غير صحيح. لا يعرض البرنامج القيمة الصحيحة لحالة الاختبار [0 ، 1 ، 4 ، 5].,الاستنتاج غير صحيح. استخدام حالة الاختبار [0 ، 1 ، 4 ، 5] لا يكفي لاستنتاج صحة البرنامج.,الاستنتاج غير صحيح. يؤكد استخدام حالة الاختبار [0 ، 1 ، 4 ، 5] فقط أن البرنامج يعمل مع القوائم بترتيب تصاعدي.,C
لماذا يعارض بارفيت المساواة؟,يجادل بأن المجتمع غير المتكافئ أمر لا مفر منه.,ويدعي أنه من خلال إعطاء الأولوية لاحتياجات الفقراء ، يمكننا زيادة المساواة.,ويؤكد أن كل منا مسؤول عن فقرنا.,إنه يرفض فكرة المساواة تماما.,B
"يشير هذا السؤال إلى المعلومات الآتية.
""في الواقع، بما أن فتاوى [العلماء] المتميزين الذين يبنون رأيهم على العقل والتقاليد على حد سواء وإجماع المجتمع السني يتفقان على أن الواجب القديم المتمثل في استئصال وإبادة وطرد البدع الشريرة يجب أن يكون هدف طموحنا السام، لأن ""الغيرة الدينية هي انتصار لإيمان الله الرحيم""؛ ثم وفقا لكلام النبي (صلى الله عليه وسلم!) ""كل من أدخل ابتكارا شريرا في نظامنا يجب طرده"" و ""كل من يفعل ضد نظامنا يجب طرده"" ، أصبح العمل ضروريا وملحا ...""
رسالة من السلطان العثماني سليم الأول إلى الشاه الصفوي إسماعيل الأول، ١٥١٤
أثار الصفويون غضب الإمبراطوريات الإسلامية مثل الإمبراطوريتين العثمانية والمغولية في المقام الأول لأن الصفويين",كانت إمبراطورية توسعية تقع جغرافيا بين اثنين من التوسعيين الآخرين,رفض المبادئ المركزية للإسلام,استعبدوا المسيحيين وحولوهم إلى مقاتلين صفويين,أعلن إسماعيل نفسه خليفة,A
"يشير هذا السؤال إلى المعلومات الآتية.
أمشي بجانب العمود ، وأسأل عما يحدث.
يقول أحد الجنود ببساطة: ""إنهم يتصلون أكثر كل يوم.
""تم إرسال بعضنا شمالا إلى النهر الأصفر في سن الخامسة عشرة ،
والآن في الأربعين نتجه إلى الحاميات في الغرب.
في جولتنا الأولى ، كان على رئيس القرية ربط مناديلنا لنا.
عندما عدنا، كان شعرنا أبيض، ولكن لا يزال هناك المزيد من الاضطرابات.
الحاميات الحدودية تجري بالدم ، بما يكفي لملء المحيط ،
لكن طموحات الإمبراطور العسكري الإقليمية لم تصل بعد إلى ذروتها.
في مائة منطقة شرق الجبال ، في جميع أنحاء أرض هان ،
يجب أن يكون هناك عشرة آلاف قرية تغزو البرامبلز الآن.
حتى لو كانت الزوجات قويات بما يكفي للتعامل مع مجرفة ومحراث ،
تنمو المحاصيل في كل اتجاه ، والحقول كلها في حالة من الفوضى.
إنه أصعب بالنسبة لرجال شانشي ، بسمعتهم كمقاتلين:
يتم تجميعهم مثل أو الدجاج ، كل ذكر معجب.
""لكن سيدي ، على الرغم من أنه من الجيد أن تسأل ،
الشكوى ليست جزءا من مهمة الجندي.
يمكننا فقط أن نهز رؤوسنا. خذ هذا الشتاء:
لم يتم إرسال قوات شانشي إلى ديارهم.
ضباط المقاطعة يطالبون بضريبة الأرض ،
ولكن من أين ستأتي؟ ماذا يأخذ الريح من البلاط!
أعتقد بصراحة أنه من سوء الحظ أن تنجب ابنا الآن ،
من الأفضل أن يكون لديك ابنة: على الأقل يمكنها الزواج
والعيش مع الجيران المجاورين.
لكن الابن سينتهي به الأمر مستلقيا في بعض البراري البعيدة "".
دو فو ، ""أغنية عربات الجيش"" ، حوالي 750 م
تقدم القصيدة دليلا على أي مما يلي فيما يتعلق بالعلاقات بين الجنسين في مجتمع تانغ؟",كانت العلاقات الكونفوشيوسية بين الزوج والزوجة لا تزال قوية في مجتمع تانغ.,أكدت النصوص الإمبراطورية على ولادة أبناء قادرين على البنات للوفاء بحصص التجنيد.,ويمكن تقاسم العمل الزراعي بين النساء والرجال على حد سواء.,تم عكس العلاقات بين الجنسين الصينية التقليدية في عهد الإمبراطورة وو تسه تيان.,C
في المستوى xy ، الرسم البياني ل x ^ (log y) = y ^ log x هو,الربع الأول المفتوح,منحنى مغلق,شعاع في الربع الأول المفتوح,نقطة واحدة,A
أي من البلدان التالية انبعث منها أكبر قدر من ثاني أكسيد الكربون للفرد في عام 2017؟,اليابان,كندا,روسيا,إيران,B
ما هو هجوم الإعادة؟,عندما يرد المهاجم على رسالة مرسلة إليه بواسطة النظام,هجوم يتكرر باستمرار ، يبحث عن نقطة ضعف,هجوم يستخدم رسائل النظام الخاصة وبالتالي لا يمكن الدفاع عنه,يعيد المهاجم إرسال رسالة تم التقاطها ، ويقبل الموقع ويستجيب لصالح المهاجم,D
حقيقة أن تردد امتصاص الأشعة تحت الحمراء لكلوريد الديوتيريوم (DCl) قد تحول من تردد كلوريد الهيدروجين (HCl) يرجع إلى الاختلافات في,توزيع الإلكترون,لحظة ثنائي القطب,ثابت القوة,انخفاض الكتلة,D
الكفاءة الكمية لكاشف الفوتون هي 0.1. إذا تم إرسال 100 فوتون إلى الكاشف ، واحدا تلو الآخر ، فسوف يكتشف الكاشف الفوتونات,بمعدل 10 مرات ، مع انحراف RMS يبلغ حوالي 4,بمعدل 10 مرات ، مع انحراف RMS حوالي 3,بمعدل 10 مرات ، مع انحراف RMS يبلغ حوالي 1,بمعدل 10 مرات ، مع انحراف RMS يبلغ حوالي 0.1,B
أي من مجموعات سلاسل البت التالية لا يمكن وصفها بتعبير عادي؟,جميع سلاسل البت التي يكون عدد الأصفار فيها من مضاعفات خمسة,تبدأ جميع سلاسل البت بصفر وتنتهي بواحد,جميع سلاسل البت بعدد زوجي من الأصفار,جميع سلاسل البت التي تحتوي على عدد أكبر من الأصفار,D
