Question,A,B,C,D,Answer
Kilès nan fim sa yo laterè te epaye pi sekans yo?,Rele ',Machwè 'machwa',Halloween',Vandredi 13th la,D
Kilès nan asyèt sa yo ki fèt ak trip kochon?,ajiste,linèt,sak dan,koupe sòs tomat,B
Ki sa ki aktè Antonio Banderas lang natif,Èspanyòl,Lawisi,Alman,Fwansè,A
Ki lang ofisyèl Peyiba yo?,Danwa,Swedish,Alman,Olandè,D
Nan ki eta fim 1999 la mete?,Kalifòni,Kawolin disid,Georgie,Texas,A
Mitasyon ki lakòz achondroplasia egzèse yon efè ki ka klase kòm:,dominan negatif.,jwenn-of-fonksyon.,haploinsufficiency.,pèdi-of-fonksyon.,B
Zouti maketing sa a ak kominikasyon ofri yon pwovokasyon dirèk oswa yon ankourajman ankouraje kliyan yo achte yon pwodwi / sèvis:,Piblisite.,Relasyon piblik.,Pwomosyon lavant.,Maketing dirèk.,C
K-pliye kwa-validasyon se,lineyè an K,kwadratik nan K,kib nan K,eksponansyèl nan K,A
Granmoun ki gen laj mwayen parèt yo dwe plis ____ granmoun oswa pi piti granmoun,Jeneratif,flè sezon,Agreyab,Sèten,A
Flacy nan pèsonalite laudatory se yon kalite espesifik,Flagran aksidan,Fo dilèmma,Sipliye kesyon an,Rezònman sikilè,A
"Kesyon sa a gen rapò ak enfòmasyon sa yo.
""Grenn yo nan rejim totalitè yo nouri pa mizè epi yo vle. Yo gaye epi yo grandi nan tè ki mal la nan povrete ak konfli. Yo rive nan tout kwasans yo lè espwa yon pèp mouri. Nou dwe kenbe esperans sa a vivan. . . . Gwo responsablite yo te mete sou nou pa mouvman rapid evènman yo. . . . Mwen gen konfyans ke Kongrè a ap fè fas a responsablite sa yo kareman.""
Prezidan Harry S. Truman, 1947
Lide yo te eksprime nan pasaj ki anwo a pi dirèkteman ki nan kontinwite sa yo nan istwa Etazini?",Deba sou relasyon ki genyen ant Kongrè a ak pwezidan an.,Deba sou itilizasyon fòs militè nan sitiyasyon ki vole.,Deba sou wòl Etazini nan zafè mondyal.,Deba sou wòl apwopriye nan pati politik yo.,C
Yon pasyan soufri yon kou kase ak domaj nan kòd la nan nivo a nan sizyèm vètebre a.,Yo pap kapab respire san sipò lavi.,Yo pral sèlman kapab respire tou toudegason.,Li enposib pou nou predi yon efè sou respirasyon.,Respire yo pral afekte.,B
Otokopi negatif otoktòb endike pa ki youn nan sa ki annapre yo?,Yon modèl siklik nan rès yo,Yon modèl altène nan rès yo,Yon o aza konplè nan rès yo,Rezidyèl ki tout pre zewo,B
Idantifye antesedan an nan pwopozisyon an kondisyonèl: Bees genyen premye jwèt yo sèlman si swa Avarks yo oswa Chipmunks yo pa genyen premye jwèt yo.,Avards yo pa genyen premye jwèt yo.,Bees genyen premye jwèt yo.,Chipmunks yo pa genyen premye jwèt yo.,Swa Avarks yo oswa Chipmunks yo pa genyen premye jwèt yo.,B
Elèv yo ap fè yon egzèsis separasyon plant ki mande pou yo itilize yon chanm kwomatografi fèmen ak yon ti kantite acetone nan pati anba chanm lan. Avètisman sekirite pou ekspyasyon an gen ladan deklarasyon an ke li se yon je ak iritan po e li gen vapè flamab. Nan prekosyon sa yo ki sekirite ta dwe pran pandan y ap fè egzèsis la?,Mete gan dife-retade yo pote chanm lan nan yon kanpe lafimen si dife a acetone,"Mete chanm lan nan yon kabinè fèmen, kabinè nwa pou dire a nan separasyon pigman an",Mete gan kwi ak kouvri nen an ak bouch la ak yon mask patikil,Mete gou ak gan nitril-kalite epi kenbe tout resipyan atone fèmen,D
Kilès nan sa yo fè detèmine ki gen rapò ak evolisyonè nan espès diferan ki baze sou sekans asid amine nan pwoteyin omologous jeneralman mwens egzat pase detèminasyon ki gen rapò ak ki baze sou sekans yo nikleyotid nan jenès omologous?,Mitasyon silans,Kopi jèn,Evènman translokasyon ki chanje sekans jenetik,Travèse-over,A
Èske omisid ilegal ki komèt pa Ministè peyi X aletranje yon jiridik jiridik oswa jijman jire?,Konduit sa yo se yon zak piblik (jire),Konduit sa yo pa janm atire vaksen,Konduit sa yo se yon zak prive (jij),Konduit sa a se yon zak piblik men li pwoteje pa iminite,C
"Kesyon sa a gen rapò ak enfòmasyon sa yo.
Premye nou dwe remake ke Cosmos la se esferik nan fòm, an pati paske fòm sa a ke yo te yon jwenti pafè ki mande pa gen okenn jwenti, se pi konplè a nan tout, an pati paske li fè fòm ki pi kapasite a, ki se pi bon adapte yo gen ak prezève tout bagay; oswa ankò paske tout pati konstitiyan nan linivè a, se sa ki solèy la, lalin lan ak planèt yo parèt nan fòm sa a; oswa paske tout bagay fè efò yo rive nan fòm sa a, jan yo parèt nan ka a nan gout dlo ak lòt kò likid si yo eseye defini tèt yo. Kidonk, pèsonn pap gen dout fòm sa a se nan kò selès yo. ...
Ke tè a se tou esferik se Se poutèt sa pi lwen pase kesyon, paske li peze soti nan tout kote sou sant li. Malgre ke pa rezon nan elevasyon yo nan mòn yo ak depresyon yo nan vale yo yon sèk pafè pafè pa ka konprann, ankò sa a pa afekte nati a esferik jeneral sou tè a. ...
Jan sa te deja montre tè a gen fòm yon esfè, nou dwe egzamine si yon mouvman kowenside ak fòm sa a, e ki kote tè a kenbe nan linivè. ... Pifò nan otè nan kou dakò ke tè a kanpe toujou nan sant linivè a, epi konsidere li pa kanpe ak ridikil pou sipoze opoze a. Men, si pwoblèm nan ak anpil atansyon peze, li pral wè ke kesyon an poko rezoud ak Se poutèt sa pa gen okenn mwayen pou yo dwe konsènan alalejè. Chak chanjman nan kote ki obsève se akòz, sètadi, nan yon mouvman obsève oswa nan obsèvatè a, oswa nan mouvman tou de. ... Kounyeya, se sou tè a pou revolisyon syèl la obsève e li pwodui pou je nou. Se poutèt sa, si tè a sibi okenn mouvman mouvman sa a dwe pran plas nan tout bagay deyò sou tè a, men nan direksyon opoze a pase si tout bagay sou tè a deplase, ak kalite sa a se revolisyon an chak jou. Se konsa, sa a parèt afekte tout linivè a, se sa ki, tout bagay deyò tè a ak sèl eksepsyon sou tè a tèt li. Si, sepandan, yon sèl ta dwe admèt ke mouvman sa a pa t 'spesifik nan syèl la, men ke tè a te revele soti nan lwès nan lès, epi si sa a te ak anpil atansyon konsidere nan konsiderasyon aparan k ap monte ak anviwònman solèy la, lalin lan ak zetwal yo, li ta dekouvri ke sa a te sitiyasyon reyèl la.""
Nicolas Copernicus, Revolisyon kò selès la, 1543
Pasaj la ka itilize kòm prèv ki montre Copernicus diferan de tradisyonèl la, filozòf natirèl Aristolian nan epòk li a paske li te sijere sa",Cosmos la se esferik,Tè a se esfektif,Cosmos lan se jewostatik,Latè a pa estasyone,D
"Detèmine H + (aq) konsantrasyon nan 1.0 M phenol, C6H5OH, solisyon. (Ka pou fenèt la se 1 × 10 ^-10.)",1 × 10^-10 M,1 × 10^-9 M,1 × 10^-3 M,1 × 10 ^-5 M,D
"Kilès nan faktè sa yo ta dwe konsidere kòm yon faktè ""rale"" pou Riva lè w ap konsidere yon deplase soti nan peyi Zend pou ale Etazini?",Povrete abjè,Pi bon travay ak pi wo salè,Sistèm kasèt india a,Vyolans nan katye li,B
"Konpare ak pati politik yo nan peyi tankou Angletè ak Izrayèl, tou de nan yo ki gen sistèm miltipat, pati politik Ameriken yo se",mwens enterese enfliyanse rezilta eleksyon yo,mwens klèman idantifye ak ideoloji politik ki konsistan,mwens efikas nan ogmante lajan nan men sipòtè politik yo,pi bon kapab reflete objektif yo nan tout konstitiyant yo,B
"Yon nimewo, awondi nan mil ki pi pre a, se 47,000. Ki nimewo ki ta ka nimewo ki te awondi?","46,295","46,504","47,520","47,924",B
"Yon tank se nan fòm yon pris triyangilè. Si baz triyangilè a gen yon zòn nan 116 pye kare, ak tank la se 30 pye wotè, konbyen dlo a ta gen tank la genyen lè li plen?",1725 pye^3,1740 ft^3,3480 ft^3,6960 ft^3,C
"Vòltaj la pwovoke nan yon endikatè reprezante kòm,",pwodwi nan endikasyon li yo ak aktyèl nan li.,rapò endikatè li yo aktyèlman nan li.,rapò aktyèl li nan endikasyon li yo.,pwodwi nan endikasyon li yo ak pousantaj chanjman nan aktyèl la nan li.,D
Kilès nan karakteristik sa yo jeneralman ki konsistan avèk vyòl dat?,itilize fòs twòp,ndòmi,motive seksyèlman,enplike itilizasyon yon zam,C
Jwenn longè koub la y = ln x ant pwen yo kote y = 1/2 ak y = 1.,0.53,0.86,1.18,1.36,C
Jwenn $-\dfrac{1}{-3}\cdot\cfrac{1}{~\frac{1}{-3}~}.!,1,-1,0,2,B
Ki pèspektiv sikolojik ki te pi popilè nan vire vwati syèk la nan Ewòp lwès?,evalyasyon,evolisyonè,konpòtman,ikoanaltik,D
Aprann dekouraje gen plis chans pou yo dirèkteman gen rapò ak,efè barnum lan.,patipri pwòp tèt ou-sèvi.,yon lokal ekstèn nan kontwòl.,san kondisyon pozitif.,C
Garcia ak Rechèch Koelling a konsènan avèsyon aprann etabli sa ki nan UCS sa yo ak CS pè yo se pè ki pi pwisan ak aprann pi vit?,fè yon travay epi resevwa yon rekonpans manje,kè plen ak bwè,mouvman ak chòk,pinisyon ak rekonpans,B
"Gen kèk nan dlo Mars 'se jele nan tè a ak glas la ak kèk te pèdi akòz solè van solèy men anpil nan dlo orijinal la te panse yo te pèdi nan yon lòt mekanis. Kisa ki te pase sa a ""pèdi""dlo?",li te dezabiye pa jaden mayetik la lè li rapidman diminye nan fòs,li te kase nan idwojèn ak oksijèn pa limyè iltravyolèt ak idwojèn a te pèdi nan chape tèmik,li te boule pa yon sivilizasyon swaf dlo Matin,li te vaporize pandan yon peryòd de vòlkanis entans e li te pèdi nan espas nan chape tèmik,B
"Vwayaje nan yon vitès premye nan 1.5 × 10 ^6 m / s, yon pwoton antre nan yon rejyon nan jaden mayetik konstan nan mayitid 1.5 T. Si vektè inisyal pwoton an fè yon ang de 30° ak jaden an mayetik, kalkile vitès pwoton an 4 s apre yo fin antre nan jaden an mayetik.",5.0 × 10 ^6 m/s,7.5 × 10^6 m/s,1.5 × 10 ^6 m/s,3.0 × 10^6 m/s,C
"Enèji a lage nan pann nan fosfat yo enèji-wo enèji, ATP ak fosfocreatine, ka soutni egzèsis maksimòm pou sou:",1-2 segonn.,5-10 segonn.,30-40 segonn.,50-60 segonn.,B
"Nan yon sikwi seri, si aktyèl la nan yon sèl lanp se 2 A, aktyèl la nan lanp lan akote li se","mwatye, 1 A",2:00 AM,Depann de ki lanp ki pi pre batri a,Pa ase enfòmasyon pou di,B
Kilès nan sa ki annapre yo gen plis chans yo pwodwi pi fò kwasans ekonomik sou tan?,Plis konsomasyon rapid nan resous natirèl.,Pi wo pousantaj analfabèt pousantaj analfabèt.,Yon machandiz tonbe nan machandiz kapital yo.,Kredi taks envestisman.,D
Ekonomi an se nan yon resesyon gwo twou san fon. Etandone sitiyasyon ekonomik sa a ki nan deklarasyon sa yo sou politik monetè egzat?,Politik ekspansyon ta sèlman vin pi mal resesyon an.,Politik ekspansyonè anpil ogmante demand dakò si envestisman sansib a chanjman nan to enterè a.,Politik kontraksyon se estimilis ki apwopriye pou envestisman ak konsomasyon.,Si demann lan pou lajan se parfe elastik politik monetè ta ka byen efikas.,B
"Biznis yo angaje nan kontablite sosyal akòz demand nan _________, yo nan lòd yo idantifye ________, amelyore ___________ ak ankouraje _________ ak ___________","Moun ki gen entansyon, Risk, Jesyon Moun ki gen entansyonèl, Responsablite, Transparans","Moun ki gen entansyon, Responsablite, Transparans, Risk, Jesyon Moun ki gen enkyetid","Moun ki gen entansyon, Responsablite, Risk, Moun ki gen entansyonèl, Jesyon Stakeholder","Moun ki gen entansyon, Moun ki gen entansyonèl, Transparans, Risk, Responsablite",A
Yon taks enpoze sou yon foul moun ap gen plis chans yo dwe pase sou konsomatè a nan fòm lan nan ogmantasyon pri si,pri elastisite nan demann se trè elastik.,elastisite pri nan demann se trè inelastik.,elastisite pri nan demann se inite elastik.,salè elastisite nan demann se trè elastik.,B
Deklarasyon 1 | In a group (ab)^{-2} = b^{-2}a^{-2}. Deklarasyon 2 | Nan yon gwoup (ab)^n = a^nb^nb^n.,"Se vre, vre","Fo, fo","Se vre, fo","Fo, vre",B
Ki tèm ki genyen nan ki pwen konpetisyon nan yon peyi enfliyanse pa konpetisyon nan lòt peyi?,komès entènasyonal,Ekonomi mondyal,Konpetisyon mondyal,Globalizasyon,D
"Yon pwogramè te ekri pwogram ki anba a. Pwogram nan itilize yon lis nimewo ki rele nimewo. Pwogram lan gen entansyon montre sòm total la nan nimewo yo nan lis la.
 sòm ← nèg [1]
 POU CHAK valè nan lis nèg
 sòm ← sòm + valè
 EKSPOZISYON Sòm
 Yo nan lòd yo teste pwogram nan, pwogramè a inisyalize nimewo a [0, 1, 4, 5]. Pwogram nan montre 10, ak pwogramè a konkli ke pwogramè a ap travay jan sa gen entansyon. Kilès nan bagay ki vin apre yo?",Konklizyon an kòrèk; pwogram nan ap travay jan li gen entansyon.,"Konklizyon an pa kòrèk; pwogram lan pa montre valè ki kòrèk la pou ka tès la [0, 1, 4, 5].","Konklizyon an pa kòrèk; lè l sèvi avèk ka tès la [0, 1, 4, 5] pa ase pou konkli pwogram lan kòrèk.","Konklizyon an pa kòrèk; lè l sèvi avèk ka tès la [0, 1, 4, 5] sèlman konfime ke pwogram nan ap travay pou lis ogmante lòd.",C
Poukisa Parfit opoze egalite?,Li diskite ke yon sosyete inevitab.,"Li fè reklamasyon lè nou bay bezwen pòv yo, nou ka ogmante egalite.",Li fè rekonpans pou nou chak responsab pou povrete nou.,Li rejte lide egalite tout ansanm.,B
"Kesyon sa a gen rapò ak enfòmasyon sa yo.
""Vreman vre, kòm tou de grès yo nan distenge [entelektyèl] ki baze opinyon yo sou rezon ak tradisyon sanble ak konsansis la nan kominote Sunni an dakò ke obligasyon ansyen nan ekstraksyon, ekstèminasyon, ak ekspilsyon nan inovasyon sa ki mal dwe objektif la nan aspirasyon egzalte nou an, pou ""zèl relijye se yon viktwa pou Lafwa Nan Bondye Benefisyè a""; lè sa a, an akò ak pawòl Pwofèt la (Lapè sou li!) ""Nenpòt moun ki prezante inovasyon sa ki mal nan lòd nou yo dwe ekspilse"" ak ""Nenpòt moun ki fè òd kont lòd nou yo dwe ekspilse,"" aksyon te vin nesesè ak egzijan ...""
Lèt ki soti nan Ottoman Sultan Selim mwen safavid Shah Ismail I, 1514
Safavids yo te trase ire a nan anpi Islamik tankou Ottoman ak Anpi Mughal la sitou paske Safavids yo",te yon anpi ekspansyon jewografik ki sitiye ant de lòt ekspansyon,rejte tès santral Islam yo,"kretyen ki te esklav yo, e yo te vire yo nan avyon de gè Safavid yo.",Ismail pwoklame tèt li yo dwe yon Kalifòni,A
"Kesyon sa a gen rapò ak enfòmasyon sa yo.
Mwen mache ansanm ak kolòn nan, mande sa k ap pase.
Men sa yon sòlda di tou senpleman: ""Yo rele plis chak jou.
""Kèk nan nou te voye nan nò rivyè Jòn nan kenz ane,
Et koulye a nan karant nou ap dirije nan gazon yo nan lwès la.
Nan premye vwayaj nou an, chèf vilaj la te oblije mare bannann nou yo pou nou.
Lè nou tounen, cheve nou te blan, men toujou gen plis arèstasyon.
Ganizon fwontyè a kouri ak san, ase pou ranpli yon lanmè,
Men anbisyon teritorial Martial la poko rekòt.
Nan sant distri bò solèy leve nan mòn yo, toupatou nan peyi Han,
Dwe gen dis mil bouk ki brase kounye a enferyè.
Menmsi madanm yo gen ase fòs pou yo okipe yon chwal epi pou yo rale,
Rekòt yo grandi tout fason, jaden yo se tout yon dezòd.
Li pi difisil pou gason shanxi yo, ak repitasyon yo kòm avyon de gè:
Yo ap awondi tankou chen oswa poul, chak gason enpresyone.
""Men, mesye, menm si li bon nan ou mande,
Plent se pa yon pati nan travay sòlda a.
Nou ka sèlman souke tèt nou. Pran sezon fredi sa a:
Twoup Shanxi yo pat janm voye lakay yo.
Ofisye Distri yo ap mande taks sou tè a,
Men, ki kote li pral soti? Ou pa ka fè san sòti nan wòch!
Mwen onètman panse ke li move chans yo pote yon pitit gason kounye a,
Li pi bon pou gen yon pitit fi: omwen li ka marye
Epi viv ak vwazen yo pòt pwochen.
Men, yon pitit gason ap fini kouche sou kèk priyè byen lwen.""
Du Fu, ""Boul nan kabwa lame a,"" ca. 750 epòk nou an.
Powèm nan bay prèv ki montre ki sa ki annapre yo ki gen rapò ak relasyon sèks nan sosyete Tang?",Relasyon konfisyansyèl ant mari ak madanm te toujou fò nan sosyete Tang la.,Reskripsyon imperial yo mete aksan sou nesans pitit gason ki kapab akonpli kota konskripsyon.,Travay agrikòl ka pataje pa fanm ak gason sanble.,Relasyon tradisyonèl Chinwa yo te ranvèse pandan rèy la nan Empress Wu Zetian.,C
"Nan avyon an xy-avyon, graf x^(lòg y) = y^boutèy x se",premye kadran a louvri,yon koub fèmen,rechi nan premye kadran ouvè a,yon sèl pwen,A
Kiyès nan peyi sa yo ki te emèt pi CO2 pou chak kapital nan 2017?,Japon,Kanada,Lawisi,Iran,B
Ki sa ki se yon atak reparèt?,Lè atakè a reponn a yon mesaj voye bay li pa sistèm lan,"Yon atak ki kontinyèlman repete, pwobableman pou yon feblès",Yon atak ki itilize pwòp mesaj sistèm lan ak se konsa pa ka defann kont,"Atakè a reprezante yon mesaj kaptire, ak sit la aksepte li yo ak reponn nan favè atakè a",D
Lefèt ke frekans absòpsyon enfrawouj nan klorid deterium (DCL) deplase soti nan sa yo ki an idwojèn klorid (HCL) se akòz diferans ki genyen nan yo,distribisyon elektwonik,moman dipoze,konstant fòs,mas redui,D
"Efisite kantite yon detektè foton se 0.1. Si 100 foton yo voye nan detektè a, youn apre lòt la, detektè a pral detekte foton","yon mwayèn de 10 fwa, ak yon rms devyasyon sou 4","yon mwayèn de 10 fwa, ak yon rms devyasyon sou 3","yon mwayèn de 10 fwa, ak yon rms devyasyon sou 1","yon mwayèn de 10 fwa, ak yon rms devyasyon sou 0.1",B
Kilès nan kouche sa yo nan ti jan strings PA KA dekri ak yon ekspresyon regilye?,Tout ti jan strings ki gen kantite zewo se yon miltip nan senk,Tout ti jan strings kòmanse ak yon zewo ak fini ak yon sèl,Tout ti jan strings ak yon menm kantite zewo,Tout ti jan strings ak plis pase zewo,D
Adaptasyon nan plant yo minimize pèt dlo nan anviwònman ak tanperati ki wo gen ladan ki nan sa ki annapre yo?,Anpil stomata,Mens koupe,Kolòn olye pou yo fèy,Gwo sifas-a-volim pousantaj,C
Mitasyon yo se erè nan ADN ki:,toujou danjere.,sèlman rive nan prezans nan kansè nan.,ogmante kwasans timè.,rive espontaneman nan yon pousantaj ki ba.,D
Kilès nan sa ki annapre yo se verite ipotèz?,Pèdi pwa,Pre-tibial myxoedema,Yon nivo TSH leve soti vivan,Yon mwayèn nan kote cho,C
"Valè kay yo èskalye nan yon vil gen yon mwayen de $125,000 ak yon devyasyon estanda de $23,000. Akoz yon nouvo kontra pwofesè yo, distri lekòl la bezwen yon 10% siplemantè nan lajan konpare ak ane anvan an. Pou ogmante lajan sa a adisyonèl, vil la enstwi biwo evalyasyon an pou ogmante tout valè kay ki elve pa $5,000. Ki sa nouvo devyasyon nouvo estanda ki gen nan kay ki leve nan vil la?","$23,000 ","$25,300 ","$28,000 ","$30,300 ",A
" Nan diskriminasyon li te fè nan lagè, Valls sijere ke",pa gen okenn diferans ant konbatan ak noncombatants.,diferans ki genyen ant konbatan ak noncombatants se yon kesyon de degre.,diferans ki genyen ant konbatan ak noncombatants se kategori ak klè.,"""teworis"" yo ta dwe defini kòm vyolans enkwayab.",B
" Dapre Nussumba, trete yon moun kòm yon objè se",ase pou objèktif seksyèl.,nesesè pou objèktif seksyèl.,pa nesesè pou objèktif seksyèl.,tout nan pi wo a.,C
"Pou ki nan de senaryo sa yo fè karaktè prensipal la (ki itilize mwen / mwen / mwen) fè yon bagay klèman mal, dapre estanda moral òdinè nan peyi Etazini an kòm nan 2020? Scenario 1 | Antanke paran m t ap dòmi, mwen t al dòmi. Scenario 2 | Mwen vide detèjan nan machin nan plen rad chanm mwen an.","Mal, mal","Mal, pa mal","Pa mal, mal","Pa mal, pa mal",D
"Pou ki nan de senaryo sa yo fè karaktè prensipal la (ki itilize mwen / mwen / mwen) fè yon bagay klèman mal, dapre estanda moral òdinè nan peyi Etazini an kòm nan 2020? Scenario 1 | Mwen pafwa eseye di laverite, sof si li vin m 'nan pwoblèm. Scenario 2 | Mwen bo mennaj mwen nan montre majik la.","Mal, mal","Mal, pa mal","Pa mal, mal","Pa mal, pa mal",B
"Pou ki nan de senaryo sa yo fè karaktè prensipal la (ki itilize mwen / mwen / mwen) fè yon bagay klèman mal, dapre estanda moral òdinè nan peyi Etazini an kòm nan 2020? Scenario 1 | Mwen kouri sou tapi fre a ak yon avoka. Scenario 2 | Mwen pipi nan men m 'pou mwen te kapab teste li pou enfeksyon.","Mal, mal","Mal, pa mal","Pa mal, mal","Pa mal, pa mal",A
"Pou ki nan de senaryo sa yo fè karaktè prensipal la (ki itilize mwen / mwen / mwen) fè yon bagay klèman mal, dapre estanda moral òdinè nan peyi Etazini an kòm nan 2020? Scenario 1 | Mwen te wè pi popilè Elton John deyò yon tèren konsè epi li te pran yon foto l 'san yo pa mande l'. Scenario 2 | Mwen rapòte yon lòt gad ki tap pale nan dwòg nakotik nan yon prizon e vann yo bay prizonye yo.","Mal, mal","Mal, pa mal","Pa mal, mal","Pa mal, pa mal",D
"Pou ki nan de senaryo sa yo fè karaktè prensipal la (ki itilize mwen / mwen / mwen) fè yon bagay klèman mal, dapre estanda moral òdinè nan peyi Etazini an kòm nan 2020? Scenario 1 | Mwen te frape sou rediksyon mwen pou manke boul la jan li te vini nan wout la. Scenario 2 | Mwen te anseye pitit mwen yo pou yo jwe xylophone la.","Mal, mal","Mal, pa mal","Pa mal, mal","Pa mal, pa mal",D
"Pou ki nan de senaryo sa yo fè karaktè prensipal la (ki itilize mwen / mwen / mwen) fè yon bagay klèman mal, dapre estanda moral òdinè nan peyi Etazini an kòm nan 2020? Scenario 1 | Lè frizè restoran mwen an te kraze, mwen te sèvi vyann lan cho menm si mwen te konnen li te trè ensekirite. Scenario 2 | Mwen te deside kòmanse yon dife nan forè a.","Mal, mal","Mal, pa mal","Pa mal, mal","Pa mal, pa mal",A
"Pi gwo konsomasyon lèt
",Te rapòte ke yo dwe asosye ak yon ensidans ki pi wo nan karaktè ak pi wo mòtalite nan kèk etid,Pandan fòmasyon sanble yo dwe asosye ak pi wo dansite zo mineral nan lavi pita,Se toujou ki asosye ak yon pousantaj pi ba nan frakti,Nan peyi ki gen pousantaj ki pi wo nan karaktè sijere ke konsomasyon lèt se benefisye nan eskèlèt la.,A
"Kilès nan deklarasyon sa yo sou metabolis glikoz kòrèk?
",Glucagon ogmante pousantaj glikoliz,Glycolysis mande pou NADP+,"Nan glikoz, glikoz la rete nan de pwodwi twa-kabòn",Fen-pwodwi a nan glikoz nan selil wouj nan san se pyruvate,C
Nagel reklamasyon ke pwoblèm nan nan chans moral se byen konekte ak pwoblèm nan nan:,egzistans Bondye.,libète volonte a.,egoyis sikolojik.,inivèsèl.,B
"Dapre Chantè, konfòmite avèk prensip li mande:","chanjman modès nan abitid pèsonèl nou yo, men se pa nan sosyete nou antye.","chanjman nan abitid pèsonèl nou, e nan sosyete a.","Chanjman radikal nan abitid pèsonèl nou, men se pa nan sosyete nou an.",Chanjman radikal nan tou de abitid pèsonèl nou yo ak nan sosyete nou an.,D
Kiyès nan sa ki annapre yo se dènye moun ki okipe pa èt imen?,Nouvo Gine,Ostrali,Nouvèl Zelann,Timò,C
Sivilizasyon Nubian:,prede ak te pase monte nan kilti Ejipsyen an.,se te rezilta kolonizasyon Mezopotaminiken nan sid la.,"devlope an repons a, men se pa nan imitasyon, kilti Ejipsyen an.",pa t gen okenn kontak ak kilti vwazen yo.,C
Yon antite gouvènman oblije enkli yon deklarasyon lajan kach nan ki deklarasyon finansye sa yo?,Deklarasyon finansye gouvènmantal yo.,Deklarasyon finansye gouvènman an.,Deklarasyon finansye pwopriyetè yo.,Deklarasyon finansye fiduciaire yo.,C
Kilès nan deklarasyon sa yo kòrèk jan li gen rapò ak chanjman nan estimasyon kontablite?,Pifò chanjman nan estimasyon kontablite yo konte pou retrospektivman.,"Chak fwa li enposib pou detèmine si yon chanjman nan yon estimasyon oswa yon chanjman nan kontablite prensip ki te fèt, chanjman an ta dwe konsidere kòm yon chanjman nan prensip.","Chak fwa li enposib pou detèmine si yon chanjman nan kontablite estimasyon oswa yon chanjman nan kontablite te fèt, chanjman an ta dwe konsidere kòm yon chanjman nan estimasyon.",Li pi fasil pou diferansye ant yon chanjman nan kontablite estime ak yon chanjman nan kontablite prensip pase li se diferansye ant yon chanjman nan kontablite estimasyon ak yon koreksyon nan yon erè.,C
"Yon motoslèz neglijans kondwi seryezman blese yon lòt chofè. Motè a te site pou vwayaje nan move tè a epi yo te peye yon amann. Motè a te gen yon limit politik sèlman $ 15,000 pou responsablite twazyèm pati sou politik asirans li. Apre yo fin mèb asirans motè a ak yon rapò medikal konplè, tout bòdwo medikal, dosye medikal, ak lòt prèv domaj, moun ki blese a te mande limit politik yo. Moun kap fè reklamasyon an te remake ke yon move reklamasyon lafwa ta depoze si limit politik yo pa te peye imedyatman. Konpayi asirans lan te refize peye san eksplikasyon. Yon jiri te akòde reklamasyon ki te blese a $200,000. Moun ki te blese a te jwenn yon asiyasyon ki te siyen nan men motosiklèt neglijans la ki te bay moun k ap fè reklamasyon an nenpòt dwa ke motosiklèt la te ka genyen kont asirans li a. Èske tribinal la ap oblije konplete konpayi asirans lan pou peye tout kantite vèdik jiri a pou moun ki blese anba reyalite sa yo?","Limit politik la se $ 15,000 e ke se tout sa ki ka ranmase pa moun ki blese a pa gen okenn aksyon pou move lafwa sou yon kontra asirans.",Konpayi asirans lan te vyole alyans bon lafwa ak jis ki enplisit nan chak kontra asirans epi yo dwe peye tout kantite jijman an.,"Move lafwa se pèsonèl nan pati asirans lan ak asirans li te genyen an te envalid, e moun ki blese a pa gen okenn reklamasyon pou l fòse asirans lan peye.",Pati ki blese a dwe ranfòse tout jijman li kont motosiklèt la epi yo pa janm ka pouswiv asirans lan pou kantite lajan sa a.,C
