Question,A,B,C,D,Answer
"Бул суроо төмөнкү маалыматка тиешелүү.
""Чындыгында, өз оюн акылга да, салтка да негиздеген көрүнүктүү [окумуштуулардын] фатвалары да, сунниттик коомдоштуктун консенсусы да байыркы жаратуу, жок кылуу жана жаман инновацияларды кууп чыгаруу боюнча байыркы милдетибиз биздин жогорку умтулуубуздун максаты болушу керек дегенге макул, анткени ""Диний ынталуулук — Кудайдын Бенефициентинин ишениминин жеңиши""; андан кийин, Пайгамбардын сөздөрүнө ылайык (Ага тынчтык!) ""Ким биздин тартипке жаман инновацияларды киргизип, кууп чыгарылышы керек"" жана ""Ким биздин тартипке каршы окутса, кууп чыгарылышы керек"", иш-аракет зарыл жана эксгитент болуп калды."".""
Османлы Сұлтан Селим I сафавид Шах Исмаил I кат, 1514
Сафавиддер Османлы жана Мугал империялары сыяктуу ислам империяларынын кыжырын келтиришкен , себеби биринчи кезекте сафавиддер",географиялык жактан башка эки экспансионисттин ортосунда жайгашкан экспансионисттик империя болгон,исламдын борбордук тенденцияларын четке какты,"Ыйсанын кулу Ыйсанын жолдоочулары, жана аларды Сафавид жоокерлерине айлантты",Исмаил өзүн Халиф деп жарыялаган,A
"Бул суроо төмөнкү маалыматка тиешелүү.
Мен колоннанын жанында жүрөм, эмне болуп жатканын сурайм.
Жоокер жөн гана мындай дейт: ""Алар күн сайын көбүрөөк чакырышат.
""Кээ бирлерибиз түндүктү он беш жашында Сары дарыяга жөнөтүлдүк,
Ал эми кырк жашында батыштагы гарнизондорго барабыз.
Биздин биринчи турда айыл башчысы биз үчүн банданналарыбызды байлоого туура келди.
Биз кайтып келгенде, чачыбыз ак болчу, бирок дагы көп толкуштар бар.
Чек ара гарнизондору кан менен чуркашат, океанды толтурууга жетиштүү,
Бирок Согуш императорунун территориялык амбициялары али өрчүй элек.
тоонун чыгышындагы жүз райондо, Бүт Хань жеринде,
Азыр дүрбөлөңгө түшкөн он миң айыл болушу керек.
аялдар шланг жана соко кармаш үчүн жетишерлик күчтүү болсо да,
Түшүмдөр ар кандай жол менен өсөт, талаалардын баары бузулат.
Бул Шаньси эркектери үчүн кыйын, алардын жоокерлер катары кадыр-баркы менен:
Алар иттер же тоок сыяктуу тегеректеп турушат, ар бир эркек таасирлентти.
""Бирок, мырза, сураган жакшы болсо да,
Арыздануу жоокердин милдетинин бир бөлүгү эмес.
Биз башыбызды гана селкинчектей алабыз. Бул кышты алып:
Шаньси аскерлери эч качан үйлөрүнө жөнөтүлгөн эмес.
Райондук кызматкерлер жер салыгын талап кылып жатышат,
Бирок ал кайдан келет? Сиз таштан кан ала албайсыз!
Чынын айтсам, азыр балалуу болуу жаман ийгилик деп эсептейм,
Кызы бар болсо жакшы: жок дегенде, ал үйлөнө алат
Жана кошуна кошуналары менен жашашат.
Бирок уулу кээ бир алыскы шалбаада жатып калат.""
Дю Фу, ""Армия арабаларынын балладасы"", о. 750 б.з.
Поэма Тан коомунда гендердик мамилелерге карата төмөнкүлөрдүн кайсынысы далил берет?",Тан коомунда күйөөсү менен аялынын ортосундагы конфуцийдик мамилелер дагы деле бекем болгон.,Императордук жазууларда кыздардын үстүнөн аскерге чакыруу квоталарын аткарууга жөндөмдүү уулдардын төрөлүшү баса айтылган.,"Айыл чарба иштерин аялдар да, эркектер да бөлүшө алышмак.",Кытайдын салттуу гендердик мамилелери Император Ву Зетяндын башкаруусунун учурунда өзгөртүлдү.,C
Xy-учакта X^(log y) = y^log X графиги,ачык биринчи квадрант,жабык ийри,ачык биринчи квадранттагы нур,бир пункт,A
Төмөнкү өлкөлөрдүн кайсынысы 2017-жылы жан башына эң көп СО2 чыгарган?,Жапония,Канада,Орусия,Иран,B
Кайталоочу чабуул деген эмне?,Кол салуучу система жөнөткөн билдирүүгө жооп бергенде,"Алсыздыкты сынап, үзгүлтүксүз кайталанган чабуул",Системанын өз билдирүүлөрүн колдонгон чабуулдан коргонуу мүмкүн эмес,"Кол салуучу басып алынган кабарды таарынтып, сайт аны кабыл алып, кол салуучу пайдасына жооп берет",D
Деутерий хлоридинин (DCl) инфракызыл сиңирүү жыштыгы суутек хлоридинин (HCl) инфракызыл жыштыгы алардын айырмачылыктарынан улам,электрон бөлүштүрүү,дипол моменти,күч туруктуу,массанын төмөндөшү,D
"Фотон детекторунун кванттык натыйжалуулугу 0,1 болуп саналат. Детекторго 100 фотон жөнөтүлгөн болсо, бири-бирин кийин, детектор фотондорду аныктайт","орто эсеп менен 10 жолу, болжол менен 4 румс четтөө менен","орто эсеп менен 10 жолу, 3 жөнүндө рмс четтөө менен","орто эсеп менен 10 жолу, болжол менен 1 румс четтөө менен","орто эсеп менен 10 жолу, болжол менен 0,1 ремс четтөө менен",B
Бит саптарынын төмөнкү топтомдорунун кайсынысын үзгүлтүксүз билдирүү менен сүрөттөп коюуга болбойт?,Нөлдөрдүн саны бештен көп болгон бардык бит саптары,"Бардык бит саптары нөлдөн баштап, бир менен аяктайт",Нөлдөрдүн бирдей саны менен бардык бит саптары,Нөлдөн көп менен бардык бит саптары,D
Жогорку температурадагы чөйрөлөрдө суу жоготууларын минимумга жеткирүү үчүн өсүмдүктөрдүн ылайыкташтыруусу төмөнкүлөрдүн кайсынысын камтыйт?,Көп сандаган стомата,Ичке кескичтер,Жалбырактардын ордуна омурткалар,Чоң беттик-томдук коэффициенттер,C
Мутациялар ДНКдагы каталар болуп саналат:,ар дайым зыяндуу болуп саналат.,канцерогендердин катышуусунда гана пайда болот.,туберкулин өсүшүн жогорулатуу.,өз алдынча төмөн чен менен пайда болот.,D
Төмөнкүлөрдүн кайсынысы гипотироидизмге тиешелүү?,Салмагын жоготуу,Алдын-ала тибиалдык миксоэдема,ТШ деңгээлинин көтөрүлүшү,Жылуу жерлерди четке кагуу,C
"Бир шаардагы үйлөрдүн бааланган баалуулуктары 23,000 $ стандарттык четтөө менен $ 125,000 дегенди билдирет. Мугалимдердин жаңы келишиминин айынан мектеп округуна өткөн жылга салыштырмалуу кошумча 10% каражат керек. Бул кошумча акча чогултуу үчүн, шаар баалоо офисине бардык бааланган үй баалуулуктарын 5000 АКШ долларына жогорулатууну буйруйт. Шаардагы үйлөрдүн бааланган баалуулуктарынын жаңы стандарттык четтөөлөрү кандай болот?","$ 23,000 ","$ 25,300 ","$ 28,000 ","$ 30,300 ",A
 Согушта дискриминацияны талкуулоодо Вальс муну сунуштайт,согушка катышуучулар менен согушпагандардын ортосунда эч кандай айырма жок.,согушка катышуучулар менен согушпагандардын ортосундагы айырмачылык даражага байланыштуу маселе болуп саналат.,согушка катышуучулар менен согушпагандардын ортосундагы айырма категориялык жана айкын.,"""Террорчулук"" кемсинтерлик зордук-зомбулук катары аныкталышы керек.",B
" Нусбаумдун айтуусу боюнча, кимдир бирөөгө объект катары мамиле кылуу",жыныстык объектификация үчүн жетиштүү.,жыныстык объектификация үчүн зарыл.,жыныстык объектификация үчүн зарыл эмес.,жогоруда берилгендердин баары.,C
"Бул эки сценарийдин кайсынысы үчүн башкы мүнөзү (I/me /my колдонот) 2020-жылга карата АКШдагы жөнөкөй адеп-ахлак нормаларына ылайык, адеп-ахлактык жактан ачык-айкын туура эмес иш кылат? Сценарий 1 | Ата-энем уктап жатканда, мен чуркап бардым. Сценарий 2 | Мен бөлмөмдүн кийимине толгон шайбага жуугуч куюп бердим.","Туура эмес, туура эмес","туура эмес, туура эмес","туура эмес, туура эмес","туура эмес, туура эмес",D
"Бул эки сценарийдин кайсынысы үчүн башкы мүнөзү (I/me /my колдонот) 2020-жылга карата АКШдагы жөнөкөй адеп-ахлак нормаларына ылайык, адеп-ахлактык жактан ачык-айкын туура эмес иш кылат? Сценарий 1 | Кээде чындыкты айтууга аракет кылып жатам, эгер ал мени кыйынчылыкка дуушар кылбаса. Сценарий 2 | Сыйкырдуу шоудо кызымды өптүм.","Туура эмес, туура эмес","туура эмес, туура эмес","туура эмес, туура эмес","туура эмес, туура эмес",B
"Бул эки сценарийдин кайсынысы үчүн башкы мүнөзү (I/me /my колдонот) 2020-жылга карата АКШдагы жөнөкөй адеп-ахлак нормаларына ылайык, адеп-ахлактык жактан ачык-айкын туура эмес иш кылат? Сценарий 1 | Мен жаңы килемдин үстүнөн газон шалбаасы менен чуркадым. Сценарий 2 | Мен аны инфекцияга текшерүү үчүн колума заара.","Туура эмес, туура эмес","туура эмес, туура эмес","туура эмес, туура эмес","туура эмес, туура эмес",A
"Бул эки сценарийдин кайсынысы үчүн башкы мүнөзү (I/me /my колдонот) 2020-жылга карата АКШдагы жөнөкөй адеп-ахлак нормаларына ылайык, адеп-ахлактык жактан ачык-айкын туура эмес иш кылат? Сценарий 1 | Мен концерт аренасынын сыртында атактуу Элтон Джонду көрүп, андан сурабай эле анын сүрөтүн алдым. Сценарий 2 | Мен баңгизат колдонуп түрмөгө жашынып, камактагыларга саткан дагы бир күзөтчү жөнүндө кабарладым.","Туура эмес, туура эмес","туура эмес, туура эмес","туура эмес, туура эмес","туура эмес, туура эмес",D
"Бул эки сценарийдин кайсынысы үчүн башкы мүнөзү (I/me /my колдонот) 2020-жылга карата АКШдагы жөнөкөй адеп-ахлак нормаларына ылайык, адеп-ахлактык жактан ачык-айкын туура эмес иш кылат? Сценарий 1 | Мен жолго келгенде допты калтырып кетүү үчүн тыныгууларыма сокку урдум. Сценарий 2 | Мен балдарымды ксилофон ойноого үйрөттүм.","Туура эмес, туура эмес","туура эмес, туура эмес","туура эмес, туура эмес","туура эмес, туура эмес",D
"Бул эки сценарийдин кайсынысы үчүн башкы мүнөзү (I/me /my колдонот) 2020-жылга карата АКШдагы жөнөкөй адеп-ахлак нормаларына ылайык, адеп-ахлактык жактан ачык-айкын туура эмес иш кылат? Сценарий 1 | Ресторанымдын муздаткычы сынганда, мен жылуу этти абдан коопсуз эмес экенин билсем да кызмат кылдым. Сценарий 2 | Мен токойдо өрт баштоону чечтим.","Туура эмес, туура эмес","туура эмес, туура эмес","туура эмес, туура эмес","туура эмес, туура эмес",A
"Сүт керектөөсүн жогорулатуу
",Бир нече изилдөөлөрдө сынуу жана өлүмдүн жогорулашы менен байланыштуу экени маалымдалган,Жыныстык жетилүү маалында сөөк минералынын тыгыздыгы кийинки жашоодо жогорулагандай сезилет .,Сыныктардын төмөндөшү менен үзгүлтүксүз байланышта,Сынуу ылдамдыгы эң жогору өлкөлөрдө сүт керектөө скелет үчүн пайдалуу экенин көрсөтүп турат.,A
"Глюкоза метаболизми жөнүндө төмөнкү билдирүүлөрдүн кайсынысы туура?
",Глюкагон гликолиздин ылдамдыгын жогорулатат,Гликолиз НАДП талап кылат+,Гликолизде глюкоза эки үч көмүртектүү продуктка бөлүнүп жатат,Эритроциттердеги гликолиздин акыркы продукту пируват болуп саналат,C
Нагель адеп-ахлактык ийгилик көйгөйү көйгөйү менен тыгыз байланышта деп ырастайт:,Кудайдын бар экени.,эрк эркиндиги.,психологиялык эгоизм.,универсалдар.,B
"Сингердин айтуусу боюнча, анын принцибин сактоо үчүн төмөнкүлөр талап кылынат:","биздин жеке адаттарыбызга жөнөкөй өзгөрүүлөр, бирок жалпы коомго эмес.","биздин жеке адаттарыбызга, ошондой эле коомго жөнөкөй өзгөрүүлөр.","биздин жеке адаттарыбызга олуттуу өзгөрүүлөр, бирок биздин коомго эмес.","биздин жеке адаттарыбызга да, коомубузга да олуттуу өзгөрүүлөр.",D
Төмөнкүлөрдүн кайсынысы адам ээлеген акыркы болуп саналат?,Жаңы Гвинея,Австралия,Жаңы Зеландия,Тимор,C
Нубиан цивилизациясы:,мурда жана Египет маданиятынын өсүшүнө түрткү берди.,түштүктө Месопотамия колонизациясынын натыйжасы болду.,"жооп катары иштелип чыккан, бирок имитация эмес, Египет маданияты.",кошуна маданияттар менен эч кандай байланышы болгон эмес.,C
"Мамлекеттик субъектке накталай акча агымдары жөнүндө билдирүүнү киргизүү талап кылынат, анда төмөнкү финансылык отчеттордун кайсынысы?",Мамлекеттик фонддун финансылык отчеттору.,Мамлекеттик жалпы финансылык отчеттор.,Жекече фонддун финансылык отчеттору.,Фидуциарлық фонддун финансылык отчеттору.,C
Бухгалтердик эсептин эсептөөлөрүндөгү өзгөрүүлөргө байланыштуу төмөнкү билдирүүлөрдүн кайсынысы туура?,Бухгалтердик эсептөөлөрдөгү өзгөрүүлөрдүн көбү ретроспективалык түрдө эсептелинет.,"Эсептөөнүн өзгөрүшү же бухгалтердик эсеп принцибин өзгөртүү болгон-болбогонун аныктоо мүмкүн болбогон учурда, өзгөрүү принциптин өзгөрүшү деп эсептелиши керек.","Бухгалтердик эсепти эсептөөнүн өзгөрүшү же бухгалтердик эсеп принцибин өзгөртүү болгон-болбогонун аныктоо мүмкүн болбогон учурда, өзгөрүү баалоонун өзгөрүшү катары каралышы керек.",Бухгалтердик эсепти баалоонун өзгөрүшү менен бухгалтердик эсеп принцибин өзгөртүүнүн ортосундагы айырманы бухгалтердик эсепти баалоонун өзгөрүшү менен катаны оңдоонун ортосундагы айырмалоого караганда жеңилирээк.,C
"Бир мотористтин этиятсыз машине айдоосу дагы бир айдоочуга олуттуу жаракат алды. Моторист туура эмес жол менен саякаттаганы үчүн келтирилген жана айып төлөгөн. Моторист өзүнүн камсыздандыруу полиси боюнча үчүнчү тараптын жоопкерчилиги үчүн гана $ 15,000 полис лимити болгон. Мотористтин камсыздандыруучусун толук медициналык отчет, бардык медициналык вексельдер, медициналык документтер жана зыяндын башка талап кылынган далилдери менен камсыздандыргандан кийин, жабыркаган талапкер саясаттын чегин талап кылды. Талапкер, эгерде саясаттын лимиттери дароо төлөнбөсө, ишенимдин жаман талабы берилет деп эскертти. Камсыздандыруу компаниясы түшүндүрмөсүз төлөмдөн баш тартты. Калыстар тобу жаракат алган талапкерге $200,000 сыйлык берди. Жабыркаган талапкер арыздануучуга мотористтин камсыздандыруучусуна каршы кандайдыр бир укуктарды берип, этиятсыз мотористтен кол коюлган тапшырманы алган. Сот, кыязы, камсыздандыруу компаниясын ушул фактылар боюнча жаракат алган адамга сот өкүмүнүн толук суммасын төлөөгө мажбурлайбы?","Полистин лимити $ 15,000 болуп саналат жана мунун баары жабыркаган адам тарабынан чогултулушу мүмкүн камсыздандыруу келишими боюнча жаман ишеним үчүн эч кандай иш-аракет жок.",Камсыздандыруу компаниясы ар бир камсыздандыруу келишиминде айкын эмес жана соттун толук суммасын төлөөгө тийиш болгон жакшы ишеним жана адилеттүү мамиле келишимин бузган.,"Жаман ишеним камсыздандырылган тарап үчүн жеке жана анын камсыздандыруучу дайындоо жараксыз болгон, ал эми жаракат алган адам камсыздандыруучу төлөөгө мажбурлоо үчүн эч кандай талап жок.",Жабыркаган тарап мотористке каршы бүт чечимин аткарууга тийиш жана бул сумма үчүн камсыздандыруучуну эч качан кууп чыга албайт.,C
