Question,A,B,C,D,Answer
Ko e fe ʻi he ngaahi filimi fakamanavahe ko ʻeni spawned e sequels lahi taha?,Kaikaila ʻ,Ngutu ʻ,Halouini ʻ,Falaite ko e 13 ʻ,D
Ko e fe ʻi he ngaahi peleti ko ʻeni ʻoku ngaohi mei he ngakau puaka?,haggis,chitlins,Grits,tuʻutuʻu suey,B
Ko e ha ʻa e lea fakafonua ʻa ʻAnitonio Banderas?,Faka-Sipeini,Lūsia,Siamane,Faka-Falanise,A
Ko e ha ʻa e lea fakaʻofisiale ʻo Netaleni?,Tenimaʻake,Sueteni,Siamane,Faka-Holani,D
Ko e fe ʻa e tuʻunga ʻoku fokotuʻu ai ʻa e foʻi faiva 1999 Makinolia ʻ?,Kalefōnia,Kalolaina Saute,Siosia,Tekisisi,A
Mutations ʻoku ne fakatupu achondroplasia ha ola ʻe lava ke fakafaʻahinga ʻo hange ko e:,kovi ʻaupito.,maʻu e ngaue.,haploinsufficiency.,mole ʻa e ngaue.,B
ʻOku ʻomi ʻe he meʻangaue fakamaketi mo e fetuʻutaki ko ʻeni ha poupou fakahangatonu pe ko ha fakaʻaiʻai ke poupouʻi ʻa e kau fakatau ke nau fakatau ha koloa/ngaue tokoni:,Tuʻuaki.,Fetuʻutaki mo e kakaí.,Tuʻuaki ʻo e fakatau.,Fakamaketi fakahangatonu.,C
K-Pelu-fakapapauʻi ko e,telinga ʻi he K,quadratic ʻi he K,ʻi he K,Exponential proportional Correlation ʻi he K,A
ʻOku hange ʻoku ____ lahi ange ʻa e kakai lalahi taʻu motuʻa ange ʻi he kakai lalahi matuʻotuʻa pe kei talavou ange,Generative,Neurotic,Fiemālie Pē,Pau,A
Ko e fallacy ʻo laudatory ʻulungaanga ko ha faʻahinga pau ia ʻo e,Ko e fallacy ʻo e fakatuʻutamaki,Palopalema loi,Kole ʻa e fehuʻi,Fakaʻuhinga ʻoku fuopotopoto,A
"ʻOku ʻuhinga ʻa e fehuʻi ko ʻení ki he fakamatala ko ʻení.
""ʻOku tanumaki ʻa e ngaahi tenga ʻo totalitarian regimes ʻe he mamahi mo e fie maʻu. ʻOku nau mafola mo tupulaki ʻi he kelekele kovi ʻo e masivá mo e fekeʻikeʻí. ʻOku nau aʻusia ʻenau tupulaki kakató ʻi he taimi kuo mate ai ha ʻamanaki lelei ʻa ha kakai ki ha moʻui ʻoku lelei angé. Kuo pau ke tau tauhi ʻa e ʻamanaki lelei ko ia ke moʻui. . . . Kuo tuku mai kiate kitautolu ha ngaahi fatongia maʻongoʻonga ʻi he ngaʻunu vave ʻa e ngaahi meʻa ʻoku hoko. . . . ʻOku ou tui pau ʻe fehangahangai hangatonu ʻa e Falealea mo e ngaahi fatongia ko ʻeni.""
Palesiteni Harry S. Truman, 1947
ʻOku fakahaaʻi fakahangatonu ʻe he ngaahi fakakaukau ʻoku fakahaaʻi ʻi he potufolofola ʻi ʻolunga ʻa e ngaahi continuities ko ʻeni ʻi he hisitolia ʻo e ʻIunaiteti Siteiti?",Fakakikihi fekauʻaki mo e va fetuʻutaki ʻi he vahaʻa ʻo e Falealea mo e Palesiteni.,Tipeiti fekauʻaki mo hono fakaʻaongaʻi ʻo e kau ngaue fakakautau ʻi he ngaahi tukunga volatile.,Tipeiti fekauʻaki mo e fatongia ʻo e ʻIunaiteti Siteiti ʻi he ngaahi meʻa ʻo e mamani.,Ngaahi fakakikihi fekauʻaki mo e fatongia totonu ʻo e ngaahi faʻahi fakapolitikale.,C
ʻOku ʻi ai ha kia ʻo ha taha faʻa kataki ʻoku ne maumauʻi ʻa e filosiliva ʻi he tuʻunga ʻo e cervical hono ono vertebra.,He ʻikai ke nau lava ʻo manava taʻe ʻi ai ha tokoni ki he moʻui.,Te nau lava pe ʻo manava fakalongolongo.,ʻOku ʻikai lava ke tala ha ola ʻo e manava.,ʻE uesia ʻa e manava.,B
ʻOku fakahaaʻi ʻa e autocorrelation kovi ʻi he taha ʻo e ngaahi meʻa ni?,Ko ha sipinga ʻoku toutou hoko ʻi he residuals,Ko ha sipinga fetongitongi ʻi he residuals,Ko ha randomness kakato ʻi he residuals,Residuals ʻoku ofi kotoa ki he noa,B
ʻAi ke ʻiloʻi ʻa e antecedent ʻo e ngaahi makatuʻunga ko ʻeni: ʻe toki maʻu pe ʻe he fanga hone ʻenau fuofua vaʻinga kapau ʻoku ʻikai maʻu ʻe he Aardvarks pe ko e Chipmunks ʻa ʻenau fuofua vaʻinga.,ʻOku ʻikai ke maʻu ʻe he Aardvarks ʻenau fuofua vaʻinga.,Naʻe maʻu ʻe he fanga hone ʻenau fuofua vaʻinga.,ʻOku ʻikai ke maʻu ʻe he Chipmunks ʻenau fuofua vaʻinga.,ʻOku ʻikai ke maʻu ʻe he Aardvarks pe ko e Chipmunks ʻa ʻenau fuofua vaʻinga.,B
ʻOku tataki ʻe he kau ako ha fuʻu ʻakau pigment ʻoku fie maʻu ai ke nau fakaʻaongaʻi ha chromatography ʻi ʻolunga mo ha kiʻi ongo siʻisiʻi ʻi he konga ki lalo ʻo e loki ʻi ʻolunga. ʻOku kau ʻi he ngaahi fakatokanga ki he malu ʻa e fakamatala ko ia ko e mata mo e kili irritant pea ʻoku velangofua ʻahu. Ko e fe ʻa e meʻa malu ʻoku totonu ke fai ʻe he kau ako lolotonga hono fakahoko ʻo e fakamalohisino?,Ko hono tui ʻo e kofunima retardant ke ʻave ʻa e loki ʻi ʻolunga ki ha fume ʻo kapau ʻe puke ʻe he ongo ʻa e afi,Ko hono tuku ʻo e loki ʻi ʻolunga ʻi ha kapineti kuo tapuni mo fakapoʻuli ki he loloa ʻo e pigment mavahevahe,Ko hono tui ʻo e kofunima leta mo ʻufiʻufi ʻa e ihu mo e ngutu ʻaki ha kiʻi fakapuli,Ko hono tui ʻo e helemeti mo e nitrile-faʻahinga kofunima mo hono tauhi ʻo e ngaahi kane leʻo kotoa pe kuo tapuni,D
Ko e fe ʻi he ngaahi meʻa ni ʻoku ne fakapapauʻi ʻa e noa pee relatedness ʻo e faʻahinga kehekehe ʻo makatuʻunga ʻi he fakahokohoko ʻo e ʻesiti ʻamino homologous polotini ʻoku siʻisiʻi ange ʻene tonu ʻi he loto fakapapau ʻo e relatedness ʻo makatuʻunga ʻi he nucleotide sequences ʻo homologous afa?,Miuteisoni fakalongolongo,Sini duplications,Translocation ngaahi meʻa ʻoku hoko ʻoku ne liliu ʻa Sini sequences,Kolosi ʻi he,A
ʻOku fakahoko nai ʻa e homicide taʻefakalao ʻe he faifekau ʻo e fonua X ʻi ha ngaue jure imperii pe jure gestionis?,Ko e faʻahinga ʻulungaanga pehee ko ha ngaue ia ʻa e kakai (jure imperii),ʻOku ʻikai teitei tohoakiʻi ʻe he faʻahinga ʻulungaanga pehee ʻa e ngaahi hao,Ko e faʻahinga ʻulungaanga pehee ko ha ngaue fakafoʻituitui (jure gestionis),Ko e faʻahinga ʻulungaanga pehee ko ha ngaue ia ʻa e kakai ka ʻoku maluʻi ia ʻe he ngaahi hao,C
"ʻOku ʻuhinga ʻa e fehuʻi ko ʻení ki he fakamatala ko ʻení.
ʻUluaki, kuo pau ke tau pehe ʻoku spherical ʻa e cosmos, koeʻuhi he ko e foomu ko ʻeni ʻoku ʻikai fie maʻu ki ai ha hokotanga hui, ko e kakato taha ia, koeʻuhi he ʻoku ne ʻai ʻa e foomu capacious taha, ʻa ia ʻoku feʻunga lelei taha ke ʻi ai mo fakatolonga ʻa e meʻa kotoa pe; pe koeʻuhi ko e ngaahi konga kotoa ʻo e ʻunivesi, ʻa ia ko e laʻaa, mahina mo e ngaahi palanite ʻoku ʻasi ʻi he founga ko ʻeni; pe koeʻuhi ʻoku feinga ʻa e meʻa kotoa pe ke maʻu ʻa e foomu ko ʻeni, ʻo hange ko ia ʻoku ha ʻi he tuluta ʻo e vai mo e ngaahi sino kehe ʻo kapau te nau feinga ke fakaʻuhingaʻi kinautolu. Ko ia heʻikai ha taha ʻ e veiveiua ko e faʻahinga ko ení ʻ oku ʻ a e ngaahi sino fakahēvaní ia. ...
ʻOku ʻikai toe fehuʻia ʻa e mamani, koeʻuhi he ʻoku ʻi he tafaʻaki kotoa pe ʻi hono senitaa. Neongo ko e ʻ uhinga ʻ o e ngaahi sanitungua ʻ o e ngaahi moʻungá mo e ngaahi loto - mafasia ʻ o e ngaahi teleʻá ʻ oku ʻ ikai lava ke mahinoʻi ai ha siakale haohaoa, ka ʻ oku ʻ ikai uesia ʻ e he meʻá ni ʻ a e natula fakalūkufua ʻ o e māmaní. ...
Hangē ko ia kuo ʻ osi fakahaaʻi ʻ oku maʻu ʻ e he māmaní ʻ a e fōtunga ʻ o ha feituʻu, kuo pau ke tau fakakaukau pe ʻ oku toe hoko tonu ha ngaʻunu ʻ i he faʻunga ko ení, pea ko e hā ʻ a e feituʻu ʻ oku maʻu ʻ e he māmaní ʻ i he ʻ univēsí. ... Ko e tokolahi taha ʻ o e kau faʻu - tohi ʻ o e moʻoní ʻ oku nau loto - tatau ʻ oku kei tuʻu pē ʻ a e māmaní ʻ i he loto - mālie ʻ o e ʻ univēsí, pea fakakaukau ʻ oku ʻ ikai ke ʻ i ai hano ʻ aonga mo ngalivale ke fakakaukau ki he fehangahangaí. Ka ʻ o kapau ʻ oku fua fakalelei ʻ a e meʻá ni, ʻ e sio ai ʻ oku teʻeki ai ke fakaleleiʻi ʻ a e fehuʻí pea ko ia ai ʻ oku ʻ ikai ha founga ke vakaiʻi ai ʻ a e meʻavaʻingá. Ko e liliu kotoa pe ʻo e feituʻu ʻoku fakatokangaʻi ʻoku totonu ke fai ia, ʻa ia, ki ha ngaue ʻa e meʻa naʻe mamata ki ai pe ko e mamata, pe ko e ngaahi feʻaveʻaki fakatouʻosi. ... Ko ʻeni mei he māmaní ʻoku fakatokangaʻi ʻa e angatuʻu ʻo e ngaahi langí pea ʻoku faʻu ia maʻa hotau matá. Ko ia ai, kapau ʻ oku ʻ ikai ha ngaʻunu ʻ a e māmaní kuo pau ke hoko ʻ a e ngaʻunu ko ení ʻ i he meʻa kotoa pē ʻ i tuʻa ʻ i he māmaní, ka ʻ i he tafaʻaki ʻ e tahá ʻ o kapau ʻ e ngaʻunu ʻ a e meʻa kotoa pē ʻ i he māmaní, pea ko e faʻahinga angatuʻu fakaʻahó ia. Ko ia ʻ oku hā ngali uesia ʻ e he meʻá ni ʻ a e ʻ univēsí kotoa, ʻ a ia, ko e meʻa kotoa pē ʻ i tuʻa ʻ i he māmaní fakataha mo e fakaʻatā pē ʻ e taha ʻ o e māmaní tonu. Kae kehe, kapau ʻ oku totonu ke fakahaaʻi ʻ e ha taha ko e ngaʻunu ko ení naʻe ʻ ikai ko ha meʻa makehe ia ki he langí, ka naʻe vilo ʻ a e māmaní mei he hihifo ki he hahaké, pea kapau naʻe fakakaukauʻi fakalelei eni fekauʻaki mo e hopo hake ʻ a e laʻaá, ko e māhiná mo e ngaahi fetuʻú, ʻ e ʻ iloʻi ai ko e tuʻunga moʻoní eni.""
Nikolasi Copernicus, The Revolutions of the Heavenly Bodies, 1543
ʻE lava ke fakaʻaongaʻi ʻa e potufolofola ko ha fakamoʻoni naʻe kehe ʻa Copernicus mei he kau filosefa fakanatula Aristotelian ʻo hono kuonga koeʻuhi he naʻa ne fokotuʻu mai",ʻOku spherical ʻa e cosmos,ʻOku spherical ʻa e mamani,ʻOku geostatic ʻa e cosmos,ʻOku ʻikai tuʻu maʻu ʻa e mamani,D
"Fakapapauʻi ʻa e H + (aq) ʻi he 1.0 M phenol, C6H5OH, founga fakaleleiʻi. (Ko e ka ki he phenol ko e 1 × 10 ^-10.)",1 × 10 ^-10 M,1 × 10 ^-9 M,1 × 10 ^-3 M,1 × 10 ^-5 M,D
"Ko e fe ʻi he ngaahi meʻa ko ʻeni ʻe lau ko ha meʻa ""tekeʻ ki he Riva ʻi he taimi ʻoku fakakaukau ai ke hiki mei ʻInitia ki he ʻIunaiteti Siteiti?",Abject masiva,Ngaue lelei ange mo e vahenga maʻolunga ange,Founga fakamatakali ʻa ʻInitia,Fetaʻaki ʻi hono kaungaʻapi,B
"Fakafehoanaki mo e ngaahi faʻahi fakapolitikale ʻi he ngaahi fonua hange ko ʻIngilani mo ʻIsileli, ʻa ia ʻoku fakatou ʻi ai multiparty ngaahi polokalama, ʻoku",siʻisiʻi ange ʻene tokanga ki hono takiekina e ola ʻo e fili,siʻisiʻi ange hono ʻiloʻi ʻi he ngaahi fakakaukau fakapolitikale maʻu pe,siʻisiʻi ange ʻene ʻaonga ʻi hono tanaki ha paʻanga mei he kau poupou fakapolitikale,lava lelei ange ke fakafotunga ʻa e ngaahi taumuʻa ʻo ʻenau constituencies kotoa,B
"Ko e fika, naʻe afe ki he toko tahaafe ofi taha, ko e 47,000. Ko e fe ʻa e fika ʻe lava ke hoko ko e fika naʻe afe?","46,295","46,504","47,520","47,924",B
"ʻOku ʻi ai ha tangike ʻi he fotunga ʻo ha prism tapatolu. Kapau ʻoku ʻi ai ha feituʻu ʻoku fute ʻe 116 ʻa e fakavaʻe tapatolu, pea ʻoku fute ʻe 30 hono maʻolunga ʻo e tangike, ko e ha hono lahi ʻo e vai ʻe ʻi ai ʻa e tangike ʻi he taimi ʻoku fonu ai?",1725 FT ^ 3,1740 FT ^ 3,3480 FT ^ 3,6960 FT ^ 3,C
"ʻOku fakafofongaʻi ʻa e voltage ʻoku fakaʻaiʻai ʻi ha inductor ko e,",ola ʻo hono inductance mo e lolotonga ʻ i aí.,fika ʻo hono inductance ke lolotonga ʻi ai.,fika ʻo e lolotonga ʻo aʻu ki hono inductance.,ola ʻo hono inductance mo e vave ʻo e liliu ʻo e lolotonga.,D
Ko e fe ʻi he ngaahi ʻulungaanga ko ʻeni ʻoku faʻa fenapasi mo e tohotoho fakamalohi?,fakaʻaongaʻi ʻo e fuʻu ivi tōtuʻ,tomuʻa fakakaukauʻí,fakaʻaiʻai fakasekisuale,kau ai hono fakaʻaongaʻi ʻo ha meʻatau,C
Kumi ʻa e loloa ʻo e Pikoʻanga y = laine x ʻi he vahaʻa ʻo e ngaahi poini ʻoku ʻi ai ʻa e y = 1/2 mo e y = 1.,0.53,0.86,1.18,1.36,C
Kumi ʻa e $-\dfrac{1}{-3} \cdot\cfrac{1}{~ \frac{1}{-3} ~}. $,1,-1,0,2,B
Ko e fe ʻa e fakakaukau fakaʻatamai naʻe manakoa taha ʻi he kamataʻanga ʻo e senituli uofulu ʻi ʻIulope Hihifo?,neuroscience,noa pee,Maʻuʻanga Fakamatala,Psychoanalytic,D
ʻOku ngalingali ʻe fekauʻaki hangatonu ʻa e taʻe-malava ke ako mo,ʻa e ola Barnum.,taʻefaitotonu.,ha locus mei tuʻa ʻo e mapuleʻi.,tokanga taʻe-faituʻungaʻa.,C
Naʻe fokotuʻu ʻe he fakatotolo ʻa Kasia mo Koelling fekauʻaki mo e ako aversions ʻa e meʻa ko ia ʻi he ngaahi hoa ko ʻeni ʻo e CS mo e CS ʻoku malohi taha mo ako vave taha?,fakahoko ha ngaue mo maʻu ha totongi meʻakai,tokakovi mo e meʻakai pe inu,ngaungaue mo e ʻohovale,ngaahi tauteá mo e palé,B
"ʻOku ʻi ai ha niʻihi ʻo e Marsʻwater ʻoku momoko ʻi he kelekele pea mo e tata ʻaisi pea naʻe mole ha niʻihi koeʻuhi ko e matangi ʻa e ngaahi fetuʻu stripping ka ko e konga lahi ʻo e vai totonu ʻoku fakakaukau ia kuo mole ʻi ha founga ʻe taha. Ko e ha e meʻa naʻe hoko ki he vai ""mole"" ko ʻeni?",Naʻe toʻo ia ʻe he malaʻe hiki fakamakinito ʻi he taimi naʻe vave ai ʻene holo ʻi he malohi,Naʻe maumauʻi ia ki fakapaaki ʻo e mo e ʻokisikena ʻe ultraviolet mama pea naʻe mole ʻa e fakapaaki ʻo e ʻi he hola,Naʻe fakaʻauha ia ʻe ha sivilaise ʻo e fieinua Martians,Naʻe vaporized ia lolotonga ha vahaʻataimi ʻo e volcanism lahi pea naʻe mole ia ʻi he hola ʻa e thermal,B
"Ko e fononga ʻi he ʻuluaki vave ʻo e 1.5 × 10 ^ 6 m/s, ʻoku hu ha proton ki ha feituʻu ʻo e hiki fakamakinito ʻo e lahi ʻo e 1.5 T. Kapau ʻoku hanga ʻe he ʻuluaki malohi vector ʻa e proton ʻo ʻai ha tuliki ʻe 30 ° mo e feituʻu hiki fakamakinito, compute e vave ʻo e proton 4 s hili ʻene hu ki he feituʻu hiki fakamakinito.",5.0 × 10 ^ 6 m/s,7.5 × 10 ^ 6 m/s,1.5 × 10 ^ 6 m/s,3.0 × 10 ^ 6 m/s,C
"ʻE lava ʻe he ivi ne tukuange mei he movete ʻa e phosphates maʻolunga, ATP mo e phosphocreatine, ʻo poupouʻi maximal ngaue ki he:",sekoni ʻe 1-2.,sekoni ʻe 5-10.,sekoni ʻe 30-40.,sekoni ʻe 50-60.,B
"ʻI ha ngaahi vahaʻa taimi hokohoko, kapau ko e ʻau ʻi he maama ʻe taha ko e 2 A, ko e ʻau ʻi he maama ofi ki ai ʻoku","vaeua, 1 A",2:00 ʻOKU,Fakafalala pe ko e fe ʻa e maama ʻoku ofi ange ki he puha ʻuhila,ʻIkai ha fakamatala feʻunga ke lea ʻaki,B
Ko e fe ʻi he ngaahi meʻa ni ʻoku ngalingali te ne fakatupu ha tupulaki fakaʻekonomika malohi ange ʻi ha vahaʻataimi?,Lahi ange hono fakaʻauha ʻo e ngaahi maʻuʻanga tokoni fakanatula.,Lahi ange e taʻeʻilo ʻa e kakai lalahi.,Ko ha ʻinasi ʻo e ngaahi koloa kolomuʻa.,Credits ʻo e tukuhau.,D
"ʻOku fuʻu tolalo fakaʻekonomika ʻa e tuʻunga fakaʻekonomika. ʻI he tuʻunga fakaʻekonomika ko ʻeni, ko e fe ʻi he ngaahi fakamatala ko ʻeni fekauʻaki mo e tuʻutuʻuni fakapaʻanga ʻoku tonu?",ʻE toe kovi ange ʻa e tuʻutuʻuni expansionary ʻi he tolalo fakaʻekonomika.,ʻOku fakatupulaki lahi ʻe he tuʻutuʻuni Expansionary aggregate fie maʻu kapau ʻoku ongoʻingofua ʻa e ngaahi liliu ʻi he vave ʻo e tokanga.,Ko e tuʻutuʻuni Contractionary ko e Stimulus totonu ia ki he tokateu mo e fakaʻauha.,Kapau ʻoku lelei ʻaupito ʻa e fie maʻu ʻo e paʻanga ʻai takai fano expansionary tuʻutuʻuni fakapaʻanga.,B
"ʻOku kau ʻa e ngaahi pisinisi ʻi he meʻa fakatauhitohi fakasosiale koeʻuhi ko e ngaahi fie maʻu mei he _________, kae lava ke ʻiloʻi ʻa e ________, ke fakaleleiʻi ʻa e ___________ pea mo poupouʻi ʻa e _________ mo e ___________","Stakeholders, tuʻu fakatuʻutamaki, Stakeholder Management, taliui, femahinoʻaki","Stakeholders, taliui, femahinoʻaki, fakatuʻutamaki, Stakeholder Management","Stakeholders, taliui, fakatuʻutamaki, Stakeholders, Stakeholder Management","Stakeholders, Stakeholder Management, femahinoʻaki, fakatuʻutamaki, taliui",A
ʻOku ngalingali ʻe ʻoatu ha tukuhau ʻi ha kautaha fakatau koloa ki he koloa ʻi he founga ʻo e totongi ʻo kapau,totongi fano afo ʻo e fie maʻu ʻoku ʻai takai fano lahi.,totongi fano afo ʻo e fie maʻu ʻoku fuʻu inelastic.,totongi fano afo ʻo e fie maʻu ko e ʻiuniti ʻai takai fano.,ʻOku ʻai takai fano afo lahi ʻa e fie maʻu.,B
Fakamatala 1 | ʻI ha kulupu (ab) ^ {-2} = b ^ {-2} a ^ {-2}. Fakamatala 2 | ʻI ha kulupu (ab) ^ n = a ^ nb ^ n.,"Moʻoni, Tuʻu Maʻu","Hala, Hala","Moʻoni, Hala","Hala, Moʻoni",B
Ko e hā ʻ a e foʻi lea ki he lahi ʻ o e feʻauhi ʻ i he fonua ʻ e tahá ʻ oku tākiekina ʻ e he feʻauhi ʻ i he ngaahi fonua kehé?,Fefakatauʻaki fakavahaʻapuleʻanga,ʻEkonomika fakaemamani lahi,Feʻauhi fakamamani lahi,Globalisation,D
"Naʻe hiki ʻe ha tokotaha fakapolokalama ʻa e polokalama ʻi lalo. ʻOku fakaʻaongaʻi ʻe he polokalama ha lisi ʻo e ngaahi mataʻifika ʻoku ui ko e numList. ʻOku fakataumuʻa ʻa e polokalama ke fakaʻaliʻali ʻa e fakakatoa ʻo e ngaahi mataʻifika ʻi he lisi.
 fakakatoa ← numList [1]
 KI he tuʻunga ʻulungaanga mahuʻinga takitaha ʻi he numList
 fakakatoa ʻo e paʻanga ← + mahuʻinga
 FAKAʻALIʻALI ʻa e fakakatoa
 Koeʻuhi ke lava ʻo siviʻi ʻa e polokalama, ʻoku initializes ʻe he tokotaha fakapolokalama ʻa e numList ki he [0, 1, 4, 5]. ʻOku fakaʻaliʻali ʻe he polokalama ʻa e 10, pea ʻoku fakaʻosi ʻe he tokotaha fakapolokalama ʻoku ngaue ʻa e polokalama ʻo hange ko e taumuʻa. Ko e fē ʻi he ngaahi meʻá ni ʻoku moʻoní?",ʻOku tonu ʻa e aofangatuku; ʻoku ngaue ʻa e polokalama ʻo hange ko e taumuʻa.,"ʻOku hala ʻa e aofangatuku; ʻOku ʻikai fakaʻaliʻali ʻe he polokalama ʻa e mahuʻinga totonu ki he sivi [0, 1, 4, 5].","ʻOku hala ʻa e aofangatuku; ʻOku ʻikai feʻunga hono fakaʻaongaʻi ʻo e sivi [0, 1, 4, 5] ke fakaʻosi ʻaki ʻoku tonu ʻa e polokalama.","ʻOku hala ʻa e aofangatuku; fakaʻaongaʻi ʻa e sivi [0, 1, 4, 5] ʻoku ne fakapapauʻi pe ʻoku ngaue ʻa e polokalama ki he ngaahi lisi ʻi he fakautuutu ʻo e maau.",C
Ko e ha ʻoku fakafepakiʻi ai ʻe Parfit ʻa e tuʻunga tatau?,ʻOku ne fakafekiki ʻi ha sosaieti ʻoku ʻikai ke tuʻunga tatau.,"ʻ Okú ne tau pehē ʻ i hono fakamuʻomuʻa ʻ a e ngaahi fiemaʻu ʻ a e masivá, ʻ e lava ke tau fakalahi ai ʻ a e tuʻunga tataú.",ʻ Okú ne fakahaaʻi ʻ oku tau taki taha fatongiaʻaki ʻ etau masivá.,ʻOku ne fakafisingaʻi ʻa e fakakaukau ʻo e tuʻunga tatau.,B
"ʻOku ʻuhinga ʻa e fehuʻi ko ʻení ki he fakamatala ko ʻení.
""Ko e moʻoni, ʻi he hoko ʻa e fatwas ʻo e [kau mataotao] ʻiloa ʻoku nau fakatefito ʻenau fakakaukau ʻi he fakaʻuhinga mo e tukufakaholo pea mo e felotoi ʻa e kolo Sunni ʻoku nau tui ko e fatongia fakakuongamuʻa ʻo e extirpation, fakaʻauha, mo hono tuli ʻo e kovi kuo pau ko e taumuʻa ia ʻo ʻetau fakaʻamu hakeakiʻi, he ""ko e vekeveke fakalotu ko ha ikuna ia ki he tui ʻa e ʻOtua ko e Beneficent""; pea, fakatatau mo e ngaahi lea ʻa e Palōfitá (Melino kiate ia!) ""Ko hai pe ʻoku ne fakafeʻiloaki ʻa e kovi ki heʻetau ʻota, kuo pau ke tuli ia"" mo e ""ko hai pe ʻoku ne taʻofi ʻetau ʻota, kuo pau ke tuli ia,"" kuo fie maʻu mo exigent ...""
Tohi mei he tangata Sultan Selim I kia Safavid Shah Ismail I, 1514
Naʻe ta ʻe he Safavids ʻa e Ire ʻo e ngaahi puleʻanga faka-ʻIsilami hange ko e tangata ʻOtomani mo e ngaahi puleʻanga Mughal koeʻuhi ko e Safavids",Ko ha puleʻanga expansionist ʻoku tuʻu ʻi he vahaʻa ʻo ha ongo expansionists kehe,fakafisingaʻi ʻa e ngaahi tefitoʻi tokateline ʻo ʻIsilami fokotuʻu,"kau Kalisitiane popula, pea fakatafoki kinautolu ki Safavid fighters",Naʻe fakaha ʻe Ismail ko ha Caliph,A
"ʻOku ʻuhinga ʻa e fehuʻi ko ʻení ki he fakamatala ko ʻení.
ʻOku ou lue fakataha mo e kolomu, ʻeke pe ko e ha e meʻa ʻoku hoko.
ʻ Oku pehē pē ʻ e ha sōtia: ""ʻ Oku nau ui lahi ange ʻ i he ʻ aho kotoa pē.
""Naʻe ʻave hamau niʻihi ki he fakatokelau ʻo e Vaitafe Engeengá ʻi homau taʻu hongofulu mā nimá,
Pea ko ʻeni ʻi he 40 ʻoku tau ʻalu atu ki he garrisons ʻi he Hihifo.
ʻI heʻemau fuofua ʻaʻahi, naʻe pau ke haʻi ʻe he headman ʻo e kolo ʻemau holoholo maʻamautolu.
ʻI heʻemau foki mai, naʻe hinehina homau ʻulu, ka ʻoku kei toe lahi ange ʻa e ngangaʻehu.
ʻOku lele ʻa e garrisons ʻi he toto, feʻunga ke fakafonu ha tahi,
Ka ʻoku teʻeki ai ke tumuʻaki ʻa e ngaahi taumuʻa fakavahe ʻa e ʻemipola fuhu.
ʻI he ngaahi vahefonua ʻe teau ki he fakahahake ʻo e ngaahi moʻunga, ʻi he fonua kotoa ʻo Hani,
Kuo pau ke ʻi ai ha ngaahi kolo ʻe 10000 ʻoku brambles he taimi ni.
Tatau ai pē kapau ʻoku mālohi feʻunga ʻa e ngaahi uaifí ke matuʻuaki ha huo mo palau,
ʻOku tupu ʻa e ngoue ʻi he tafaʻaki kotoa pe, ʻoku taʻemaau kotoa ʻa e ngoue.
ʻOku faingataʻa taha ki he kau tangata Shanxi, mo ʻenau reputations ko fighters:
ʻOku nau afe hake ʻo hange ha fanga kulii pe fanga moa, naʻe saiʻia ʻa e tangata kotoa pe.
""Ka tangataʻeiki, neongo ʻoku lelei ke ke kole,
ʻOku ʻikai ko ha konga ʻo e ngaue ʻa e sotia ʻa e launga.
Te tau lava pe ʻo kalokalo hotau ʻulu. Toʻo ʻa e faʻahitaʻu momoko ko ʻeni:
Naʻe ʻikai teitei ʻave ʻa e kau sotia Shanxi ki ʻapi.
ʻOku fie maʻu ʻe he kau ʻofisa fakavahefonua ʻa e tukuhau ʻo e fonua,
Ka ʻe haʻu ia mei fē? He ʻikai lava ke ke maʻu ha toto mei ha maka!
ʻOku ou tui moʻoni ʻoku kovi ke faʻeleʻi ha foha he taimi ni,
ʻOku lelei ange ke ʻi ai ha ʻofefine: te ne lava ʻo mali
Pea nofo mo e kaungaʻapi hoko mai.
Ka ʻe iku tokoto ha foha ʻi ha feituʻu tokamalie mamaʻo.""
Du fu, ""Ballad of the Army Carts,"" ca. 750 T.S.
ʻOku ʻomi ʻe he foʻi maau ha fakamoʻoni pe ko e fe ʻi he ngaahi meʻa ni ʻoku fekauʻaki mo e fetuʻutaki fakahomosekisualé ʻi he sosaieti ʻo e tang?",Naʻe kei malohi pe ʻa e ngaahi va fetuʻutaki ʻi he vahaʻa ʻo e husepaniti mo e uaifi ʻi he sosaieti.,Naʻe fakamamafaʻi ʻe ʻemipola rescripts ʻa hono faʻeleʻi ʻo e ngaahi foha ʻe lava ke nau fakahoko conscription fika tukupau.,ʻE lava ke vahevahe ʻa e ngaue ngoue ʻe he kakai fefine mo e kakai tangata fakatouʻosi.,Naʻe mafuli ʻa e fetuʻutaki faka-Siaina angamaheni ʻi he lolotonga ʻo e pule ʻa ʻemipola Wu Zetian.,C
"ʻI he vakapuna XY, ko e kalafi ʻo e x ^ (log y) = y ^ log x",ʻa e ʻuluaki quadrant,ko ha Pikoʻanga kuo tapuni,ko ha huelo ʻi he ʻuluaki quadrant,ko ha foʻi poini pe ʻe taha,A
Ko e fe ʻi he ngaahi fonua ko ʻeni emitted ʻa e CO2 lahi taha ki he capita ʻi he 2017?,Siapani,Kānata,Lūsia,ʻIulani,B
Ko e ha ʻa e ʻohofi ʻoku toe fai?,ʻI he taimi ʻoku tali ai ʻe he attacker ha popoaki naʻe ʻave ki ai ʻe he polokalama,"Ko ha ʻohofi ʻoku hokohoko atu, ʻo ne ʻomi ha vaivai",Ko ha ʻohofi ʻoku ne fakaʻaongaʻi ʻa e ngaahi popoaki ʻa e polokalama pea he ʻikai lava ke maluʻi ia,"ʻOku toe ʻave ʻe he attacker ha popoaki naʻe maʻu, pea ʻoku tali ʻe he saiti ʻa hono mo tali ʻi he loto ʻo e attacker",D
Ko e foʻi moʻoni ko ia ko e infrared absorption tuʻo lahi ʻo e deuterium chloride (DCl) ʻoku liliu ia mei he fakapaaki ʻo e chloride (HCl) ʻoku tupu ia mei he ngaahi faikehekehe ʻi heʻenau,electron tufakiʻanga naunau,momeniti dipole,fakamalohiʻi maʻu pe,fakasiʻisiʻi e lahi,D
"Ko e 0.1 ʻa e lavameʻa ʻa ha photon MONOKISAITI. Kapau ʻoku ʻave ʻa e photons ʻe 100 ki he MONOKISAITI, ʻe ʻiloʻi ʻe he MONOKISAITI ʻa e photons","ko e ʻavalisi ʻo e tuʻo 10, mo ha rms ʻo e taʻu 4","ko e ʻavalisi ʻo e tuʻo 10, mo ha rms ʻo e taʻu 3","ko e ʻavalisi ʻo e tuʻo 10, mo ha rms ʻo e taʻu 1","ko e ʻavalisi ʻo e tuʻo 10, mo ha rms ʻo e 0.1",B
Ko e fe ʻi he ngaahi seti ko ʻeni ʻo e ngaahi meʻalea ʻoku ʻikai lava ke fakamatalaʻi ʻaki ha lea angamaheni?,Ko e ngaahi meʻalea kotoa pe ʻoku zeros ko ha toko nima,ʻOku kamata ʻa e ngaahi meʻalea kotoa pe ʻaki ha noa pea fakaʻosi ʻaki ha taha,Ko e fanga kiʻi meʻalea kotoa pe ʻoku ʻi ai ha zeros,ʻOku lahi ange ʻa e ngaahi meʻalea ʻi he zeros,D
ʻOku kau ʻi hono fulihi ʻo e ʻakau ke fakasiʻisiʻi e mole ʻa e vai ʻi he ngaahi ʻatakai ʻoku mafana ai e ʻea?,Ngaahi stomata lahi,Cuticles manifi,Spines kae ʻikai ko e lauʻiʻakau,Lahi ʻo e ratios,C
Ko e Mutations ko ha ngaahi fehalaaki ia ʻi he DNA ʻoku:,ʻoku fakatuʻutamaki maʻu pe.,ʻOku toki hoko pe ia ʻi he ʻao ʻo carcinogens.,fakatupulaki ʻa e tupulaki ʻa e clamp.,hoko ʻi ha tuʻunga maʻulalo.,D
Ko e fe ʻi he ngaahi meʻa ni ʻoku moʻoni ʻi he hypothyroidism?,Mole ʻa e mamafa,Tomuʻa tibial myxoedema,Ko ha tuʻunga TSH,Ko ha aversion ki he ngaahi feituʻu mafana,C
"ʻOku ʻuhinga ʻa e ngaahi tuʻunga ʻulungaanga mahuʻinga ʻo e ngaahi fale ʻi ha kolo ki he $125,000 mo ha tuʻunga angamaheni ʻo e $23,000. Koeʻuhi ko ha aleapau ʻa e kau faiako foʻou, ʻoku fie maʻu ʻe he vahefonua ako ha 10% ʻi he paʻanga ʻi hono fakafehoanaki ki he taʻu kimuʻa. Ke hiki hake ʻa e paʻanga kehe ko ʻeni, ʻoku fakahinohinoʻi ʻe he kolo ʻa e ʻofisi ʻo e sivi ke hiki hake ʻa e ngaahi tuʻunga ʻulungaanga mahuʻinga kotoa ʻo e fale ʻi he $5,000. Ko e ha ʻa e tuʻunga moʻui foʻou ʻo e ngaahi tuʻunga ʻulungaanga mahuʻinga ʻo e ngaahi fale ʻi he kolo?","$23,000 ","$25,300 ","$28,000 ","$30,300 ",A
" ʻI heʻene aleaʻi ʻa e filifilimanako ʻi he tau, ʻoku fokotuʻu mai ʻe Valls",ʻoku ʻikai ha faikehekehe ʻi he kau tau mo e noncombatants.,Ko e faikehekehe ʻi he vahaʻa ʻo e kau tau mo e noncombatants ko ha tuʻunga ia.,ʻOku categorical mo mahino ʻa e faikehekehe ʻi he vahaʻa ʻo e kau tau mo e noncombatants.,"ʻOku totonu ke fakaʻuhingaʻi ʻa e ""tautoitoi"" ko indiscriminate fetaʻaki.",B
" Fakatatau ki he Nussbaum, ko hono ngaohileleiʻi ha taha ko ha meʻa",feʻunga ki he objectification fakasekisuale.,fie maʻu ki he objectification fakasekisuale.,ʻikai fie maʻu ia ki he objectification fakasekisuale.,kotoa ʻi ʻolunga.,C
"Ko e fe ʻi he ongo fokotuʻutuʻu ko ʻeni ʻoku fai ʻe he tefitoʻi ʻulungaanga (ʻa ia ʻoku ne fakaʻaongaʻi au/ko au/ʻeku) fai ha meʻa ʻoku hala fakaeangamaʻa, ʻo fakatatau ki he ngaahi tuʻunga moʻui fakaeangamaʻa angamaheni ʻi he US ʻi he 2020? Fokotuʻutuʻu 1 | ʻI he mohe ʻeku ongomātuʻá, ne u lele. Fokotuʻutuʻu 2 | Naʻá ku huaʻi hifo ʻa e koá ki he misini foo ʻoku fonu ʻi he vala hoku kaungā-lokí.","Hala, Hala","Hala, ʻikai ke hala","ʻIkai ke hala, hala","ʻIkai ke hala, ʻikai ke hala",D
