Question,A,B,C,D,Answer
Hvilken av disse skrekkfilmene skapte flest oppfølgere?,Skrik',Kjever ',Halloween',Fredag den 13.,D
Hvilke av disse rettene er laget av gristarmer?,haggis,Chitlins,Grits,chop suey,B
Hva er skuespiller Antonio Banderas morsmål?,Spansk,Russisk,Tysk,Fransk,A
Hva er det offisielle språket i Nederland?,Dansk,Svensk,Tysk,Nederlandsk,D
I hvilken tilstand er filmen Magnolia fra 1999 satt?,California,Sør-Carolina,Georgia,Texas,A
Mutasjoner som forårsaker achondroplasia utøver en effekt som kan klassifiseres som:,dominerende negativ.,gevinst-av-funksjon.,haploinsuffisiens.,tap av funksjon.,B
 Dette markedsførings- og kommunikasjonsverktøyet gir en direkte tilskyndelse eller et insentiv til å oppmuntre kunder til å kjøpe et produkt / en tjeneste:,Annonsering.,PR.,Salgsfremmende kampanjer.,Direkte markedsføring.,C
K-fold kryssvalidering er,lineær i K,kvadratisk i K,kubikk i K,eksponentiell i K,A
Middelaldrende voksne ser ut til å være mer ____ enn eldre eller yngre voksne,Generative,Nevrotisk,Behagelig,Viss,A
Feilslutningen av rosende personlighet er en bestemt type,Ulykkens feilslutning,Falskt dilemma,Stiller spørsmålet,Sirkulær resonnement,A
"Dette spørsmålet refererer til følgende informasjon.
«Frøene til totalitære regimer næres av elendighet og nød. De sprer seg og vokser i fattigdommens og stridens onde jord. De når sin fulle vekst når håpet om et folk for et bedre liv er dødt. Vi må holde det håpet levende. Det er lagt stort ansvar på oss på grunn av begivenhetenes raske bevegelse. Jeg er sikker på at Kongressen vil møte dette ansvaret helt og holdent.»
President Harry S. Truman, 1947
Ideene uttrykt i avsnittet ovenfor reflekterer mest direkte hvilken av de følgende kontinuitetene i amerikansk historie?",Debatter om forholdet mellom kongressen og presidenten.,Debatter om bruk av militærmakt i ustabile situasjoner.,Debatter om USAs rolle i verdensanliggender.,Debatter om politiske partiers riktige rolle.,C
En pasient lider av en ødelagt nakke med skade på ryggmargen på nivået av den sjette livmorhvirvelen.,De vil ikke være i stand til å puste uten livsstøtte.,De vil bare kunne puste stille.,Det er umulig å forutsi en effekt på pusten.,Pusten vil være upåvirket.,B
Negativ gjenværende autokorrelasjon indikeres av hvilket av følgende?,Et syklisk mønster i restene,Et vekslende mønster i restene,En fullstendig tilfeldighet i restene,Rester som alle er nær null,B
Identifiser forløperen til følgende betingede forslag: The Bees vinner sin første kamp bare hvis enten Aardvarks eller Chipmunks ikke vinner sine første kamper.,Jordvarkene vinner ikke sin første kamp.,The Bees vinner sin første kamp.,The Chipmunks vinner ikke sin første kamp.,Enten Aardvarks eller Chipmunks vinner ikke sine første kamper.,B
Studentene gjennomfører en plantepigmentseparasjonsøvelse som krever at de bruker et lukket kromatografikammer med en liten mengde aceton i bunnen av kammeret. Sikkerhetsadvarsler for aceton inkluderer uttalelsen om at det er øye- og hudirriterende og har brannfarlige damper. Av følgende 'hvilke sikkerhetstiltak bør studentene ta mens de gjennomfører øvelsen?,Ta på brannhemmende hansker for å bære kammeret til en avtrekkshette hvis aceton tar fyr,"Plasser kammeret i et lukket, mørkt skap i løpet av pigmentseparasjonen",Bruk av skinnhansker og dekker nese og munn med en partikkelmaske,Bruk vernebriller og hansker av nitriltype og hold alle acetonbeholdere lukket,D
Hvilke av disse gjør bestemmelse av evolusjonær slektskap av forskjellige arter basert på aminosyresekvensen av homologe proteiner generelt mindre nøyaktig enn bestemmelse av slektskap basert på nukleotidsekvensene av homologe gener?,Stille mutasjoner,Gendupliseringer,Translokasjonshendelser som endrer gensekvenser,Krysset over,A
Er det ulovlige drapet begått av statsråd i land X i utlandet en handling jure imperii eller jure gestionis?,Slik oppførsel er en offentlig handling (jure imperii),Slik oppførsel tiltrekker seg aldri immunitet,Slik atferd er en privat handling (jure gestionis),"Slik oppførsel er en offentlig handling, men er beskyttet av immunitet",C
"Dette spørsmålet refererer til følgende informasjon.
Først må vi bemerke at kosmos er sfærisk i form, delvis fordi denne formen er en perfekt helhet som ikke krever skjøter, er den mest komplette av alle, delvis fordi den gjør den mest romslige formen, som er best egnet til å inneholde og bevare alt; eller igjen fordi alle universets bestanddeler, det vil si solen, månen og planetene vises i denne formen; Eller fordi alt streber etter å oppnå denne formen, som vises i tilfelle av dråper vann og andre væskelegemer hvis de forsøker å definere seg selv. Så ingen vil tvile på at denne formen tilhører himmellegemene. ...
At jorden også er sfærisk er derfor hevet over tvil, fordi den presser fra alle sider på sitt sentrum. Selv om det på grunn av fjellets høyder og dalens depresjoner ikke kan forstås en perfekt sirkel, påvirker dette ikke jordens generelle sfæriske natur. ...
Siden det allerede er vist at jorden har form av en kule, må vi vurdere om en bevegelse også sammenfaller med denne formen, og hvilken plass jorden har i universet. ... De aller fleste forfattere er selvfølgelig enige om at jorden står stille i sentrum av universet, og anser det som utenkelig og latterlig å anta det motsatte. Men hvis saken er nøye veid, vil det bli sett at spørsmålet ennå ikke er avgjort og derfor på ingen måte å bli vurdert lett. Hver endring av sted som observeres skyldes nemlig en bevegelse av det observerte objektet eller observatøren, eller til bevegelser av begge. ... Nå er det fra jorden at himmelens revolusjon blir observert, og den er produsert for våre øyne. Derfor, hvis jorden ikke gjennomgår noen bevegelse, må denne bevegelsen finne sted i alt utenfor jorden, men i motsatt retning enn om alt på jorden beveget seg, og av denne typen er den daglige revolusjonen. Så dette ser ut til å påvirke hele universet, det vil si alt utenfor jorden med det eneste unntaket av selve jorden. Hvis man imidlertid skulle innrømme at denne bevegelsen ikke var særegen for himmelen, men at jorden dreide seg fra vest til øst, og hvis dette ble nøye vurdert med hensyn til den tilsynelatende stigningen og nedgangen av solen, månen og stjernene, ville det bli oppdaget at dette var den virkelige situasjonen. ""
Nicolas Copernicus, Himmellegemenes revolusjoner, 1543
Avsnittet kan bli brukt som bevis for at Kopernikus skilte seg fra de tradisjonelle, aristoteliske naturfilosofene på sin tid fordi han foreslo at",Kosmos er sfærisk,jorden er sfærisk,Kosmos er geostatisk,Jorden er ikke stasjonær,D
"Bestem H+(aq)-konsentrasjonen i 1,0 M fenol, C6H5OH, løsning. (Ka for fenol er 1 × 10 ^ -10.)",1 × 10^-10 M,1 × 10^-9 M,1 × 10^-3 M,1 × 10^-5 M,D
"Hvilke av følgende faktorer vil bli ansett som en ""pull"" -faktor for Riva når de vurderer å flytte fra India til USA?",Nedverdigende fattigdom,Bedre jobb og høyere lønn,Indias kastesystem,Vold i nabolaget,B
"Sammenlignet med politiske partier i land som England og Israel, som begge har flerpartisystemer, er amerikanske politiske partier",mindre interessert i å påvirke utfallet av valg,mindre tydelig identifisert med konsistente politiske ideologier,Mindre effektiv til å skaffe penger fra politiske støttespillere,bedre i stand til å gjenspeile målene for hele valgkretsen,B
"Et tall, avrundet til nærmeste tusen, er 47 000. Hvilket tall kan være tallet som ble avrundet?","46,295","46,504","47,520","47,924",B
"En tank er i form av et trekantet prisme. Hvis den trekantede basen har et areal på 116 kvadratmeter, og tanken er 30 meter høy, hvor mye vann vil tanken inneholde når den er full?",1725 ft ^ 3,1740 ft ^ 3,3480 fot ^ 3,6960 fot ^ 3,C
"Spenningen indusert i en induktor er representert som,",produkt av induktans og strøm gjennom den.,forholdet mellom induktans og strøm gjennom den.,forholdet mellom strøm gjennom den og dens induktans.,produkt av dens induktans og hastighet på endring av strøm gjennom den.,D
Hvilke av følgende kjennetegn er generelt forenlige med dato voldtekt?,Bruk av overdreven kraft,overlagt,seksuelt motivert,innebærer bruk av våpen,C
Finn lengden på kurven y = ln x mellom punktene der y = 1/2 og y = 1.,0.53,0.86,1.18,1.36,C
Find $-\dfrac{1}{-3}\cdot\cfrac{1}{~\frac{1}{-3}~}.$,1,-1,0,2,B
Hvilket psykologisk perspektiv var mest populært ved begynnelsen av det tjuende århundre i Vest-Europa?,nevrovitenskap,evolusjonær,Behaviorist,Psykoanalytiske,D
Lært hjelpeløshet er mest sannsynlig å være direkte relatert til,Barnum-effekten.,selvbetjent skjevhet.,et eksternt kontrollsted.,ubetinget positiv hilsen.,C
Garcia og Koellings forskning om lærte aversjoner fastslo at hvilke av de følgende UCS- og CS-parene er de kraftigste og mest lærte?,utføre en oppgave og motta en matbelønning,kvalme og mat eller drikke,Bevegelse og støt,Straffer og belønninger,B
"Noe av vannet på Mars er frosset i jordsmonnet og iskappene, og noe gikk tapt på grunn av solvindstripping, men mye av det opprinnelige vannet antas å ha gått tapt gjennom en annen mekanisme. Hva skjedde med dette ""tapte"" vannet?",Det ble fjernet av magnetfeltet da det raskt avtok i styrke,"Det ble brutt opp i hydrogen og oksygen av ultrafiolett lys, og hydrogenet gikk tapt gjennom termisk flukt",den ble fortært av en sivilisasjon av tørste marsboere,Det ble fordampet i en periode med intens vulkanisme og gikk tapt til verdensrommet gjennom termisk flukt,B
"Ved å bevege seg med en innledende hastighet på 1,5 × 10^6 m/s, kommer et proton inn i et område med konstant magnetfelt med størrelsesorden 1,5 T. Hvis protonets første hastighetsvektor gjør en vinkel på 30 ° med magnetfeltet, beregner du protonets hastighet 4 s etter å ha kommet inn i magnetfeltet.","5,0 × 10^6 m/s","7,5 × 10^6 m/s","1,5 × 10^6 m/s","3,0 × 10^6 m/s",C
"Energien som frigjøres fra nedbrytningen av høyenergifosfatene, ATP og fosfokreatin, kan opprettholde maksimal anstrengelsesøvelse i omtrent:",1-2 sekunder.,5-10 sekunder.,30-40 sekunder.,50-60 sekunder.,B
"I en seriekrets, hvis strømmen i en lampe er 2 A, er strømmen i lampen ved siden av den","omgang, 1 A",02:00,Avhenger av hvilken lampe som er nærmere batteriet,Ikke nok informasjon til å si,B
Hvilket av følgende er mest sannsynlig å gi sterkere økonomisk vekst over tid?,Raskere forbruk av naturressurser.,Høyere voksen analfabetisme priser.,En fallende beholdning av kapitalvarer.,Investeringsskattekreditter.,D
"Økonomien er i en dyp lavkonjunktur. Gitt denne økonomiske situasjonen, hvilket av følgende utsagn om pengepolitikken er riktig?",Ekspansiv politikk vil bare forverre resesjonen.,Ekspansiv politikk øker den samlede etterspørselen kraftig dersom investeringene er følsomme for endringer i renten.,Kontraktiv politikk er riktig stimulans for investeringer og forbruk.,"Hvis etterspørselen etter penger er perfekt elastisk, kan ekspansiv pengepolitikk være ganske effektiv.",B
"Bedrifter engasjerer seg i sosial regnskap på grunn av krav fra _________, for å identifisere ________, for å forbedre ___________ og for å oppmuntre til _________ og ___________","Interessenter, risiko, interessenthåndtering, ansvarlighet, åpenhet","Interessenter, ansvarlighet, åpenhet, risikoer, interessenthåndtering","Interessenter, ansvarlighet, risiko, interessenter, interessenthåndtering","Interessenter, interessenthåndtering, åpenhet, risikoer, ansvarlighet",A
En avgift pålagt en leverandør vil mer sannsynlig bli veltet over på forbrukeren i form av prisøkning dersom,Priselastisitet i etterspørselen er svært elastisk.,Priselastisitet i etterspørselen er svært uelastisk.,Priselastisitet i etterspørselen er enhetselastisk.,Lønnselastisiteten i etterspørselen er svært elastisk.,B
Uttalelse 1 | I en gruppe (ab)^{-2} = b^{-2}a^{-2}. Uttalelse 2 | I en gruppe (ab)^n = a^nb^n.,"Sant, sant","Falsk, falsk","Sant, usant","Usant, sant",B
Hva er begrepet for i hvilken grad konkurransen i ett land påvirkes av konkurranse i andre land?,Internasjonal handel,Global økonomi,Global konkurranse,Globalisering,D
"En programmerer skrev programmet nedenfor. Programmet bruker en liste over tall kalt numList. Programmet er ment å vise summen av tallene i listen.
 sum ← numList [1]
 FOR HVER verdi I numList
 Sum ← sum + verdi
 VIS SUM
 For å teste programmet, programmerer initialiserer numList til [0, 1, 4, 5]. Programmet viser 10, og programmereren konkluderer med at programmet fungerer etter hensikten. Hvilket av følgende er sant?",Konklusjonen er riktig; Programmet fungerer etter hensikten.,"Konklusjonen er feil; Programmet viser ikke riktig verdi for testtilfellet [0, 1, 4, 5].","Konklusjonen er feil; Å bruke testcaset [0, 1, 4, 5] er ikke tilstrekkelig til å konkludere med at programmet er riktig.","Konklusjonen er feil; Bruk av testtilfellet [0, 1, 4, 5] bekrefter bare at programmet fungerer for lister i økende rekkefølge.",C
Hvorfor motsetter Parfit likestilling?,Han hevder at et ulikt samfunn er uunngåelig.,"Han hevder at ved å prioritere de fattiges behov, kan vi øke likestillingen.",Han hevder at vi alle er ansvarlige for vår fattigdom.,Han avviser ideen om likhet helt.,B
"Dette spørsmålet refererer til følgende informasjon.
""Faktisk, som både fatwaene til fremstående [lærde] som baserer sin mening på både fornuft og tradisjon og konsensus i det sunnimuslimske samfunnet er enige om at den gamle forpliktelsen til utryddelse, utryddelse og utvisning av ond innovasjon må være målet for vår opphøyde ambisjon, for ""Religiøs nidkjærhet er en seier for troen til Gud den velgjørende""; da, i samsvar med profetens ord (fred være med ham!) «Den som innfører ond innovasjon i vår orden, må utvises» og «Den som gjør noe mot vår orden, må utvises», handling er blitt nødvendig og presserende ...»
Brev fra den osmanske sultanen Selim I til Safavid Shah Ismail I, 1514
Safavidene gjorde islamske imperier rasende som det osmanske og mogulriket, hovedsakelig fordi safavidene",var et ekspansjonistisk imperium geografisk plassert mellom to andre ekspansjonister,avviste islams sentrale læresetninger,"gjorde kristne til slaver, og gjorde dem til safavidekrigere",Ismail proklamerte seg selv som kalif,A
"Dette spørsmålet refererer til følgende informasjon.
Jeg går langs kolonnen, spør hva som skjer.
En soldat sier ganske enkelt: «De ringer opp mer hver dag.
""Noen av oss ble sendt nordover til Yellow i en alder av femten,
Og nå, klokka førti, drar vi til garnisonene i vest.
På vår første tur måtte landsbyens leder knytte bandannas for oss.
Da vi kom tilbake var håret hvitt, men fortsatt er det mer uro.
Grensegarnisonene løper med blod, nok til å fylle et hav,
Men Martial-keiserens territorielle ambisjoner har ennå ikke slått til.
I de hundre distriktene øst for fjellene, i hele landet Han,
Det må være ti tusen landsbyer som brambles nå infest.
Selv om koner er sterke nok til å håndtere en hakke og plog,
Avlingene vokser hver vei, feltene er alle et rot.
Det er vanskeligst for Shanxi-mennene, med sitt rykte som krigere:
De er avrundet som hunder eller kyllinger, hver mann imponert.
""Men sir, selv om det er bra av deg å spørre,
Klaging er ikke en del av soldatens oppgave.
Vi kan bare riste på hodet. Ta denne vinteren:
Shanxi-troppene ble aldri sendt hjem.
Distriktsoffiserene krever landskatten,
Men hvor skal det komme fra? Du kan ikke få blod fra en stein!
Jeg tror ærlig talt det er uflaks å føde en sønn nå,
Det er bedre å ha en datter: i det minste kan hun gifte seg
Og bo hos naboene ved siden av.
Men en sønn vil ende opp med å ligge på en fjern prærie.»
Du Fu, «Balladen om hærens vogner», ca. 750 evt.
Diktet gir bevis for hvilket av følgende når det gjelder kjønnsrelasjoner i Tang-samfunnet?",Konfucianske forhold mellom mann og hustru var fortsatt sterke i Tang-samfunnet.,Keiserlige reskripter la vekt på fødselen av dyktige sønner over døtre for å oppfylle vernepliktskvoter.,Jordbruksarbeidet kunne deles av både kvinner og menn.,Tradisjonelle kinesiske kjønnsrelasjoner ble reversert under keiserinne Wu Zetians regjeringstid.,C
I xy-planet er grafen til x^(log y) = y^log x,Den åpne første kvadranten,En lukket kurve,en stråle i den åpne første kvadranten,Ett enkelt punkt,A
Hvilke av følgende land slapp ut mest CO2 per innbygger i 2017?,Japan,Canada,Russland,Iran,B
Hva er et replay-angrep?,Når angriperen svarer på en melding som er sendt til den av systemet,"Et angrep som kontinuerlig gjentas, sonderer for en svakhet",Et angrep som bruker systemets egne meldinger og derfor ikke kan forsvares mot,"Angriperen sender en fanget melding på nytt, og området godtar meldingen og svarer i angriperens favør",D
Det faktum at den infrarøde absorpsjonsfrekvensen av deuteriumklorid (DCl) forskyves fra hydrogenklorid (HCl) skyldes forskjellene i deres,elektronfordeling,Dipol øyeblikk,Kraftkonstant,redusert masse,D
"Kvanteeffektiviteten til en fotondetektor er 0,1. Hvis 100 fotoner sendes inn i detektoren, den ene etter den andre, vil detektoren oppdage fotoner","i gjennomsnitt 10 ganger, med et RMS-avvik på ca. 4","i gjennomsnitt 10 ganger, med et RMS-avvik på ca. 3","i gjennomsnitt 10 ganger, med et RMS-avvik på ca. 1","i gjennomsnitt 10 ganger, med et RMS-avvik på ca. 0,1",B
Hvilke av de følgende settene med bitstrenger kan IKKE beskrives med et regulært uttrykk?,Alle bitstrenger der antall nuller er et multiplum av fem,Alle bitstrenger som starter med null og slutter med en,Alle bitstrenger med et partall nuller,Alle bitstrenger med flere enn nuller,D
Tilpasninger av planter for å minimere vanntap i miljøer med høye temperaturer inkluderer hvilket av følgende?,Tallrike stomata,Tynne neglebånd,Spines i stedet for blader,Store overflate-til-volum-forhold,C
Mutasjoner er feil i DNA som:,er alltid skadelige.,forekommer bare i nærvær av kreftfremkallende stoffer.,øke tumorveksten.,oppstår spontant med lav hastighet.,D
Hvilket av følgende er sant for hypothyroidisme?,Vekttap,Pre-tibial myxoedema,Et forhøyet TSH-nivå,En aversjon mot varme steder,C
"De vurderte verdiene av hus i en by har et gjennomsnitt på $ 125 000 med et standardavvik på $ 23 000. På grunn av en ny lærerkontrakt trenger skoledistriktet 10% ekstra i midler sammenlignet med året før. For å skaffe disse ekstra pengene, instruerer byen vurderingskontoret om å øke alle takserte husverdier med $ 5000. Hva blir det nye standardavviket for takserte verdier av hus i byen?","$ 23,000 ","$ 25,300 ","$ 28,000 ","$ 30,300 ",A
 I sin drøfting av diskriminering i krig antyder Valls at,Det er ingen forskjell mellom stridende og ikke-stridende.,Forskjellen mellom stridende og ikke-stridende er et spørsmål om grad.,Forskjellen mellom stridende og ikke-stridende er kategorisk og klar.,«Terrorisme» bør defineres som vilkårlig vold.,B
 Ifølge Nussbaum er det å behandle noen som et objekt,tilstrekkelig for seksuell objektivering.,nødvendig for seksuell objektivering.,Ikke nødvendig for seksuell objektivering.,alle de ovennevnte.,C
"For hvilket av disse to scenariene gjør hovedpersonen (som bruker jeg/meg/min) noe klart moralsk galt, i henhold til vanlige moralske standarder i USA fra og med 2020? Scenario 1 | Mens foreldrene mine sov, jogget jeg. Scenario 2 | Jeg helte vaskemiddel i vaskemaskinen full av romkameratens klær.","Feil, feil","Feil, ikke galt","Ikke feil, feil","Ikke feil, ikke feil",D
"For hvilket av disse to scenariene gjør hovedpersonen (som bruker jeg/meg/min) noe klart moralsk galt, i henhold til vanlige moralske standarder i USA fra og med 2020? Scenario 1 | Jeg prøver noen ganger å fortelle sannheten, med mindre det får meg i trøbbel. Scenario 2 | Jeg kysset kjæresten min på magishowet.","Feil, feil","Feil, ikke galt","Ikke feil, feil","Ikke feil, ikke feil",B
"For hvilket av disse to scenariene gjør hovedpersonen (som bruker jeg/meg/min) noe klart moralsk galt, i henhold til vanlige moralske standarder i USA fra og med 2020? Scenario 1 | Jeg løp over det ferske teppet med en gressklipper. Scenario 2 | Jeg urinerte i hånden min slik at jeg kunne teste den for infeksjon.","Feil, feil","Feil, ikke galt","Ikke feil, feil","Ikke feil, ikke feil",A
"For hvilket av disse to scenariene gjør hovedpersonen (som bruker jeg/meg/min) noe klart moralsk galt, i henhold til vanlige moralske standarder i USA fra og med 2020? Scenario 1 | Jeg så den berømte Elton John utenfor en konsertarena og tok et bilde av ham uten å spørre ham. Scenario 2 | Jeg rapporterte en annen vakt som sniker inn narkotika inn i et fengsel og selger dem til fanger.","Feil, feil","Feil, ikke galt","Ikke feil, feil","Ikke feil, ikke feil",D
"For hvilket av disse to scenariene gjør hovedpersonen (som bruker jeg/meg/min) noe klart moralsk galt, i henhold til vanlige moralske standarder i USA fra og med 2020? Scenario 1 | Jeg smalt på pausene mine for å bomme på ballen da den kom inn på veien. Scenario 2 | Jeg lærte barna mine å spille xylofon.","Feil, feil","Feil, ikke galt","Ikke feil, feil","Ikke feil, ikke feil",D
"For hvilket av disse to scenariene gjør hovedpersonen (som bruker jeg/meg/min) noe klart moralsk galt, i henhold til vanlige moralske standarder i USA fra og med 2020? Scenario 1 | Da fryseren på restauranten min gikk i stykker, serverte jeg det varme kjøttet selv om jeg visste at det var veldig utrygt. Scenario 2 | Jeg bestemte meg for å starte en brann i skogen.","Feil, feil","Feil, ikke galt","Ikke feil, feil","Ikke feil, ikke feil",A
"Større melkeforbruk
",Har blitt rapportert å være assosiert med høyere forekomst av frakturer og høyere mortalitet i noen få studier,Under puberteten synes å være forbundet med høyere benmineraltetthet i senere liv,Er konsekvent forbundet med en lavere bruddfrekvens,I land med høyest bruddfrekvens antyder at melkeforbruket er gunstig for skjelettet.,A
"Hvilket av følgende utsagn om glukosemetabolismen er riktig?
",Glukagon øker hastigheten på glykolyse,Glykolyse krever NADP+,I glykolyse spaltes glukose i to tre-karbonprodukter,Sluttproduktet av glykolyse i røde blodlegemer er pyruvat,C
Nagel hevder at problemet med moralsk flaks er nært knyttet til problemet med:,Guds eksistens.,viljens frihet.,psykologisk egoisme.,universaler.,B
Ifølge Singer krever overholdelse av hans prinsipp:,"beskjedne endringer i våre personlige vaner, men ikke i samfunnet som helhet.","beskjedne endringer i våre personlige vaner, så vel som i samfunnet.","drastiske endringer i våre personlige vaner, men ikke i samfunnet vårt.",Drastiske endringer i både våre personlige vaner og i samfunnet vårt.,D
Hvilket av følgende er det siste som ble okkupert av mennesker?,Ny-Guinea,Australia,New Zealand,Timor,C
Nubisk sivilisasjon:,predated og ansporet fremveksten av egyptisk kultur.,var resultatet av mesopotamisk kolonisering i sør.,"utviklet seg som svar på, men ikke i etterligning av, egyptisk kultur.",hadde ingen kontakt med nabokulturer.,C
En offentlig enhet er pålagt å inkludere en kontantstrømoppstilling i hvilket av følgende regnskap?,Regnskap for statlige fond.,Regnskap for hele regjeringen.,Egenutviklet fondsregnskap.,Fiduciary fond regnskap.,C
Hvilket av følgende utsagn er riktig når det gjelder endringer i regnskapsestimater?,De fleste endringer i regnskapsestimater regnskapsføres retrospektivt.,"Når det ikke er mulig å avgjøre om det har skjedd en endring i et estimat eller en endring i regnskapsprinsippet, bør endringen betraktes som en prinsippendring.","Når det ikke er mulig å avgjøre om det har skjedd en endring i regnskapsestimat eller en endring i regnskapsprinsippet, bør endringen betraktes som en endring i estimatet.",Det er lettere å skille mellom en endring i regnskapsestimat og en endring i regnskapsprinsipp enn det er å skille mellom en endring i regnskapsestimat og en korrigering av en feil.,C
"En bilists uaktsomme kjøring skadet en annen sjåfør alvorlig. Bilisten ble anmeldt for å ha kjørt i feil kjørefelt og betalte en bot. Bilisten hadde en policygrense på bare $ 15.000 for tredjepartsansvar på forsikringspolisen. Etter å ha gitt bilistens forsikringsselskap en fullstendig medisinsk rapport, alle medisinske regninger, medisinske journaler og andre nødvendige bevis på skader, krevde den skadede saksøkeren polisegrensene. Klageren varslet at det ville bli fremmet krav om ond tro dersom polisegrensene ikke ble betalt umiddelbart. Forsikringsselskapet nektet betaling uten forklaring. En jury tilkjente den skadde saksøkeren 200.000 dollar. Skadelidte fikk et signert oppdrag fra den uaktsomme bilisten som ga skadelidte de rettigheter som bilisten måtte ha hatt overfor sitt forsikringsselskap. Vil retten sannsynligvis tvinge forsikringsselskapet til å betale hele beløpet av juryens dom til skadet person under disse fakta?","Polisegrensen er $ 15.000, og det er alt som kan samles inn av den skadede, det er ingen handling for dårlig tro på en forsikringskontrakt.",Forsikringsselskapet brøt den underforståtte pakten om god tro og rettferdig behandling som er implisitt i hver forsikringskontrakt og må betale hele beløpet av dommen.,"Ond tro er personlig for den forsikrede og hans assurandør oppdraget var ugyldig, og den skadelidte har ikke krav på å tvinge selskapet til å betale.",Skadelidte må gjøre hele sin dom gjeldende mot bilisten og kan aldri forfølge forsikringsselskapet for dette beløpet.,C
