Question,A,B,C,D,Answer
تلقت الشرطة معلومات من مخبر موثوق به بأن رجلا كان يتاجر بالكوكايين من منزله. ثم قدم الضباط إلى القاضي إفادة خطية تبين الظروف التي تبين الأسباب المحتملة لإصدار أمر التفتيش. وأصدر القاضي مذكرة تفتيش للمخدرات في عنوان الرجل. ذهب ضباط الشرطة إلى منزل الرجل وقرعوا جرس الباب. عندما لم يرد أحد، اقتحمت الشرطة المنزل ودخلته. فتشوا الغرف في الطابق الأول ولم يعثروا على أدلة تدينهم، ثم خرجوا ولاحظوا مدخلا منفصلا يؤدي إلى الطابق الثاني من المسكن. صعدوا الدرج ودخلوا غرفة نوم في الطابق العلوي. داخل الغرفة ، وجد الضباط مخبأ من الكوكايين ملقى على خزانة ملابس. وبينما كان الضباط يواصلون تفتيشهم لغرفة النوم، دخل المدعى عليه الغرفة. سألت الشرطة المدعى عليه إذا كان هو الرجل. عرف المتهم عن نفسه وأخبر الشرطة أنهم كانوا في غرفة نومه وأنه احتل الطابق الثاني من المسكن. وأوضح المدعى عليه أن الرجل كان يقيم في الطابق الأول وأن أماكن إقامته منفصلة عن مسكن المدعى عليه. ومع ذلك ، تم وضع المدعى عليه قيد الاعتقال واتهم بحيازة الكوكايين. قدم المدعى عليه طلبا لاستبعاد الكوكايين من القبول كدليل. يجب أن يكون طلب المدعى عليه,منحت ، لأن مذكرة التوقيف لم تذكر اسم المدعى عليه.,ممنوح ، لأن الأمر لم يذكر على وجه التحديد المنطقة التي سيتم تفتيشها.,تم رفضه لأن الشرطة اعتقدت بشكل معقول أنها كانت تفتش منزل الرجل عندما دخلت مكان إقامة المدعى عليه.,رفض ، لأن الأمر كان صالحا وصدر لسبب محتمل.,C
"أعيد فتح سوبر ماركت للتو بعد إغلاق دام أسبوعين للتجديدات. في صباح يوم إعادة الافتتاح ، كانت امرأة تتسوق عندما سقطت فجأة وأصيبت بكسر في ساقها. بعد ذلك ، رفعت المرأة دعوى قضائية ضد السوبر ماركت بسبب إصابات شخصية. في بدلتها ، ادعت المرأة أنها تعثرت فوق دلو طلاء كان ملقى في أحد الممرات. في المحاكمة، اتصلت المرأة بزبون آخر لتشهد أنه بينما كان يتسوق سمع صوتا، واستدار ورأى المرأة تسقط على الأرض. كما شهد بأنه رأى دلو طلاء فارغا ملقى على بعد أقدام قليلة من ساق المرأة. عند الاستجواب ، دخل العميل في تبادل جدلي مع محامي السوبر ماركت. عندما سئل عن رأيه في سبب سقوط المرأة ، شهد العميل ، ""لقد سقطت لأنها تعثرت على الدلو. "" ومع ذلك ، اعترف في الاستجواب أنه لم ير المرأة تتعثر على الدلو. ثم سأل محامي السوبر ماركت العميل السؤال التالي: ""إذا لم تر المرأة تتعثر على الدلو ، فكيف تعرف أنها سقطت بسببها؟"" أجاب الزبون ، ""لأن صديقتي التي كانت تتسوق معي أخبرتني لاحقا أنها رأت المرأة تتعثر فوق الدلو. "" يتحرك محامي السوبر ماركت لضرب الإجابة الأخيرة للعميل. إذا ألغى قاضي المحاكمة طلب المدعى عليه وسمح لإجابة العميل بالوقوف ، فمن المرجح أن يكون ذلك بسبب",تمت دعوة إجابة العميل من خلال سؤال محامي السوبر ماركت.,استندت إجابة العميل إلى معرفة مباشرة.,كانت إجابة العميل عبارة عن بيان للتصور الحديث.,كانت إجابة العميل انطباعا منطقيا حاضرا.,A
"مزارع هو حاليا صاحب سجل قطعة أرض تم تعيينها على أنها ""A. "" وهي أعلى عقارين مجاورين على جبل. المزارع هو صاحب القطعة ""ب"" ، التي تقع أقل من ""أ"" على سفح الجبل. في عام 2000 ، قام المزارع ، الذي كان يمتلك قطعتي الأرض ، ببناء نظام صرف خاص. يتكون هذا النظام من خط أنابيب تحت الأرض يمتد عبر قطعتي الأرض. يتم تصريف مياه الصرف الصحي من القطعة ""أ"" عبر النظام إلى مجاري البلدية ، التي كانت تقع في أسفل الجبل. في عام 2005 ، باع المزارع الطرد ""ب"" للمزارع. لم يتضمن صك المزارع أي ذكر لنظام الصرف الصحي للمزرعة. تقع على كل قطعة من قطع الأراضي منازل كبيرة على طراز المزرعة يشغلها أصحابها. في الآونة الأخيرة ، بدأ تصريف مياه الصرف الصحي ينبعث منه رائحة كريهة عبر الطرد ""ب. "" ونتيجة لذلك ، رفع المزارع دعوى قضائية ضد المزارع في التعدي على ممتلكات الغير للمطالبة بالأضرار الناجمة عن نظام الصرف. يجب أن يكون الحكم ل",المزارع ، لأن صك المزارع لم يحتوي على أي تعهدات تقيد استخدام المزارع للأرض.,مربي الماشية ، لأن السبب الصحيح لعمل المزارع سيكون الإزعاج ، وليس التعدي على ممتلكات الغير.,المزارع ، لأن نظام الصرف كان السبب المباشر لأضرار المدعي كمسألة قانونية.,المزارع ، لأن المزارع لم يكن له الحق في تحسين أرضه بطريقة تسبب ضررا لآخر.,B
تأتي امرأة تبلغ من العمر 54 عاما إلى المكتب لأنها عانت من ألم متقطع في إطلاق النار على خدها الأيمن وفكها خلال الأسابيع ال 3 الماضية. كل حلقة من الألم تستمر لمدة 1 ثانية أو أقل. غالبا ما يحدث الألم بسبب الهواء البارد والمضغ والتحفيز عن طريق اللمس وتنظيف أسنانها بالفرشاة. لم تتعرض لصدمة في وجهها أو رأسها. التاريخ الطبي ملحوظ لصداع التوتر والسمنة وجراحة المجازة المعدية. يبلغ طولها 165 سم (5 أقدام و 5 بوصات) ويزن 62 كجم (137 رطلا) ؛ مؤشر كتلة الجسم هو 23 كجم / م 2. العلامات الحيوية طبيعية. لا يمكن للمريض تحمل اللمس على الجانب الأيمن من الوجه. لا يوجد ضعف في الوجه أو فقدان الإحساس. ما تبقى من الفحص البدني لا يظهر أي تشوهات. لا يظهر التصوير المقطعي المحوسب للرأس مع التباين وبدونه أي تشوهات. أي من الآتي أنسب علاج دوائي في هذا الزمن؟,كاربامازيبين,لاموتريجين,ليفيتيراسيتام,توبيراميت,A
أشارت الدراسات التي أجريت على مسببات الفصام إلى وجود استعداد وراثي للحالة ولكن هناك عوامل أخرى متورطة. من خلال معرفتك بالموضوع ، حدد أي من العبارات التالية غير صحيحة.,الدوبامين الزائد أو الحساسية للدوبامين يمكن أن يكون عاملا مساهما.,المرضى البيض هم أكثر أعراضا.,مغفرة من الحالة في العالم الثالث هو 65 ٪.,انخفاض معدل الفصام الذي تم تشخيصه بين الأمريكيين من أصل أفريقي.,D
يجد موظف في شركة تصنيع كبيرة العمل مملا ، ويتابع الوظيفة فقط من أجل المال. الموظف يؤدي الحد الأدنى ، وليس لديه الدافع لذلك إنتاج أعلى كمية أو جودة أفضل. وفقا لنظرية العاملين ل F. Herzberg ، فإن أفضل طريقة 10 لزيادة الدافع الذاتي لهذا العامل هي,تقديم زيادة ودفع حافز لزيادة الإنتاجية,إعادة تصميم الوظيفة لتوفير التحدي والشعور بالإنجاز,زيادة فرص التفاعل الاجتماعي المستنير,تزويد الموظف بمد وظيفي يحمل مكانة أكبر,B
أي مما يلي يصف الإرشادات الأخلاقية المتعلقة بالحميمية الجنسية مع عملاء العلاج السابقين؟,يحظر على علماء النفس إقامة علاقات جنسية حميمة مع عملاء العلاج السابقين تحت أي ظرف من الظروف.,يحظر على علماء النفس إقامة علاقات جنسية حميمة مع عملاء العلاج السابقين لمدة عام على الأقل بعد إنهاء العلاج.,يحظر على علماء النفس إقامة علاقات جنسية حميمة مع عملاء العلاج السابقين في ظروف معينة (على سبيل المثال ، عندما يكون هناك خطر الاستغلال).,لا يحظر على علماء النفس إقامة علاقات جنسية حميمة مع عملاء العلاج السابقين.,C
أظهرت الأبحاث حول اكتساب اللغة الثانية أي مما يلي عن الأطفال الذين يكتسبون لغة ثانية,تأخر نموهم المعرفي,لديهم تعبير أفضل من الأطفال الذين ليسوا ثنائيي اللغة,إجادتهم لغتهم الأم ليس لها أي تأثير على معدل اكتساب اللغة الثانية,لديهم زيادة المرونة المعرفية,D
ضمن أي مجال من مجالات العلاقات العامة من المرجح أن ينطوي على الضغط؟,الشركات,العلاقات المالية,الشؤون العامة,الأعمال التجارية إلى الأعمال,C
"وفي سياق العولمة، كيف يمكننا تعريف مصطلح ""التنمية"" على أفضل وجه؟",يشير مصطلح التنمية إلى الحالة الإنسانية التي يوجد فيها التحرر من الخوف والعوز. هناك موارد كافية للحفاظ على الحياة ويمكن أن توجد هذه الحياة في حالة خالية من التهديد أو التهديد المتصور بالانقطاع المفاجئ.,"لكي تعتبر الأمة متقدمة ، يجب أن تكون قد حققت وضعا اقتصاديا وسياسيا معينا داخل نظام الدولة العالمي. وهكذا يتم تحديد معيار ما يشكل دولة ""متقدمة"" من خلال متطلبات التفاعل في هذا النظام.",والتنمية وسيلة لمعالجة أوجه عدم المساواة التي تصاحب العولمة النيوليبرالية. وفي هذا السياق، تشير التنمية إلى قدرة السكان أو المجتمع المحلي على استخدام الموارد بفعالية وزيادة الكفاءة في الإنتاج والتوزيع، وتعزيز التوزيع الأكثر إنصافا للدخل داخل المجتمع.,يشير تطور المجتمع إلى أنظمة القيم الأيديولوجية والأخلاقية التي يشترك فيها سكانه. في النظام الدولي المعولم ، يشير هذا إلى تبني الأيديولوجية الديمقراطية الليبرالية الغربية واقتصاديات السوق الحرة.,C
أي مما يلي يصف المركزية الأوروبية؟,المركزية الأوروبية هي أسلوب تحليل تتم فيه مقارنة المجتمعات الأوروبية بالمجتمعات غير الأوروبية لإنتاج مقارنة غير متحيزة للمزايا النسبية لكل منها.,المركزية الأوروبية هي أسلوب تفكير يتم فيه صياغة تقييم وتقييم المجتمعات غير الأوروبية من حيث الافتراضات والتحيزات الثقافية للأوروبيين.,تصف المركزية الأوروبية الدراسات أو العمل العلمي الذي يأخذ في الاعتبار الأنظمة السياسية أو الاقتصادية الأوروبية فقط.,كل هذه الخيارات.,B
أي النظريات الآتية تركز على كيفية إدارة المجتمع للقيام بالأنشطة اللازمة للحفاظ على النظام والاستقرار؟,الوظيفية,التفاعلية,نظرية الاختيار العقلاني,نظرية الصراع,A
أي مما يلي هو مستند شخصي ذو وصول مغلق؟,"""ورقة بيضاء"" حكومية",السجلات الطبية السرية,دفتر حسابات الأسرة,سجل أسهم الشركة,C
أي من النقاط التالية تدعم حجة الأحادية الأمريكية؟,الهيمنة الخيرة,عدم فعالية تعددية الأطراف,القوة الأمريكية,كل ما سبق,D
ما المرض الذي لا تسببه فيروسات الهربس؟,شلل الأطفال,التهاب الدماغ,الأمراض المنقولة جنسيا,سرطان,A
الغرض من الدراسة مزدوجة التعمية أو المزدوجة المقنعة هو:,تحقيق قابلية المقارنة بين الأشخاص المعالجين وغير المعالجين,تقليل آثار تباين العينات,تجنب تحيز المراقب والموضوع,تجنب تحيز المراقب وتباين العينات,B
 يعرف النص الكلاسيكي Daodejing بأي عنوان باللغة الإنجليزية؟,كلاسيكي التغييرات,كلاسيكي الطريق والقوة,كلاسيكي المرأة,كلاسيكية الفلسفة,B
 ترتبط مجتمعات القاعدة بأي مما يلي؟,المطران أوسكار روميرو,المقاومة والتجديد,كرامة جميع البشر,كل ما سبق,D
النائب العام هو رئيس أي من الكيانات التالية؟,اللجنة القضائية بمجلس الشيوخ,وزارة العدل,وزارة الخارجية,سلك القاضي المحامي العام,B
خطوط المجال المغناطيسي حول شكل سلك يحمل التيار,الدوائر,خطوط شعاعية,التيارات الدوامة,حلقات الطاقة,A
"يشير مصطلح ""الفلفل الحار يخدع كارني"" إلى الفلفل الحار مع ماذا؟",الفول,لحم,جبن,الفلفل الحار,B
أي من الآتي يصف الموقف بعد رفع السعر على منتج له طلب غير مرن؟,الكمية المطلوبة لن تتغير.,الكمية المطلوبة ستزيد.,سينخفض إجمالي الإيرادات.,إجمالي الإيرادات لن يتغير.,A
تتكون رقائق الكمبيوتر الحديثة في المقام الأول من أي عنصر؟,صوديوم,سليكون,ألمنيوم,فضة,B
