Question,A,B,C,D,Answer
"Този въпрос се отнася до следната информация.
""Наистина, тъй като и фетвите на изтъкнати [учени], които основават мнението си както на разума, така и на традицията, и консенсусът на сунитската общност са съгласни, че древното задължение за изкореняване, изтребление и изгонване на злото нововъведение трябва да бъде целта на нашия възвишен стремеж, защото ""Религиозната ревност е победа за Вярата на Бог Благодетелния""; [И ще им се каже:] ""Мир!"" ""Всеки, който въвежда зло нововъведение в нашия ред, трябва да бъде изгонен"" и ""Който прави нещо против нашата заповед, трябва да бъде изгонен"", действието е станало необходимо и неотложно.
Писмо от османския султан Селим I до Сефевид шах Исмаил I, 1514 г.
Сефевидите си навличат гнева на ислямските империи като Османската и Моголската империи главно заради сефевидите","са експанзионистична империя, географски разположена между двама други експанзионисти.",отхвърля основните принципи на исляма,"поробени християни, и ги превърна в Safavid бойци",Исмаил се провъзгласил за халиф,A
"Този въпрос се отнася до следната информация.
Вървя покрай колоната, питам какво става.
Един войник казва просто: ""Те се обаждат повече всеки ден.
""Някои от нас бяха изпратени на север до Жълтата река на петнадесетгодишна възраст.
И сега в четирийсет се отправяме към гарнизоните на запад.
При първото ни турне главатарят на селото трябваше да ни върже банданите.
Когато се върнахме, косата ни беше бяла, но все още има повече вълнения.
Граничните гарнизони текат с кръв, достатъчна да напълни океана,
Но териториалните амбиции на военния император все още не са се развихрили.
В стоте области на изток от планините, по цялата земя Хан,
Трябва да има десет хиляди села, които сега гъмжат.
Дори ако съпругите са достатъчно силни, за да се справят с мотика и плуг,
Посевите растат по всякакъв начин, всички полета са бъркотия.
Най-трудно е за мъжете Шанси, с репутацията си на бойци:
Те са закръглени като кучета или пилета, всеки мъжки впечатлен.
""Но, сър, въпреки че е добре от ваша страна да попитате,
Оплакването не е част от задачата на войника.
Можем само да клатим глави. Вземете тази зима:
Войските на Шанси никога не са изпращани у дома.
Областните управители настояват за поземлен данък,
Но откъде ще дойде? Не може да му вземете парите!
Честно казано мисля, че е лош късмет да родиш син сега,
По-добре е да имате дъщеря: поне може да се омъжи
И живеят със съседите в съседство.
Но един син ще свърши да лежи в някоя далечна прерия.""
Ду Фу, ""Балада за армейските каруци"", ок. 750 г. сл.
Стихотворението дава доказателства за това кое от следните по отношение на отношенията между половете в обществото на Тан?",Конфуцианските отношения между съпруг и съпруга все още са силни в обществото на Тан.,"Имперските рескрипти подчертават раждането на способни синове над дъщери, за да изпълнят квотите за наборна служба.","Селскостопанската работа може да бъде споделена както от жените, така и от мъжете.",Традиционните китайски отношения между половете са обърнати по време на управлението на императрица Ву Дзетиан.,C
"В равнината xy, графиката на x^(log y) = y^log x е",отворения първи квадрант,затворена крива,лъч в отворения първи квадрант,една точка,A
Коя от следните държави е отделила най-много CO2 на глава от населението през 2017 г.?,Япония,Канада,Русия,Иран,B
Какво е атака за преиграване?,"Когато нападателят отговори на съобщение, изпратено до него от системата","Атака, която непрекъснато се повтаря, сондиране за слабост","Атака, която използва собствените съобщения на системата и така не може да бъде защитена","Нападателят изпраща отново заловено съобщение, а сайтът го приема и отговаря в полза на нападателя",D
"Фактът, че инфрачервената абсорбционна честота на деутериевия хлорид (DCl) се измества от тази на хлороводорода (HCl), се дължи на разликите в тяхната",Разпределение на електроните,диполен момент,константа на силата,намалена маса,D
"Квантовата ефективност на фотонния детектор е 0,1. Ако в детектора се изпратят 100 фотона, един след друг, детекторът ще открие фотони","средно 10 пъти, с rms отклонение от около 4","средно 10 пъти, с rms отклонение от около 3","средно 10 пъти, с rms отклонение от около 1","средно 10 пъти, с rms отклонение от около 0,1",B
Кой от следните набори от битови низове НЕ МОЖЕ да бъде описан с регулярен израз?,"Всички битови низове, чийто брой нули е кратен на пет","Всички битови низове, започващи с нула и завършващи с единица",Всички битови низове с четен брой нули,"Всички битови низове с повече единици, отколкото нули",D
Адаптациите на растенията за свеждане до минимум на загубите на вода в среди с високи температури включват кое от следните?,Многобройни устица,Тънки кожички,Бодли вместо листа,Големи съотношения повърхност-обем,C
"Мутациите са грешки в ДНК, които:",Те винаги са вредни.,Срещат се само в присъствието на канцерогени.,увеличаване на туморния растеж.,възникват спонтанно с ниска скорост.,D
Кое от следните е вярно за хипотиреоидизъм?,Загуба на тегло,Претибиален миксоедем,Повишено ниво на TSH,Отвращение към топлите места,C
"Оценените стойности на къщите в един град имат средна стойност от 125 000 долара със стандартно отклонение от 23 000 долара. Заради нов учителски договор училищният район се нуждае от допълнителни 10% средства в сравнение с предходната година. За да събере тези допълнителни пари, градът инструктира службата за оценка да повиши всички оценени стойности на жилищата с 5000 долара. Какво ще бъде новото стандартно отклонение на оценените стойности на къщите в града?","$23,000 ","$25,300 ","$28,000 ","$30,300 ",A
" В дискусията си за дискриминацията по време на война Валс предполага, че",Няма разлика между бойци и невоюващи.,Разликата между бойци и невоюващи е въпрос на степен.,Разликата между бойци и невоюващи е категорична и ясна.,"""Тероризмът"" трябва да се определи като безразборно насилие.",B
" Според Нусбаум, третирането на някого като обект е",Това е достатъчно за сексуално обективизиране.,необходими за сексуално обективизиране.,Не е необходимо за сексуално обективизиране.,всичко по-горе.,C
"За кой от тези два сценария главният герой (който използва I/me/my) прави нещо очевидно морално погрешно, според обикновените морални стандарти в САЩ към 2020 г.? Сценарий 1 | Докато родителите ми спяха, аз отидох да тичам. Сценарий 2 | Излях препарат в пералнята, пълна с дрехите на съквартиранта ми.","Грешно, грешно","Грешно, не грешно","Не е грешно, грешно","Не е грешно, не е грешно",D
"За кой от тези два сценария главният герой (който използва I/me/my) прави нещо очевидно морално погрешно, според обикновените морални стандарти в САЩ към 2020 г.? Сценарий 1 | Понякога се опитвам да кажа истината, освен ако това не ме вкара в беда. Сценарий 2 | Целунах приятелката си на вълшебното шоу.","Грешно, грешно","Грешно, не грешно","Не е грешно, грешно","Не е грешно, не е грешно",B
"За кой от тези два сценария главният герой (който използва I/me/my) прави нещо очевидно морално погрешно, според обикновените морални стандарти в САЩ към 2020 г.? Сценарий 1 | Прегазих свежия килим с косачка. Сценарий 2 | Уринирах в ръката си, за да мога да я тествам за инфекция.","Грешно, грешно","Грешно, не грешно","Не е грешно, грешно","Не е грешно, не е грешно",A
"За кой от тези два сценария главният герой (който използва I/me/my) прави нещо очевидно морално погрешно, според обикновените морални стандарти в САЩ към 2020 г.? Сценарий 1 | Видях известния Елтън Джон пред концертна арена и го снимах, без да го питам. Сценарий 2 | Докладвах за друг пазач, който се промъква в наркотични вещества в затвора и ги продава на затворници.","Грешно, грешно","Грешно, не грешно","Не е грешно, грешно","Не е грешно, не е грешно",D
"За кой от тези два сценария главният герой (който използва I/me/my) прави нещо очевидно морално погрешно, според обикновените морални стандарти в САЩ към 2020 г.? Сценарий 1 | Затръшнах се на брейковете си, за да пропусна топката, когато тя влезе на пътя. Сценарий 2 | Научих децата си да играят на ксилофон.","Грешно, грешно","Грешно, не грешно","Не е грешно, грешно","Не е грешно, не е грешно",D
"За кой от тези два сценария главният герой (който използва I/me/my) прави нещо очевидно морално погрешно, според обикновените морални стандарти в САЩ към 2020 г.? Сценарий 1 | Когато фризерът на ресторанта ми се счупи, сервирах топлото месо, въпреки че знаех, че е много опасно. Сценарий 2 | Реших да запаля огън в гората.","Грешно, грешно","Грешно, не грешно","Не е грешно, грешно","Не е грешно, не е грешно",A
"По-голяма консумация на мляко
","Съобщава се, че е свързано с по-висока честота на фрактури и по-висока смъртност в няколко проучвания",По време на пубертета изглежда е свързано с по-висока костна минерална плътност в по-късен живот,Последователно се свързва с по-ниска честота на фрактури,"В страните с най-висок процент на фрактури се предполага, че консумацията на мляко е полезна за скелета.",A
"Кое от следните твърдения за метаболизма на глюкозата е правилно?
",Глюкагонът увеличава скоростта на гликолизата,Гликолизата изисква NADP+,При гликолизата глюкозата се разцепва на два тривъглеродни продукта,Крайният продукт на гликолизата в червените кръвни клетки е пируват,C
"Нейджъл твърди, че проблемът за моралния късмет е тясно свързан с проблема за:",съществуването на Бога.,Свобода на волята.,психологически егоизъм.,универсали.,B
Според Сингър спазването на неговия принцип изисква:,"скромни промени в личните ни навици, но не и в обществото ни като цяло.","скромни промени в личните ни навици, както и в обществото.","Драстични промени в личните ни навици, но не и в обществото ни.","драстични промени както в личните ни навици, така и в обществото ни.",D
"Кое от следните е последното, което е заето от човешки същества?",Нова Гвинея,Австралия,Нова Зеландия,Тимор,C
Нубийска цивилизация:,предшества и стимулира възхода на египетската култура.,Това е резултат от месопотамската колонизация на юг.,"Тя е разработена в отговор на, но не и в имитация на египетската култура.",Не са имали контакти със съседни култури.,C
От държавното предприятие се изисква да включи отчет за паричните потоци в кой от следните финансови отчети?,Финансови отчети на държавния фонд.,Финансови отчети за цялото правителство.,Финансови отчети на собствения фонд.,Финансови отчети на доверителния фонд.,C
"Кое от следните твърдения е вярно, тъй като се отнася до промени в счетоводните приблизителни оценки?",Повечето промени в счетоводните приблизителни оценки се отчитат ретроспективно.,"Когато е невъзможно да се определи дали е настъпила промяна в приблизителната оценка или в счетоводния принцип, промяната следва да се счита за принципна промяна.","Когато е невъзможно да се определи дали е настъпила промяна в счетоводната приблизителна оценка или промяна в счетоводния принцип, промяната следва да се счита за промяна в приблизителната оценка.","По-лесно е да се направи разграничение между промяна в счетоводната приблизителна оценка и промяна в счетоводния принцип, отколкото да се направи разграничение между промяна в счетоводната приблизителна оценка и корекция на грешка.",C
"Небрежно шофиране на шофьор сериозно е наранило друг шофьор. Мотористът е цитиран за пътуване в грешната лента и е платил глоба. Шофьорът имаше лимит на полицата от само 15 000 долара за гражданска отговорност по застрахователната си полица. След като предостави на застрахователя на шофьора пълен медицински доклад, всички медицински сметки, медицински досиета и други необходими доказателства за щети, пострадалият ищец поиска лимитите на полицата. Ищецът е уведомил, че ще бъде подаден иск за недобросъвестност, ако лимитите на полицата не бъдат платени незабавно. Застрахователната компания отказа плащане без обяснение. Съдебните заседатели присъдиха на пострадалия ищец 200 000 долара. Пострадалият ищец е получил подписана цесия от небрежния шофьор, давайки на ищеца всички права, които шофьорът може да е имал срещу застрахователя си. Вероятно ли съдът ще принуди застрахователната компания да плати пълната сума на присъдата на съдебните заседатели на увреденото лице при тези факти?","Лимитът на полицата е 15 000 долара и това е всичко, което може да бъде събрано от пострадалото лице няма действие за недобросъвестност по застрахователен договор.","Застрахователната компания е нарушила подразбиращия се завет за добросъвестност и честна сделка, който се подразбира във всеки застрахователен договор и трябва да плати пълния размер на съдебното решение.","Недобросъвестността е лична за застрахованата страна и неговия застраховател цесията е била недействителна, а увреденото лице няма претенция да принуди застрахователя да плати.",Увреденото лице трябва да изпълни цялото си съдебно решение срещу шофьора и никога не може да преследва застрахователя за тази сума.,C
"Една жилищна корпорация притежаваше парцел земя. Жилищната корпорация подготви план за развитие, за да раздели земята на 100 парцела и да създаде жилищна общност на тракта. Декларацията на заветите създава асоциацията на собствениците на жилища, административна единица, която ще администрира и прилага правилата и ограниченията, цитирани сред заветите. Едно от ограниченията, изложени в Декларацията на заветите, гласи: ""Никога не трябва да се издига, разрешава или поддържа върху която и да е част от имота каквато и да е структура, проектирана или използвана като салон или място за продажба или производство на малц, винени или спиртни напитки."" Декларацията за заветите била надлежно записана и била включена в акта, взет от учител, когато закупил лот 62 в разработката. Учителят веднага записал постъпката си. Учителят отдал дома си под наем на библиотекар за срок от една година. Договорът за наем включваше същите ограничения като тези в Декларацията за заветите и в акта на учителя. Библиотекарят веднага започнал да продава алкохол в помещенията по време на седмични партита ""след часове"". Сдружението на собствениците на жилища съди библиотекаря в иск за вреди. Кое от следните е най-добрият аргумент за библиотекаря?",Правилото в случая на Спенсър не позволява на библиотекаря да носи отговорност.,Библиотекарят не е в тайна на договор с асоциацията на собствениците на жилища.,Библиотекарят не е в собственост с учителя.,Други партиди в непосредствена близост се използват за търговски цели.,B
