Question,A,B,C,D,Answer
"మెక్సికన్-అమెరికన్ అయిన ఆయన ఎన్నికల్లో విజయం సాధించాలంటే పెద్ద సంఖ్యలో మెక్సికన్ ఓటర్లు అవసరమని అభిప్రాయపడుతున్నారు. తత్ఫలితంగా, అతని ప్రచార నిర్వాహకుడు, రిజిస్టర్డ్ మెక్సికన్ ఓటరుకు కన్నీటి స్టిక్కర్ను మెయిల్ చేయాలని నిర్ణయించుకుంటాడు, ఇది అభ్యర్థి పేరు మరియు అతను పోటీ చేస్తున్న కార్యాలయం కలిగి ఉంటుంది. చాలా మంది స్థానిక మెక్సికన్ ప్రజలు ఇంగ్లీష్ చదవడం మరియు రాయడంలో నైపుణ్యం లేనందున, చాలా మంది ఓటర్లు బ్యాలెట్పై అభ్యర్థి పేరు మరియు కార్యాలయాన్ని రాయడంలో ఇబ్బంది పడతారని ప్రచార నిర్వాహకుడు భావిస్తున్నారు. దీంతో బ్యాలెట్ కు స్టిక్కర్లు ఎలా వేయాలో ఓటర్లకు తెలియజేసేందుకు క్యాంపెయిన్ మేనేజర్ విస్తృతంగా ప్రచారం నిర్వహించారు. ఎన్నికలకు ఐదు నెలల ముందు టియర్ ఆఫ్ స్టిక్కర్లు రాష్ట్ర చట్టానికి అనుగుణంగా లేవని ఎన్నికల అధికారి అభ్యర్థి ప్రచార కమిటీకి తెలియజేస్తారు. సంభావ్య ఓటర్లు అభ్యర్థి పేరును సిరాతో రాయడం అవసరమని రాష్ట్ర ఎన్నికల అధికారులు అభిప్రాయపడుతున్నారని ఆమె తన లేఖలో వివరించారు. అందువల్ల, స్టిక్కర్లు చట్టపరమైన అవసరాలకు అనుగుణంగా లేవని ఆమె తేల్చారు. మూడు వారాల తరువాత, అభ్యర్థి రాష్ట్ర ఎన్నికల అధికారులపై ఫెడరల్ డిస్ట్రిక్ట్ కోర్టులో దావా వేశాడు, రాష్ట్ర శాసనాన్ని వారు వ్యాఖ్యానించడం అమెరికా రాజ్యాంగాన్ని ఉల్లంఘిస్తుందని పేర్కొన్నారు. ఈ క్రిందివాటిలో ఏది స్థాపించబడినట్లయితే, శాసనంపై ఎన్నికల అధికారి యొక్క వివరణను సమర్థించే బలమైన రాజ్యాంగ వాదనను ముందుకు తెస్తుంది?",ఇంగ్లిష్ లో ప్రావీణ్యం లేని రిజిస్టర్డ్ మెక్సికన్ అమెరికన్ ఓటర్లలో ఇటీవలి ఎన్నికలలో మొత్తం రాష్ట్ర మొత్తంలో 1% కంటే తక్కువ ఓటింగ్ నమోదైంది.,ఓట్ల రాతను సులభతరం చేయడానికి ప్రతి పోలింగ్ బూత్ కు సిరా పెన్నును అమర్చాలని రాష్ట్ర చట్టం చెబుతోంది.,"పెద్ద సంఖ్యలో రైట్-ఇన్ ఓట్లు సాధారణంగా అన్ని ఓట్లను లెక్కించడానికి అవసరమైన సమయాన్ని పెంచుతాయి కాబట్టి, అటువంటి ఓట్లను ఏకరీతిలో వేయడం అవసరం.",ప్రీప్రింటెడ్ స్టిక్కర్లతో ఓటింగ్ మోసానికి అవకాశం గణనీయంగా ఎక్కువగా ఉంటుంది.,D
"నగరంలో కొత్తగా నిర్మించిన హోటల్ కు ఓ వ్యక్తి యజమాని. మార్చి 15న హోటల్ పరికరాల పంపిణీదారు అయిన సేల్స్ పర్సన్ నుంచి ఆ వ్యక్తికి ఫోన్ వచ్చింది. తన హోటల్ కోసం 1,000 అగ్నిమాపక యంత్రాలను అమ్మడానికి సేల్స్ మెన్ ముందుకొచ్చాడు. డెలివరీ తర్వాత 90 రోజుల తర్వాత చెల్లించాల్సిన అగ్నిమాపక యంత్రాల ఖరీదు $ 35,000 (లేదా ఒక్కొక్కటి $ 35) అని సేల్స్ పర్సన్ ఆ వ్యక్తికి చెప్పాడు. ఏప్రిల్ 15 లోపు అగ్నిమాపక యంత్రాలను ఏర్పాటు చేస్తామని సేల్స్ పర్సన్ హామీ ఇచ్చారు. మార్చి 16న ఆ వ్యక్తి సేల్స్ పర్సన్ కు ఫోన్ చేసి ఆఫర్ ను అంగీకరించాడు. మరుసటి రోజు, ఆ వ్యక్తి సేల్స్ పర్సన్ కు ఈ క్రింది మెమోను మెయిల్ చేశాడు: ""ఇన్ స్టలేషన్ చేసిన ఏడు రోజుల తరువాత నగదు చెల్లింపు కొరకు నేను 15 శాతం డిస్కౌంట్ తీసుకుంటానని దయచేసి సలహా ఇవ్వండి."" మార్చి 20న సేల్స్ పర్సన్ కు ఆ వ్యక్తి ఉత్తరప్రత్యుత్తరాలు అందాయి. ఏప్రిల్ 1న సేల్స్ పర్సన్ ఆ వ్యక్తికి టెలిగ్రామ్ పంపాడు, ""మాకు అమలు చేయదగిన ఒప్పందం అమలులో లేదని స్పష్టమవుతోంది. ఏప్రిల్ 15న గానీ, మరే సమయంలో గానీ నేను అగ్నిమాపక యంత్రాలను డెలివరీ చేయను. ఒప్పందాన్ని ఉల్లంఘించినందుకు ఆ వ్యక్తి సేల్స్ పర్సన్ పై దావా వేస్తాడు. సేల్స్ పర్సన్ యుసిసి కింద మోసాల చట్టాన్ని సమర్థిస్తాడు. సేల్స్ పర్సన్ యొక్క రక్షణలకు సంబంధించి ఈ క్రిందివాటిలో అత్యంత ఖచ్చితమైన ప్రకటన ఏది?","సేల్స్ పర్సన్ యొక్క డిఫెన్స్ చెల్లుబాటు అవుతుంది, ఎందుకంటే ఒక ఒప్పందం ఏర్పడిందని సూచించడానికి ఆ వ్యక్తి యొక్క మెమో సరిపోదు.","సేల్స్ పర్సన్ యొక్క డిఫెన్స్ చెల్లుబాటు అవుతుంది, ఎందుకంటే ఆ వ్యక్తి యొక్క మెమో సేల్స్ పర్సన్ యొక్క మౌఖిక ఆఫర్ యొక్క నిబంధనలకు విరుద్ధంగా ఉంది.","సేల్స్ పర్సన్ యొక్క డిఫెన్స్ చెల్లదు, ఎందుకంటే సేల్స్ పర్సన్ ఆ వ్యక్తి యొక్క మెమోకు సహేతుకమైన వ్యవధిలో ప్రతిస్పందించడంలో విఫలమయ్యాడు.","సేల్స్ పర్సన్ యొక్క డిఫెన్స్ చెల్లదు, ఎందుకంటే UCC కింద వ్యాపారుల మధ్య ఒప్పందాలలో మోసాల శాసనం వర్తించదు.",A
"రెండు పట్టణాలను విలీనం చేసే ప్రతిపాదనను బ్యాలెట్ లో ఉంచడానికి ముందు, రాష్ట్ర అటార్నీ జనరల్ ఒక సలహా అభిప్రాయాన్ని జారీ చేశారు, ఆమె అభిప్రాయం ప్రకారం, ఈ చర్య ఎటువంటి చట్టపరమైన లేదా రాజ్యాంగ నిబంధనలను ఉల్లంఘించలేదని పేర్కొంది. ఆ తర్వాత ఈ ప్రతిపాదనను బ్యాలెట్ లో ఉంచి రెండు పట్టణాల్లోని ఓటర్లు భారీగా ఆమోదించారు. ఎన్నికల తరువాత, కానీ విలీనం అధికారికంగా జరగక ముందే, ఒక పట్టణానికి చెందిన ఇద్దరు పన్ను చెల్లింపుదారులు ఈ ప్రతిపాదన యొక్క రాజ్యాంగబద్ధతను దెబ్బతీస్తూ ఏకీకరణకు ఆదేశించడానికి దావా వేశారు. ఈ వ్యాజ్యం రాష్ట్ర సర్వోన్నత న్యాయస్థానానికి చేరింది మరియు రాష్ట్ర మరియు ఫెడరల్ చట్టాల ప్రకారం రాజ్యాంగబద్ధమైనదిగా గుర్తించబడింది. ఈ కేసును అమెరికా సుప్రీంకోర్టు సమీక్షించాలని కోరుతూ పిటిషనర్లు పిటిషన్ దాఖలు చేశారు. కోర్టు ఇలా చేయవచ్చు.","ఈ కేసును విచారించలేదు, ఎందుకంటే ఇది స్వతంత్ర రాష్ట్ర ప్రాతిపదికన నిర్ణయించబడింది.",కేసును విచారించకుండా ఫెడరల్ డిస్ట్రిక్ట్ కోర్టుకు రిమాండ్ కు తరలించవచ్చు.,"ఫెడరల్ అంశాలను వినండి, కానీ రాష్ట్ర సమస్యపై పాలించడానికి నిరాకరిస్తారు.",రాష్ట్ర అటార్నీ జనరల్ ఇచ్చిన సలహా అభిప్రాయంపై ఆధారపడండి మరియు దాని అర్హతలపై కేసును విచారించవద్దు.,A
"ఓ వ్యక్తి తన ఇంటి నుంచి కొకైన్ సరఫరా చేస్తున్నట్లు పోలీసులకు విశ్వసనీయ సమాచారం అందింది. సెర్చ్ వారెంట్ జారీకి గల కారణాలను వివరిస్తూ అధికారులు మేజిస్ట్రేట్ కు అఫిడవిట్ సమర్పించారు. ఆ వ్యక్తి చిరునామా వద్ద మాదకద్రవ్యాల కోసం మేజిస్ట్రేట్ సెర్చ్ వారెంట్ జారీ చేశారు. పోలీసు అధికారులు ఆ వ్యక్తి ఇంటికి వెళ్లి డోర్ బెల్ మోగించారు. ఎవరూ సమాధానం చెప్పకపోవడంతో పోలీసులు లోపలికి చొరబడి లోపలికి ప్రవేశించారు. మొదటి అంతస్తులోని గదులను తనిఖీ చేయగా ఎలాంటి ఆధారాలు లభించకపోవడంతో బయటకు వెళ్లి చూడగా రెండో అంతస్తుకు వెళ్లే ప్రత్యేక ప్రవేశ ద్వారం కనిపించింది. మెట్లు ఎక్కి మేడపై ఉన్న పడకగదిలోకి ప్రవేశించారు. గదిలో డ్రస్సర్ పై కొకైన్ నిల్వలు పడి ఉండటాన్ని అధికారులు గుర్తించారు. అధికారులు పడకగదిలో తనిఖీలు కొనసాగిస్తుండగా నిందితుడు గదిలోకి ప్రవేశించాడు. ఆ వ్యక్తినా అని పోలీసులు నిందితుడిని ప్రశ్నించారు. నిందితుడు తనను తాను గుర్తుపట్టి, వారు తన పడకగదిలో ఉన్నారని, తాను నివాసం యొక్క రెండవ అంతస్తును ఆక్రమించానని పోలీసులకు చెప్పాడు. ఆ వ్యక్తి మొదటి అంతస్తులో నివసిస్తున్నాడని, అతని నివాస గృహాలు ప్రతివాది నివాసం నుండి వేరుగా ఉన్నాయని ప్రతివాది వివరించాడు. అయినప్పటికీ నిందితుడిని అరెస్టు చేసి కొకైన్ కలిగి ఉన్నారనే అభియోగం మోపారు. కొకైన్ ను సాక్ష్యంగా స్వీకరించకుండా మినహాయించాలని ప్రతివాది పిటిషన్ దాఖలు చేశారు. ప్రతివాది యొక్క కదలిక ఇలా ఉండాలి","మంజూరు చేయబడింది, ఎందుకంటే వారెంట్ ప్రతివాది పేరును పేర్కొనలేదు.",ఎందుకంటే వారెంట్ లో శోధించాల్సిన ప్రాంతాన్ని నిర్దిష్టంగా పేర్కొనలేదు.,"నిరాకరించారు, ఎందుకంటే వారు ప్రతివాది నివాసాల్లోకి ప్రవేశించినప్పుడు వారు ఆ వ్యక్తి నివాసంలో సోదాలు చేస్తున్నారని పోలీసులు సహేతుకంగా విశ్వసించారు.","తిరస్కరించబడింది, ఎందుకంటే వారెంట్ చెల్లుబాటు అవుతుంది మరియు సంభావ్య కారణంతో జారీ చేయబడింది.",C
"పునరుద్ధరణ కోసం రెండు వారాల మూసివేత తర్వాత సూపర్ మార్కెట్ తిరిగి తెరుచుకుంది. తిరిగి తెరిచిన రోజు ఉదయం ఓ మహిళ షాపింగ్ చేస్తుండగా అకస్మాత్తుగా కిందపడి కాలు విరిగింది. ఆ తర్వాత ఆ మహిళ వ్యక్తిగత గాయాల కోసం సూపర్ మార్కెట్ పై కేసు పెట్టింది. ఓ గదిలో పడి ఉన్న పెయింట్ బకెట్ పై నుంచి జారిపడిపోయానని ఆ మహిళ తన సూట్ లో పేర్కొంది. తాను షాపింగ్ చేస్తుండగా శబ్దం వినిపించిందని, వెనక్కి తిరిగి చూడగా మహిళ నేలపై పడిపోవడాన్ని చూశానని బాధితురాలు మరో కస్టమర్ కు ఫోన్ చేసి సాక్ష్యం చెప్పింది. మహిళ కాలికి కొన్ని అడుగుల దూరంలో ఖాళీ పెయింట్ బకెట్ పడి ఉండటాన్ని తాను చూశానని అతను సాక్ష్యం చెప్పాడు. క్రాస్ ఎగ్జామినేషన్ లో కస్టమర్ సూపర్ మార్కెట్ అటార్నీతో వాగ్వాదానికి దిగాడు. మహిళ పడిపోవడానికి కారణమేమిటని కస్టమర్ ను ప్రశ్నించగా, ""ఆమె బకెట్ పై పడిపోవడం వల్ల పడిపోయింది"" అని సాక్ష్యం చెప్పాడు. అయితే క్రాస్ ఎగ్జామినేషన్ లో బకెట్ పై మహిళ ప్రయాణాన్ని తాను చూడలేదని అంగీకరించాడు. సూపర్ మార్కెట్ యొక్క న్యాయవాది అప్పుడు కస్టమర్ ను ఈ క్రింది ప్రశ్న అడిగారు: ""బకెట్ పై మహిళ ప్రయాణించడాన్ని మీరు చూడకపోతే, దాని కారణంగా ఆమె పడిపోయిందని మీకు ఎలా తెలుస్తుంది?"" ""ఎందుకంటే నాతో పాటు షాపింగ్ చేస్తున్న నా స్నేహితురాలు బకెట్ పై మహిళ ప్రయాణించడాన్ని చూశానని తరువాత చెప్పింది"" అని కస్టమర్ సమాధానమిచ్చాడు. సూపర్ మార్కెట్ యొక్క అటార్నీ కస్టమర్ యొక్క చివరి సమాధానాన్ని కొట్టడానికి కదులుతాడు. ట్రయల్ జడ్జి ప్రతివాది యొక్క కదలికను తోసిపుచ్చి, కస్టమర్ యొక్క సమాధానాన్ని నిలబడటానికి అనుమతించినట్లయితే, అది చాలావరకు కారణం కావచ్చు.",సూపర్ మార్కెట్ యొక్క అటార్నీ యొక్క ప్రశ్నకు కస్టమర్ యొక్క సమాధానం ఆహ్వానించబడింది.,కస్టమర్ యొక్క సమాధానం ప్రత్యక్ష పరిజ్ఞానంపై ఆధారపడి ఉంటుంది.,కస్టమర్ యొక్క సమాధానం ఇటీవలి అవగాహన యొక్క ప్రకటన.,కస్టమర్ యొక్క సమాధానం ప్రస్తుత సెన్స్ ఇంప్రెషన్.,A
"ఒక పశుపోషకుడు ప్రస్తుతం ""A. "" అని పేర్కొనబడిన భూమి యొక్క రికార్డుకు యజమానిగా ఉన్నాడు, ఇది ఒక పర్వతంపై ఉన్న రెండు పొరుగు ఆస్తుల కంటే ఎత్తైనది. ఒక రైతు పర్వతంపై ""A"" కంటే దిగువన ఉన్న పార్శిల్ ""B"" యొక్క యజమాని. 2000 సంవత్సరంలో రెండు గుంటల భూమిని సొంతం చేసుకున్న రైతు ప్రైవేటు డ్రైనేజీ వ్యవస్థను నిర్మించాడు. ఈ వ్యవస్థలో భూగర్భ పైప్లైన్ ఉంది, ఇది రెండు భూభాగాలలో విస్తరించి ఉంది. పార్శిల్ ""ఎ"" నుండి వచ్చే మురుగునీరు వ్యవస్థ ద్వారా పర్వతం దిగువన ఉన్న మునిసిపల్ మురుగునీటిలోకి ప్రవహించింది. 2005లో రైతుకు పార్శిల్ 'బి'ని విక్రయించాడు. రైతుకు ఇచ్చిన దస్తావేజులో డ్రైనేజీ వ్యవస్థ ప్రస్తావన లేదు. ప్రతి పార్శిళ్లపై ఆయా యజమానులు ఆక్రమించిన పెద్ద రాంచ్ తరహా ఇళ్లు ఉన్నాయి. ఇటీవల, మురుగునీటి కాలువ పార్శిల్ ""బి"" అంతటా అసహ్యకరమైన వాసనను వెదజల్లడం ప్రారంభించింది, ఫలితంగా, డ్రైనేజీ వ్యవస్థ వల్ల కలిగే నష్టాలను కోరుతూ రైతు అతిక్రమణలో వ్యవసాయదారుడిపై కేసు వేశాడు. తీర్పు దేనికి ఉండాలి",రైతుకు చేసిన దస్తావేజులో వ్యవసాయదారుడు భూమిని ఉపయోగించడాన్ని పరిమితం చేసే ఒడంబడికలు ఏవీ లేవు.,ఎందుకంటే రైతు యొక్క సరైన చర్య కారణం అతిక్రమణ కంటే ఉపద్రవం కోసం ఉంటుంది.,"రైతు, ఎందుకంటే చట్టం ప్రకారం పిటిషనర్ నష్టాలకు డ్రైనేజీ వ్యవస్థ ప్రధాన కారణం.","రైతు, ఎందుకంటే, తన స్వంత భూమిని మరొకరికి హాని కలిగించే విధంగా మెరుగుపరచుకునే హక్కు వ్యవసాయదారుడికి లేదు.",B
