Question,A,B,C,D,Answer
Který z těchto hororů zplodil nejvíce pokračování?,Křičet',Čelisti',Halloween',Pátek třináctého',D
Které z těchto pokrmů se vyrábí z vepřových střev?,haggis,chitliny,ovesná kaše,Chop Suey,B
Jaký je rodný jazyk herce Antonia Banderase?,Španělština,Ruština,Němčina,Francouzština,A
Jaký je úřední jazyk Nizozemska?,Dánština,Švédština,Němčina,Holandština,D
V jakém stavu se odehrává film Magnolia z roku 1999?,Kalifornský,Jižní Karolína,Gruzie,Texas,A
"Mutace, které způsobují achondroplázii, mají účinek, který lze klasifikovat jako:",dominantní negativní.,zisk funkce.,haploinsuficience.,ztráta funkce.,B
Tento marketingový a komunikační nástroj nabízí přímou pobídku nebo pobídku k povzbuzení zákazníků ke koupi produktu/služby:,Reklamní.,Styk s veřejností.,Podpora prodeje.,Přímý marketing.,C
K-násobné křížové ověřování je,lineární v K,kvadratická v K,krychlový v K,Exponenciála v K,A
Dospělí středního věku se zdají být více ____ než starší nebo mladší dospělí,Generativní,Neurotický,Příjemný,Jistý,A
Klam pochvalné osobnosti je specifickým typem,Omyl náhody,Falešné dilema,Prosí o otázku,Uvažování v kruhu,A
"Tato otázka se týká následujících informací.
""Semena totalitních režimů jsou živena bídou a nedostatkem. Šíří se a rostou ve zlé půdě chudoby a sváru. Plného růstu dosáhnou, když pomine naděje lidu na lepší život. Tuto naději musíme udržovat živou. . . . Rychlý běh událostí na nás vložil velkou odpovědnost. . . . Jsem přesvědčen, že Kongres se k těmto povinnostem postaví čelem.""
Prezident Harry S. Truman, 1947
Myšlenky vyjádřené ve výše uvedené pasáži nejpříměji odrážejí kterou z následujících kontinuit v dějinách USA?",Debaty o vztahu mezi Kongresem a prezidentem.,Debaty o použití vojenské síly v nestabilních situacích.,Debaty o roli Spojených států ve světových záležitostech.,Debaty o správné roli politických stran.,C
Pacient utrpí zlomeninu krčku s poškozením míchy na úrovni šestého krčního obratle.,Bez podpory životních funkcí nebudou moci dýchat.,Budou moci dýchat pouze tiše.,Je nemožné předpovědět vliv na dýchání.,Dýchání nebude ovlivněno.,B
Která z následujících možností indikuje negativní reziduální autokorelaci?,Cyklický vzorec v reziduích,Střídající se vzor v reziduích,Naprostá náhodnost v reziduích,"Rezidua, která se všechna blíží nule",B
"Určete předchůdce následující podmiňovací věty: Včely vyhrají svou první hru pouze tehdy, pokud buď hrabáči, nebo Chipmunkové nevyhrají své první hry.",Hrabáči nevyhráli svůj první zápas.,Včely vyhrávají svůj první zápas.,Chipmunkové svůj první zápas nevyhrávají.,Hrabáči ani Chipmunkové své první hry nevyhrávají.,B
"Studenti provádějí cvičení separace rostlinných pigmentů, které vyžaduje, aby používali uzavřenou chromatografickou komoru s malým množstvím acetonu na dně komory. Bezpečnostní varování pro aceton zahrnují prohlášení, že dráždí oči a kůži a obsahuje hořlavé výpary. Jaká bezpečnostní opatření by měli studenti při provádění cvičení dodržovat?","Nasazení nehořlavých rukavic k přenášení komory do digestoře, pokud se aceton vznítí","Umístění komory do uzavřené, zatemněné skříně po dobu separace pigmentu",Nošení kožených rukavic a zakrytí nosu a úst maskou proti částicím,Nošení brýlí a nitrilových rukavic a uzavření všech nádob s acetonem,D
Která z těchto možností činí určení evoluční příbuznosti různých druhů na základě aminokyselinové sekvence homologních proteinů obecně méně přesným než určení příbuznosti založené na nukleotidových sekvencích homologních genů?,Tiché mutace,Genové duplikace,"Translokační události, které mění genové sekvence",Přechod přes,A
Je nezákonné zabití spáchané ministrem země X v zahraničí act iure imperii nebo iure gestionis?,Takové jednání je veřejným aktem (iure imperii),Takové chování nikdy nepřitahuje imunitu,Takové jednání je soukromoprávním úkonem (iure gestionis),"Takové jednání je veřejným aktem, ale je chráněno imunitou",C
"Tato otázka se týká následujících informací.
Nejprve je třeba poznamenat, že kosmos má kulovitý tvar, částečně proto, že tato forma, která je dokonalým celkem, který nevyžaduje žádné klouby, je ze všech nejúplnější, částečně proto, že vytváří nejprostornější formu, která se nejlépe hodí k tomu, aby vše obsáhla a uchovala; nebo také proto, že všechny součásti vesmíru, tj. Slunce, Měsíc a planety, se objevují v této podobě; Nebo proto, že všechno usiluje o dosažení této formy, jak se to jeví u kapek vody a jiných tekutých těles, pokud se pokoušejí vymezit. Nikdo tedy nebude pochybovat o tom, že tato podoba patří k nebeským tělesům. ...
Že Země je také kulatá, je tedy nesporné, protože ze všech stran tlačí na svůj střed. I když kvůli vyvýšeninám hor a prohlubním údolí nelze pochopit dokonalý kruh, přece to nemá vliv na celkovou kulatost Země. ...
Protože již bylo ukázáno, že Země má tvar koule, musíme uvážit, zda se s tímto tvarem kryje také pohyb a jaké místo zaujímá Země ve vesmíru. ... Velká většina autorů se samozřejmě shoduje na tom, že Země stojí nehybně ve středu vesmíru, a považuje za nemyslitelné a směšné předpokládat opak. Budeme-li však tuto záležitost pečlivě zvažovat, ukáže se, že tato otázka ještě není rozhodnuta, a proto ji nelze brát na lehkou váhu. Každá změna místa, která je pozorována, je způsobena pohybem pozorovaného předmětu nebo pozorovatele, nebo pohybem obou. ... Ze země se však pozoruje otáčení nebes a vytváří se pro naše oči. Nepohybuje-li se tedy Země, musí se tento pohyb dít ve všem mimo Zemi, ale opačným směrem, než kdyby se všechno na Zemi pohybovalo, a k tomu patří každodenní oběžení. Zdá se tedy, že to ovlivňuje celý vesmír, to jest všechno mimo Zemi, s jedinou výjimkou samotné Země. Připustíme-li však, že tento pohyb není charakteristický pro nebesa, ale že Země se otáčí od západu k východu, a budeme-li to pečlivě uvažovat s ohledem na zdánlivé východy a západy slunce, měsíce a hvězd, zjistíme, že tomu tak skutečně je.""
Mikuláš Koperník, Revoluce nebeských těles, 1543
Tato pasáž může být použita jako důkaz, že se Koperník lišil od tradičních, aristotelských přírodních filozofů své doby, protože tvrdil, že",Vesmír je kulovitý,"Země je kulatá,",Vesmír je geostatický,Země není nehybná,D
"Stanovte koncentraci H+(aq) v 1.0 M fenolu, C6H5OH, roztok. (Ka pro fenol je 1 × 10^-10.)",1 × 10^-10 M,1 × 10^-9 M,1 × 10^-3 M,1 × 10^-5 M,D
"Který z následujících faktorů by byl považován za ""přitažlivý"" faktor pro společnost Riva při zvažování přesunu z Indie do Spojených států?",Bída v bídě,Lepší práce a vyšší mzdy,Indický kastovní systém,Násilí v jejím sousedství,B
"Ve srovnání s politickými stranami v zemích, jako je Anglie a Izrael, které mají systém více stran, jsou americké politické strany",menší zájem o ovlivňování výsledků voleb,méně jasně ztotožněné s konzistentními politickými ideologiemi,méně efektivní při získávání peněz od politických podporovatelů,lépe odrážet cíle všech svých volebních obvodů,B
"Číslo zaokrouhlené na nejbližší tisícovku je 47 000. Které číslo by mohlo být číslo, které bylo zaokrouhleno?","46,295","46,504","47,520","47,924",B
"Nádrž je ve tvaru trojúhelníkového hranolu. Pokud má trojúhelníková základna plochu 116 čtverečních stop a nádrž je vysoká 30 stop, kolik vody by nádrž obsahovala, když je plná?",1725 ft^3,1740 ft^3,3480 ft^3,6960 ft^3,C
"Napětí indukované v induktoru je reprezentováno jako,",součin jeho indukčnosti a proudu jím procházejícího.,"poměr jeho indukčnosti k proudu, který jím prochází.","poměr proudu, který jím prochází, k jeho indukčnosti.","součin jeho indukčnosti a rychlosti změny proudu, který jím prochází.",D
Která z následujících charakteristik je obecně v souladu se znásilněním na schůzce?,použití nadměrné síly,promyšlený,sexuálně motivovaný,zahrnuje použití zbraně,C
"Najděte délku křivky y = ln x mezi body, kde y = 1/2 a y = 1.",0.53,0.86,1.18,1.36,C
Najděte $-\dfrac{1}{-3}\cdot\cfrac{1}{~\frac{1}{-3}~}.$,1,-1,0,2,B
Která psychologická perspektiva byla na přelomu 19. a 20. století v západní Evropě nejpopulárnější?,vědy zkoumající neurony,evoluční,behaviorista,psychoanalytický,D
Naučená bezmocnost s největší pravděpodobností přímo souvisí s,Barnumův efekt.,Samoúčelná zaujatost.,vnější místo kontroly.,bezpodmínečný pozitivní respekt.,C
"Garciův a Koellingův výzkum týkající se naučených averzí prokázal, že který z následujících párů UCS a CS je nejsilnější a nejrychleji se učí?",splnění úkolu a získání odměny v podobě jídla,nevolnost a jídlo nebo pití,Pohyb a šok,Tresty a odměny,B
"Část vody na Marsu je zmrzlá v půdě a ledových čepičkách a část byla ztracena v důsledku odlupování slunečního větru, ale předpokládá se, že většina původní vody byla ztracena jiným mechanismem. Co se stalo s touto ""ztracenou"" vodou?","byl odstraněn magnetickým polem, když rychle klesala jeho síla",Ultrafialovým světlem se rozpadl na vodík a kyslík a vodík se ztratil tepelným únikem,byla pohlcena civilizací žíznivých Marťanů,Během období intenzivního vulkanismu se vypařil a ztratil se ve vesmíru tepelným únikem,B
"Pohybem počáteční rychlosti 1,5 × 10^6 m/s vstupuje proton do oblasti konstantního magnetického pole o magnitudě 1,5 T. Pokud počáteční vektor rychlosti protonu svírá s magnetickým polem úhel 30°, vypočítejte rychlost protonu 4 s po vstupu do magnetického pole.","5,0 × 10^6 m/s","7,5 × 10^6 m/s","1,5 × 10^6 m/s","3,0 × 10^6 m/s",C
"Energie uvolněná rozkladem vysokoenergetických fosfátů, ATP a kreatinfosfátu, může udržet maximální námahu po dobu přibližně:",1-2 sekundy.,5-10 sekund.,30-40 sekund.,50-60 sekund.,B
"Pokud je v sériovém obvodu proud v jedné lampě 2 A, proud v lampě vedle ní je","polovina, 1 A",2:00,"Záleží na tom, která lampa je blíže k baterii","Nedostatek informací, které by se daly říct",B
Která z následujících možností s největší pravděpodobností povede k silnějšímu hospodářskému růstu v průběhu času?,Rychlejší spotřeba přírodních zdrojů.,Vyšší míra negramotnosti dospělých.,Klesající zásoba kapitálových statků.,Investiční daňové úlevy.,D
Ekonomika je v hluboké recesi. Které z následujících tvrzení o měnové politice je vzhledem k této ekonomické situaci přesné?,Expanzivní politika by recesi jen zhoršila.,"Expanzivní politika výrazně zvyšuje agregátní poptávku, pokud jsou investice citlivé na změny úrokových sazeb.",Kontrakční politika je vhodným stimulem pro investice a spotřebu.,"Pokud je poptávka po penězích dokonale elastická, expanzivní měnová politika může být docela účinná.",B
"Podniky se zapojují do sociálního účetnictví kvůli požadavkům _________, aby identifikovaly ________, zlepšily ___________ a podpořily _________ a ___________","Stakeholdeři, rizika, řízení zainteresovaných stran, odpovědnost, transparentnost","Stakeholdeři, odpovědnost, transparentnost, rizika, řízení zainteresovaných stran","Stakeholdeři, odpovědnost, rizika, stakeholdeři, management stakeholderů","Stakeholdeři, řízení zainteresovaných stran, transparentnost, rizika, odpovědnost",A
"Daň uložená dodavateli bude s větší pravděpodobností přenesena na spotřebitele ve formě zvýšení ceny, pokud",Cenová elasticita poptávky je vysoce elastická.,Cenová elasticita poptávky je vysoce neelastická.,Cenová elasticita poptávky je jednotková elastická.,Mzdová elasticita poptávky je vysoce elastická.,B
Prohlášení 1 | Ve skupině (ab)^{-2} = b^{-2}a^{-2}. Prohlášení 2 | Ve skupině (ab)^n = a^nb^n.,"Pravda, pravda","Nepravda, nepravda","Pravda, Nepravda","Nepravda, pravda",B
"Jak se označuje míra, do jaké je hospodářská soutěž v jedné zemi ovlivněna konkurencí v jiných zemích?",Mezinárodní obchod,Globální ekonomika,Celosvětová konkurence,Globalizace,D
"Programátor napsal níže uvedený program. Program používá seznam čísel s názvem numList. Program je určen k zobrazení součtu čísel v seznamu.
 součet ← numList [1]
 PRO KAŽDOU hodnotu v numList
 součet ← součet + hodnota
 ZOBRAZIT součet
 Aby bylo možné program otestovat, programátor inicializuje numList na [0 , 1 , 4 , 5]. Program zobrazí 10 a programátor dojde k závěru, že program funguje tak, jak má. Která z následujících možností je pravdivá?","Závěr je správný; Program funguje tak, jak má.","Závěr je nesprávný; Program nezobrazuje správnou hodnotu pro testovací případ [0, 1, 4, 5].","Závěr je nesprávný; Použití testovacího případu [0, 1, 4, 5] nestačí k závěru, že program je správný.","Závěr je nesprávný; Použití testovacího případu [0, 1, 4, 5] pouze potvrzuje, že program pracuje se seznamy ve vzestupném pořadí.",C
Proč se Parfit staví proti rovnosti?,"Tvrdí, že nerovná společnost je nevyhnutelná.","Tvrdí, že upřednostněním potřeb chudých můžeme zvýšit rovnost.","Tvrdí, že každý z nás je zodpovědný za svou chudobu.",Myšlenku rovnosti zcela odmítá.,B
"Tato otázka se týká následujících informací.
""Vskutku, jak fatwy význačných [učenců], kteří zakládají svůj názor na rozumu i tradici, tak konsensus sunnitské komunity se shodují na tom, že cílem naší vznešené aspirace musí být odvěká povinnost vymýtit, vyhladit a vyhnat zlé inovace, protože ""náboženská horlivost je vítězstvím víry v Boha Dobrotivého""; pak, v souladu se slovy Proroka (mír s ním!) ""Každý, kdo vnese do našeho řádu zlou inovaci, musí být vyhnán"" a ""Každý, kdo udělá něco proti našemu řádu, musí být vyhnán.""
Dopis osmanského sultána Selima I. Safíovskému šáhovi Ismailovi I., 1514
Safíovci na sebe přivolali hněv islámských říší, jako byla Osmanská a Mughalská říše, především proto, že Safíovci","byly expanzionistickým impériem geograficky umístěným mezi dvěma dalšími expanzionisty,",odmítl ústřední principy islámu,zotročili křesťany a udělali z nich safíovské bojovníky,Ismaíl se prohlásil za chalífu,A
"Tato otázka se týká následujících informací.
Procházím kolem kolony a ptám se, co se děje.
Voják říká prostě: ""Každý den volají víc.
""Někteří z nás byli posláni na sever ke Žluté řece, když jim bylo patnáct.
A teď, ve čtyřiceti, odjíždíme k posádkám na západě.
Na naší první prohlídce nám starosta vesnice musel zavázat šátky.
Když jsme se vrátili, měli jsme bílé vlasy, ale i tak tu byl další neklid.
Pohraniční posádky jsou potřísněny krví, dost na to, aby naplnily oceán
Teritoriální ambice Válečného císaře však ještě nedosáhly vrcholu.
V stovce krajin na východ od hor, po celé zemi Chan,
Musí existovat deset tisíc vesnic, které nyní zamořuje ostružiní.
I když jsou manželky dost silné na to, aby zvládly motyku a pluh,
Plodiny rostou na všechny strany, na polích je nepořádek.
Nejtěžší je to pro muže ze Shanxi, kteří mají pověst bojovníků:
Jsou zakuklení jako psi nebo slepice, každý samec ohromen.
""Ale pane, i když je od vás hezké, že se ptáte,
Stěžovat si není součástí úkolu vojáka.
Můžeme jen kroutit hlavou. Vezměte si tuto zimu:
Vojáci ze Šan-si nebyli nikdy posláni domů.
Okresní úředníci požadují pozemkovou daň,
Ale odkud to přijde? Z něj peníze nevymáčkneš!
Upřímně si myslím, že je smůla mít teď syna,
Je lepší mít dceru: alespoň se může vdát
A bydlet u sousedů odvedle.
Ale syn skončí ležet někde v daleké prérii.""
Du Fu, ""Balada o vojenských vozech"", kolem roku 750 n. l.
Báseň poskytuje důkaz o tom, která z následujících skutečností se týká genderových vztahů v tchangské společnosti?",Konfuciánské vztahy mezi manželem a manželkou byly v tchangské společnosti stále silné.,"Císařské reskripty kladly důraz na narození schopných synů před narozením dcer, aby byly splněny branné kvóty.",O práci v zemědělství se mohly dělit ženy i muži.,Tradiční čínské genderové vztahy byly za vlády císařovny Wu Zetian obráceny.,C
V rovině xy je graf x^(log y) = y^log x,Otevřený první kvadrant,uzavřená křivka,Paprsek v otevřeném prvním kvadrantu,jediný bod,A
Která z následujících zemí vypouštěla v roce 2017 nejvíce CO2 na obyvatele?,Japonsko,Kanada,Rusko,Írán,B
Co je to útok přehráním?,"Když útočník odpoví na zprávu, kterou mu poslal systém","Útok, který se neustále opakuje a hledá slabinu","Útok, který využívá vlastní zprávy systému, a proto se proti němu nelze bránit",Útočník znovu odešle zachycenou zprávu a web ji přijme a odpoví ve prospěch útočníka,D
"Skutečnost, že infračervená absorpční frekvence chloridu deuteria (DCl) je posunuta od frekvence chlorovodíku (HCl), je způsobena rozdíly v jejich",distribuce elektronů,dipólový moment,Konstanta síly,snížená hmotnost,D
"Kvantová účinnost fotonového detektoru je 0,1. Pokud je do detektoru vysláno 100 fotonů, jeden po druhém, detektor detekuje fotony","v průměru 10krát, s RMS odchylkou asi 4","v průměru 10krát, s RMS odchylkou asi 3","Průměrně 10krát, s RMS odchylkou asi 1","v průměru 10krát, s odchylkou RMS asi 0,1",B
Která z následujících sad bitových řetězců NEMŮŽE být popsána regulárním výrazem?,"Všechny bitové řetězce, jejichž počet nul je násobkem pěti",Všechny bitové řetězce začínající nulou a končící jedničkou,Všechny bitové řetězce se sudým počtem nul,Všechny bitové řetězce s více jedničkami než nulami,D
Adaptace rostlin k minimalizaci ztrát vody v prostředí s vysokými teplotami zahrnují následující možnosti?,Četné průduchy,Tenká kůžička,Ostny místo listů,Velké poměry povrchu k objemu,C
"Mutace jsou chyby v DNA, které:",jsou vždy škodlivé.,vyskytují se pouze v přítomnosti karcinogenů.,zvýšit růst nádoru.,vyskytují se spontánně v nízké míře.,D
Která z následujících skutečností platí pro hypotyreózu?,Hubnutí,Pre-tibiální myxedém,Zvýšená hladina TSH,Averze k teplým místům,C
"Odhadní hodnoty domů ve městě mají průměr 125 000 USD se směrodatnou odchylkou 23 000 USD. Kvůli nové smlouvě s učiteli potřebuje školský obvod ve srovnání s předchozím rokem o 10 % více finančních prostředků. Aby město získalo tyto dodatečné peníze, nařídilo odhadní kanceláři, aby zvýšila všechny odhadované hodnoty domů o 5 000 dolarů. Jaká bude nová směrodatná odchylka odhadních hodnot domů ve městě?",23 000 dolarů ,25 300 dolarů ,28 000 dolarů ,30 300 dolarů ,A
" Ve své diskusi o diskriminaci ve válce Valls naznačuje, že",Není žádný rozdíl mezi kombatanty a nekombatanty.,Rozdíl mezi kombatanty a civilisty je otázkou míry.,Rozdíl mezi kombatanty a civilisty je kategorický a jasný.,"""Terorismus"" by měl být definován jako nerozlišující násilí.",B
 Podle Nussbaumové je zacházení s někým jako s objektem,dostatečné pro sexuální objektivizaci.,nezbytné pro sexuální objektivizaci.,není nutné pro sexuální objektivizaci.,vše výše uvedené.,C
"U kterého z těchto dvou scénářů udělá hlavní postava (která používá Já/mě/můj) něco, co je podle běžných morálních standardů v USA od roku 2020 zjevně morálně špatné? Scénář 1 | Když rodiče spali, šel jsem si zaběhat. Scénář 2 | Nalila jsem prací prostředek do pračky plné oblečení mého spolubydlícího.","Špatně, špatně","Špatně, ne špatně","Ne špatně, špatně","Ne špatně, ne špatně",D
"U kterého z těchto dvou scénářů udělá hlavní postava (která používá Já/mě/můj) něco, co je podle běžných morálních standardů v USA od roku 2020 zjevně morálně špatné? Scénář 1 | Někdy se snažím říkat pravdu, pokud mě to nedostane do problémů. Scénář 2 | Na kouzelnickém představení jsem políbil svou přítelkyni.","Špatně, špatně","Špatně, ne špatně","Ne špatně, špatně","Ne špatně, ne špatně",B
"U kterého z těchto dvou scénářů udělá hlavní postava (která používá Já/mě/můj) něco, co je podle běžných morálních standardů v USA od roku 2020 zjevně morálně špatné? Scénář 1 | Přeběhl jsem čerstvý koberec sekačkou na trávu. Scénář 2 | Vymočil jsem se do ruky, abych ji mohl otestovat na infekci.","Špatně, špatně","Špatně, ne špatně","Ne špatně, špatně","Ne špatně, ne špatně",A
"U kterého z těchto dvou scénářů udělá hlavní postava (která používá Já/mě/můj) něco, co je podle běžných morálních standardů v USA od roku 2020 zjevně morálně špatné? Scénář 1 | Viděl jsem slavného Eltona Johna před koncertní arénou a vyfotil jsem si ho, aniž bych se ho zeptal. Scénář 2 | Nahlásil jsem jiného dozorce, který pašuje narkotika do věznice a prodává je vězňům.","Špatně, špatně","Špatně, ne špatně","Ne špatně, špatně","Ne špatně, ne špatně",D
"U kterého z těchto dvou scénářů udělá hlavní postava (která používá Já/mě/můj) něco, co je podle běžných morálních standardů v USA od roku 2020 zjevně morálně špatné? Scénář 1 | Dával jsem si brejky, abych netrefil míč, který přicházel na hřiště. Scénář 2 | Učil jsem své děti hrát na xylofon.","Špatně, špatně","Špatně, ne špatně","Ne špatně, špatně","Ne špatně, ne špatně",D
"U kterého z těchto dvou scénářů udělá hlavní postava (která používá Já/mě/můj) něco, co je podle běžných morálních standardů v USA od roku 2020 zjevně morálně špatné? Scénář 1 | Když se v mé restauraci rozbil mrazák, podával jsem teplé maso, i když jsem věděl, že je velmi nebezpečné. Scénář 2 | Rozhodl jsem se rozdělat oheň v lese.","Špatně, špatně","Špatně, ne špatně","Ne špatně, špatně","Ne špatně, ne špatně",A
"Větší spotřeba mléka
","V několika studiích bylo hlášeno, že je spojen s vyšším výskytem zlomenin a vyšší úmrtností","Zdá se, že během puberty je spojena s vyšší hustotou kostních minerálů v pozdějším životě",Je konzistentně spojen s nižší mírou zlomenin,"V zemích s nejvyšší mírou zlomenin naznačuje, že konzumace mléka je prospěšná pro kostru.",A
"Které z následujících tvrzení o metabolismu glukózy je správné?
",Glukagon zvyšuje rychlost glykolýzy,Glykolýza vyžaduje NADP+,Při glykolýze se glukóza štěpí na dva tříuhlíkové produkty,Konečným produktem glykolýzy v červených krvinkách je pyruvát,C
"Nagel tvrdí, že problém morálního štěstí je úzce spojen s problémem:",existenci Boha.,svoboda vůle.,psychologický egoismus.,univerzálie.,B
Podle Singera dodržování jeho principu vyžaduje:,"Mírné změny v našich osobních návycích, ale ne v naší společnosti jako celku.",Mírné změny v našich osobních návycích i ve společnosti.,"drastické změny v našich osobních zvycích, ale ne v naší společnosti.","drastické změny jak v našich osobních zvycích, tak v naší společnosti.",D
"Která z následujících je poslední, kterou obsadily lidské bytosti?",Nová Guinea,Austrálie,Nový Zéland,Timor,C
Núbijská civilizace:,předcházel a podnítil vzestup egyptské kultury.,byl výsledkem mezopotámské kolonizace na jihu.,"se vyvinul v reakci na egyptskou kulturu, ale ne jako její napodobování.",neměl žádné kontakty se sousedními kulturami.,C
"Vládní subjekt je povinen zahrnout výkaz o peněžních tocích, do které z následujících účetních závěrek?",Účetní závěrka vládních fondů.,Účetní závěrka za celou vládu.,Účetní závěrka vlastního fondu.,Účetní závěrka svěřeneckého fondu.,C
"Které z následujících tvrzení je správné, pokud jde o změny v účetních odhadech?",Většina změn v účetních odhadech je účtována zpětně.,"Není-li možné určit, zda došlo ke změně odhadu nebo ke změně účetních zásad, měla by být tato změna považována za změnu principu.","Není-li možné určit, zda došlo ke změně účetního odhadu nebo ke změně účetních zásad, měla by být tato změna považována za změnu odhadu.","Je snazší rozlišit mezi změnou účetního odhadu a změnou účetního principu, než rozlišit mezi změnou účetního odhadu a opravou chyby.",C
