Question,A,B,C,D,Answer
"Офиске 54 жаштагы бир аял келет, себеби ал акыркы 3 жуманын ичинде оң жаагы менен жаагынын үстүнөн үзгүлтүксүз атып кыйналган. Оорунун ар бир эпизоду 1 секуд же андан аз убакытка созулат. оору көп учурда муздак аба, чайнап, тактильдик стимуляция, жана тиштерин щеткалоо менен пайда болот. Анын бетине да, башына да эч кандай жаракат алган эмес. Медициналык тарых стресс баш оорулары, семіздик, ашказанды айналып өтүү операциясы үчүн өзгөчө. Ал 165 см (5 фут 5 в) бийиктиги жана салмагы 62 кг (137 фунт); ДМИ — 23 кг / м2 . Маанилүү белгилер нормалдуу. Бейтап беттин оң жагына тийгенге чыдай албайт. бет алсыздыгы же сезим жоготуу жок. Физикалык текшерүүнүн калган бөлүгү эч кандай аномалияларды көрсөтпөөдө. Карама-каршылык менен жана карама-каршылыксыз башын компьютердик сканерлеу эч кандай аномалияларды көрсөтпөйт. Төмөнкүлөрдүн кайсынысы азыркы учурда эң ылайыктуу фармакотерапия болуп саналат?",Карбамазепин,Ламотригин,Леветирацетам,Топирамат,A
"Шизофрения этиологиясы боюнча изилдөөлөр абалга генетикалык даярдыгын көрсөттү, бирок башка факторлор катышат. Тема боюнча билимиңизден төмөнкү билдирүүлөрдүн кайсынысы туура эмес экенин аныктаңыз.",Ашыкча допамин же допаминге сезгичтик өбөлгө түзүшү мүмкүн.,Ак бейтаптар көбүрөөк симптоматикасы болуп саналат.,Үчүнчү дүйнөдө абалдан ремиссия 65% түзөт.,Африкалык америкалыктардын арасында диагноз коюлган Шизофрениянын төмөн деңгээли.,D
"Ири өндүрүштүк фирманын кызматкери жумушту ыңгайсыз деп таап, жумушту акча үчүн гана жүргүзөт. Кызматкер минималдуу аткарат, жана түрткү эмес, ошондуктан жогорку санын же жакшы сапатын өндүрүү. Ф. Херцбергдин эки фактордук теориясына ылайык, 10 жогорулатуу мыкты жолу бул жумушчунун өзүн-өзү мотивациялоо болмок",өндүрүмдүүлүктү жогорулатуу жана стимулдаштыруу акысын сунуштоо,кыйынчылыкты жана жетишкендиктерди сезүүнү камсыз кылуу үчүн жумушту кайра иштеп чыгуу,маалымдалган социалдык өз ара иштешүү мүмкүнчүлүктөрүн жогорулатуу,кызматкерге көбүрөөк кадыр - баркын көтөргөн жумуш менен камсыз кылуу,B
Төмөнкүлөрдүн кайсынысы мурунку терапия кардарлары менен жыныстык адеп-ахлаксыздыкка байланыштуу этикалык көрсөтмөлөрдү мыкты сүрөттөйт?,Психологдорго ар кандай шарттарда мурунку терапия кардарлары менен жыныстык ынталуулукка ээ болууга тыюу салынат.,"Психологдор терапия токтотулгандан кийин, жок эле дегенде, бир жыл мурунку терапия кардарлары менен жыныстык ынталуулукка ээ болууга тыюу салынат.","Психологдорго белгилүү бир шарттарда (мисалы, эксплуатация коркунучу пайда болгондо) мурунку терапия кардарлары менен жыныстык мамиледе болууга тыюу салынат.",Психологдор мурунку терапия кардарлары менен жыныстык ынталуулукка ээ болууга тыюу салынбайт.,C
"Экинчи тилди сатып алуу боюнча жүргүзүлгөн изилдөөлөр көрсөткөндөй , экинчи тилди алган балдар жөнүндө төмөнкүлөрдүн кайсынысы",Алардын түшүнүү өнүгүүсү кечигип жатат,Алар эки тилде сүйлөбөгөн балдарга караганда жакшыраак сүйлөшөт,Алардын эне тилин жакшы үйрөнүшү экинчи тилди үйрөнүүгө эч кандай таасир этпейт,Алар түшүнүү ийкемдүүлүгүн жогорулатты,D
Коомдук мамилелердин кайсы чөйрөсүнүн алкагында лоббизмди камтышы мүмкүн?,Корпоративдик,Финансылык мамилелер,Коомдук иштер,Бизнеске бизнес,C
Жаһандануунун контекстинде биз «өнүгүү» терминин кантип мыкты аныктай алабыз?,"Өнүктүрүү термини коркуу жана каалоо эркиндиги бар адамдын абалын билдирет; жашоону камсыз кылуу үчүн жетиштүү ресурстар бар жана бул жашоо күтүлбөгөн жерден үзүлүп коркунучтан, же кабыл алынган коркунучтан бошонгон абалда болушу мүмкүн.","Өнүккөн деп эсептелиши үчүн, бир эл глобалдык мамлекеттик системанын алкагында белгилүү бир экономикалык жана саясий статуска жетиши керек; ""Өнүккөн"" мамлекетти түзүүнүн критерийи ушул системадагы өз ара иштешүүнүн талаптары менен аныкталат.","Өнүктүрүү неолибералдык жаһанданууну коштогон теңсиздиктерди жоюу каражаты болуп саналат. Бул контекстте өнүгүү калктын же коомдоштуктун ресурстарды натыйжалуу пайдаланып, өндүрүштө жана бөлүштүрүүдө натыйжалуулугун жогорулатуу, кирешелерди коом ичинде адилеттүү бөлүштүрүүгө көмөктөшүү мүмкүнчүлүгүн билдирет.",Коомду өнүктүрүү анын калкы жазылып жаткан идеологиялык жана этикалык баалуулук системаларын билдирет. Глобалдык эл аралык системада бул батыш либерал-демократиялык идеологиясын жана эркин рыноктук экономиканы кабыл алууну билдирет.,C
Төмөнкүлөрдүн кайсынысы евроцентризмди мыкты сүрөттөйт?,"Евроцентризм – бул талдоо стили, анда европалык коомдор европалык эмес коомдор менен салыштырып, ар биринин салыштырмалуу баалуулугун бир тараптуу салыштырышат.",Евроцентризм – бул европалык эмес коомдорду баалоо жана баалоо европалыктардын маданияттык божомолдору жана бейкалыстыгы жагынан коштолгон ой стили.,Евроцентризм европалык саясий же экономикалык системаларды гана эске алган изилдөөлөрдү же окумуштуулык иштерди сүрөттөйт.,Бул варианттардын баары.,B
Төмөнкү теориялардын кайсынысы коом тартипти жана туруктуулукту сактоо үчүн зарыл иш-чараларды кантип аткара аларына басым жасайт?,Функционализм,Өз ара аракеттешүү,Рационалдуу тандоо теориясы,Конфликт теориясы,A
Төмөнкүлөрдүн кайсынысы жабык жеткиликтүү жеке документ болуп саналат?,мамлекеттик «ак кагаз»,жашыруун медициналык документтер,тиричилик эсеби китеби,бизнестин үлүштөр реестри,C
Төмөнкү пункттардын кайсынысы америкалык бир тараптуулугу үчүн аргументти колдойт?,Кайрымдуу гегемония,Көп тараптуулуктун натыйжалуулугу,Америкалык держава,Жогоруда берилгендердин баары,D
Герпес вирустары кандай ооруга себеп болбойт?,Инфантил параличи,Энцефалит,Жыныстык жол менен жугуучу оорулар,Рак,A
Эки сокур же кош маскалуу изилдөөнүн максаты болуп саналат:,Дарыланган жана дарыланбаган субъекттердин салыштырмалуулугуна жетишүү,Тандап алуу вариациясынын таасирин азайтуу,Байкоочудан жана темадагы бейкалыс пикирден качкыла,Байкоочунун бейкалыстыгын жана үлгүлөрүнүн вариациясын болгула,B
 Классикалык текст Даодежин англис тилинде кандай наамы менен белгилүү?,Өзгөрүүлөр классикасы,Жол менен күчтүн классикасы,Аялдар классикасы,Философия классикасы,B
 Communidades de Base төмөнкүлөрдүн кайсынысы менен байланыштуу?,Епископ Оскар Ромеро,Каршылык жана жаңылоо,Бардык адамдардын кадыр - баркын сыйлоо,Жогоруда берилгендердин баары,D
Башкы прокурор төмөнкү субъекттердин кайсынысынын башчысы болуп саналат?,Сенаттын сот комитети,Әділет департаменти,Мамлекеттик департамент,Сот генералдык корпусту жактайт,B
Магнит талаасы учурдагы ташуучу зым формасы жөнүндө сызыктар,тегеректер,радиалдык сызыктар,эдди агымдары,энергетикалык циклдар,A
«Чили кон карне» термини эмне менен чили дегенди билдирет?,буурчак,эт,сыр,чили калемпир,B
Төмөнкүлөрдүн кайсынысы ажырагыс суроо-талапка ээ продукт боюнча баа көтөрүлгөндөн кийинки жагдайды мыкты сүрөттөйт?,Талап кылынган сан өзгөрбөйт.,Талап кылынган сан көбөйөт.,Жалпы киреше төмөндөйт.,Жалпы киреше өзгөрбөйт.,A
Заманбап компьютер микрочиптери биринчи кезекте кайсы элементтен турат?,Натрий,Кремний,Алюминий,Күмүш,B
