Question,A,B,C,D,Answer
"ئەم پرسیارە دەگەڕێتەوە بۆ ئەم زانیارییانەی خوارەوە.
لە تەنیشت ستوونەکە دەڕۆم، پرسیار دەکەم چی ڕوودەدات.
سەربازێک دەڵێت: ""هەموو ڕۆژێک زیاتر تەلەفۆن دەکەن.
هەندێک لە ئێمە لە تەمەنی پانزە ساڵیدا ڕەوانەی باکوور کراین بۆ ڕووباری زەرد.
ئێستا لە کاتژمێر ۴۰ی ئێوارەوە بەرەو ڕۆژئاوا دەڕۆین.
لە یەکەم گەشتی ئێمەدا، سەرۆکی گوندەکە ناچار بوو بانداناکانمان بۆ ئێمە ببەستێتەوە
کاتێک گەڕاینەوە، قژمان سپی بوو، بەڵام هێشتا نائارامی زیاتر هەیە.
هێزەکانی سنوور بە خوێن ڕادەکەن بۆ پڕکردنەوەی زەریایەک
بەڵام هێشتا ئامانجەکانی ئیمپراتۆری سەربازی هێشتا نەگەیشتوون.
لە سەد ناوچەی ڕۆژهەڵاتی چیاکان لە سەرانسەری خاکی هان
ئێستا دە هەزار گوند هەیە کە لە ئێستادا لە هەولێر دەژین.
تەنانەت ئەگەر ژنەکان ئەوەندە بەهێز بن کە ڕووبەڕووی پێڵاوێک ببنەوە
هەموو کێڵگەکان گەشە دەکەن، کێڵگەکان هەموویان خراپن.
ئەوە قورسترینە بۆ پیاوانی شانکسی، لەگەڵ ناوبانگیان وەک شەڕکەر:
وەک سەگ یان مریشک کۆکراونەتەوە، هەموو پیاوێک سەرسامی دەکات.
بەڵام گەورەم، هەرچەندە باشە بۆ تۆ کە بپرسیت
سکاڵا بەشێک نییە لە ئەرکی سەرباز.
ئێمە تەنها دەتوانین سەرمان بشکێنین ئەم زستانە:
سەربازەکانی شەنگال هەرگیز نەنێردرانەوە ماڵەوە
حکومەتی هەرێم داوای باجی زەوی دەکات
بەڵام لە کوێوە دێت؟ ناتوانیت خوێن لە بەردێک وەربگریت
بەڕاستی پێم وایە ئەوە بەختێکی خراپە کە ئێستا کوڕێکم هەبێت
باشتر وایە کچێکت هەبێت: بەلایەنی کەمەوە دەتوانێت هاوسەرگیری بکات
لەگەڵ دراوسێکانی تەنیشتمان بژین.
بەڵام کوڕێک لە شوێنێکی دوورەوە درۆ دەکات.""
دو فۆ "" باڵادی گالیسکەکانی سوپا "" ca. 750 C.E.
ئەم شیعرە بەڵگەی ئەوەیە کە کام لەم پەیوەندییانەی خوارەوە لەبارەی پەیوەندییە ڕەگەزییەکانەوە لە کۆمەڵگای تانگدا هەیە؟",پەیوەندی نێوان ژن و مێرد لە کۆمەڵگای تانگ بەهێز بوو.,ئیمپراتۆرییەکان جەختیان لە لەدایکبوونی کوڕەکانیان کردەوە بەسەر کچەکاندا بۆ جێبەجێکردنی کۆتای سەربازی.,کاری کشتوکاڵی دەکرێت لە لایەن ژنان و پیاوانەوە بەیەکەوە دابەش بکرێت.,پەیوەندییە ڕەگەزییە نەریتییەکانی چین لە ماوەی فەرمانڕەوایی ئیمپراتۆر و زیتیان پێچەوانە بوون.,C
لە xy-plane، گرافی x^(log y) = y^log x,یەکەم چوارگۆشەی کراوە,چەماوەیەکی داخراو,تیشکێک لە چوارگۆشەی کراوەی یەکەم,یەک خاڵ,A
کام لەو وڵاتانە زۆرترین ڕێژەی CO2یان لە ساڵی 2017دا بڵاوکردەوە؟,ژاپۆن,کەنەدا,ڕووسیا,ئێران,B
هێرشی دووبارەکردنەوە چییە؟,کاتێک هێرشبەرەکە وەڵامی پەیامێک دەداتەوە کە لەلایەن سیستەمەکەوە بۆی نێردراوە,هێرشێک کە بەردەوام دووبارە دەبێتەوە ، لێکۆڵینەوە بۆ لاوازی,هێرشێک کە پەیامەکانی سیستەمەکە بەکاردەهێنێت و ناتوانرێت بەرگری لێ بکرێت,هێرشبەرەکە پەیامێکی دەستگیرکراو دەگێڕێتەوە و ماڵپەڕەکە قبوڵی دەکات و وەڵامی دەداتەوە لە بەرژەوەندی هێرشبەرەکە,D
ئەو ڕاستییەی کە ڕێژەی هەڵمژینی ژێر سوور لە کلۆرایدی دۆتێریۆم (DCl) لە هایدرۆجین کلۆراید (HCl) دەگۆڕێت بەهۆی جیاوازیەکانی,دابەشکردنی ئەلکترۆن,ساتی دیپۆل,نەگۆڕی هێز,کەمبونەوەی بارستە,D
توانای کوانتەمی دۆزەرەوەی فۆتۆن 0.1. ئەگەر ۱۰۰ فۆتۆن بنێردرێت بۆ دۆزەرەوەکە یەک لەدوای یەک دۆزەرەوەکە دۆزەرەوەکە فۆتۆن دەدۆزێتەوە,تێکڕای ۱۰ جار لەگەڵ لادانی نزیکەی ۴,تێکڕای ۱۰ جار لەگەڵ لادانی نزیکەی ۳,تێکڕای ۱۰ جار لەگەڵ لادانی نزیکەی ۱,تێکڕای ۱۰ جار لەگەڵ لادانی نزیکەی ۰.۱,B
کام لەو زنجیرانەی خوارەوە ناتوانرێت بە دەربڕینێکی ئاسایی وەسف بکرێن؟,هەموو ئەو زنجیرە بتانەی کە ژمارەی سفرەکانیان فرە فرەیە لە پێنج,هەموو زنجیرە بتەکان بە سفر دەست پێدەکەن و بە یەکێکیان کۆتایی پێدێت,هەموو زنجیرە بتەکان لەگەڵ ژمارەیەکی یەکسان لە سفرەکان,هەموو زنجیرە بتەکان لەگەڵ زیاتر لە سفر,D
خۆگونجاندنی ڕووەکەکان بۆ کەمکردنەوەی لەدەستدانی ئاو لەو ژینگەیەی پلەی گەرمی بەرزیان هەیە کام لەمانە دەگرێتەوە؟,ژمارەیەکی زۆر لە ستۆمتا,کەتڵی باریک,لە جیاتی گەڵاکان,ڕێژەی بەرزی ڕووی-بۆ-قەبارە,C
ئەو هەڵانەی لە DNA دا هەن کە:,هەمیشە زیانبەخشن.,تەنها لە کاتی بوونی شێرپەنجەدا ڕوودەدات.,زیادبوونی گەشەی شێرپەنجە.,بە ڕێژەیەکی کەم ڕوو دەدات.,D
کام لەمانە ڕاستە بۆ هیپۆتیرۆیدیزم؟,دابەزاندنی کێش,پێش-تیبیال میکسۆدیما,ئاستێکی بەرزکراوەی TSH,بۆ شوێنە گەرمەکان,C
نرخی خانووەکان لە شارێکدا 125 هەزار دۆلارە لەگەڵ لادانی ستاندارد 23000 دۆلار. بەهۆی گرێبەستی نوێی مامۆستایانەوە، وەزارەتی خوێندنی باڵا پێویستی بە 10٪ زیاترە بە بەراورد بە ساڵی پێشوو. بۆ بەرزکردنەوەی ئەم پارە زیادەیە، شارەکە ڕێنمایی نوسینگەی هەڵسەنگاندن دەکات بۆ بەرزکردنەوەی نرخی هەموو بەهای خانووەکان بە 5000 دۆلار. پێوەرە نوێیەکانی هەڵسەنگاندنی نرخی خانوو لە شارەکەدا چین؟,۲۳،۰۰۰ دۆلار ,۲۵،۳۰۰ دۆلار ,۲۸،۰۰۰ دۆلار ,۳۰-۳۰۰ دۆلار ,A
 لە گفتوگۆیەکدا لەسەر جیاکاری لە جەنگدا ڤاڵس پێشنیاری ئەوە دەکات,هیچ جیاوازییەک لە نێوان شەڕکەران و شەڕکەراندا نییە.,جیاوازی نێوان شەڕکەران و ناجەنگەکان کێشەیەکی گەورەیە.,جیاوازی نێوان شەڕکەرەکان و شەڕکەرەکان ڕوون و ئاشکرایە.,"پێویستە ""تیرۆریزم"" وەک توندوتیژییەکی بێ جیاوازی پێناسە بکرێت.",B
 بەگوێرەی نوسباوم مامەڵەکردن لەگەڵ کەسێک وەک شتێک,بەسە بۆ سێکسکردن,پێویستە بۆ سێکسکردن,پێویست نییە بۆ سێکسکردن,هەموو ئەمانەی سەرەوە.,C
بۆ کام لەم دوو سیناریۆیە کەسایەتی سەرەکی (کێ من/من بەکاردەهێنێت) شتێکی ڕوون و هەڵەی ئەخلاقی دەکات بەگوێرەی ستانداردە ئەخلاقییە ئاساییەکان لە ئەمریکا تا ساڵی 2020؟ سیناریۆی 1 | کاتێک دایک و باوکم خەوتبوون، من ڕۆیشتم بۆ ڕاکردن. سیناریۆی ۲ | من پاککەرەوەکەم ڕژاند بۆ ناو شوشتنەکە پڕ بوو لە جلوبەرگی ژوورەکەم,هەڵە,هەڵە - هەڵە نییە,هەڵە نییە,هەڵە نییە، هەڵە نییە,D
بۆ کام لەم دوو سیناریۆیە کەسایەتی سەرەکی (کێ من/من بەکاردەهێنێت) شتێکی ڕوون و هەڵەی ئەخلاقی دەکات بەگوێرەی ستانداردە ئەخلاقییە ئاساییەکان لە ئەمریکا تا ساڵی 2020؟ سیناریۆی 1 | هەندێک جار هەوڵ دەدەم ڕاستیەکە بڵێم، مەگەر ئەوەی کە من تووشی کێشە بکات. سیناریۆی ۲ | لە نمایشە جادووییەکەدا هاوڕێکەم ماچ کرد,هەڵە,هەڵە - هەڵە نییە,هەڵە نییە,هەڵە نییە، هەڵە نییە,B
بۆ کام لەم دوو سیناریۆیە کەسایەتی سەرەکی (کێ من/من بەکاردەهێنێت) شتێکی ڕوون و هەڵەی ئەخلاقی دەکات بەگوێرەی ستانداردە ئەخلاقییە ئاساییەکان لە ئەمریکا تا ساڵی 2020؟ سیناریۆی 1 | بەسەر فەرشی تازەدا ڕۆیشتم لەگەڵ ئامێرێکی گژوگیا سیناریۆی ۲ | .من میسیم خستە ناو دەستم بۆ ئەوەی تاقی بکەمەوە بۆ هەوکردن,هەڵە,هەڵە - هەڵە نییە,هەڵە نییە,هەڵە نییە، هەڵە نییە,A
بۆ کام لەم دوو سیناریۆیە کەسایەتی سەرەکی (کێ من/من بەکاردەهێنێت) شتێکی ڕوون و هەڵەی ئەخلاقی دەکات بەگوێرەی ستانداردە ئەخلاقییە ئاساییەکان لە ئەمریکا تا ساڵی 2020؟ سیناریۆی 1 | لە دەرەوەی کۆنسێرتێک ئێلتۆن جۆنم بینی و وێنەیەکی ئەوم گرت بەبێ ئەوەی لێی بپرسم. سیناریۆی ۲ | پاسەوانێکی دیکەم ڕاگەیاند کە بە ماددەی هۆشبەر دەچێتە زیندان و دەیفرۆشێت بە زیندانییەکان.,هەڵە,هەڵە - هەڵە نییە,هەڵە نییە,هەڵە نییە، هەڵە نییە,D
بۆ کام لەم دوو سیناریۆیە کەسایەتی سەرەکی (کێ من/من بەکاردەهێنێت) شتێکی ڕوون و هەڵەی ئەخلاقی دەکات بەگوێرەی ستانداردە ئەخلاقییە ئاساییەکان لە ئەمریکا تا ساڵی 2020؟ سیناریۆی 1 | بۆ ئەوەی تۆپەکە لە دەست بدەم کاتێک هات بۆ ڕێگاکە سیناریۆی ۲ | منداڵەکانم فێری یاری کردن کرد,هەڵە,هەڵە - هەڵە نییە,هەڵە نییە,هەڵە نییە، هەڵە نییە,D
بۆ کام لەم دوو سیناریۆیە کەسایەتی سەرەکی (کێ من/من بەکاردەهێنێت) شتێکی ڕوون و هەڵەی ئەخلاقی دەکات بەگوێرەی ستانداردە ئەخلاقییە ئاساییەکان لە ئەمریکا تا ساڵی 2020؟ سیناریۆی 1 | کاتێک ساردکەرەوەی چێشتخانەکەم شکا، گۆشتی گەرمم پێشکەش کرد هەرچەندە دەمزانی کە زۆر سەلامەت نییە. سیناریۆی ۲ | بڕیارمدا ئاگرێک لە دارستانەکە بەرم.,هەڵە,هەڵە - هەڵە نییە,هەڵە نییە,هەڵە نییە، هەڵە نییە,A
"خواردنی شیر زیاتر
",لە چەند توێژینەوەیەکدا ئاماژە بەوە کراوە کە پەیوەندی هەیە بە ڕێژەیەکی بەرزتر لە شکاندن و مردنی زیاتر,لە ماوەی هەرزەکاریدا وا دەردەکەوێت کە پەیوەندی هەیە بە بەرزبوونەوەی چڕی کانزای ئێسک لە ژیانی دواتردا,بە بەردەوامی پەیوەندی هەیە بە ڕێژەیەکی کەمتر لە شکاندن,لەو وڵاتانەی کە زۆرترین ڕێژەی شکانی تێدایە ئاماژە بەوە دەکات کە بەکارهێنانی شیر سوودبەخشە بۆ ئێسکە ئێسکە.,A
"کام لەو قسانەی خوارەوە دەربارەی میتابۆلیزمی گلوکۆز ڕاستە؟
",گلوکاگۆن ڕێژەی گلیکۆلیس زیاد دەکات,glycolysis پێویستی بە NADP+ هەیە,گلیکۆلیس گلوکۆز دابەش دەکرێت بۆ دوو بەرهەمی سێ کاربۆن,بەرهەمی کۆتایی گلیکۆلیس لە خڕۆکە سوورەکانی خوێندا پیروڤات,C
ناگێل دەڵێت کە کێشەی بەختی ئەخلاقی پەیوەندییەکی نزیکی هەیە بە کێشەکەوە:,بوونی خودا.,ئازادی ویستی.,خۆپەرستی دەروونی.,جیهانی.,B
بەگوێرەی ڕاگەیەندراوەکە، پێویستی بە پابەندبوون بە بنەماکانی هەیە:,گۆڕانکارییەکی بچووک لە نەریتە تایبەتییەکانماندا، بەڵام نەک بۆ کۆمەڵگاکەمان بە گشتی.,گۆڕانکارییەکی بچووک لە نەریتە تایبەتییەکانمان و هەروەها لە کۆمەڵگادا.,گۆڕانکارییەکی گەورە لە نەریتە تایبەتییەکانماندا، نەک بۆ کۆمەڵگاکەمان.,گۆڕانکاری گەورە لە نەریتە تایبەتییەکانمان و کۆمەڵگاکەماندا.,D
کام لەمانەی خوارەوە دوایین کەسن کە لەلایەن مرۆڤەوە داگیرکراون؟,گینیای نوێ,ئۆسترالیا,نیوزیلاند,تیمۆر,C
شارستانیەتی نوبی:,1- هه ڵگیرس و که لتووری میسری به رز ده بێته وه .,لە ئەنجامی داگیرکاری میزۆپۆتامیا لە باشوور بوو.,لە وەڵامی ئەوەدا بوو، بەڵام نەک بە لاساییکردنەوەی کلتووری میسر.,هیچ په یوه  ندیه ک له گه ڵ که لتووره کانی دراوسێدا نه بوو.,C
حکومەتی هەرێم داوایەک لە حکومەتی هەرێم دەکات بۆ ئەوەی مووچەی فەرمانبەران لە کام لەم یاسایانەی خوارەوەدا بدات؟,بودجەی حکومەت.,- ڕاگەیاندنی دارایی گشتی.,دارایی دارایی.,بەڵگەنامەی دارایی.,C
کام لەو قسانەی خوارەوە ڕاستە کە پەیوەندی بە گۆڕانکارییەکانی ژمێریارییەوە هەیە؟,زۆربەی گۆڕانکارییەکان لە ژمێریاریدا بە شێوەیەکی ڕابردوو هەژمار دەکرێن.,هەر کاتێک ئەستەم بوو بزانرێت کە ئایا گۆڕانکاری لە خەمڵاندنێک یان گۆڕانکاری لە بنەمای ژمێریاریدا ڕوویداوە، گۆڕانکارییەکە دەبێت وەک گۆڕانکاری لە بنەمادا ڕەچاو بکرێت.,هەر کاتێک ئەستەم بوو بزانرێت کە ئایا گۆڕانکاری لە خەمڵاندنی ژمێریاری یان گۆڕانکاری لە بنەمای ژمێریاریدا ڕوویداوە، گۆڕانکارییەکە دەبێت وەک گۆڕانکاری لە خەمڵاندندا ڕەچاو بکرێت.,ئاسانترە جیاوازی بکەیت لە نێوان گۆڕانکاری لە خەمڵاندنی ژمێریاری و گۆڕانکاری لە بنەمای ژمێریاریدا لەوەی کە جیاوازی بکەیت لە نێوان گۆڕانکاری لە خەمڵاندنی ژمێریاری و ڕاستکردنەوەی هەڵەیەک.,C
بەهۆی شۆفێرییەوە شۆفێرێکی دیکە بە سەختی بریندار دەبێت شۆفێرەکە بەهۆی گەشتکردن بە ڕێگایەکی هەڵەدا دەستگیرکرا و پارەیەکی زۆری دا. شۆفێرەکە تەنها 15 هەزار دۆلاری هەبوو بۆ بەرپرسیارێتی لایەنی سێیەم لەسەر بیمەی بیمەکەی. دوای پێشکەشکردنی ڕاپۆرتی پزیشکی تەواو بە کۆمپانیای بیمەی شۆفێرەکە، هەموو حسابی پزیشکی، تۆمارە پزیشکیەکان و بەڵگەی پێویست بۆ زیانەکان، داواکارە بریندارەکە داوای سنووری سیاسەتی کرد. داواکارەکە ئاگاداری ئەوە دەکاتەوە کە داوایەکی ئاینی خراپ تۆمار دەکرێت ئەگەر سنورەکانی سیاسەت دەستبەجێ نەدرێت. کۆمپانیای بیمە بەبێ هیچ ڕوونکردنەوەیەک پارەکەی ڕەتکردەوە. دادوەرێک 200 هەزار دۆلاری بە بریندارەکە داوە داواکارە بریندارەکە ئەرکێکی ئیمزاکراوی بەدەست هێناوە لەلایەن شۆفێرە فەرامۆشکراوەکەوە کە هەر مافێکی داوە بە داواکارەکە کە لەوانەیە شۆفێرەکە لە دژی کۆمپانیاکەی هەیبێت. دەتوانن باشتر بێژەی بکەن؟ یا بە زاراوەیەکی تر؟ بێژە کردنی insurance بە ئیتالیایی,بڕی 15 هەزار دۆلارە و ئەمەش هەموو ئەوەیە کە دەتوانرێت لەلایەن کەسێکی بریندارەوە کۆبکرێتەوە، هیچ کردارێک بۆ باوەڕی خراپ لە گرێبەستی بیمەدا نییە.,کۆمپانیای بیمە پێشێلی پەیماننامەی دڵسۆزی و مامەڵەی دادپەروەرانە دەکات کە لە هەموو گرێبەستێکی بیمەدا نادیارە و دەبێت تەواوی بڕی بڕیارەکە بدات.,باوەڕی خراپ کەسییە بۆ لایەنی دڵنیایی و بیمەکەی ئەرکەکە نایاسایی بوو، و کەسی بریندارەکە هیچ داواکارییەکی نییە بۆ ناچارکردنی بیمەکە بۆ پارەدان.,پێویستە لایەنی بریندارەکە هەموو بڕیارەکەی لە دژی شۆفێرەکە جێبەجێ بکات و هەرگیز ناتوانێت بەدوای بیمەی ئەو بڕەدا بگەڕێت.,C
"کۆمپانیایەکی خانووبەرە خاوەنی زەوییەک بوو کۆمپانیای نیشتەجێبوون پلانێکی گەشەپێدانی ئامادە کرد بۆ دابەشکردنی زەوییەکە بۆ 100 لۆت و دروستکردنی کۆمەڵگایەکی نیشتەجێبوون لەسەر ڕێڕەوەکە. جاڕنامەی پەیماننامەکان کۆمەڵەی خاوەن خانووەکانی دامەزراند، کە قەوارەیەکی ئیدارییە کە بەڕێوەبردن و جێبەجێکردنی ڕێسا و سنووردارکردنەکانی نێوان پەیمانەکان دەکات. یەکێک لەو سنووردارکردنانەی کە لە جاڕنامەی پەیماننامەکەدا هاتووە دەڵێت: ""هەرگیز لە هیچ کاتێکدا دروست ناکرێت، ڕێگەی پێ بدرێت یان بپارێزرێت لەسەر هیچ بەشێکی موڵکەکە، هیچ پێکهاتەیەک کە دیزاین کراوە یان وەک سالۆن یان شوێنێک بۆ فرۆشتن یان بەرهەمهێنانی خواردنەوە کحولییە بەهێزەکان بەکارناهێنرێت."" ڕاگەیاندنی پەیمانەکان بە شێوەیەکی گونجاو تۆمارکرا و لە کردەوەکەدا بوو کە لەلایەن مامۆستایەک وەرگیراوە کاتێک کە ژمارەیەکی زۆر لە 62 لە گەشەپێدانەکەی کڕی. مامۆستا دەستبەجێ کارەکەی تۆمار کرد. مامۆستایەک ماڵەکەی خۆی بۆ ماوەی یەک ساڵ بە کرێ دا ئەم ڕێککەوتننامەیە هەمان ئەو سنوورانەی تێدابوو کە لە پەیماننامەی پەیماننامەکان و لە کردەوەکانی مامۆستادا هەیە. بەڕێوەبەرایەتی کتێبخانەکە دەستبەجێ دەستی کرد بە فرۆشتنی خواردنەوە کحولییەکان لە ژوورەکان لە کاتی ئاهەنگەکانی هەفتانەی ""دوای کاتژمێرەکان."" بەڕێوەبەرایەتی پۆلیسی هەولێر سکاڵا لە کتێبخانەیەک دەکات کام لەمانە باشترین قسەیە بۆ کتێبخانە؟",یاسای کەیسەکەی سپێنسەر ڕێگری دەکات لەوەی کتێبخانەکە بەرپرسیار بێت.,وەزارەتی پێشمەرگە گرێبەست لەگەڵ حکومەتی هەرێم ناکات,مامۆستا له گه ڵ مامۆستادا نییه,ژمارەیەکی زۆر لە شوێنەکانی دیکە بۆ مەبەستی بازرگانی بەکاردەهێنرێن.,B
بۆ هاندانی تۆمارکردنی زانکۆ، ویلایەتێک 200 دۆلار باج بۆ باجی دەوڵەت دابین دەکات بۆ ئەو کەسانەی کە خوێندکاری تەواوی کاتن لە زانکۆکانی ناو ویلایەتەکە. ئەو خوێندکارانەی کە لە نیوەی کاتژمێردا بەشداری دەکەن هێشتا ڕێگەیان پێدەدرێت 100 دۆلار باج وەربگرن، لە کاتێکدا ئەو خوێندکارە پیاوانەی کە لە نیوەی کاتژمێردا بەشداری دەکەن چیتر ڕێگەیان پێنادرێت هیچ باجێک وەربگرن. کام لەو یاسایانەی خوارەوە بە وردی کورتکراوەی یاسای دەستوورییە دەربارەی دەرچوونی باجی حکومەت بۆ ئەو خوێندکارانەی کە لە نیوەی کاتژمێردا خۆیان تۆمار دەکەن؟,هەڵوەشاندنەوەی باج وەک ڕەتکردنەوەی پرۆسەیەکی یاسایی ڕەت دەکرێتەوە.,هەڵوەشاندنەوەی باج وەک پێشێلکردنی یاسای پاراستنی یەکسان نایاسایی دەکرێت.,باجەکە لە چوارچێوەی پرۆسەی یاساییدا جێبەجێ دەکرێت.,ئەو باجە لە ژێر دەسەڵاتی شارەوانییەکەدایە بۆ ئەوەی باجی چینە جیاوازەکانی کەسانی نایەکسان بدات.,B
"ئەم دەسەڵاتە دەسەڵاتی دادوەرییە ئەم یاسایەی خوارەوەی هەیە: ""کەسێک بەرپرس نییە لە ڕەفتاری تاوانکاری ئەگەر لە کاتی ئەنجامدانی ئەم جۆرە ڕەفتارەدا، لە ئەنجامی نەخۆشی دەروونی یان کەموکوڕی، توانایەکی بەرچاوی نەبێت بۆ ئەوەی ڕێز لە هەڵەی ڕەفتارەکەی بگرێت، یان ڕەفتارەکەی لەگەڵ پێداویستییەکانی یاسادا بگونجێنێت."" ئێوارەیەک، تۆمەتبارێک چاودێری منداڵە پێنج ساڵانەکەی دەکات کاتێک لە دەرەوە یارییان دەکرد، تۆمەتبارەکە تۆپەکەی بەسەر سەری برازاکەیدا فڕێدا و چووە سەر شەقام. بە شێوەیەکی سروشتی برازاکە دوای تۆپەکە ڕایکرد، بەڵام کەوتە سەر گۆڕەپانەکە و کەوتە سەر شەقام. کاتێک کە کەوت، برازاکە بە توندی چەقۆکەی شکاند و نەیتوانی هەستێتە سەر پێ. چەند چرکەیەک دواتر، ئۆتۆمبێلێکی گەورەی زبڵ گەڕانەوە و بەسەر برازاکەیدا تێپەڕی و کوشتی. هەرچەندە تۆمەتبارەکە کێشەی برازاکەی بینی، بەڵام هیچ هەوڵێکی نەدا بۆ ڕزگارکردنی. دواتر تۆمەتبارەکە بە تۆمەتی کوشتنی بەبێ ویست دەستگیرکرا. لە دادگاییەکەدا، تۆمەتبارەکە شایەتی دا کە ئەوەندە توشی شۆک بوو کاتێک بینی برازاکەی لە نزیک ئۆتۆمبێلە زبڵەکە دەکەوێتە خوارەوە و بەستووە و نەیتوانیوە بجوڵێت هەتا ئەو کاتەی زۆر درەنگ بووە. دوای شایەتی تۆمەتبارەکە، شایەتحاڵێکی شارەزا بۆ بەرگریکارەکە شایەتی دا کە کاردانەوەکانی ئەو جۆرەی کە تۆمەتبارەکە باسی دەکات نائاسایی نییە کاتێک ڕووداوێکی بەڕاستی شۆککەر ڕوودەدات. ئەگەر دادوەر باوەڕی بە شایەتی تۆمەتبارەکە و شایەتحاڵە شارەزاکەی هەبێت، باشترین بەرگری تۆمەتبارەکە کام لەمانەی خوارەوەیە؟",تۆمەتبارەکە بە شێتییەکی کاتییەوە دەناڵێنێت.,تۆمەتبارەکە باری دەروونی پێویستی نەبوو بۆ ئەنجامدانی تاوانەکە.,شکستی تۆمەتبارەکە خۆبەخش نەبوو.,تۆمەتبارێک بە تۆمەتی شۆفێری ئۆتۆمبێلەکە دەستگیرکرا,C
