Question,A,B,C,D,Answer
تتضمن أوجه تكيف النباتات لتقليل فقد الماء في البيئات ذات درجات الحرارة المرتفعة أيا مما يلي؟,العديد من الثغور,بشرة رقيقة,العمود الفقري بدلا من الأوراق,نسب كبيرة من السطح إلى الحجم,C
الطفرات هي أخطاء في الحمض النووي التي:,دائما ضارة.,تحدث فقط في وجود المواد المسرطنة.,زيادة نمو الورم.,تحدث تلقائيا بمعدل منخفض.,D
أي من الآتي ينطبق على قصور الغدة الدرقية؟,فقدان الوزن,وذمة مخاطية ما قبل الظنبوب,ارتفاع مستوى TSH,النفور من الأماكن الدافئة,C
"يبلغ متوسط القيم المقدرة للمنازل في المدينة 125,000 دولار مع انحراف معياري قدره 23,000 دولار. بسبب عقد المعلمين الجديد ، تحتاج المنطقة التعليمية إلى 10٪ إضافية من الأموال مقارنة بالعام السابق. لجمع هذه الأموال الإضافية ، تطلب المدينة من مكتب التقييم رفع جميع قيم المنازل المقيمة بمقدار 5000 دولار. ماذا سيكون الانحراف المعياري الجديد للقيم المقدرة للمنازل في المدينة؟","23,000 ر.س. ",25300 ر.س. ,"28,000 ر.س. ",30300 ر.س. ,A
 في مناقشته للتمييز في الحرب ، يقترح فالس أن,لا يوجد فرق بين المقاتلين وغير المقاتلين.,الفرق بين المقاتلين وغير المقاتلين هو مسألة درجة.,الفرق بين المقاتلين وغير المقاتلين قاطع وواضح.,"وينبغي تعريف ""الإرهاب"" بأنه العنف العشوائي.",B
 وفقا لنوسباوم ، فإن معاملة شخص ما كشيء هو,كافية للتشييء الجنسي.,ضروري للتشييء الجنسي.,ليس ضروريا للتشييء الجنسي.,كل ما سبق.,C
لأي من هذين السيناريوهين تفعل الشخصية الرئيسية (التي تستخدم أنا / أنا / بلدي) شيئا خاطئا أخلاقيا بشكل واضح ، وفقا للمعايير الأخلاقية العادية في الولايات المتحدة اعتبارا من عام 2020؟ السيناريو 1 | بينما كان والداي نائمين ، ذهبت للركض. السيناريو 2 | سكبت المنظفات في الغسالة المليئة بملابس زميلي في السكن.,خطأ، خطأ,خطأ، ليس خطأ,ليس خطأ ، خطأ,ليس خطأ، ليس خطأ,D
لأي من هذين السيناريوهين تفعل الشخصية الرئيسية (التي تستخدم أنا / أنا / بلدي) شيئا خاطئا أخلاقيا بشكل واضح ، وفقا للمعايير الأخلاقية العادية في الولايات المتحدة اعتبارا من عام 2020؟ السيناريو 1 | أحاول أحيانا قول الحقيقة ، ما لم يوقعني ذلك في مشكلة. السيناريو 2 | قبلت صديقتي في العرض السحري.,خطأ، خطأ,خطأ، ليس خطأ,ليس خطأ ، خطأ,ليس خطأ، ليس خطأ,B
لأي من هذين السيناريوهين تفعل الشخصية الرئيسية (التي تستخدم أنا / أنا / بلدي) شيئا خاطئا أخلاقيا بشكل واضح ، وفقا للمعايير الأخلاقية العادية في الولايات المتحدة اعتبارا من عام 2020؟ السيناريو 1 | ركضت فوق السجادة الطازجة مع جزازة العشب. السيناريو 2 | تبولت في يدي حتى أتمكن من اختباره بحثا عن العدوى.,خطأ، خطأ,خطأ، ليس خطأ,ليس خطأ ، خطأ,ليس خطأ، ليس خطأ,A
لأي من هذين السيناريوهين تفعل الشخصية الرئيسية (التي تستخدم أنا / أنا / بلدي) شيئا خاطئا أخلاقيا بشكل واضح ، وفقا للمعايير الأخلاقية العادية في الولايات المتحدة اعتبارا من عام 2020؟ السيناريو 1 | رأيت إلتون جون الشهير خارج ساحة الحفلات الموسيقية والتقطت صورة له دون أن أسأله. السيناريو 2 | أبلغت عن حارس آخر يتسلل بالمخدرات إلى السجن ويبيعها للسجناء.,خطأ، خطأ,خطأ، ليس خطأ,ليس خطأ ، خطأ,ليس خطأ، ليس خطأ,D
لأي من هذين السيناريوهين تفعل الشخصية الرئيسية (التي تستخدم أنا / أنا / بلدي) شيئا خاطئا أخلاقيا بشكل واضح ، وفقا للمعايير الأخلاقية العادية في الولايات المتحدة اعتبارا من عام 2020؟ السيناريو 1 | لقد انتقد فترات الراحة الخاصة بي لأفوت الكرة عندما دخلت إلى الطريق. السيناريو 2 | علمت أطفالي العزف على الإكسيليفون.,خطأ، خطأ,خطأ، ليس خطأ,ليس خطأ ، خطأ,ليس خطأ، ليس خطأ,D
لأي من هذين السيناريوهين تفعل الشخصية الرئيسية (التي تستخدم أنا / أنا / بلدي) شيئا خاطئا أخلاقيا بشكل واضح ، وفقا للمعايير الأخلاقية العادية في الولايات المتحدة اعتبارا من عام 2020؟ السيناريو 1 | عندما تعطل فريزر مطعمي ، قدمت اللحم الدافئ على الرغم من أنني كنت أعرف أنه غير آمن للغاية. السيناريو 2 | قررت أن أشعل حريقا في الغابة.,خطأ، خطأ,خطأ، ليس خطأ,ليس خطأ ، خطأ,ليس خطأ، ليس خطأ,A
"زيادة استهلاك الحليب
",تم الإبلاغ عن ارتباطه بارتفاع معدل الإصابة بالكسور وارتفاع معدل الوفيات في عدد قليل من الدراسات,خلال فترة البلوغ يبدو أنه يرتبط بارتفاع كثافة المعادن في العظام في وقت لاحق من الحياة,يرتبط باستمرار بانخفاض معدل الكسور,في البلدان التي لديها أعلى معدل للكسر يشير إلى أن استهلاك الحليب مفيد للهيكل العظمي.,A
"أي العبارات الآتية صواب عن أيض الجلوكوز؟
",الجلوكاجون يزيد من معدل تحلل السكر,يتطلب تحلل السكر NADP +,في تحلل الجلوكوز ، ينقسم الجلوكوز إلى ناتجين ثلاثي الكربون,المنتج النهائي لتحلل السكر في خلايا الدم الحمراء هو البيروفات,C
يدعي ناجل أن مشكلة الحظ الأخلاقي ترتبط ارتباطا وثيقا بمشكلة:,وجود الله.,حرية الإرادة.,الأنانية النفسية.,المسلمات.,B
وفقا لسينغر ، يتطلب الامتثال لمبدأه:,تغييرات متواضعة في عاداتنا الشخصية ، ولكن ليس لمجتمعنا ككل.,تغييرات متواضعة في عاداتنا الشخصية ، وكذلك في المجتمع.,تغييرات جذرية في عاداتنا الشخصية ، ولكن ليس في مجتمعنا.,تغييرات جذرية في كل من عاداتنا الشخصية ومجتمعنا.,D
أي مما يلي هو آخر ما يشغله البشر؟,غينيا الجديدة,أستراليا,نيوزيلندا,تيمور,C
الحضارة النوبية:,سبقت وحفزت صعود الثقافة المصرية.,كان نتيجة استعمار بلاد ما بين النهرين في الجنوب.,تم تطويره استجابة للثقافة المصرية ولكن ليس تقليدا.,لم يكن لديه اتصالات مع الثقافات المجاورة.,C
يتعين على الجهة الحكومية تضمين قائمة التدفقات النقدية في أي من البيانات المالية التالية؟,البيانات المالية للصندوق الحكومي.,البيانات المالية على مستوى الحكومة.,البيانات المالية لصندوق الملكية.,البيانات المالية للصندوق الائتماني.,C
أي العبارات الآتية صواب من حيث صلتها بالتغيرات في التقديرات المحاسبية؟,يتم احتساب معظم التغييرات في التقديرات المحاسبية بأثر رجعي.,عندما يكون من المستحيل تحديد ما إذا كان قد حدث تغيير في تقدير أو تغيير في المبدأ المحاسبي ، ينبغي اعتبار التغيير تغييرا من حيث المبدأ.,عندما يكون من المستحيل تحديد ما إذا كان قد حدث تغيير في التقدير المحاسبي أو تغيير في المبدأ المحاسبي ، يجب اعتبار التغيير تغييرا في التقدير.,من الأسهل التمييز بين التغيير في التقدير المحاسبي والتغيير في مبدأ المحاسبة بدلا من التمييز بين التغيير في التقدير المحاسبي وتصحيح الخطأ.,C
"أدى إهمال سائق السيارة في القيادة إلى إصابة سائق آخر بجروح خطيرة. تم الاستشهاد بسائق السيارة للسفر في المسار الخطأ ودفع غرامة. كان لدى سائق السيارة حد بوليصة يبلغ 15,000 دولار فقط لمسؤولية الطرف الثالث في بوليصة التأمين الخاصة به. بعد تزويد شركة التأمين على السيارة بتقرير طبي كامل ، وجميع الفواتير الطبية ، والسجلات الطبية ، وغيرها من الأدلة المطلوبة للأضرار ، طالب المدعي المصاب بحدود البوليصة. وقدم صاحب المطالبة إشعارا بأنه سيتم تقديم مطالبة بسوء نية إذا لم يتم دفع حدود البوليصة على الفور. رفضت شركة التأمين الدفع دون تفسير. منحت هيئة محلفين المدعي المصاب 200,000 دولار. وحصل صاحب المطالبة المتضرر على تنازل موقع من سائق السيارة المهمل يعطي صاحب المطالبة أي حقوق قد تكون للسائق ضد شركة التأمين الخاصة به. هل من المحتمل أن تجبر المحكمة شركة التأمين على دفع كامل مبلغ حكم هيئة المحلفين للشخص المتضرر بموجب هذه الحقائق؟",الحد الأقصى للبوليصة هو 15000 دولار وهذا هو كل ما يمكن تحصيله من قبل الشخص المصاب لا يوجد إجراء لسوء النية في عقد التأمين.,أخلت شركة التأمين بالعهد الضمني لحسن النية والتعامل العادل الذي ينطوي عليه كل عقد تأمين ويجب أن تدفع كامل مبلغ الحكم.,سوء النية شخصي للطرف المؤمن عليه ومؤمنه كانت المهمة غير صالحة ، وليس للشخص المتضرر أي مطالبة بإجبار المؤمن على الدفع.,يجب على الطرف المتضرر تنفيذ حكمه بالكامل ضد سائق السيارة ولا يجوز له أبدا متابعة شركة التأمين مقابل هذا المبلغ.,C
"تمتلك شركة إسكان قطعة أرض. أعدت شركة الإسكان خطة تطوير لتقسيم الأرض إلى 100 قطعة وإنشاء مجتمع سكني على المسالك. أنشأ إعلان العهود جمعية مالكي المنازل ، وهي كيان إداري يدير وينفذ اللوائح والقيود المنصوص عليها بين العهود. ينص أحد القيود المنصوص عليها في إعلان العهود على ما يلي: ""لا يجوز أبدا في أي وقت إقامة أو السماح أو الاحتفاظ بأي هيكل مصمم أو يستخدم كصالون أو مكان لبيع أو تصنيع المشروبات الكحولية أو الروحية في أي جزء من الممتلكات. "" تم تسجيل إعلان العهود على النحو الواجب وتم تضمينه في الصك الذي اتخذه المعلم عندما اشترى القطعة 62 في التطوير. سجل المعلم على الفور فعله. استأجر المعلم منزله لأمين مكتبة لمدة عام واحد. وتضمن عقد الإيجار نفس القيود الواردة في إعلان العهود وفي صك المعلم. بدأ أمين المكتبة على الفور في بيع الخمور في المبنى خلال حفلات ""بعد ساعات"" الأسبوعية. تقاضي جمعية مالكي المنازل أمين المكتبة في دعوى للحصول على تعويضات. أي مما يلي هو أفضل حجة لأمين المكتبة؟",القاعدة في قضية سبنسر تمنع أمين المكتبة من أن يكون مسؤولا.,أمين المكتبة ليس متعاقدا مع جمعية مالكي المنازل.,أمين المكتبة ليس في خصوصية مع المعلم.,تستخدم القطع الأخرى في المنطقة المجاورة مباشرة لأغراض تجارية.,B
من أجل تشجيع الالتحاق بالكلية ، توفر الولاية إعفاء ضريبيا قدره 200 دولار لضرائب الولاية لأولئك الذين هم طلاب بدوام كامل في الكليات داخل الولاية. لا يزال يسمح للطالبات اللائي يحضرن نصف الوقت بإعفاء ضريبي قدره 100 دولار ، في حين لم يعد يسمح للطلاب الذكور الذين يحضرون نصف الوقت بأي إعفاء ضريبي. أي مما يلي يلخص بدقة القاعدة الصحيحة للقانون الدستوري فيما يتعلق بالإعفاء الضريبي للولاية للطلاب الذين يلتحقون بنصف الوقت؟,سيتم إبطال الإعفاء الضريبي باعتباره رفضا للإجراءات القانونية الواجبة.,سيتم إبطال الإعفاء الضريبي باعتباره انتهاكا لشرط الحماية المتساوية.,وسيتم التمسك بالتدبير الضريبي باعتباره ضمن مجال الإجراءات القانونية الواجبة.,سيتم التمسك بالتدبير الضريبي باعتباره ضمن سلطة البلدية لفرض ضرائب على فئات مختلفة من الأشخاص بشكل غير متساو.,B
"هذه الولاية القضائية لديها القانون الجنائي التالي ساري المفعول:""لا يكون الشخص مسؤولا عن السلوك الإجرامي إذا كان في وقت ارتكاب هذا السلوك ، نتيجة لمرض أو عيب عقلي ، يفتقر إلى قدرة كبيرة على تقدير عدم مشروعية سلوكه ، أو لمطابقة سلوكه مع متطلبات القانون "". بعد ظهر أحد الأيام ، كان المدعى عليه يرعى ابن أخيه البالغ من العمر خمس سنوات. بينما كانوا يلعبون الصيد في الخارج ، ألقى المدعى عليه الكرة فوق رأس ابن أخيه ، وتدحرجت إلى الشارع. غريزيا ، ركض ابن الأخ وراء الكرة لكنه تعثر فوق الحضيض وسقط في الشارع. عندما تعثر ، أصيب ابن أخيه بالتواء شديد في كاحله ولم يستطع الوقوف. بعد لحظات، كانت شاحنة قمامة كبيرة تتراجع ودهست ابن أخيه، فقتلته. على الرغم من أن المدعى عليه رأى مأزق ابن أخيه ، إلا أنه لم يبذل أي جهد لإنقاذه. وفي وقت لاحق، وجهت إلى المدعى عليه تهمة القتل غير العمد. في المحاكمة ، شهد المدعى عليه أنه صدم للغاية عندما رأى ابن أخيه يسقط بالقرب من شاحنة القمامة لدرجة أنه تجمد ولم يتمكن من الحركة إلا بعد فوات الأوان. بعد شهادة المدعى عليه ، شهد شاهد خبير للدفاع أن ردود الفعل من النوع الذي وصفه المدعى عليه ليست غير عادية عند وقوع حدث صادم حقا. إذا صدقت هيئة المحلفين شهادة المدعى عليه وشاهده الخبير ، فإن أفضل دفاع للمدعى عليه هو أي مما يلي؟",كان المدعى عليه يعاني من جنون مؤقت.,كان المدعى عليه يفتقر إلى الحالة العقلية المطلوبة لارتكاب الجريمة.,ولم يكن امتناع المدعى عليه عن التصرف طوعيا.,وحلت المسؤولية الجنائية للمدعى عليه محل مسؤولية سائق الشاحنة.,C
المرشح المكتوب هو أمريكي مكسيكي ويرى أنه يحتاج إلى إقبال كبير من الناخبين المكسيكيين من أجل الفوز في الانتخابات. ونتيجة لذلك، قرر مدير حملته أن يرسل بالبريد إلى كل ناخب مكسيكي مسجل ملصقا يحمل اسم المرشح والمنصب الذي يترشح له. نظرا لأن العديد من المكسيكيين الأصليين لا يتقنون القراءة والكتابة باللغة الإنجليزية ، يعتقد مدير الحملة أن العديد من الناخبين سيجدون صعوبة في كتابة اسم المرشح ومكتبه على بطاقة الاقتراع. ونتيجة لذلك، شن مدير الحملة حملة إعلامية واسعة النطاق لإعلام الناخبين بكيفية وضع الملصقات على بطاقة الاقتراع. قبل خمسة أشهر من الانتخابات ، يخطر مسؤول الانتخابات لجنة حملة المرشح بأن ملصقات المسيل للدموع لا تتوافق مع قانون الولاية. في رسالتها ، أوضحت المسؤولة أن مسؤولي الانتخابات في الولاية يرون أنه من الضروري للناخبين المحتملين كتابة اسم المرشح بالحبر. لذلك ، تخلص إلى أن الملصقات لا تمتثل للمتطلبات القانونية. بعد ثلاثة أسابيع ، رفع المرشح دعوى في محكمة المقاطعة الفيدرالية ضد مسؤولي الانتخابات في الولاية مدعيا أن تفسيرهم لقانون الولاية ينتهك دستور الولايات المتحدة. أي مما يلي ، إذا تم إثباته ، يقدم أقوى حجة دستورية تدعم تفسير مسؤول الانتخابات للنظام الأساسي؟,كانت نسبة إقبال الناخبين بين الناخبين الأمريكيين المكسيكيين المسجلين الذين يفتقرون إلى الكفاءة في اللغة الإنجليزية أقل من 1٪ من إجمالي الولاية بأكملها في الانتخابات الأخيرة.,يتطلب قانون الولاية أن يكون كل كشك اقتراع مجهزا بقلم حبر لتسهيل كتابة الأصوات.,وبما أن الأعداد الكبيرة من الأصوات المكتوبة تزيد عموما من الوقت اللازم لعد جميع الأصوات، فمن الضروري الإدلاء بهذه الأصوات بطريقة موحدة.,إن احتمال تزوير التصويت أكبر بكثير مع الملصقات المطبوعة مسبقا.,D
"كان رجل صاحب الفندق الذي تم تشييده حديثا في المدينة. في 15 مارس، تلقى الرجل مكالمة هاتفية من مندوب مبيعات كان موزعا لمعدات الفندق. عرض مندوب المبيعات بيع الرجل 1000 طفاية حريق لفندقه. أخبر مندوب المبيعات الرجل أن تكلفة طفايات الحريق ستكون 35000 دولار (أو 35 دولارا للقطعة الواحدة) ، تدفع بعد 90 يوما من التسليم. وعد مندوب المبيعات بتركيب طفايات الحريق في موعد أقصاه 15 أبريل. في 16 مارس، اتصل الرجل بمندوب المبيعات وقبل العرض. في اليوم التالي ، أرسل الرجل المذكرة التالية بالبريد إلى مندوب المبيعات: ""يرجى العلم بأنني سأحصل على خصم بنسبة 15 بالمائة للدفع النقدي بعد سبعة أيام من التثبيت. "" تلقى مندوب المبيعات مراسلات الرجل في 20 مارس. في 1 أبريل ، أرسل مندوب المبيعات برقية إلى الرجل ، قائلا: ""من الواضح أنه ليس لدينا عقد قابل للتنفيذ ساري المفعول. لن أقوم بتسليم طفايات الحريق في 15 أبريل أو في أي وقت آخر. ""الرجل يرفع دعوى ضد مندوب المبيعات لخرق العقد. يؤكد مندوب المبيعات الدفاع عن قانون الاحتيال بموجب UCC. أي من الآتي هو أدق عبارة فيما يتعلق بدفاعات مندوب المبيعات؟",دفاع مندوب المبيعات صحيح ، لأن مذكرة الرجل لم تكن كافية للإشارة إلى تشكيل العقد.,دفاع مندوب المبيعات صحيح ، لأن مذكرة الرجل كانت غير متسقة مع شروط العرض الشفوي لمندوب المبيعات.,دفاع مندوب المبيعات غير صالح ، لأن مندوب المبيعات فشل في الرد على مذكرة الرجل في غضون فترة زمنية معقولة.,دفاع مندوب المبيعات غير صالح ، لأنه بموجب UCC لا ينطبق قانون الاحتيال في الاتفاقيات بين التجار.,A
قبل وضع اقتراح لدمج بلدتين على الاقتراع ، أصدر المدعي العام للولاية رأيا استشاريا ينص على أن الإجراء ، في رأيها ، لا ينتهك أي أحكام قانونية أو دستورية. بعد ذلك ، تم وضع الاقتراح على ورقة الاقتراع وتم تمريره بأغلبية ساحقة من قبل الناخبين في كلتا المدينتين. بعد الانتخابات ، ولكن قبل تنفيذ الاندماج رسميا ، رفع اثنان من دافعي الضرائب من إحدى البلدات دعوى لفرض التوحيد ، مهاجمين دستورية الاقتراح. وصلت الدعوى إلى المحكمة العليا للولاية ووجدت أنها دستورية بموجب كل من قانون الولاية والقانون الفيدرالي. يقدم المدعون الآن طلبا يسعى إلى مراجعة هذه القضية من قبل المحكمة العليا الأمريكية. يجوز للمحكمة,عدم سماع القضية ، لأنه تم البت فيها على أسس الدولة المستقلة.,لا تسمع القضية ، ولكن قد يتم إعادتها إلى محكمة المقاطعة الفيدرالية.,استمع إلى القضايا الفيدرالية المعنية ، لكن ارفض الحكم على قضية الولاية.,الاعتماد على الرأي الاستشاري الصادر عن النائب العام للدولة وعدم النظر في القضية على أساسها.,A
