Question,A,B,C,D,Answer
"Энэ асуулт нь дараах мэдээллийг хэлнэ.
Би баганын хажуугаар алхаж, юу болж байгааг асууя.
Нэг цэрэг энгийнээр « Тэд өдөр бүр илүү олон хүн дуудна.
""Бидний заримыг арван таван настайдаа Умард зүгт Шар мөрөн рүү илгээж,
Харин одоо дөчин цагт бид баруун зүгийн гарнизонууд руу явж байна.
Биднийг анхны аяллаар явж байхад тосгоны тэргүүн банданнаг маань бидэнд уяж өгөх хэрэгтэй болов.
Биднийг буцаж ирэхэд үс маань цагаан байсан ч үймээн самуун улам ихсээд байна.
Хил хязгаарын гарнизонууд цусаар гүйдэг бөгөөд далайг дүүргэхэд хангалттай.
Гэвч Мартын эзэн хааны нутаг дэвсгэрийн хүсэл эрмэлзэл хараахан амсаагүй байна.
Уулсаас зүүн тийш зуун дүүрэгт Хан улсын нутаг даяар,
Одоо өртөж буй арван мянган тосгон байх ёстой.
Эхнэр нь хойлог, анжсаа даах хүчтэй байсан ч
Ургац нь бүх талаараа ургаж, талбай нь бүгд завхраар.
Шаньси эрчүүдийн хувьд хамгийн хэцүү нь. Тэдний тулаанч гэсэн нэр хүндтэй:
Тэд нохой, тахиа шиг бөөгнөрүүлж, эрэгтэй хүн бүр биширчээ.
""Харин эрхэм ээ, хэдийгээр та нараас асуухад сайн ч,
Гомдоллох нь цэргийн үүрэг биш.
Бид зөвхөн толгой сэгсэрч чадна. Энэ өвлийг авч үзье:
Шансигийн цэргүүдийг хэзээ ч гэр рүүгээ явуулж байгаагүй.
Дүүргийн газрын албаныхан газрын албан татварыг шаардаж,
Тэгвэл хаанаас гарах вэ? Чулуунаас цус авч болохгүй!
Үнэнийг хэлэхэд одоо хүү төрүүлэх нь азгүй хэрэг гэж бодож байна,
Охинтой болсон нь дээр: ядаж л гэрлэж болно
Зэргэлдээх хөршүүдтэйгээ хамт амьдар.
Харин хүү нь алс холын хээр талд хэвтэнэ» гэж байдаг.
Ду Фу, ""Армийн картуудын Баллад"", ca. 750.
Энэ шүлэг Танг нийгэм дэх хүйсийн харилцааны талаар дараах зүйлсийн аль нь болохыг нотолжээ.",Танг нийгэмд нөхөр эхнэр хоёрын харилцаа бат бөх хэвээр байлаа.,Эзэн хааны бичээсүүд нь цэрэгт татагдсан квотыг биелүүлэхийн тулд охид дээр чадварлаг хөвгүүд төрөхийг онцлон тэмдэглэсэн байдаг.,"Хөдөө аж ахуйн ажлыг эмэгтэйчүүд, эрэгтэйчүүд ч хуваалцаж болно.",Эмпресс Ву Зетянь хааны үед Хятадын уламжлалт хүйсийн харилцаа өөрчлөгдсөн.,C
xy-plane-д x^(log y) = y^log x-ийн график нь,нээлттэй эхний квадрант,хаалттай муруй,нээлттэй эхний квадрант дахь туяа,ганц цэг,A
2017 онд дараах улс орнуудаас аль нь хүн амд хамгийн их нүүрсхүчлийн хий ялгаруулсан бэ?,Япон,Канад,Орос,Ирэн,B
Дахин тоглох дайралт гэж юу вэ?,Дайрагч нь системээр илгээсэн мессеж рүү хариу өгөхөд,"Сул талыг шалгаж, байнга давтагддаг халдлага","Системийн өөрийнх нь мессежийг ашигладаг, тиймээс хамгаалж чадахгүй халдлага","Дайрагч нь олзлогдсон мэдээг няцааж, сайт нь өөрийн хүлээн авч, дайрагчийн таалалд хариу өгдөг",D
Дейтерийн хлоридын (DCl) инфрастай шингээх давтамж нь устөрөгчийн хлорид (HCl)-ийн давтамжаас шилждэг нь тэдний ялгаатай байдлаас үүдэлтэй,электроны тархалт,диполын мөч,хүч байнгын,массыг багасгасан,D
Фотон илрүүлэгчийн квантын үр ашиг 0.1 байна. 100 фотоныг илрүүлэгч рүү илгээвэл нэг нэгээр нь нөгөөгийнх нь дараа илрүүлэгч фотонуудыг илрүүлнэ,"дунджаар 10 удаа, 4 орчим рм-ийн хазайлттай","дунджаар 10 удаа, 3 орчим рм-ийн хазайлттай","дунджаар 10 удаа, 1 орчим рм-ийн хазайлттай","дунджаар 10 удаа, 0,1 орчим рм-ийн хазайлттай",B
Байнгын илэрхийлэлтэй дараах багц битийн уяаны алийг нь хэлж болох вэ?,0-ийн тоо нь тавын хэдтэй битийн бүх уяа,"Бүх битийн уяа 0-ээр эхэлж, нэг үзүүрт",Бүх битийн уяа бүр тоо 0-тэй,Бүх битийн утаснууд нь 0-ээс илүү,D
Өндөр температуртай орчинд усны алдагдлыг багасгахын тулд ургамлын тохируулгад дараах зүйлсийн аль нь багтдаг вэ?,Олон тооны стомата,Нимгэн зүсэлттэй,Навчны оронд шөрмөс,Том гадаргуутай ба хэмжээстэй харьцаа,C
Мутаци нь ДНХ-ийн алдаа юм. Үүнд:,үргэлж хор хөнөөлтэй байдаг.,зөвхөн хавдрыг дэргэдээс нь бий болдог.,хавдрын өсөлтийг нэмэгдүүлнэ.,бага хурдтайгаар өөрийн мэдэлгүй тохиолддог.,D
Дараах гипотироидизмын аль нь үнэн бэ?,Жин хасах,Tibial-ийн өмнөх миxоедем,ТШ-ийн түвшин дээшлэх,Дулаан газрыг үзэн яддаг,C
Хотын байшингийн үнэ цэнийг үнэлсэн нь 23 мянган ам.долларын стандарт хазайлттай 125 мянган ам.доллартай. Шинэ багш нарын гэрээтэй тул сургуулийн дүүрэгт өмнөх онтой харьцуулахад 10% илүү хөрөнгө хэрэгтэй байна. Энэ нэмэлт мөнгийг нэмэгдүүлэхийн тулд үнэлгээний албанд үнэлгээ авсан байшингийн бүх үнэ цэнийг 5000 ам.доллараар нэмэгдүүлэхийг зааварлажээ. Хотын байшингийн үнэлэгдсэн үнэт зүйлсийг шинэ жишиг хазайх нь юу байх вэ?,"$23,000 ","$25,300 ","$28,000 ","$30,300 ",A
 Воллс дайнд ялгаварлан гадуурхах үзлийн талаар ярилцахдаа,"байлдагч, байлдагч бус хүмүүс хоорондоо ямар ч ялгаа байхгүй.","байлдагч, байлдагч бус хүмүүсийн ялгаа нь зэрэгцлийн асуудал юм.","байлдагч болон байлдагч бус хүний ялгаа нь тодорхой, тодорхой байна.","""Терроризм"" гэж ялгаварлан гадуурхахгүй хүчирхийлэл гэж тодорхойлох ёстой.",B
 Нуссбаумын хэлснээр хэн нэгнийг эд зүйл гэж үзэх нь,бэлгийн харьцаанд хангалттай.,бэлгийн харьцааны объектын хувьд шаардлагатай.,бэлгийн дур хүслээ хангах шаардлагагүй.,дээр дурдсан бүхэн.,C
2020 оны байдлаар АНУ-д ёс суртахууны жирийн хэм хэмжээний дагуу гол дүр (I/me/my-г ашигладаг) ёс суртахууны хувьд тодорхой буруу зүйл хийдэг энэ хоёр нөхцөл байдлын аль нь вэ? Сценари 1 | Аав ээж хоёр унтаж байх үед би гүйж очив. Сценари 2 | Би өрөөний найзынхаа хувцсаар дүүрэн угаагч руу усанд уусгагч асгав.,"Буруу, буруу","Буруу, буруу биш","Буруугүй, Буруу","Буруугүй, буруугүй",D
2020 оны байдлаар АНУ-д ёс суртахууны жирийн хэм хэмжээний дагуу гол дүр (I/me/my-г ашигладаг) ёс суртахууны хувьд тодорхой буруу зүйл хийдэг энэ хоёр нөхцөл байдлын аль нь вэ? Сценари 1 | Надад гай зовлон тохиолдохгүй л бол би заримдаа үнэнийг хэлэхийг хичээдэг. Сценари 2 | Илбэчин шоун дээр найз охиноо үнслээ.,"Буруу, буруу","Буруу, буруу биш","Буруугүй, Буруу","Буруугүй, буруугүй",B
2020 оны байдлаар АНУ-д ёс суртахууны жирийн хэм хэмжээний дагуу гол дүр (I/me/my-г ашигладаг) ёс суртахууны хувьд тодорхой буруу зүйл хийдэг энэ хоёр нөхцөл байдлын аль нь вэ? Сценари 1 | Би зүлгэн дээр зүлгэн дээгүүр гүйлээ. Сценари 2 | Би халдвар авахын тулд гартаа шээс шүхрээр шээв.,"Буруу, буруу","Буруу, буруу биш","Буруугүй, Буруу","Буруугүй, буруугүй",A
"2020 оны байдлаар АНУ-д ёс суртахууны жирийн хэм хэмжээний дагуу гол дүр (I/me/my-г ашигладаг) ёс суртахууны хувьд тодорхой буруу зүйл хийдэг энэ хоёр нөхцөл байдлын аль нь вэ? Сценари 1 | Би концертын талбай дээр алдартай Элтон Жоныг харж, түүнээс асуулгүйгээр түүний зургийг авсан юм. Сценари 2 | Би өөр нэг харгалзагчийг мансууруулах бодисоор сэмхэн шоронд хийж, хоригдлуудад зарж байгаа тухай мэдээлсэн юм.","Буруу, буруу","Буруу, буруу биш","Буруугүй, Буруу","Буруугүй, буруугүй",D
2020 оны байдлаар АНУ-д ёс суртахууны жирийн хэм хэмжээний дагуу гол дүр (I/me/my-г ашигладаг) ёс суртахууны хувьд тодорхой буруу зүйл хийдэг энэ хоёр нөхцөл байдлын аль нь вэ? Сценари 1 | Би завсарлагаанаар бөмбөгийг зам дээр гарч ирэхэд нь алдахаар цохив. Сценари 2 | Би хүүхдүүддээ xylophone тоглохыг заасан.,"Буруу, буруу","Буруу, буруу биш","Буруугүй, Буруу","Буруугүй, буруугүй",D
2020 оны байдлаар АНУ-д ёс суртахууны жирийн хэм хэмжээний дагуу гол дүр (I/me/my-г ашигладаг) ёс суртахууны хувьд тодорхой буруу зүйл хийдэг энэ хоёр нөхцөл байдлын аль нь вэ? Сценари 1 | Манай рестораны хөлдөөгч хагарахад маш аюултай гэдгийг мэдэж байсан ч би дулаан махаар үйлчилдэг байлаа. Сценари 2 | Би ойд гал асаахаар шийдэв.,"Буруу, буруу","Буруу, буруу биш","Буруугүй, Буруу","Буруугүй, буруугүй",A
"Сүү их хэрэглэх
","Хэд хэдэн судалгаагаар хугарал, нас баралт өндөр болсонтой холбоотой гэж мэдээлсэн",Шилжилтийн үед хожуу үеийн ясны эрдэсжилт ихэсдэгтэй холбоотой бололтой,Хугарлын доод хэмжээтэй байнга холбоотой байдаг,Хамгийн өндөр хугаралтай орнуудад сүүний хэрэглээ нь гавлын ясанд ашигтай болохыг харуулж байна.,A
"Глюкозын метаболизмын талаар дараах мэдэгдлүүдийн аль нь зөв бэ?
",Глюкагон нь гликолизийн хурдыг нэмэгдүүлдэг,Гликолиз NADP+ шаарддаг,Гликолизид глюкозыг гурван нүүрстөрөгчийн хоёр бүтээгдэхүүн болгон хуваадаг,Цусны улаан эсэд гликолизийн эцсийн бүтээгдэхүүн пируват,C
Ёс суртахууны азын асуудал нь асуудалтай нягт холбоотой гэж Нагел мэдэгдэв:,Бурхан байдаг.,хүсэл тааллын эрх чөлөө.,сэтгэл зүйн хувьд биеэ тоох.,нийтлэг.,B
Singer-ийн хэлснээр түүний зарчмыг дагаж мөрдөх нь дараах шаардлагыг тавьдаг. Үүнд:,хувийн хэвшилдээ даруухан өөрчлөлт хийх боловч нийт нийгэмдээ биш.,хувийн хэвшил болон нийгэмдээ даруухан өөрчлөлт гардаг.,хувийн хэвшилдээ эрс өөрчлөлт хийх боловч нийгэмдээ биш.,хувийн хэвшил болон нийгэмдээ эрс өөрчлөлт гардаг.,D
Хүн төрөлхтөн хамгийн сүүлд ямар хүнийг эзлэх вэ?,Шинэ Гвиней,Австрали,Шинэ Зеланд,Тимор,C
Нубийн соёл иргэншил:,"Египетийн соёлыг бий болгож, эрт дээр үед бий болсон.",өмнөд хэсэгт Месопотамины колоничлолын үр дүн байсан юм.,египетийн соёлыг даган хөгжсөн юм.,хөрш зэргэлдээ соёл иргэншилтэй холбоогүй байсан.,C
Засгийн газрын байгууллага дараах санхүүгийн тайлангийн аль нь бэлэн мөнгөний гүйлгээний тайланг оруулах шаардлагатай вэ?,Засгийн газрын сангийн санхүүгийн тайлан.,Засгийн газрын санхүүгийн тайлан.,Эзэмшлийн сангийн санхүүгийн тайлан.,Fiduciary сангийн санхүүгийн тайлан.,C
Нягтлан бодох бүртгэлийн тооцооллын өөрчлөлттэй холбоотой дараах мэдэгдлийн аль нь зөв бэ?,Нягтлан бодох бүртгэлийн тооцооны ихэнх өөрчлөлтийг эргэн харахад тооцдог.,"Тооцооллын өөрчлөлт, тооцооллын зарчмын өөрчлөлт гарсан эсэхийг тодорхойлох боломжгүй тохиолдолд уг өөрчлөлтийг зарчмын өөрчлөлт гэж үзэх ёстой.","Нягтлан бодох бүртгэлийн тооцоонд өөрчлөлт орсон уу, эсвэл нягтлан бодох бүртгэлийн зарчим өөрчлөгдсөн үү гэдгийг тодорхойлох боломжгүй бол энэ өөрчлөлтийг тооцооллын өөрчлөлт гэж үзэх ёстой.","Нягтлан бодох бүртгэлийн тооцооны өөрчлөлт болон нягтлан бодох бүртгэлийн зарчмын өөрчлөлтийг нягтлан бодох бүртгэлийн тооцооллын өөрчлөлт, алдааг засах хоёрын ялгааг ялгахад хялбар байдаг.",C
"Нэгэн моторт жолоочийн хайхрамжгүй жолоо барих нь өөр нэг жолоочийг ноцтой гэмтээсэн байна. Моторт жолоочийг буруу замаар аялсных нь төлөө эш татаж, торгууль төлсөн байна. Моторт жолооч даатгалынхаа талаар гуравдагч этгээдэд хариуцлага хүлээлгэхэд ердөө 15 мянган ам.долларын бодлогын хязгаартай байжээ. Жолоочийн даатгуулагчийг эрүүл мэндийн бүрэн тайлан, эмнэлгийн бүх төлбөр, эмнэлгийн бүртгэл болон бусад шаардлагатай хохирлын баталгааг өгсний дараа гэмтэж бэртсэн этгээд журмын хязгаарыг шаардсан байна. Хэрэв бодлогын хязгаарыг тэр даруй төлөхгүй бол итгэл муутай нэхэмжлэл гаргана гэдгийг нэхэмжлэгч мэдэгджээ. Даатгалын компани ямар ч тайлбаргүйгээр төлбөрөөс татгалзав. Шүүхийн шийдвэрээр гэмтсэн этгээдэд 200 мянган төгрөг олгосон байна. Гэмтсэн нэхэмжлэгч нь хайхрамжгүй моторт жолоочоос даатгуулагчийнхаа эсрэг байж болох аливаа эрхийг нэхэмжлэгчид өгч гарын үсэг зурсан даалгавар авсан байна. Шүүх эдгээр баримтаар гэмтэж бэртсэн хүнд шүүхийн шийдвэрийн бүрэн хэмжээг төлөхийг даатгалын компанид албадах болов уу?","Энэ бодлогын хязгаар нь 15,000 ам.доллар бөгөөд даатгалын гэрээнд муу итгэл үзүүлэх ямар ч үйлдэл байхгүй гэмтэж бэртсэн хүний цуглуулж болох бүх зүйл юм.","Даатгалын компани нь даатгалын гэрээ болгонд далд утга бүхий итгэл, шударга харилцааны далд гэрээг зөрчсөн бөгөөд шүүлтийн бүрэн хэмжээг төлөх ёстой.",Муу итгэл нь даатгуулсан этгээд болон түүний даатгуулагчийн хувьд үүрэг даалгавар нь хүчин төгөлдөр бус байсан бөгөөд гэмтэж бэртсэн хүн даатгуулагчийг албадан төлөхийг шаардах эрхгүй.,Гэмтэж бэртсэн этгээд моторт жолоочийн эсрэг гаргасан шүүлтээ бүхэлд нь хэрэгжүүлэх ёстой бөгөөд даатгуулагчийг хэзээ ч ийм хэмжээний төлөө мөрдөж болохгүй.,C
"Орон сууцны корпорацид нэг танилцуулга газар өмчилж авсан байна. Орон сууцны корпораци нь газар нутгийг 100 газарт хувааж, танилцуулга дээр орон сууцжуулах хөгжлийн төлөвлөгөө бэлтгэсэн байна. Гэрээ байгуулах тухай тунхаглал нь гэрийн эздийн холбоо буюу гэрээнд заасан дүрэм, журмын хүрээнд гэрээнд заасан хориглолтыг гүйцэтгэх, түүнийг хэрэгжүүлэх захиргааны байгууллага бий болгосон. « Гэрээний тунхаглал » - д : « Ямар ч үед тахилын хэрэгсэл, сүргүүдийг худалдах, үйлдвэрлэхэд зориулан зориулалтын, эсвэл зориулалтын зориулалтын барилга байгууламжийг өмчийн аль ч хэсэгт барьж, зөвшөөрч, арчилж тордохгүй » гэж заасан байдаг. Гэрээний тунхаглалыг зохих ёсоор тэмдэглэж, хөгжлийн 62-р газрыг худалдаж авахдаа багшийн авсан үйл ажиллагаанд оруулсан байна. Багш тэр даруй өөрийн үйл хэргийг тэмдэглэн авсан. Багш нь номын санд байраа 1 жилийн хугацаатай түрээслүүлжээ. Түрээсэнд Гэрээний тунхаглал болон багшийн үйл ажиллагаанд дээрхтэй адил хязгаарлалтууд орсон байв. Номын санч тэр даруй долоо хоног тутмын ""хэдэн цагийн дараа"" үдэшлэгийн үеэр байранд согтууруулах ундаа зарж эхэлсэн байна. Гэрийн эздийн холбоо нь номын санчийг хохирлын арга хэмжээ авч шүүдэг. Дараах зүйлсийн аль нь номын санч хамгийн сайн аргумент вэ?",Спенсерийн Кэйс дэх дүрэм нь номын санчийг хариуцлага хүлээхэд саад болдог.,Номын санч нь гэрийн эздийн холбоотой гэрээтэй хувийн хэрэг биш юм.,Номын санч нь багштай хамт эд хөрөнгийн хувьчлалд байдаггүй.,Ойр орчмын бусад газрыг худалдааны зориулалтаар ашигладаг.,B
Коллежид элсэхийг дэмжихийн тулд муж улсын хэмжээнд коллежид бүрэн цагийн оюутан болох хүмүүст улсын татвараас 200 ам.долларын татвараас чөлөөлдөг. Хагас цагаар сурдаг эмэгтэй оюутнуудад 100 долларын татвараас чөлөөлөгдөхийг зөвшөөрсөн хэвээр байгаа бол хагас цагаар суралцдаг эрэгтэй оюутнуудад татвараас чөлөөлөгдөхийг зөвшөөрдөггүй болсон байна. Хагас болон бүтэн сайнд элсэн суралцах оюутнуудын улсын татвараас чөлөөлөх тухай Үндсэн хуулийн зөв дүрмийг дараахаас аль нь хамгийн оновчтой дүгнэж байна вэ?,Татвараас чөлөөлөх нь зохих үйл явцыг үгүйсгэсэн гэж хүчингүй болно.,Татварын чөлөөлөлтийг тэгш хамгаалах зарчмыг зөрчсөн гэж хүчингүйд тооцно.,Татварын арга хэмжээ нь бодит зохих үйл явцын хүрээнд дэмжигдэх байв.,Татварын арга хэмжээ нь өөр өөр эд ангиудыг тэгш бус татвар ногдуулах хотын эрх мэдлийн хүрээнд дэмжигдэх юм.,B
