Question,A,B,C,D,Answer
Quina d'aquestes pel·lícules de terror va generar més seqüeles?,Cridar',Mandíbules',Halloween',Divendres 13',D
Quin d'aquests plats s'elabora amb intestins de porc?,haggis,Quitlins,Grits,picar suey,B
Quina és la llengua materna de l'actor Antonio Banderas?,Espanyol,Rus,Alemany,Francès,A
Quin és l'idioma oficial dels Països Baixos?,Danès,Suec,Alemany,Holandès,D
En quin estat es troba el plató de la pel·lícula de 1999 Magnolia?,Califòrnia,Carolina del Sud,Geòrgia,Texas,A
Les mutacions que causen acondroplàsia exerceixen un efecte que es pot classificar en:,dominant negatiu.,guany de funció.,haploinsuficiència.,pèrdua de funció.,B
 Aquesta eina de màrqueting i comunicació ofereix un incentiu directe o un incentiu per animar els clients a comprar un producte/servei:,Publicitat.,Relacions públiques.,Promoció de vendes.,Màrqueting directe.,C
La validació creuada de K-fold és,lineal en K,quadràtic en K,cúbic en K,exponencial en K,A
Els adults de mitjana edat semblen ser més ____ que els adults grans o joves,Generatiu,Neuròtics,Agradable,Segur,A
La fal·làcia de la personalitat laudatòria és un tipus específic de,La fal·làcia de l'accident,Fals dilema,Demanant la pregunta,Raonament circular,A
"Aquesta pregunta fa referència a la informació següent.
""Les llavors dels règims totalitaris es nodreixen de la misèria i el desig. S'estenen i creixen en el sòl maligne de la pobresa i les lluites. Arriben al seu ple creixement quan ha mort l'esperança d'un poble per a una vida millor. Hem de mantenir viva aquesta esperança. El ràpid moviment dels esdeveniments ens ha imposat grans responsabilitats. Confio que el Congrés afrontarà aquestes responsabilitats directament"".
El president Harry S. Truman, 1947
Les idees expressades en el passatge anterior reflecteixen més directament quina de les següents continuïtats en la història dels Estats Units?",Debats sobre la relació entre el Congrés i el president.,Debats sobre l'ús de la força militar en situacions volàtils.,Debats sobre el paper dels Estats Units en els assumptes mundials.,Debats sobre el bon paper dels partits polítics.,C
Un pacient pateix una fractura de coll amb danys a la medul·la espinal a nivell de la sisena vèrtebra cervical.,Seran incapaços de respirar sense suport vital.,Només podran respirar tranquil·lament.,És impossible predir un efecte sobre la respiració.,La respiració no es veurà afectada.,B
L'autocorrelació residual negativa s'indica amb quina de les següents?,Un patró cíclic en els residus,Un patró altern en els residus,Una aleatorietat completa en els residus,Residus que són tots propers a zero,B
Identifiqueu l'antecedent de la següent proposició condicional: Les Abelles guanyen la seva primera partida només si els Aardvarks o els Chipmunks no guanyen les seves primeres partides.,Els Aardvarks no guanyen el seu primer partit.,Les Abelles guanyen el seu primer partit.,Els Chipmunks no guanyen el seu primer partit.,O els Aardvarks o els Chipmunks no guanyen les seves primeres partides.,B
"Els estudiants estan realitzant un exercici de separació de pigments vegetals que requereix que utilitzin una cambra de cromatografia tancada amb una petita quantitat d'acetona al fons de la cambra. Les advertències de seguretat per a l'acetona inclouen la declaració que és un irritant ocular i de la pell i que té vapors inflamables. De les següents, quines precaucions de seguretat han de prendre els estudiants durant la realització de l'exercici?",Posar-se guants ignífugs per portar la cambra a una campana de fums si l'acetona s'incendia,Col·locació de la cambra en un armari tancat i enfosquit durant la durada de la separació del pigment,Portar guants de cuir i cobrir-se nas i boca amb una màscara de partícules,Portar ulleres i guants tipus nitril i mantenir tancats tots els envasos d'acetona,D
Quin d'aquests fa que la determinació de la relació evolutiva de diferents espècies basada en la seqüència d'aminoàcids de proteïnes homòlogues generalment sigui menys precisa que les determinacions de relació basades en les seqüències de nucleòtids de gens homòlegs?,Mutacions silencioses,Duplicacions gèniques,Esdeveniments de translocació que canvien les seqüències gèniques,Encreuament,A
L'homicidi il·legítim comès pel ministre del país X a l'estranger és un acte jure imperii o jure gestionis?,Aquesta conducta és un acte públic (jure imperii),Aquesta conducta mai atrau immunitat,Aquesta conducta és un acte privat (jure gestionis),"Aquesta conducta és un acte públic, però està blindada per la immunitat",C
"Aquesta pregunta fa referència a la informació següent.
En primer lloc hem de remarcar que el cosmos té forma esfèrica, en part perquè aquesta forma en ser un tot perfecte que no requereix articulacions, és la més completa de totes, en part perquè fa la forma més àmplia, la més adequada per contenir-ho i conservar-ho tot; o de nou perquè totes les parts constitutives de l'univers, és a dir, el sol, la lluna i els planetes apareixen d'aquesta forma; o perquè tot s'esforça per assolir aquesta forma, com apareix en el cas de les gotes d'aigua i altres cossos fluids si intenten definir-se. Per tant, ningú dubtarà que aquesta forma pertany als cossos celestes. ...
Que la terra també és esfèrica és, per tant, inqüestionable, perquè pressiona per tots els costats sobre el seu centre. Tot i que per raó de les elevacions de les muntanyes i les depressions de les valls no es pot entendre un cercle perfecte, això no afecta la naturalesa esfèrica general de la terra. ...
Com ja s'ha demostrat que la Terra té forma d'esfera, hem de plantejar-nos si un moviment coincideix també amb aquesta forma, i quin lloc ocupa la Terra a l'univers. ... La gran majoria d'autors, per descomptat, estan d'acord que la Terra es troba quieta al centre de l'univers, i consideren inconcebible i ridícul suposar el contrari. Però si es sospesa acuradament l'assumpte, es veurà que la qüestió encara no està resolta i, per tant, de cap manera s'ha de considerar a la lleugera. Tot canvi de lloc que s'observa es deu, és a dir, a un moviment de l'objecte observat o de l'observador, o a moviments d'ambdós. ... Ara és des de la terra que s'observa la revolució del cel i es produeix per als nostres ulls. Per tant, si la terra no pateix cap moviment, aquest moviment ha de tenir lloc en tot el que està fora de la terra, però en la direcció contrària a si tot a la terra es mogués, i d'aquest tipus és la revolució quotidiana. Per tant, això sembla afectar tot l'univers, és a dir, tot el que està fora de la terra amb l'única excepció de la terra mateixa. No obstant això, si s'ha d'admetre que aquest moviment no era peculiar del cel, sinó que la terra girava d'oest a est, i si això es considerava acuradament pel que fa a l'aparent sortida i posta del sol, la lluna i les estrelles, es descobriria que aquesta era la situació real.
Nicolau Copèrnic, Les revolucions dels cossos celestials, 1543
El passatge es pot utilitzar com a prova que Copèrnic es diferenciava dels filòsofs naturals aristotèlics tradicionals del seu temps perquè suggeria que",El cosmos és esfèric,la Terra és esfèrica,El cosmos és geostàtic,la Terra no és estacionària,D
"Determineu la concentració d'H+(aq) en solució de fenol 1,0 M, C6H5OH. (El Ka per al fenol és 1 × 10^-10.)",1 × 10^-10 M,1 × 10^-9 M,1 × 10^-3 M,1 × 10^-5 M,D
Quin dels següents factors es consideraria un factor d'atracció per Riva a l'hora de considerar un trasllat de l'Índia als Estats Units?,Pobresa abjecta,Millor ocupació i salaris més alts,El sistema de castes de l'Índia,Violència al seu barri,B
"En comparació amb els partits polítics de països com Anglaterra i Israel, que tenen sistemes multipartidistes, els partits polítics nord-americans són",menys interessat a influir en el resultat de les eleccions,menys clarament identificat amb ideologies polítiques consistents,menys eficaç per recaptar diners dels partidaris polítics,més capaç de reflectir els objectius de tota la seva circumscripció,B
"Un nombre, arrodonit al miler més proper, és de 47.000. Quin número podria ser el número que es va arrodonir?","46,295","46,504","47,520","47,924",B
"Un tanc té forma de prisma triangular. Si la base triangular té una superfície de 116 peus quadrats i el dipòsit té 30 peus d'alçada, quanta aigua contindria el dipòsit quan estigui ple?",1725 peus^3,1740 peus^3,3480 peus ^3,6960 peus^3,C
"La tensió induïda en un inductor es representa com,",producte de la seva inductància i corrent a través d'ella.,relació entre la seva inductància i el corrent a través d'ella.,relació del corrent a través d'ell amb la seva inductància.,producte de la seva inductància i velocitat de canvi de corrent a través d'ella.,D
Quines de les següents característiques són generalment consistents amb la violació de cites?,Ús excessiu de la força,premeditat,Motivació sexual,implica l'ús d'una arma,C
Trobeu la longitud de la corba y = ln x entre els punts on y = 1/2 i y = 1.,0.53,0.86,1.18,1.36,C
Find $-\dfrac{1}{-3}\cdot\cfrac{1}{~\frac{1}{-3}~}.$,1,-1,0,2,B
Quina perspectiva psicològica va ser més popular al tombant del segle XX a Europa occidental?,Neurociència,evolutiu,Conductista,Psicoanalítica,D
És probable que la indefensió apresa estigui directament relacionada amb,l'efecte Barnum.,Biaix egoista.,un locus extern de control.,Consideració positiva incondicional.,C
La investigació de Garcia i Koelling sobre les aversions apreses va establir que quins dels següents parells UCS i CS són els més poderosos i apresos més ràpidament?,Realitzar una tasca i rebre una recompensa alimentària,nàusees i menjar o beguda,Moviment i xoc,Càstigs i recompenses,B
"Part de l'aigua de Mart està congelada al sòl i als casquets polars i una altra es va perdre a causa de l'extracció del vent solar, però es creu que gran part de l'aigua original es va perdre a través d'un altre mecanisme. Què ha passat amb aquesta aigua ""perduda""?",Va ser despullat pel camp magnètic quan va disminuir ràpidament de força,Es va trencar en hidrogen i oxigen per llum ultraviolada i l'hidrogen es va perdre per fuita tèrmica,era consumida per una civilització de marcians assedegats,Es va vaporitzar durant un període d'intens vulcanisme i es va perdre a l'espai a través de la fuita tèrmica,B
"Viatjant a una velocitat inicial d'1,5 × 10^6 m/s, un protó entra en una regió de camp magnètic constant de magnitud 1,5 T. Si el vector velocitat inicial del protó fa un angle de 30° amb el camp magnètic, calculeu la velocitat del protó 4 s després d'entrar al camp magnètic.","5,0 × 10^6 m/s","7,5 × 10^6 m/s","1,5 × 10^6 m/s","3,0 × 10^6 m/s",C
"L'energia alliberada de la descomposició dels fosfats d'alta energia, ATP i fosfocreatina, pot mantenir l'exercici d'esforç màxim durant aproximadament :",1-2 segons.,5-10 segons.,30-40 segons.,50-60 segons.,B
"En un circuit en sèrie, si el corrent d'una làmpada és de 2 A, el corrent de la làmpada del costat és","meitat, 1 A",02:00,Depèn de quina làmpada estigui més a prop de la bateria,No hi ha prou informació per dir,B
Quina de les opcions següents té més probabilitats de produir un creixement econòmic més fort al llarg del temps?,Consum més ràpid de recursos naturals.,Majors taxes d'analfabetisme adult.,Una caiguda de l'estoc de béns d'equipament.,Deduccions fiscals per a inversions.,D
"L'economia està en una profunda recessió. En aquest context econòmic, quina de les afirmacions següents sobre política monetària és encertada?",La política expansiva no faria més que empitjorar la recessió.,La política expansiva augmenta molt la demanda agregada si la inversió és sensible a canvis en el tipus d'interès.,La política contractiva és l'estímul adequat per a la inversió i per al consum.,"Si la demanda de diners és perfectament elàstica, la política monetària expansiva pot ser força efectiva.",B
"Les empreses es dediquen a la comptabilitat social a causa de les demandes de _________, per tal d'identificar ________, millorar ___________ i fomentar _________ i ___________","Grups d'interès, Riscos, Gestió de grups d'interès, Rendició de comptes, Transparència","Grups d'interès, Rendició de comptes, Transparència, Riscos, Gestió de grups d'interès","Parts interessades, Rendició de comptes, Riscos, Parts interessades, Gestió de grups d'interès","Grups d'interès, gestió de grups d'interès, transparència, riscos, rendició de comptes",A
És més probable que un impost imposat a un proveïdor es repercuteixi al consumidor en forma d'augment de preus si,L'elasticitat preu de la demanda és molt elàstica.,L'elasticitat preu de la demanda és molt inelàstica.,L'elasticitat preu de la demanda és elàstica unitària.,L'elasticitat salarial de la demanda és molt elàstica.,B
Enunciat 1 | En un grup (ab)^{-2} = b^{-2}a^{-2}. Enunciat 2 | En un grup (ab)^n = a^nb^n.,"Cert, cert","Fals, Fals","Cert, Fals","Fals, Cert",B
Quin és el terme fins a quin punt la competència en un país està influenciada per la competència en altres països?,Comerç internacional,Economia global,Competència global,Globalització,D
"Un programador va escriure el programa a continuació. El programa utilitza una llista de números anomenada numList. El programa està pensat per mostrar la suma dels números de la llista.
 suma ← numList [1]
 PER A CADA VALOR A NUMList
 Suma ← suma + valor
 MOSTRAR SUMA
 Per tal de provar el programa, el programador inicialitza numList a [0 , 1 , 4 , 5]. El programa mostra 10, i el programador conclou que el programa funciona com es pretén. Quina de les següents coses és certa?",La conclusió és correcta; El programa funciona com es pretén.,"La conclusió és incorrecta; El programa no mostra el valor correcte per al cas de prova [0, 1, 4, 5].","La conclusió és incorrecta; L'ús del cas de prova [0, 1, 4, 5] no és suficient per concloure que el programa és correcte.","La conclusió és incorrecta; L'ús del cas de prova [0, 1, 4, 5] només confirma que el programa funciona per a llistes en ordre creixent.",C
Per què Parfit s'oposa a la igualtat?,Argumenta que una societat desigual és inevitable.,"Afirma que donant prioritat a les necessitats dels pobres, podem augmentar la igualtat.",Afirma que cadascú som responsables de la nostra pobresa.,Rebutja del tot la idea d'igualtat.,B
"Aquesta pregunta fa referència a la informació següent.
""De fet, com que tant les fàtues de distingits [erudits] que basen la seva opinió en la raó i la tradició per igual com en el consens de la comunitat sunnita estan d'acord que l'antiga obligació d'extirpació, extermini i expulsió de la innovació maligna ha de ser l'objectiu de la nostra aspiració exaltada, perquè ""el zel religiós és una victòria de la fe de Déu benèfic""; després, d'acord amb les paraules del Profeta (Pau sobre ell!) ""Qui introdueixi la innovació maligna en el nostre ordre ha de ser expulsat"" i ""Qui faci contra el nostre ordre ha de ser expulsat"", l'acció s'ha tornat necessària i exigent...""
Carta del sultà otomà Selim I al xa safàvida Ismail I, 1514
Els safàvides van provocar la ira dels imperis islàmics com l'otomà i el mogol, principalment perquè els safàvides",eren un imperi expansionista situat geogràficament entre altres dos expansionistes,va rebutjar els principis centrals de l'islam,va esclavitzar els cristians i els va convertir en combatents safàvides,Ismaïl es va proclamar califa,A
"Aquesta pregunta fa referència a la informació següent.
Camino al costat de la columna, pregunto què passa.
Un soldat diu simplement: ""Cada dia criden més.
""Alguns de nosaltres vam ser enviats al nord al riu Groc als quinze anys,
I ara, a les quaranta, ens dirigim a les guarnicions de l'oest.
En la nostra primera excursió, el cap del poble ens va haver de lligar les bandannes.
Quan vam tornar, els cabells eren blancs, però encara hi havia més malestar.
Les guarnicions frontereres corren amb sang, suficient per omplir un oceà,
Però les ambicions territorials de l'Emperador Marcial encara no han crescut.
Als cent districtes a l'est de les muntanyes, al llarg de la terra de Han,
Hi deu haver deu deu ser deu mil pobles que ara s'esbargeixen infestats.
Fins i tot si les dones són prou fortes per manejar una aixada i llaurar,
Els cultius creixen de totes maneres, els camps són tot un desastre.
És el més difícil per als homes Shanxi, amb la seva reputació com a lluitadors:
Estan arrodonits com gossos o gallines, tots els mascles impressionats.
""Però senyor, encara que és bo de vostè preguntar,
Queixar-se no forma part de la tasca del soldat.
Només ens pot tremolar el cap. Agafeu aquest hivern:
Les tropes de Shanxi mai van ser enviades a casa.
Els oficials del districte exigeixen l'impost sobre la terra,
Però, d'on sortirà? D'on no n'hi ha, no se'n pot traure!
Sincerament, crec que és mala sort tenir un fill ara,
És millor tenir una filla: almenys es pot casar
I viure amb els veïns del costat.
Però un fill acabarà estirat en alguna praderia llunyana"".
Du Fu, ""Balada dels carros de l'exèrcit"", ca. 750 C.E.
El poema evidencia quin dels següents aspectes respecte a les relacions de gènere en la societat Tang?",Les relacions confucianes entre marit i muller eren encara fortes en la societat Tang.,Els rescriptes imperials emfatitzaven el naixement de fills capaços sobre filles per complir les quotes de reclutament.,El treball agrícola podia ser compartit tant per dones com per homes.,Les relacions tradicionals xineses de gènere es van invertir durant el regnat de l'emperadriu Wu Zetian.,C
"En el pla xy, la gràfica de x^(log y) = y^log x és",El primer quadrant obert,una corba tancada,Un raig al primer quadrant obert,un sol punt,A
Quins dels següents països van emetre més CO2 per càpita el 2017?,El Japó,Canadà,Rússia,L'Iran,B
Què és un atac de repetició?,Quan l'atacant respon a un missatge que li ha enviat el sistema,"Un atac que es repeteix contínuament, sondejant una debilitat","Un atac que utilitza els propis missatges del sistema i, per tant, no es pot defensar",L'atacant reenvia un missatge capturat i el lloc accepta el seu i respon a favor de l'atacant,D
El fet que la freqüència d'absorció infraroja del clorur de deuteri (DCl) es desplaci de la del clorur d'hidrogen (HCl) es deu a les diferències en la seva,Distribució d'electrons,Moment dipolar,constant de força,Massa reduïda,D
"L'eficiència quàntica d'un detector de fotons és 0,1. Si s'envien 100 fotons al detector, un darrere l'altre, el detector detectarà fotons","una mitjana de 10 vegades, amb una desviació RMS d'aproximadament 4","una mitjana de 10 vegades, amb una desviació RMS d'aproximadament 3","una mitjana de 10 vegades, amb una desviació RMS d'aproximadament 1","una mitjana de 10 vegades, amb una desviació RMS d'aproximadament 0,1",B
Quin dels següents conjunts de cadenes de bits NO es pot descriure amb una expressió regular?,Totes les cadenes de bits el nombre de zeros de les quals és múltiple de cinc,Totes les cadenes de bits que comencen amb un zero i acaben amb un,Totes les cadenes de bits amb un nombre parell de zeros,Totes les cadenes de bits amb més d'uns que zeros,D
Les adaptacions de les plantes per minimitzar la pèrdua d'aigua en ambients amb altes temperatures inclouen quina de les següents?,Nombrosos estomes,Cutícules fines,Espines en lloc de fulles,Grans relacions superfície-volum,C
Les mutacions són errors en l'ADN que:,sempre són perjudicials.,només es produeixen en presència de cancerígens.,Augmentar el creixement tumoral.,ocorren espontàniament a un ritme baix.,D
Quina de les següents coses és certa per a l'hipotiroïdisme?,Pèrdua de pes,Mixoedema pretibial,Un nivell de TSH elevat,Aversió als llocs càlids,C
"Els valors de taxació de les cases d'una ciutat tenen una mitjana de 125,000 dòlars amb una desviació estàndard de 23,000 dòlars. A causa d'un nou contracte de professors, el districte escolar necessita un 10% addicional en fons en comparació amb l'any anterior. Per recaptar aquests diners addicionals, la ciutat ordena a l'oficina d'avaluació que augmenti tots els valors de la casa taxada en 5.000 dòlars. Quina serà la nova desviació estàndard dels valors de taxació dels habitatges a la ciutat?","$ 23,000 ","$ 25,300 ","$ 28,000 ","$ 30,300 ",A
" En la seva discussió sobre la discriminació en la guerra, Valls suggereix que",No hi ha diferència entre combatents i no combatents.,La diferència entre combatents i no combatents és una qüestió de grau.,La diferència entre combatents i no combatents és categòrica i clara.,"El ""terrorisme"" s'ha de definir com a violència indiscriminada.",B
" Segons Nussbaum, tractar algú com un objecte és",suficient per a l'objectivació sexual.,necessari per a la cosificació sexual.,no és necessari per a la cosificació sexual.,tot això.,C
"Per a quin d'aquests dos escenaris el personatge principal (que utilitza I/me/my) fa alguna cosa clarament moralment incorrecta, segons els estàndards morals ordinaris als EUA a partir del 2020? Escenari 1 | Mentre els meus pares dormien, vaig sortir a córrer. Escenari 2 | Vaig abocar detergent a la rentadora plena de roba del meu company de pis.","Malament, incorrecte","Malament, No està malament","No està malament, Malament","No està malament, no està malament",D
"Per a quin d'aquests dos escenaris el personatge principal (que utilitza I/me/my) fa alguna cosa clarament moralment incorrecta, segons els estàndards morals ordinaris als EUA a partir del 2020? Escenari 1 | De vegades intento dir la veritat, tret que em posi en problemes. Escenari 2 | Vaig besar la meva xicota a l'espectacle de màgia.","Malament, incorrecte","Malament, No està malament","No està malament, Malament","No està malament, no està malament",B
"Per a quin d'aquests dos escenaris el personatge principal (que utilitza I/me/my) fa alguna cosa clarament moralment incorrecta, segons els estàndards morals ordinaris als EUA a partir del 2020? Escenari 1 | Vaig córrer per sobre de la catifa fresca amb una tallagespa. Escenari 2 | Vaig orinar a la mà per poder provar-ne la infecció.","Malament, incorrecte","Malament, No està malament","No està malament, Malament","No està malament, no està malament",A
"Per a quin d'aquests dos escenaris el personatge principal (que utilitza I/me/my) fa alguna cosa clarament moralment incorrecta, segons els estàndards morals ordinaris als EUA a partir del 2020? Escenari 1 | Vaig veure el famós Elton John fora d'una sala de concerts i li vaig fer una foto sense preguntar-li. Escenari 2 | Vaig denunciar un altre guàrdia que s'està colant estupefaents en una presó i els ven als presos.","Malament, incorrecte","Malament, No està malament","No està malament, Malament","No està malament, no està malament",D
"Per a quin d'aquests dos escenaris el personatge principal (que utilitza I/me/my) fa alguna cosa clarament moralment incorrecta, segons els estàndards morals ordinaris als EUA a partir del 2020? Escenari 1 | Vaig colpejar en els meus descansos per perdre la pilota quan entrava a la carretera. Escenari 2 | Vaig ensenyar als meus fills a tocar el xilòfon.","Malament, incorrecte","Malament, No està malament","No està malament, Malament","No està malament, no està malament",D
"Per a quin d'aquests dos escenaris el personatge principal (que utilitza I/me/my) fa alguna cosa clarament moralment incorrecta, segons els estàndards morals ordinaris als EUA a partir del 2020? Escenari 1 | Quan es va trencar el congelador del meu restaurant, vaig servir la carn calenta tot i que sabia que era molt insegura. Escenari 2 | Vaig decidir iniciar un incendi al bosc.","Malament, incorrecte","Malament, No està malament","No està malament, Malament","No està malament, no està malament",A
"Major consum de llet
",S'ha informat que s'associa amb una major incidència de fractura i una major mortalitat en alguns estudis,Durant la pubertat sembla estar associat amb una major densitat mineral òssia en la vida posterior,S'associa consistentment amb una menor taxa de fractures,En els països amb major taxa de fractura suggereix que el consum de llet és beneficiós per a l'esquelet.,A
"Quina de les següents afirmacions sobre el metabolisme de la glucosa és correcta?
",El glucagó augmenta la taxa de glucòlisi,La glicòlisi requereix NADP+,"En la glucòlisi, la glucosa es divideix en dos productes de tres carbonis",El producte final de la glicòlisi en els glòbuls vermells és el piruvat,C
Nagel afirma que el problema de la sort moral està estretament relacionat amb el problema de:,l'existència de Déu.,llibertat de la voluntat.,egoisme psicològic.,universals.,B
"Segons Singer, el compliment del seu principi requereix:","Canvis modestos en els nostres hàbits personals, però no en el conjunt de la nostra societat.","canvis modestos en els nostres hàbits personals, així com en la societat.","canvis dràstics en els nostres hàbits personals, però no en la nostra societat.",canvis dràstics tant en els nostres hàbits personals com en la nostra societat.,D
Quina de les següents és l'última ocupada per éssers humans?,Nova Guinea,Austràlia,Nova Zelanda,Timor,C
Civilització de Núbia:,precedí i esperonà l'auge de la cultura egípcia.,va ser el resultat de la colonització mesopotàmica al sud.,"desenvolupat en resposta, però no a imitació, de la cultura egípcia.",no va tenir contactes amb cultures veïnes.,C
