Question,A,B,C,D,Answer
"Турак жай корпорациясы жер баракчасына ээ болгон. Турак жай корпорациясы жерди 100 лотко бөлүү жана баракчада турак жай коомчулугун түзүү боюнча өнүктүрүү планын даярдады. Келишимдер декларациясы келишимдер арасында келтирилген регламенттерди жана чектөөлөрдү башкарууга жана аткарууга мүмкүндүк берген административдик субъект болгон үй ээлеринин бирикмеси болгон. Келишимдер декларациясында көрсөтүлгөн чектөөлөрдүн биринде мындай деп жазылган: ""Мүлктүн кайсы бир бөлүгүнө эч качан курулбайт, уруксат берилбейт, же малды, атактууну же рухтуу ликер-арактерди сатуу же өндүрүү үчүн салон же орун катары иштелип чыккан же колдонулган кандайдыр бир түзүлүш сакталбайт"". Келишимдер декларациясы тийиштүү түрдө жазылып, мугалим иштеп чыгууда 62 лот сатып алганда алган иштерине киргизилген. Мугалим ошол замат өзүнүн ишин жазды. Мугалим үйүн китепканачыга бир жылга ижарага алган. Ижарага келишимдер декларациясындагы жана мугалимдин ишиндеги чектөөлөр менен бирдей чектөөлөр киргизилген. Китепканачы ошол замат жумалык ""сааттан кийин"" кечелеринде үй-жайда ликер-арак сата баштады. Үй ээлеринин бирикмеси китепканачыга зыян келтиргени үчүн иш-аракет кылууда талап коёт. Китепканачы үчүн төмөнкүлөрдүн кайсынысы мыкты аргумент болуп саналат?",Спенсердин иши боюнча эреже китепканачынын жооптуу болушуна тоскоолдук кылат.,Китепканачы үй ээлеринин бирикмеси менен келишим түзүүдө эмес.,Китепканачы мугалим менен мүлктү жашыруун эмес.,Жакын жердеги башка лоттор коммерциялык максатта колдонулат.,B
"Колледжге кабыл алынууну ынталандыруу максатында, мамлекеттик колледждерде толук убакыттагы студенттер болуп эсептелгендер үчүн мамлекеттик салыктар үчүн 200 АКШ долларынан салыктан бошотуу каралган. Жарым убакытка катышкан аял студенттерге дагы эле $100 салыктан бошотууга уруксат берилет, ал эми жарым убакытка катышкан эркек студенттерге мындан ары салыктан бошотууга уруксат берилбейт. Төмөнкүлөрдүн кайсынысы жарым убакыт окууга кабыл алынган студенттер үчүн мамлекеттик салыктан бошотууга байланыштуу конституциялык мыйзамдын туура эрежесин так жыйынтыктайт?",Салыктан бошотуу тийиштүү процесстен баш тартуу катары жараксыз болмок.,Салыктан бошотуу бирдей коргоо пунктун бузгандык катары жараксыз болуп калмак.,Салыктык чара тийиштүү процесстин маңыздуу чөйрөсүндөгүдөй сакталат.,Салык чаралары бир муниципалитеттин жеке адамдардын ар кандай класстарына тең эмес салык салуу бийлигинин чегинде сакталат.,B
"Бул юрисдикцияда төмөнкү кылмыш мыйзамы күчүндө: ""Мындай жүрүм-турум учурунда, психикалык оорунун же кемчиликтин натыйжасында, жүрүм-турумунун туура эместигин баалоого же жүрүм-турумун мыйзам талаптарына ылайык келтирүүгө олуттуу жөндөмдүүлүгү жок болсо, адам кылмыштуу жүрүм-турум үчүн жооптуу эмес"". Бир күнү түштөн кийин айыпталуучу беш жашар инисин төрөп жаткан. Алар сыртта кармоо ойноп жатканда, айыпталуучу допты инисинин башынын үстүнө ыргытып, көчөгө ыргытты. Инстинкт менен бир тууганы доптун артынан чуркап, бирок науа үстүнөн чуркап, көчөгө жыгылып кетти. Ал чуркап баратканда, иниси бутун катуу бүктөп, туруштук бере алган жок. Бир нече убакыт өткөндөн кийин чоң таштанды ташуучу машине артка чегинип, бир тууганынын үстүнөн чуркап, аны өлтүрдү. Айыпталуучу инисинин кыйынчылыгын көрсө да, аны куткаруу үчүн эч кандай күч-аракет жумшаган эмес. Андан кийин айыпталуучуга өз ыктыяры менен киши өлтүрүү айыпталды. Сот учурунда айыпталуучу бир тууганынын таштанды ташуучу машинеге жакын түшүп калганын көргөндө ушунчалык дүрбөлөңгө түшкөнүн жана өтө кеч болуп калганга чейин кыймылдай албай турганын күбөлөндүрдү. Айыпталуучунун күбөлөндүрүүсүнөн кийин эксперт күбө коргоо үчүн айыпталуучу сүрөттөгөн түрдөгү реакциялар чындап үрөй учурарлык окуя болгондо өзгөчө эмес экенин күбөлөндүрдү. Эгерде соттор айыпталуучунун жана анын эксперттик күбөсүнүн күбөлүгүнө ишенсе, айыпталуучунун мыкты коргоосу төмөнкүлөрдүн кайсынысы?",Айыпталуучу убактылуу акылсыздыктан азап чегип жаткан.,Айыпталуучуда кылмышты ишке киргизүү үчүн зарыл болгон керектүү психикалык абал жок.,Айыпталуучунун иш-аракет кылбагандыгы өз ыктыяры менен болгон эмес.,Айыпталуучунун кылмыш жоопкерчилиги жүк ташуучу айдоочунун жоопкерчилигинен жогору турган.,C
"Жазууга талапкер мексикалык-америкалык болуп саналат жана ал шайлоодо жеңишке жетиш үчүн мексикалык сайлаучылардын көп катышуусу керек деген ойдо. Натыйжада, анын кампания менеджери, ар бир катталган мексикалык сайлаучуга ал чуркап бараткан талапкердин аты-жөнүн жана офисин көтөргөн көз жаш жапсырмасын жөнөтүүнү чечет. Көптөгөн түпкүлүктүү Мексика эли англис тилин окууну жана жазууну жакшы билгендиктен, кампаниянын менеджери сайлаучылардын көбү талапкердин атын жана офисин бюллетенге жазууда кыйынчылыкка кабылат деп эсептейт. Натыйжада кампаниянын менеджери сайлаучуларды бюллетенге жапсырмаларды кантип колдонуу керектиги жөнүндө маалымат берүү үчүн кеңири медиа-кампания жүргүздү. Шайлоого беш ай калганда, шайлоонун кызматкери талапкердин үгүт комитетине көз жаш жапсырмаларынын мамлекеттик мыйзамга ылайык келбей турганын маалымдайт. Шенеунік өзүнүн катында мамлекеттик шайлоо кызматкерлери потенциалдуу сайлаучулар үчүн талапкердин атын сыя менен жазуу зарыл деген ойдо экенин түшүндүрөт. Ошондуктан ал жапсырмалар мыйзамдуу талаптарга ылайык келбейт деген жыйынтыкка келди. Үч жумадан кийин талапкер федералдык округдук сотто мамлекеттик шайлоо кызматкерлерине каршы арыз берип, алардын мамлекеттик мыйзамды түшүндүрүүсү АКШнын Конституциясына доо кетирет деп ырастаган. Төмөнкүлөрдүн кайсынысы аныкталса, шайлоо кызматкеринин мыйзамды түшүндүрмөсүн колдогон эң күчтүү конституциялык аргументти көрсөтөт?","Англис тилин үйрөнбөгөн, катталган мексикалык америкалык сайлаучылардын арасында шайлоочулардын катышуусу акыркы шайлоолордо бүтүндөй мамлекеттик жалпы санынын 1%дан азын түздү.",Мамлекеттик мыйзам ар бир добуш берүү кабинасын добуш жазууну жеңилдетүү үчүн сыя калем менен жабдылышын талап кылат.,"Көп сандаган жазуу үнү, адатта, бардык добуштарды эсептөө үчүн керектүү убакытты көбөйтсө, мындай добуштарды бирдиктүү түрдө берүү зарыл.",Алдын ала даярдалган жапсырмалар менен добуш берүүдөгү алдамчылыктын потенциалы бир кыйла жогору.,D
"Бир киши шаарда жаңы курулган мейманкананын ээси болгон. 15-март күнү ал киши мейманкана жабдууларынын дистрибьютору болгон сатуучудан телефон чалып калган. Сатуучу кишиге өзүнүн мейманканасы үчүн 1000 өрт өчүргүчтү сатууну сунуштады. Сатуучу адамга өрт өчүргүчтөрдүн наркы жеткирилгенден кийин 90 күн өткөндөн кийин төлөнүүчү $35,000 (же ар бири 35 доллар) болорун айтты. Сатуучу өрт өчүргүчтөрдү 15-апрелден кеч эмес орнотууга убада берди. 16-март күнү адам сатуучуга телефон чалып, сунушту кабыл алган. Кийинки күнү адам сатуучуга төмөнкү жадынаманы жөнөттү: ""Орнотулгандан жети күн өткөндөн кийин накталай төлөм үчүн 15 пайыздык арзандатуу алуу сунуш кылынат"". Сатуучу адамдын кат-катын 20-март күнү алган. 1-апрелде сатуучу адамга телеграмма жөнөтип, мындай деди: ""Биздин күчүндө аткарылуучу келишим жок экени айкын. Мен 15-апрелде же башка убакта өрт өчүргүчтөрдү жеткирбейм. ""Адам келишимди бузгандыгы үчүн сатуучуга каршы костюм алып келет. Сатуучу УККнын алдындагы алдамчылыктын мыйзамын коргоону ырастайт. Төмөнкүлөрдүн кайсынысы сатуучунун коргоосуна байланыштуу эң так билдирүү болуп саналат?","Сатуучунун коргоосу жарактуу, анткени адамдын жадынамасы келишим түзүлгөнүн көрсөтүү үчүн жетиштүү болгон эмес.","Сатуучунун коргоосу жарактуу, анткени адамдын жадынамасы сатуучунун оозеки сунушунун шарттарына карама-каршы келген.","Сатуучунун коргоосу жарактуу эмес, анткени сатуучу акылга сыярлык убакыттын ичинде адамдын жадынамасына жооп бере алган жок.","Сатуучунун коргоосу жарактуу эмес, анткени УККга ылайык соодагерлердин ортосундагы келишимдерде алдамчылык мыйзамы колдонулбайт.",A
"Эки шаарды бириктирүү сунушу бюллетенге коюлганга чейин мамлекеттик башкы прокурор бул чара, анын ою боюнча, мыйзамдуу же конституциялык жоболорду бузбагандыгы жөнүндө консультативдик пикир чыгарган. Андан кийин сунуш бюллетенге коюлду жана эки шаарчадагы сайлаучулар тарабынан басымдуу түрдө кабыл алынды. Шайлоодон кийин, бирок бириктирүү расмий түрдө жүргүзүлгөнгө чейин, шаарлардын биринен эки салык төлөөчү бириктирүүгө кошулуу үчүн арыз башташты, сунуштун конституциялуулугуна кол салат. Арыз мамлекеттик жогорку сотко жетти жана мамлекеттик жана федералдык мыйзам боюнча конституциялык деп табылган. Талапкерлер азыр бул өтүнмөнү АКШнын Жогорку соту карап чыгууга умтулуп өтүнмө беришет. Сот мүмкүн","бул ишти укпайт, анткени ал көз карандысыз мамлекеттик негиздер боюнча чечилген.","ишти укпайт, бирок аны федералдык округдук сотко алып келиши мүмкүн.","тиешелүү федералдык маселелер угуу, бирок мамлекеттик маселе боюнча чечим чыгаруудан баш тартуу.",мамлекеттик башкы прокурор тарабынан берилген консультативдик пикирге таянуу жана анын баалуулугу боюнча ишти укпай коюу.,A
"Полицияга ишенимдүү маалыматчыдан бир кишинин үйүнөн кокаин сатканы тууралуу кеңеш берилген. Андан кийин офицерлер магистрантка издөө ордерин чыгарууга мүмкүн болгон себепти көрсөткөн жагдайларды көрсөткөн күбөлүктү беришти. Магистрант адамдын дареги боюнча баңгизат издөө ордерин чыгарды. Полиция кызматкерлери адамдын үйүнө барып, эшиктин коңгуроосун чалышты. Эч ким жооп бергенде, полиция кирип, турак жайга кирди. Алар биринчи кабаттагы бөлмөлөрдү издеп таап, эч кандай айыптуу далил таппады, анан сыртка чыгып, турак жайдын экинчи кабатына алып баруучу өзүнчө кирүүнү байкашкан. Алар тепкичке көтөрүлүп, үстүнкү бөлмөгө киришти. Бөлмөнүн ичинде офицерлер көйнөктө жаткан кокаиндин сакталышын табышты. Офицерлер уктоо бөлмөсүн издөөнү улантып жатканда, айыпталуучу бөлмөгө кирди. Полиция айыпталуучудан анын адам экенин сурады. Айыпталуучу өзүн аныктап, полицияга алардын уктоо бөлмөсүндө экенин жана турак жайдын экинчи кабатын ээлегенин айтты. Айыпталуучу адам биринчи кабатта жашаганын жана анын турак жайлары айыпталуучунун үй-жайынан бөлүнүп калганын түшүндүрдү. Ошентсе да айыпталуучу камакка алынып, кокаин кармагандыгы үчүн айыпталды. Айыпталуучу кокаинди далилдерге кабыл алуудан алып салуу жөнүндө өтүнүч менен кайрылган. Айыпталуучунун өтүнүчү болушу керек","берилген, анткени ордерде жоопкердин аты аталбаган.","берилген, анткени ордерде издөөгө тийиш аймак өзгөчөлүк менен көрсөтүлгөн эмес.","четке кагылды, анткени полиция айыпталуучунун турак жайына киргенде адамдын жашаган жерин издеп жатканына акылга сыярлык түрдө ишенген.","жокко чыгарылган, анткени ордер жарактуу болгон жана мүмкүн болгон себеп менен берилген.",C
"Жаңыртуу иштери үчүн эки жумалык жабылгандан кийин супермаркет кайрадан ачылды. Кайра ачылган күнү эртең менен бир аял соода-сатык жүргүзүп жатканда, күтүлбөгөн жерден жыгылып, буту сынган. Андан кийин аял супермаркетке жеке жаракат алгандыгы үчүн талап-арыз берген. Анын костюминде аял жолдун биринде жаткан боёк шелектин үстүнөн чуркап кеткенин айткан. Сот учурунда аял дагы бир кардарга чалып, соода-сатык жүргүзгөндө бир дүрбөлөң укканын, бурулуп, аялдын жерге жыгылып калганын көргөнүн күбөлөндүргөн. Ошондой эле аялдын бутунан бир нече фут алыстыкта жаткан бош боёк шелек көргөнүн күбөлөндүрдү. Айкаш текшерүүдө кардар супермаркеттин адвокаты менен аргументтик алмашууга киришти. Аялдын кулап кетишине эмне себеп болгону жөнүндө өзүнүн оюн сураганда, кардар күбөлөндүрүп: ""Ал шелекке чуркап кеткендиктен жыгылып кетти"", - деп күбөлөндүрдү. Бирок ал айкаш текшерүүдө аялдын шелек менен саякаттаганын көрбөгөнүн мойнуна алды. Андан кийин супермаркеттин адвокаты кардардан төмөнкү суроону берди: ""Эгер аялдын шелекке саякатын көрбөсөңөр, анын анын айынан жыгылып калганын кайдан билесиңер?"" Кардар мындай деп жооп берди: ""Анткени мени менен соода-сатык жүргүзгөн кызым кийинчерээк аялдын шелектин үстүнөн саякаттап баратканын көргөнүн айтты"". Супермаркеттин адвокаты кардардын акыркы жообун сокку үчүн көчүп барат. Эгерде соттун судьясы айыпталуучунун өтүнүчүн жокко чыгарып, кардардын жообун турууга уруксат берсе, анда бул, кыязы, себеби",кардардын жообу супермаркеттин адвокатынын суроосу менен чакырылган.,кардардын жообу өз алдынча билимге негизделди.,кардардын жообу жакында кабыл алынган билдирүү болду.,кардардын жообу азыркы мааниде таасир калтырган.,A
"Азыркы учурда бир фермер "" А. "" деп белгиленген жердин бир бөлүгүнүн рекордунун ээси болуп саналат, бул тоодогу кошуна эки касиеттен жогору. Фермер - тоо боюндагы ""А""дан төмөн жайгашкан ""В"" посылкасынын ээси. 2000-жылы жердин эки посылкасына да ээ болгон фермер жеке дренаж системасын курган. Бул система жер астындагы конвейерден турган, ал жердин эки посылкасына да созулган. ""А"" посылкасынан канализация система аркылуу тоонун түбүндө жайгашкан муниципалдык канализацияга чейин агызылган. 2005-жылы фермерге ""В"" посылкасын сатты. Фермердин ишинде фермердин дренаж системасы жөнүндө эч нерсе айтылбаган. Посылкалардын ар биринде жайгашкан чоң ранчо стилиндеги үйлөр тиешелүү ээлери ээлеген. Акыркы күндөрдө канализацияны агызуу ""Б."" посылкасы аркылуу жагымсыз жыт чыгара баштады, натыйжада фермер дренаж системасынын кесепетинен келген зыянды сурап, фермерди кылмышка дуушар кылды. Сот өкүмү үчүн болушу керек","фермердин ишинде фермердин жерди пайдалануусун чектеген келишимдер жок болгондуктан, фермердин иши камтылган эмес.","фермер, анткени фермердин иш-аракеттеринин туура себеби кылмыш эмес, нюанс үчүн болмок.","фермер, анткени дренаж системасы мыйзам боюнча талапкердин зыяндуулугунун жакын себеби болгон.","фермер, анткени фермердин өз жерин башкасына зыян келтирген жол менен жакшыртууга укугу жок болчу.",B
