Question,A,B,C,D,Answer
"ఒక శ్రేణి వలయంలో, ఒక దీపంలోని విద్యుత్ 2 A అయితే, దాని పక్కన ఉన్న దీపంలోని విద్యుత్ ప్రవాహం","సగం, 1 ఎ",2:00 AM,ఏ ల్యాంప్ బ్యాటరీకి దగ్గరగా ఉంటుందనే దానిపై ఆధారపడి ఉంటుంది.,చెప్పడానికి తగినంత సమాచారం లేదు,B
ఈ క్రింది వాటిలో ఏది కాలక్రమేణా బలమైన ఆర్థిక వృద్ధిని ఉత్పత్తి చేసే అవకాశం ఉంది?,సహజవనరుల వేగవంతమైన వినియోగం.,వయోజన నిరక్షరాస్యత అధికం.,పడిపోతున్న క్యాపిటల్ గూడ్స్ స్టాక్.,ఇన్వెస్ట్మెంట్ ట్యాక్స్ క్రెడిట్స్..,D
ఆర్థిక వ్యవస్థ తీవ్ర మాంద్యంలో ఉంది. ఈ ఆర్థిక పరిస్థితి దృష్ట్యా ద్రవ్య విధానానికి సంబంధించి ఈ క్రింది ప్రకటనలలో ఏది ఖచ్చితమైనది?,విస్తరణ విధానం మాంద్యం మరింత తీవ్రతరం చేస్తుంది.,వడ్డీ రేటులో మార్పులకు పెట్టుబడి సున్నితంగా ఉంటే విస్తరణ విధానం మొత్తం డిమాండ్ను బాగా పెంచుతుంది.,"పెట్టుబడులకు, వినియోగానికి సంకోచ విధానం సరైన ఉద్దీపన.",డబ్బుకు డిమాండ్ పూర్తిగా స్థితిస్థాపక విస్తరణ ద్రవ్య విధానం చాలా ప్రభావవంతంగా ఉండవచ్చు.,B
"________ గుర్తించడానికి, ___________ మెరుగుపరచడానికి మరియు _________ మరియు ___________ ప్రోత్సహించడానికి _________ నుండి వచ్చే డిమాండ్ల కారణంగా వ్యాపారాలు సోషల్ అకౌంటింగ్ లో పాల్గొంటాయి","వాటాదారులు, రిస్క్ లు, వాటాదారుల నిర్వహణ, జవాబుదారీతనం, పారదర్శకత","వాటాదారులు, జవాబుదారీతనం, పారదర్శకత, రిస్క్ లు, వాటాదారుల నిర్వహణ","వాటాదారులు, జవాబుదారీతనం, రిస్క్ లు, వాటాదారులు, వాటాదారుల నిర్వహణ","వాటాదారులు, వాటాదారుల నిర్వహణ, పారదర్శకత, ప్రమాదాలు, జవాబుదారీతనం",A
సరఫరాదారునిపై విధించిన పన్ను ధర పెరుగుదల రూపంలో వినియోగదారుడికి బదిలీ అయ్యే అవకాశం ఉంది.,డిమాండ్ యొక్క ధర స్థితిస్థాపకత చాలా స్థితిస్థాపకత కలిగి ఉంటుంది.,డిమాండ్ యొక్క ధర స్థితిస్థాపకత చాలా అస్థిరంగా ఉంటుంది.,డిమాండ్ యొక్క ధర స్థితిస్థాపకత యూనిట్ స్థితిస్థాపకత.,డిమాండ్ యొక్క వేతన స్థితిస్థాపకత చాలా స్థితిస్థాపకంగా ఉంటుంది.,B
ప్రకటన 1 | ఒక సమూహంలో (ab)^{-2} = b^{-2}a^{-2}. ప్రకటన 2 | ఒక సమూహంలో (ab)^n = a^nb^n.,"నిజం, సత్యం","అబద్ధం, తప్పు","నిజం, అబద్ధం","అబద్ధం, సత్యం",B
ఒక దేశంలో పోటీ ఇతర దేశాలలో పోటీని ఏ మేరకు ప్రభావితం చేస్తుందో ఏ పదం?,అంతర్జాతీయ వాణిజ్యం[మార్చు],గ్లోబల్ ఎకనామిక్స్,[మార్చు] ప్రపంచ పోటీ,ప్రపంచీకరణ[మార్చు],D
"ఒక ప్రోగ్రామర్ ఈ కార్యక్రమాన్ని క్రింద వ్రాశాడు. ప్రోగ్రామ్ న్యూమ్ లిస్ట్ అని పిలువబడే సంఖ్యల జాబితాను ఉపయోగిస్తుంది. ఈ ప్రోగ్రామ్ జాబితాలోని సంఖ్యల మొత్తాన్ని ప్రదర్శించడానికి ఉద్దేశించబడింది.
 మొత్తం ← సంఖ్యా జాబితా [1]
 సంఖ్యా జాబితాలోని ప్రతి విలువ కొరకు
 మొత్తం ← మొత్తం + విలువ
 డిస్ ప్లే మొత్తం
 ప్రోగ్రామ్ ను పరీక్షించడానికి, ప్రోగ్రామర్ నం లిస్ట్ ను [0, 1, 4, 5]కు ప్రారంభిస్తాడు. ప్రోగ్రామ్ 10ని ప్రదర్శిస్తుంది, మరియు ప్రోగ్రామ్ అనుకున్న విధంగా పనిచేస్తుందని ప్రోగ్రామర్ నిర్ధారిస్తాడు. ఈ క్రింది వాటిలో ఏది నిజం?",ముగింపు సరైనదే; అనుకున్న విధంగా ప్రోగ్రామ్ పనిచేస్తుంది.,"ముగింపు తప్పు; టెస్ట్ కేస్ కొరకు ప్రోగ్రామ్ సరైన విలువను ప్రదర్శించదు [0, 1, 4, 5].","ముగింపు తప్పు; ప్రోగ్రామ్ సరైనదని తేల్చడానికి టెస్ట్ కేస్ [0, 1, 4, 5] ఉపయోగించడం సరిపోదు.","ముగింపు తప్పు; పరీక్ష కేసును ఉపయోగించడం [0, 1, 4, 5] ప్రోగ్రామ్ పెరుగుతున్న క్రమంలో జాబితాల కోసం పనిచేస్తుందని మాత్రమే నిర్ధారిస్తుంది.",C
పార్ఫిట్ సమానత్వాన్ని ఎందుకు వ్యతిరేకిస్తుంది?,అసమాన సమాజం అనివార్యమని ఆయన వాదించారు.,పేదల అవసరాలకు ప్రాధాన్యమివ్వడం ద్వారా సమానత్వాన్ని పెంచుకోవచ్చని ఆయన పేర్కొన్నారు.,మన పేదరికానికి మనమంతా బాధ్యులమని ఆయన నొక్కి చెప్పారు.,అతను సమానత్వ భావనను పూర్తిగా తిరస్కరిస్తాడు.,B
"ఈ ప్రశ్న ఈ క్రింది సమాచారాన్ని సూచిస్తుంది.
""వాస్తవానికి, హేతువాదం మరియు సంప్రదాయంపై తమ అభిప్రాయాన్ని ఆధారం చేసుకునే ప్రముఖ [పండితుల] ఫత్వాలు మరియు సున్నీ సమాజం యొక్క ఏకాభిప్రాయం రెండూ చెడు ఆవిష్కరణల నిర్మూలన, నిర్మూలన మరియు బహిష్కరణ అనే పురాతన బాధ్యత మన ఉన్నత ఆకాంక్ష యొక్క లక్ష్యం కావాలని అంగీకరిస్తున్నాయి, ఎందుకంటే ""మతపరమైన ఉత్సాహం ప్రయోజకుడైన దేవుని విశ్వాసానికి విజయం""; అప్పుడు ప్రవక్త (స) మాటలకు అనుగుణంగా!) ""మన వ్యవస్థలోకి చెడును ప్రవేశపెట్టిన వారిని బహిష్కరించాలి"", ""మన క్రమానికి విరుద్ధంగా ఎవరు చేసినా బహిష్కరించాలి"", చర్య అవసరం మరియు అత్యవసరంగా మారింది...""
ఒట్టోమన్ సుల్తాన్ మొదటి సెలీం నుండి మొదటి సఫావిద్ షా ఇస్మాయిల్ కు రాసిన లేఖ, 1514
సఫావిదులు ఒట్టోమన్ మరియు మొఘల్ సామ్రాజ్యాల వంటి ఇస్లామిక్ సామ్రాజ్యాల ఆగ్రహాన్ని ప్రధానంగా సఫావిద్ ల కారణంగా ఆకర్షించారు",భౌగోళికంగా మరో రెండు విస్తరణవాదుల మధ్య ఉన్న విస్తరణవాద సామ్రాజ్యం,ఇస్లాం యొక్క కేంద్ర సిద్ధాంతాలను తిరస్కరించింది,"క్రైస్తవులను బానిసలుగా చేసి, వారిని సఫావిద్ యోధులుగా మార్చాడు",ఇస్మాయిల్ తనను తాను ఖలీఫాగా ప్రకటించుకున్నాడు.,A
"ఈ ప్రశ్న ఈ క్రింది సమాచారాన్ని సూచిస్తుంది.
నేను కాలమ్ పక్కన నడుస్తూ, ఏమి జరుగుతోందని అడిగాను.
ఒక సైనికుడు సింపుల్ గా ఇలా అ౦టున్నాడు: ""వాళ్లు ప్రతిరోజూ ఎక్కువ ఫోన్ చేస్తారు.
""మాలో కొందరిని పదిహేనేళ్ల వయసులో ఉత్తరంగా ఎల్లో నదికి పంపారు.
ఇప్పుడు నలభై ఏళ్ళ వయసులో పశ్చిమాన ఉన్న సైనిక స్థావరాలకు వెళ్తున్నాం.
మా మొదటి పర్యటనలో గ్రామపెద్ద మా కోసం మా బండలు కట్టాల్సి వచ్చింది.
మేము తిరిగి వచ్చినప్పుడు, మా జుట్టు తెల్లగా ఉంది, కానీ ఇంకా అశాంతి ఉంది.
సరిహద్దు దళాలు ఒక సముద్రాన్ని నింపేంత రక్తంతో పరిగెత్తుతాయి,
కానీ మార్షల్ చక్రవర్తి ప్రాదేశిక ఆకాంక్షలు ఇంకా నెరవేరలేదు.
పర్వతాలకు తూర్పున ఉన్న వంద జిల్లాలలో, హాన్ భూభాగం అంతటా,
ఇప్పుడు ముంపునకు గురయ్యే గ్రామాలు పది వేల ఉండాలి.
భార్యలు దున్నడం, దున్నడం నిర్వహించేంత దృఢంగా ఉన్నప్పటికీ..
పంటలు అన్ని విధాలుగా పండుతాయి, పొలాలన్నీ అస్తవ్యస్తంగా ఉంటాయి.
పోరాట యోధులుగా వారి ఖ్యాతితో షాన్క్సీ పురుషులకు ఇది చాలా కష్టం:
అవి కుక్కలు లేదా కోళ్ల వలె గుండ్రంగా ఉంటాయి, ప్రతి మగవాడు ఆకట్టుకుంటాడు.
""కానీ సార్, మీరు అడగడం మంచిదే అయినా,
ఫిర్యాదు చేయడం సైనికుడి పనిలో భాగం కాదు.
మనం తలలు మాత్రమే ఊపగలం. ఈ శీతాకాలాన్ని తీసుకోండి:
షాంక్సీ దళాలను ఎప్పుడూ ఇంటికి పంపలేదు.
జిల్లా అధికారులు భూమి పన్ను చెల్లించాలని డిమాండ్ చేస్తున్నారు.
కానీ అది ఎక్కడి నుంచి వస్తుంది? రాయి నుంచి రక్తం రాదు!
ఇప్పుడు కొడుకు పుట్టడం దురదృష్టం అనుకుంటున్నాను.
కూతురు ఉంటే మంచిది: కనీసం పెళ్లి చేసుకోవచ్చు
పక్కింటివారితో కలిసి నివసిస్తారు.
కానీ కొడుకు మాత్రం ఎక్కడో దూరపు గడ్డిమీద పడుకుంటాడు.""
డు ఫూ, ""బల్లాడ్ ఆఫ్ ది ఆర్మీ కార్ట్స్"", క్రీ.శ. 750.
టాంగ్ సమాజంలో లింగ సంబంధాలకు సంబంధించి ఈ క్రింది వాటిలో దేనికి ఈ కవిత సాక్ష్యాన్ని అందిస్తుంది?",టాంగ్ సమాజంలో భార్యాభర్తల మధ్య కన్ఫ్యూషియన్ సంబంధాలు ఇప్పటికీ బలంగా ఉన్నాయి.,సామ్రాజ్య పునర్నిర్మాణాలు నిర్బంధ నియామక కోటాలను నెరవేర్చడానికి కుమార్తెల కంటే సమర్థులైన కుమారుల పుట్టుకను నొక్కిచెప్పాయి.,"వ్యవసాయ పనులను స్త్రీలు, పురుషులు సమానంగా పంచుకోవచ్చు.",సామ్రాజ్ఞి వు జెటియన్ పాలనలో సాంప్రదాయ చైనీస్ లింగ సంబంధాలు తారుమారయ్యాయి.,C
"xy-ప్లేన్ లో, x^(లాగ్ y) = y^log x యొక్క గ్రాఫ్",ఓపెన్ ఫస్ట్ క్వాడ్రంట్,ఒక క్లోజ్డ్ కర్వ్,ఓపెన్ ఫస్ట్ క్వాడ్రంట్ లో ఒక కిరణం,ఒక్క పాయింట్,A
2017 లో ఈ క్రింది వాటిలో ఏ దేశం తలసరి కార్బన్ డయాక్సైడ్ ను అత్యధికంగా విడుదల చేసింది?,జపాన్,కెనడా,రష్యా,ఇరాన్,B
రీప్లే అటాక్ అంటే ఏమిటి?,సిస్టమ్ ద్వారా పంపిన సందేశానికి దాడిదారు ప్రతిస్పందించినప్పుడు,బలహీనత కోసం అన్వేషిస్తూ నిరంతరం పునరావృతమయ్యే దాడి,సిస్టమ్ యొక్క స్వంత సందేశాలను ఉపయోగించే దాడి మరియు తద్వారా దాని నుండి రక్షించబడదు,"దాడి చేసిన వ్యక్తి సంగ్రహించిన సందేశాన్ని తిరిగి పంపుతాడు, మరియు సైట్ దానిని అంగీకరిస్తుంది మరియు దాడి చేసిన వ్యక్తికి అనుకూలంగా స్పందిస్తుంది",D
డ్యూటీరియం క్లోరైడ్ (డిసిఎల్) యొక్క పరారుణ శోషణ ఫ్రీక్వెన్సీ హైడ్రోజన్ క్లోరైడ్ (హెచ్సిఎల్) నుండి మారడానికి వాటిలో తేడాలే కారణం.,ఎలక్ట్రాన్ పంపిణీ,ద్విధ్రువ క్షణం,బల స్థిరాంకం,తగ్గిన ద్రవ్యరాశి,D
ఫోటాన్ డిటెక్టర్ యొక్క క్వాంటమ్ సామర్థ్యం 0.1. 100 ఫోటాన్లను డిటెక్టర్లోకి పంపితే ఒకదాని తర్వాత మరొకటి డిటెక్టర్ ఫోటాన్లను గుర్తిస్తుంది.,"సగటున 10 సార్లు, సుమారు 4 సార్లు ఆర్ఎమ్ఎస్ డీవియేషన్ ఉంటుంది.","సగటున 10 సార్లు, సుమారు 3 సార్లు ఆర్ఎమ్ఎస్ డీవియేషన్ ఉంటుంది.","సగటున 10 సార్లు, సుమారు 1 ఆర్ఎమ్ఎస్ డీవియేషన్తో","సగటున 10 రెట్లు, సుమారు 0.1 ఆర్ఎమ్ఎస్ విచలనం",B
ఈ క్రింది బిట్ స్ట్రింగ్ ల సెట్ లలో ఏది సాధారణ వ్యక్తీకరణతో వర్ణించబడదు?,సున్నాల సంఖ్య ఐదు యొక్క గుణకం ఉన్న అన్ని బిట్ స్ట్రింగ్ లు,అన్ని బిట్ స్ట్రింగ్ లు సున్నాతో ప్రారంభమై ఒకదానితో ముగుస్తాయి,అన్ని బిట్ స్ట్రింగ్ లు సమాన సంఖ్యలో సున్నాలతో ఉంటాయి,సున్నాల కంటే ఎక్కువ ఉన్న అన్ని బిట్ స్ట్రింగ్ లు,D
అధిక ఉష్ణోగ్రతలు ఉన్న వాతావరణంలో నీటి నష్టాన్ని తగ్గించడానికి మొక్కల అనుసరణలు ఈ క్రింది వాటిలో దేనిని కలిగి ఉంటాయి?,అనేక stomata,సన్నని క్యూటికల్స్,ఆకులకు బదులు వెన్నెముకలు,పెద్ద ఉపరితలం-ఘనపరిమాణ నిష్పత్తులు,C
ఉత్పరివర్తనలు డిఎన్ఎలో దోషాలు:,ఎల్లప్పుడూ హానికరం.,కార్సినోజెన్ల సమక్షంలో మాత్రమే సంభవిస్తాయి.,కణితుల పెరుగుదలను పెంచుతాయి.,తక్కువ రేటుతో ఆకస్మికంగా సంభవిస్తాయి.,D
హైపోథైరాయిడిజానికి సంబంధించి ఈ క్రింది వాటిలో ఏది నిజం?,బరువు తగ్గడం,Pre-tibial myxoedema,పెరిగిన టీఎస్ హెచ్ స్థాయి,వెచ్చని ప్రదేశాల పట్ల విరక్తి,C
"ఒక నగరంలోని గృహాల అంచనా విలువలు సగటున $125,000 మరియు ప్రామాణిక విచలనం $23,000 కలిగి ఉంటాయి. కొత్త ఉపాధ్యాయుల కాంట్రాక్ట్ కారణంగా గత ఏడాదితో పోలిస్తే పాఠశాల జిల్లాకు అదనంగా 10% నిధులు అవసరం. ఈ అదనపు డబ్బును సమీకరించడానికి, అంచనా వేసిన అన్ని ఇంటి విలువలను 5,000 డాలర్లు పెంచాలని నగరం మదింపు కార్యాలయాన్ని ఆదేశిస్తుంది. నగరంలోని గృహాల మదింపు విలువల యొక్క కొత్త ప్రామాణిక వ్యత్యాసం ఏమిటి?","$23,000 ","$25,300 ","28,000 డాలర్లు ","$30,300 ",A
" యుద్ధంలో వివక్ష గురించి తన చర్చలో, వాల్స్ ఇలా సూచిస్తాడు",పోరాట యోధులు మరియు సహజీవనం చేయని వారి మధ్య తేడా లేదు.,పోరాట యోధులు మరియు సహజీవనం చేయని వారి మధ్య వ్యత్యాసం ఒక స్థాయికి సంబంధించిన విషయం.,పోరాట యోధులు మరియు సహజీవనం చేయని వారి మధ్య వ్యత్యాసం స్పష్టంగా మరియు స్పష్టంగా ఉంది.,'ఉగ్రవాదం'ను విచక్షణారహిత హింసగా నిర్వచించాలి.,B
" నుస్బామ్ ప్రకారం, ఒకరిని ఒక వస్తువుగా పరిగణించడం",లైంగిక ఆబ్జెక్టిఫికేషన్ కు సరిపోతుంది.,లైంగిక ఆబ్జెక్టిఫికేషన్ కు అవసరం.,లైంగిక ఆబ్జెక్టిఫికేషన్ అవసరం లేదు.,పైవన్నీ..,C
"2020 నాటికి యుఎస్ లో సాధారణ నైతిక ప్రమాణాల ప్రకారం, ఈ రెండు సందర్భాలలో దేనికి ప్రధాన పాత్ర (నేను /నేను / నా ఉపయోగించేవారు) నైతికంగా స్పష్టంగా తప్పు చేస్తుంది? సన్నివేశం 1 | అమ్మానాన్నలు నిద్రపోతుంటే జాగింగ్ కు వెళ్లాను. సన్నివేశం 2 | నా రూమ్ మేట్ బట్టలతో నిండిన వాషర్ లో డిటర్జెంట్ పోశాను.","తప్పు, తప్పు","తప్పు, తప్పు కాదు","తప్పు కాదు, తప్పు","తప్పు కాదు, తప్పు కాదు",D
"2020 నాటికి యుఎస్ లో సాధారణ నైతిక ప్రమాణాల ప్రకారం, ఈ రెండు సందర్భాలలో దేనికి ప్రధాన పాత్ర (నేను /నేను / నా ఉపయోగించేవారు) నైతికంగా స్పష్టంగా తప్పు చేస్తుంది? సన్నివేశం 1 | నేను కొన్నిసార్లు నిజం చెప్పడానికి ప్రయత్నిస్తాను, అది నన్ను ఇబ్బందుల్లోకి నెట్టకపోతే. సన్నివేశం 2 | మ్యాజిక్ షోలో నా ప్రేయసిని ముద్దు పెట్టుకున్నాను.","తప్పు, తప్పు","తప్పు, తప్పు కాదు","తప్పు కాదు, తప్పు","తప్పు కాదు, తప్పు కాదు",B
