Question,A,B,C,D,Answer
 دەتوانن باشتر بێژەی بکەن؟ یا بە زاراوەیەکی تر؟ بێژە کردنی Daodejing بە ئینگلیزی,کلاسیکی گۆڕانکاریەکان,ڕێگای کلاسیک و دەسەڵات,کلاسیکی ژنان,کلاسیکی فەلسەفە,B
 کۆمەڵگای کوردستان لەگەڵ کام لەمانەی خوارەوە پەیوەندی هەیە؟,بیشۆپ ئۆسکار ڕۆمێرۆ,بەرخۆدان و نوێبوونەوە,شکۆی هەموو مرۆڤەکان,هەموو ئەمانەی سەرەوە,D
سەرۆکی کام لەم لایەنانەی خوارەوەیە؟,لیژنەی دادوەری ئەنجومەنی پیران,وەزارەتی داد,وەزارەتی دەوڵەت,دەستەی دادوەری گشتی,B
هێڵەکانی بواری موگناتیسی دەربارەی شێوەی وایەری هەڵگری تەزو,بازنەکان,هێڵە نیوەتیرەییەکان,تەزیوەکانی eddy,بازنەی وزە,A
"دەستەواژەی ""چیلی کۆن کارن"" ئاماژە بە چی دەکات؟",فاسۆلیا,گۆشت,پەنیر,بیبەری چەور,B
کام لەو بەرهەمانەی خوارەوە بە باشترین شێوە باس لە بارودۆخەکە دەکەن دوای ئەوەی نرخەکە بەرز دەبێتەوە لەسەر بەرهەمێک کە داواکارییەکی نادیاری هەیە؟,ئەو بڕەی کە داواکراوە ناگۆڕێت.,ژمارەی داواکراو زیاد دەکات,داهاتی گشتی کەم دەبێتەوە,داهاتی گشتی ناگۆڕێت,A
