Question,A,B,C,D,Answer
Cal destes filmes de terror xerou máis secuelas?,Berros',Xabier',Halloween',Venres 13',D
Cal destes pratos está feito a partir de intestinos de porco?,Haggis,Chitlins,Grits,Chop Suey,B
Que é o actor Antonio Banderas lingua nativa?,Españois,Ruso,Alemán,Francés,A
Cal é a lingua oficial dos Países Baixos?,Dinamarqués,Sueco,Alemán,Holanda,D
En que estado está a película Magnolia de 1999?,California,Carolina do Sur,Xeorxia,Texas,A
As mutacións que causan acondroplasia exercen un efecto que pode clasificarse como:,Negativo dominante.,Ganancia de función.,haploinsuficiencia.,Perda de función.,B
Esta ferramenta de márketing e comunicación ofrece unha indución directa ou un incentivo para animar aos clientes a comprar un produto/servizo:,Publicidade.,Relacións públicas.,Promoción de vendas.,Mercadotecnia directa.,C
A validación cruzada de K-fold é,Lineal en K,cuadrático en K,cúbico en K,Exponencial en K,A
Os adultos de mediana idade parecen ser máis ____ que os adultos maiores ou máis novos.,Xerativa,Neurótico,Agradable,Certas,A
A falacia da personalidade laudatoria é un tipo específico de,Falacia do accidente,Falso dilema,Pedindo a pregunta,Razoamento circular,A
"Esta pregunta refírese á seguinte información.
""As sementes dos réximes totalitarios nútrense da miseria e do desexo. Esténdense e medran no mal chan da pobreza e as loitas. Alcanzan o seu pleno crecemento cando morreu a esperanza dun pobo para unha vida mellor. Debemos manter viva esa esperanza... As grandes responsabilidades foron postas sobre nós polo rápido movemento dos acontecementos... Estou seguro de que o Congreso afrontará estas responsabilidades de forma cadrada"".
O presidente Harry S. Truman, 1947.
As ideas expresadas na pasaxe anterior reflicten máis directamente cal das seguintes continuidades na historia dos Estados Unidos?",Debates sobre a relación entre o Congreso e o presidente.,Debates sobre o uso da forza militar en situacións volátiles.,Debates sobre o papel dos Estados Unidos nos asuntos mundiais.,Debates sobre o papel axeitado dos partidos políticos.,C
Un paciente sofre un pescozo roto con danos na medula espiñal a nivel da sexta vértebra cervical.,Non poderán respirar sen soporte vital.,Só poderán respirar tranquilamente.,É imposible predicir un efecto sobre a respiración.,A respiración non se verá afectada.,B
A autocorrelación residual negativa indícase por cal é unha das seguintes?,Patrón cíclico nos residuais,Patrón alternante nos residuais,Unha aleatoriedade completa nos residuos,Residuos que están todos próximos a cero,B
Identifica o antecedente da seguinte proposición condicional: Os Bees gañan o seu primeiro partido só se os Aardvarks ou os Chipmunks non gañan os seus primeiros partidos.,Os Aardvarks non gañan o seu primeiro partido.,As abellas gañan o seu primeiro partido.,Os chipmunks non gañan o seu primeiro partido.,Ou os Aardvarks ou os Chipmunks non gañan os seus primeiros partidos.,B
Os estudantes están realizando un exercicio de separación de pigmentos vexetais que require que usen unha cámara de cromatografía pechada cunha pequena cantidade de acetona no fondo da cámara. Os avisos de seguridade para a acetona inclúen a afirmación de que é un irritante ocular e da pel e ten vapores inflamables. Do seguinte' que precaución de seguridade deben tomar os alumnos mentres realizan o exercicio?,Poñer luvas retardantes ao lume para levar a cámara a un capuchón de fume se a acetona prende lume,Colocando a cámara nun armario pechado e escurecido durante a duración da separación do pigmento.,Usar luvas de coiro e cubrir o nariz e a boca con máscara de partículas,Usar lentes e luvas de tipo nitrilo e manter todos os contedores de acetona pechados,D
Cal deles fai determinar o parentesco evolutivo de diferentes especies baseado na secuencia de aminoácidos de proteínas homólogas xeralmente menos precisa que as determinacións do parentesco baseadas nas secuencias de nucleótidos de xenes homólogos?,Mutacións silenciosas,Duplicacións xénicas,Translocacións eventos que cambian as secuencias xénicas,Cruceiro,A
É o homicidio ilegal cometido polo ministro do país X no estranxeiro un acto jure imperii ou jure gestionis?,Tal conduta é un acto público (jure imperii),Tal conduta nunca atrae inmunidade,Tal conduta é un acto privado (jure gestionis),Esta conduta é un acto público pero está blindada pola inmunidade.,C
"Esta pregunta refírese á seguinte información.
Primeiro hai que remarcar que o cosmos é esférico en forma, en parte porque esta forma sendo un todo perfecto que non require articulacións, é a máis completa de todas, en parte porque fai a forma máis capaciosa, que mellor se adapta para conter e preservar todo; ou de novo porque todas as partes constituíntes do universo, que é o Sol, a Lúa e os planetas aparecen nesta forma; ou porque todo se esforza por acadar esta forma, como aparece no caso de pingas de auga e outros corpos fluídos se intentan definirse. Así que ninguén dubidará de que esta forma pertence aos corpos celestes. ...
Que a Terra tamén é esférica está, polo tanto, fóra de cuestión, porque presiona desde todos os lados sobre o seu centro. Aínda que por razón das elevacións das montañas e das depresións dos vales non se pode entender un círculo perfecto, pero isto non afecta á natureza esférica xeral da terra. ...
Como xa se demostrou que a Terra ten a forma dunha esfera, debemos considerar se un movemento coincide tamén con esta forma, e que lugar ocupa a Terra no universo. ... A gran maioría dos autores, por suposto, coinciden en que a terra se mantén aínda no centro do universo, e considérana inconcibible e ridícula supoñer o contrario. Pero se o asunto pesa coidadosamente, verase que a cuestión aínda non está resolta e, polo tanto, de ningún xeito para ser considerada lixeiramente. Cada cambio de lugar que se observa débese, é dicir, a un movemento do obxecto observado ou do observador, ou a movementos de ambos. ... Agora é desde a terra onde se observa a revolución do ceo e prodúcese para os nosos ollos. Polo tanto, se a Terra non sofre movemento este movemento debe ter lugar en todo o que está fóra da terra, senón na dirección oposta que se todo o que hai na terra se movía, e deste tipo é a revolución cotiá. Así que isto parece afectar a todo o universo, é dicir, todo o que está fóra da Terra coa única excepción da propia Terra. Se, con todo, hai que admitir que este movemento non era peculiar dos ceos, senón que a terra xiraba de oeste a leste, e se isto fose coidadosamente considerado en canto á aparente subida e posta do sol, a lúa e as estrelas, descubriríase que esta era a situación real.
Nicolas Copérnico, As revolucións dos corpos celestes, 1543.
A pasaxe pode utilizarse como evidencia de que Copérnico difería dos tradicionais filósofos naturais aristotélicos da súa época porque suxeriu que",O cosmos é esférico,A Terra é esférica,O cosmos é xeostático,A Terra non está estacionaria,D
"Determinar a concentración de H+(aq) en fenol de 1,0 M, C6H5OH, solución. (O Ka para fenol é 1 × 10^-10.)",- 1 × 10^-10 M,- 1 × 10^-9 M,- 1 × 10^-3 M,- 1 × 10^-5 M,D
"Cal dos seguintes factores sería considerado un factor de ""tirón"" para Riva ao considerar un paso da India a Estados Unidos?",Pobreza abxecta,Mellor emprego e salarios máis altos,Sistema de castas da India,Violencia no seu barrio,B
"En comparación cos partidos políticos de países como Inglaterra e Israel, ambos con sistemas multipartidistas, os partidos políticos estadounidenses son",Menos interesado en influír no resultado das eleccións,Menos claramente identificado con ideoloxías políticas coherentes,menos eficaz para recadar diñeiro de partidarios políticos,Mellor capaz de reflectir os obxectivos de todas as súas circunscricións,B
"Un número, redondeado aos mil máis próximos, é de 47.000. Cal é o número que se redondeou?","46,295","46,504","47,520","47,924",B
"Un tanque ten forma de prisma triangular. Se a base triangular ten unha superficie de 116 pés cadrados, e o tanque ten 30 pés de altura, canta auga contería o tanque cando está cheo?",1725 ft^3,1740 ft^3,3480 ft^3,6960 ft^3,C
"A voltaxe inducida nun indutor represéntase como,",produto da súa indución e corrente a través dela.,Proporción da súa indución á corrente a través dela.,Relación de corrente a través dela coa súa indución.,produto da súa indución e taxa de cambio de corrente a través dela.,D
Cal das seguintes características son xeralmente consistentes coa violación de datas?,Uso da forza excesiva,Premeditado,Motivación sexual,implica o uso dunha arma,C
Atopa a lonxitude da curva y = ln x entre os puntos onde y = 1/2 e y = 1.,0.53,0.86,1.18,1.36,C
Find $-\dfrac{1}{-3}\cdot\cfrac{1}{~\frac{1}{-3}~}.$,1,-1,0,2,B
Que perspectiva psicolóxica foi máis popular a comezos do século XX en Europa Occidental?,Neurociencia,Evolución,Conductista,Psicanalíticos,D
A indefensión aprendida é máis probable que estea directamente relacionada con,Efecto Barnum.,Sesgo autosuficiente.,Un locus externo de control.,Respecto positivo incondicional.,C
A investigación de García e Koelling sobre as aversións aprendidas estableceu que cal dos seguintes pares UCS e CS son os máis poderosos e aprendidos máis rapidamente?,Realizar unha tarefa e recibir unha recompensa alimentaria,Náuseas e alimentos ou bebidas,Movemento e choque,Castigos e recompensas,B
"Parte da auga de Marte está conxelada no chan e nas capas de xeo e algunhas perdéronse debido ás cortas de vento solar, pero crese que gran parte da auga orixinal perdeuse por outro mecanismo. Que pasou con esta auga ""perdida""?",Foi desposuído polo campo magnético cando diminuíu rapidamente a súa forza.,Foi roto en hidróxeno e osíxeno pola luz ultravioleta e o hidróxeno perdeuse por escape térmico.,Foi consumido por unha civilización de marcianos sedentos.,Vaporizouse durante un período de vulcanismo intenso e perdeuse polo espazo a través do escape térmico.,B
"Viaxando a unha velocidade inicial de 1,5 × 10^6 m/s, un protón entra nunha rexión de campo magnético constante de magnitude 1,5 T. Se o vector de velocidade inicial do protón fai un ángulo de 30° co campo magnético, computa a velocidade do protón 4 s despois de entrar no campo magnético.",5.0 × 10^6 m/s,- 7.5 × 10^6 m/s,- 1.5 × 10^6 m/s,- 3.0 × 10^6 m/s,C
"A enerxía liberada pola rotura dos fosfatos de alta enerxía, o ATP e a fosfocreatina, pode soster o máximo exercicio de esforzo por aproximadamente:",1-2 segundos.,5-10 segundos.,30-40 segundos.,50-60 segundos.,B
"Nun circuíto serie, se a corrente nunha lámpada é de 2 A, a corrente na lámpada ao seu carón é","Metade, 1 A",- 2:00 horas,Depende de que lámpada estea máis preto da batería,Non hai información suficiente para dicir,B
Cal dos seguintes é máis probable que produza un crecemento económico máis forte ao longo do tempo?,Consumo máis rápido dos recursos naturais.,Maiores taxas de analfabetismo adulto.,Unha caída do capital mobiliario.,Créditos fiscais de investimento.,D
A economía está nunha profunda recesión. Ante esta situación económica cal das seguintes declaracións sobre política monetaria é precisa?,A política expansiva só agravaría a recesión.,A política expansiva aumenta enormemente a demanda agregada se o investimento é sensible aos cambios no tipo de interese.,A política de contracción é o estímulo adecuado para o investimento e o consumo.,Se a demanda de diñeiro é perfectamente elástica política monetaria expansiva pode ser bastante efectiva.,B
"As empresas participan na contabilidade social debido ás demandas de _________, co fin de identificar ________, mellorar a ___________ e fomentar _________ e ___________","Partes interesadas, riscos, xestión das partes interesadas, rendición de contas, transparencia","Partes interesadas, rendición de contas, transparencia, riscos, xestión das partes interesadas","Partes interesadas, rendición de contas, riscos, partes interesadas, xestión das partes interesadas","Partes interesadas, xestión das partes interesadas, transparencia, riscos, rendición de contas",A
Un imposto imposto a un provedor será máis probable que se transmita ao consumidor en forma de aumento de prezos se,A elasticidade de prezos da demanda é altamente elástica.,A elasticidade de prezos da demanda é altamente inelástica.,A elasticidade dos prezos da demanda é elástica unitaria.,A elasticidade salarial da demanda é altamente elástica.,B
Declaración 1 | Nun grupo (ab)^{-2} = b^{-2}a^{-2}. Declaración 2 | Nun grupo (ab)^n = a^nb^n.,"Certo, certo","Falso, falso","Certo, falso","Falso, certo",B
Cal é o termo para ata que punto a competencia nun país está influenciada pola competencia noutros países?,Comercio internacional,Economía global,Competencia global,Globalización,D
"Un programador escribiu o programa a continuación. O programa usa unha lista de números chamados numList. O programa pretende mostrar a suma dos números da lista.
 suma ← numList [1]
 Por cada valor en numList
 suma ← suma + valor
 Mostrar suma
 Para probar o programa, o programador inicializa numList a [0, 1, 4 , 5]. O programa mostra 10, e o programador conclúe que o programa funciona como se pretendía. Cal das seguintes cousas é certa?",A conclusión é correcta; O programa funciona como se pretende.,"A conclusión é incorrecta; O programa non mostra o valor correcto para o caso de proba [0, 1, 4, 5].","A conclusión é incorrecta; Usar o caso de proba [0, 1, 4, 5] non é suficiente para concluír que o programa é correcto.","A conclusión é incorrecta; Usando o caso de proba [0, 1, 4, 5] só confirma que o programa funciona para listas en orde crecente.",C
Por que Parfit se opón á igualdade?,Argumenta que unha sociedade desigual é inevitable.,"Afirma que dando prioridade ás necesidades dos pobres, podemos aumentar a igualdade.",Afirma que somos cada un dos responsables da nosa pobreza.,Rexeita por completo a idea de igualdade.,B
"Esta pregunta refírese á seguinte información.
En efecto, tanto as fatwas de distinguidos [eruditos] que basean a súa opinión na razón e na tradición por igual e no consenso da comunidade sunnita coinciden en que a antiga obriga de extirpación, exterminio e expulsión da innovación maligna debe ser o obxectivo da nosa exaltada aspiración, pois ""o celo relixioso é unha vitoria para a Fe de Deus Beneficente""; Entón, de acordo coas palabras do Profeta (Paz sobre el!) ""Quen introduce a innovación maligna na nosa orde debe ser expulsado"" e ""Quen ensine contra a nosa orde debe ser expulsado"", a acción volveuse necesaria e exixente...""
Carta do sultán otomán Selim I ao Safavid Shah Ismail I, 1514
Os safávidas atraeron a ira dos imperios islámicos como os otománs e os mogoles principalmente porque os safávidas",Foi un Imperio expansionista xeograficamente situado entre outros dous expansionistas.,Rexeitaron os principios centrais do Islam,Cristiáns escravizados e convertéronos en combatentes safávidas,Ismail proclamouse califa,A
"Esta pregunta refírese á seguinte información.
Ando xunto á columna, pregúntome que pasa.
Un soldado di simplemente: ""Chaman máis todos os días.
""Algúns de nós foron enviados ao norte ao río Amarelo aos quince anos;
E agora aos corenta imos ás guarnicións do oeste.
Na nosa primeira xira, o cabezallo da vila tivo que atar as nosas bandanas para nós.
Cando volvemos, o pelo era branco, pero aínda hai máis inquedanzas.
As guarnicións fronteirizas corren con sangue, o suficiente para encher un océano,
Pero as ambicións territoriais do emperador marcial aínda non crebaron.
Nos cen distritos ao leste das montañas, en toda a terra de Han,
Debe haber dez mil aldeas que agora se infestan.
Aínda que as esposas sexan o suficientemente fortes como para manexar unha mangueira e arado,
Os cultivos medran de todos os xeitos, os campos son todos un lío.
É máis difícil para os homes Shanxi, coa súa reputación como loitadores:
Están redondeados como cans ou galiñas, cada macho impresionado.
Pero señor, aínda que é bo que pidas,
Queixarse non é parte da tarefa do soldado.
Só podemos sacudir a cabeza. Toma este inverno:
As tropas de Shanxi nunca foron enviadas a casa.
Os axentes municipais reclaman o imposto de terras,
Pero de onde virá? Non podes obter sangue dunha pedra!
Sinceramente creo que é mala sorte levar un fillo agora,
É mellor ter unha filla: polo menos pode casar
E convivir cos veciños do lado.
Pero un fillo acabará deitado nalgunha pradeira afastada.
Du Fu, ""Balada dos carros do exército"", ca. 750 C.E.
O poema evidencia cal dos seguintes con respecto ás relacións de xénero na sociedade Tang?",As relacións confucianas entre marido e esposa aínda eran fortes na sociedade Tang.,Os rescriptos imperiais enfatizaban o nacemento de fillos capaces sobre as fillas para cumprir cotas de conscripción.,O traballo agrícola podería ser compartido por mulleres e homes por igual.,As relacións de xénero tradicionais chinesas inverteuse durante o reinado da emperatriz Wu Zetian.,C
"No plano xy, a gráfica de x^(log y) = y^log x é",Primeiro cuadrante aberto,Unha curva pechada,Un raio no primeiro cuadrante aberto,Un único punto,A
Cal dos seguintes países emitiu máis CO2 per cápita en 2017?,Xapón,Canadá,Rusia,Irán,B
Que é un ataque de reprodución?,Cando o atacante responde a unha mensaxe enviada polo sistema,"Un ataque que se repite continuamente, procurando unha debilidade",Un ataque que utiliza as propias mensaxes do sistema e por iso non se pode defender contra,"O atacante envía unha mensaxe capturada, e o sitio acepta o seu e responde a favor do atacante",D
O feito de que a frecuencia de absorción infravermella do cloruro de deuterio (DCl) se despraza da do cloruro de hidróxeno (HCl) débese ás diferenzas no seu interior.,Distribución electrónica,Dipole Moment,Constante de forza,Masa reducida,D
"A eficiencia cuántica dun detector de fotóns é 0.1. Se se envían 100 fotóns ao detector, un tras outro, o detector detectará fotóns.","Unha media de 10 veces, cunha desviación de RMS de aproximadamente 4","Unha media de 10 veces, cunha desviación de RMS de aproximadamente 3","Unha media de 10 veces, cunha desviación de RMS de aproximadamente 1","Unha media de 10 veces, cunha desviación de RMS de aproximadamente 0,1",B
Cal dos seguintes conxuntos de cadeas de bits NON se pode describir cunha expresión regular?,Todas as cadeas de bits cuxo número de ceros é un múltiplo de cinco,Todas as cordas de bits comezan cun cero e rematan cun,Todas as cadeas de bits cun número par de ceros,Todas as cadeas de bits con máis duns que ceros,D
Entre as adaptacións das plantas para minimizar a perda de auga en ambientes con altas temperaturas están cales das seguintes?,Numerosos estomas,Cutículas delgadas,Espiñas en lugar de follas,Grandes proporcións superficie-volume,C
As mutacións son erros no ADN que:,Sempre son prexudiciais.,Só aparecen en presenza de carcinóxenos.,Aumentar o crecemento tumoral.,Ocorre espontaneamente a un ritmo baixo.,D
Cal dos seguintes é o hipotiroidismo?,Perda de peso,Mixoedema pre-tibial,Un nivel de TSH elevado,Unha aversión aos lugares cálidos,C
"Os valores taxados das casas nunha cidade teñen unha media de 125.000 dólares cunha desviación estándar de 23.000 dólares. Debido a un novo contrato de profesorado, o centro educativo necesita un 10% adicional en fondos con respecto ao curso anterior. Para recadar este diñeiro adicional, a cidade instrúe á oficina de avaliación para recadar todos os valores da vivenda taxados en 5.000 dólares. Cal será a nova desviación estándar dos valores taxados das vivendas na cidade?",23.000 euros ,25.300 euros ,28.000 euros ,30.300 euros ,A
" Na súa discusión sobre a discriminación na guerra, Valls suxire que",Non hai diferenza entre combatentes e non combatentes.,A diferenza entre combatentes e non combatentes é unha cuestión de grao.,A diferenza entre combatentes e non combatentes é categórica e clara.,"O ""terrorismo"" debe definirse como violencia indiscriminada.",B
" Segundo Nussbaum, tratar a alguén como obxecto é",suficiente para a obxectificación sexual.,Necesaria para a obxectificación sexual.,Non é necesario para a obxectificación sexual.,Todo o anterior.,C
"Para cal destes dous escenarios o personaxe principal (quen usa eu/eu/meu) fai algo claramente incorrecto moralmente, segundo as normas morais ordinarias en Estados Unidos a partir de 2020? Escenario 1 | Mentres os meus pais durmían, fun jogging. Escenario 2 | Vertei deterxente no lavadoiro cheo de roupa do meu compañeiro de habitación.","Mal, mal","Mal, non mal","Non está mal, mal","Non está mal, non mal",D
"Para cal destes dous escenarios o personaxe principal (quen usa eu/eu/meu) fai algo claramente incorrecto moralmente, segundo as normas morais ordinarias en Estados Unidos a partir de 2020? Escenario 1 | Ás veces intento dicir a verdade, a menos que me teña problemas. Escenario 2 | Biquei á miña noiva no espectáculo de maxia.","Mal, mal","Mal, non mal","Non está mal, mal","Non está mal, non mal",B
"Para cal destes dous escenarios o personaxe principal (quen usa eu/eu/meu) fai algo claramente incorrecto moralmente, segundo as normas morais ordinarias en Estados Unidos a partir de 2020? Escenario 1 | Corría sobre a alfombra fresca cun céspede. Escenario 2 | Ouriñaba na man para poder probalo para a infección.","Mal, mal","Mal, non mal","Non está mal, mal","Non está mal, non mal",A
"Para cal destes dous escenarios o personaxe principal (quen usa eu/eu/meu) fai algo claramente incorrecto moralmente, segundo as normas morais ordinarias en Estados Unidos a partir de 2020? Escenario 1 | Vin ao famoso Elton John fóra dun pavillón de concertos e fixen unha foto del sen preguntarlle. Escenario 2 | Relatou a outro garda que se estorba en drogas estupefacientes a un cárcere e vendéndoos a presos.","Mal, mal","Mal, non mal","Non está mal, mal","Non está mal, non mal",D
"Para cal destes dous escenarios o personaxe principal (quen usa eu/eu/meu) fai algo claramente incorrecto moralmente, segundo as normas morais ordinarias en Estados Unidos a partir de 2020? Escenario 1 | Botei man dos meus descansos para perder o balón cando entraba na estrada. Escenario 2 | Ensinei aos meus fillos a tocar o xilófono.","Mal, mal","Mal, non mal","Non está mal, mal","Non está mal, non mal",D
"Para cal destes dous escenarios o personaxe principal (quen usa eu/eu/meu) fai algo claramente incorrecto moralmente, segundo as normas morais ordinarias en Estados Unidos a partir de 2020? Escenario 1 | Cando o conxelador do meu restaurante rompeu, servín a carne quente aínda que sabía que era moi insegura. Escenario 2 | Decidín iniciar un incendio no monte.","Mal, mal","Mal, non mal","Non está mal, mal","Non está mal, non mal",A
"Maior consumo de leite
",Informouse de que está asociada a unha maior incidencia de fractura e maior mortalidade nuns poucos estudos,Durante a puberdade parece estar asociada cunha maior densidade mineral ósea na vida posterior.,Asóciase constantemente cunha menor taxa de fracturas.,En países con maior taxa de fractura suxire que o consumo de leite é beneficioso para o esqueleto.,A
"Cal das seguintes afirmacións sobre o metabolismo da glicosa é correcta?
",O glicagón incrementa a velocidade de glicólise,A glicólise require NADP+,"Na glicólise, a glicosa clívase en dous produtos de tres carbonos.",O produto final da glicólise nos glóbulos vermellos é o piruvato.,C
Nagel afirma que o problema da sorte moral está intimamente ligado ao problema de:,A existencia de Deus.,Liberdade de vontade.,Egoísmo psicolóxico.,Universais.,B
"Segundo Singer, o cumprimento do seu principio require:","Cambios modestos nos nosos hábitos persoais, pero non no conxunto da nosa sociedade.","Cambios modestos nos nosos hábitos persoais, así como na sociedade.","Cambios drásticos nos nosos hábitos persoais, pero non na nosa sociedade.",cambios drásticos tanto nos nosos hábitos persoais como na nosa sociedade.,D
Cal das seguintes é a última en ser ocupada polos seres humanos?,Nova Guinea,Australia,Nova Zelandia,Timor,C
Civilización nubiana:,Precedeu e estimulou o auxe da cultura exipcia.,Foi o resultado da colonización mesopotámica no sur.,"Desenvolveuse en resposta, pero non a imitación da cultura exipcia.",Non tivo contactos coas culturas veciñas.,C
Unha entidade gobernamental está obrigada a incluír un estado de fluxos de efectivo en cal dos seguintes estados financeiros?,Estados financeiros do fondo gobernamental.,Estados financeiros de todo o goberno.,Estados financeiros do fondo propietario.,Estados financeiros do fondo fiduciario.,C
Cal das seguintes declaracións é correcta xa que se refire a cambios nas estimacións contables?,A maioría dos cambios nas estimacións contables son contabilizados retrospectivamente.,"Sempre que sexa imposible determinar se se produciu un cambio nunha estimación ou un cambio no principio contable, o cambio debe considerarse un cambio de principio.","Sempre que sexa imposible determinar se se produciu un cambio na estimación contable ou un cambio no principio contable, o cambio debe considerarse un cambio na estimación.",É máis fácil diferenciar entre un cambio na estimación contable e un cambio no principio contable do que é diferenciar entre un cambio na estimación contable e unha corrección dun erro.,C
