Question,A,B,C,D,Answer
Cili nga këta filma horror solli më shumë vazhdime?,Bërtit',Nofullat',Hallouini',E premtja e 13-të',D
Cila nga këto pjata është bërë nga zorrët e derrit?,Haggis,Chitlins,Grits,Chop Suey,B
Çfarë është aktori Antonio Banderas gjuhë amtare?,Spanjisht,Rusisht,Gjermanisht,Frëngjisht,A
Cila është gjuha zyrtare e Holandës?,Danisht,Suedisht,Gjermanisht,Holandisht,D
Në ç'gjendje është vendosur filmi Magnolia' i vitit 1999?,Kalifornia,Karolina e Jugut,Gjeorgjia,Texas,A
Mutacionet që shkaktojnë achondroplasia ushtrojnë një efekt i cili mund të klasifikohet si:,Negative dominuese.,Fitimi i funksionit.,Haploinsufficiency.,Humbja e funksionit.,B
 Ky mjet marketingu dhe komunikimi ofron një nxitje të drejtpërdrejtë ose një nxitje për të nxitur klientët të blejnë një produkt/shërbim:,Reklama.,Marrëdhëniet me publikun.,Promovimi i shitjeve.,Marketing direkt.,C
K-fold cross-validation është,Lineare në K,Quadratic në K,Kub në K,Eksponenciale në K,A
Të rriturit e moshës së mesme duket se janë më shumë ____ se të rriturit më të vjetër ose më të rinj,Gjeneruese,Neurotike,E pranueshme,Të sigurt,A
Fallacia e personalitetit lavdërues është një lloj specifik i,Pasojat e aksidentit,Dilema e rreme,Duke iu lutur pyetjes,Arsyetimi rrethor,A
"Kjo pyetje i referohet informacionit të mëposhtëm.
""Farat e regjimeve totalitare ushqehen nga mjerimi dhe dëshira. Ata përhapen dhe rriten në tokën e keqe të varfërisë dhe grindjeve. Ata arrijnë rritjen e tyre të plotë kur shpresa e një populli për një jetë më të mirë ka vdekur. Duhet ta mbajmë gjallë këtë shpresë. . . . Përgjegjësi të mëdha na janë vënë nga lëvizja e shpejtë e ngjarjeve. . . . Kam besim se Kongresi do t'i përballet drejtpërdrejt me këto përgjegjësi.""
Presidenti Harry S. Truman, 1947
Idetë e shprehura në pasazhin e mësipërm pasqyrojnë më drejtpërdrejt se cila nga vazhdimësitë e mëposhtme në historinë amerikane?",Debate rreth marrëdhënieve midis Kongresit dhe presidentit.,Debate rreth përdorimit të forcës ushtarake në situata të paqëndrueshme.,Debate rreth rolit të Shteteve të Bashkuara në çështjet botërore.,Debate rreth rolit të duhur të partive politike.,C
Një pacient pëson një qafë të thyer me dëmtime të palcës kurrizore në nivelin e vertebrës së gjashtë të qafës së mitrës.,Ata nuk do të jenë në gjendje të marrin frymë pa mbështetjen e jetës.,Ata vetëm do të jenë në gjendje të marrin frymë qetësisht.,Është e pamundur të parashikohet një efekt në frymëmarrje.,Frymëmarrja do të jetë e paprekur.,B
Autokorrelacioni negativ i mbetjeve tregohet nga cili nga më poshtë?,Një model ciklik në mbetjet,Një model i alternuar në mbetjet,Një rastësi e plotë në mbetjet,Mbetje që janë të gjitha afër zeros,B
Identifikoni paraardhësin e propozimit të kushtëzuar të mëposhtëm: Bletët fitojnë ndeshjen e tyre të parë vetëm nëse ose Aardvarks ose Ketrushat nuk fitojnë ndeshjet e para.,Aardvarks nuk e fitojnë ndeshjen e tyre të parë.,Bletët fitojnë ndeshjen e tyre të parë.,Ketrushat nuk e fitojnë ndeshjen e tyre të parë.,Ose Aardvarkët ose Ketrushat nuk fitojnë ndeshjet e para.,B
Studentët po kryejnë një ushtrim të ndarjes së pigmentit të bimëve që u kërkon atyre të përdorin një dhomë kromatografie të mbyllur me një sasi të vogël acetone në pjesën e poshtme të dhomës. Paralajmërimet e sigurisë për acetone përfshijnë pohimin se është një irritues i syve dhe lëkurës dhe ka avuj të djegshëm. Nga sa vijon' cilën masë sigurie duhet të marrin studentët gjatë kryerjes së stërvitjes?,Vënia e dorezave të vonuara nga zjarri për ta çuar dhomën në një kapuç tymi nëse acetoni merr zjarr,Vendosja e dhomës në një kabinet të mbyllur dhe të errësuar për kohëzgjatjen e ndarjes së pigmentit,Duke veshur doreza lëkure dhe duke mbuluar hundën dhe gojën me një maskë grimcash,Veshja e syzeve dhe dorezave të tipit nitrile dhe mbajtja e të gjitha kontejnerëve me acetone të mbyllura,D
Cila nga këto e bën përcaktimin e lidhshmërisë evolucionare të llojeve të ndryshme bazuar në sekuencën e aminoacideve të proteinave homologe në përgjithësi më pak të sakta se përcaktimet e lidhshmërisë bazuar në sekuencat nukleotide të gjeneve homologe?,Mutacione të heshtura,Duplikimet e gjeneve,Ngjarjet e translokimit që ndryshojnë sekuencat e gjeneve,Kalimi mbi,A
A është vrasja e paligjshme e kryer nga ministri i vendit X jashtë vendit një akt jure imperii apo gestionis jure?,Një sjellje e tillë është një akt publik (jure imperii),Një sjellje e tillë nuk tërheq kurrë imunitet,Një sjellje e tillë është një akt privat (jure gestionis),"Një sjellje e tillë është një akt publik, por mbrohet nga imuniteti",C
"Kjo pyetje i referohet informacionit të mëposhtëm.
Së pari duhet të vërejmë se kozmosi është në formë sferike, pjesërisht sepse kjo formë duke qenë një tërësi e përsosur që nuk kërkon nyje, është më e plota nga të gjitha, pjesërisht sepse bën formën më të kapshme, e cila është më e përshtatshme për të përmbajtur dhe ruajtur gjithçka; ose përsëri sepse të gjitha pjesët përbërëse të universit, pra dielli, hëna dhe planetët shfaqen në këtë formë; ose sepse çdo gjë përpiqet të arrijë këtë formë, siç duket në rastin e pikave të ujit dhe trupave të tjerë fluidë nëse përpiqen të përcaktojnë veten. Pra, askush nuk do të dyshojë se kjo formë u përket trupave qiellorë. ...
Që toka është edhe sferike është, pra, pa diskutim, sepse shtyp nga të gjitha anët në qendër të saj. Edhe pse për shkak të lartësive të maleve dhe depresionit të luginave një rreth i përsosur nuk mund të kuptohet, megjithatë kjo nuk ndikon në natyrën e përgjithshme sferike të tokës. ...
Siç është treguar tashmë se toka ka formën e një sferë, duhet të shqyrtojmë nëse një lëvizje përkon edhe me këtë formë, dhe çfarë vendi mban toka në univers. ... Shumica e autorëve natyrisht janë dakord se toka qëndron e palëvizshme në qendër të universit, dhe e konsiderojnë të pakonceptueshme dhe qesharake të supozojmë të kundërtën. Por nëse çështja peshohet me kujdes, do të shihet se çështja nuk është zgjidhur ende dhe për këtë arsye në asnjë mënyrë nuk do të konsiderohet lehtë. Çdo ndryshim i vendit që vërehet është për shkak, domethënë, të një lëvizjeje të objektit të vëzhguar ose të vëzhguesit, ose të lëvizjeve të të dyjave. ... Tani nga toka vërehet revolucioni i qiejve dhe prodhohet për sytë tanë. Prandaj, nëse toka nuk pëson asnjë lëvizje kjo lëvizje duhet të bëhet në çdo gjë jashtë tokës, por në drejtim të kundërt sesa nëse çdo gjë në tokë lëvizte, dhe e këtij lloji është revolucioni i përditshëm. Pra, kjo duket se ndikon në të gjithë universin, pra çdo gjë jashtë tokës me përjashtim të vetëm të vetë tokës. Megjithatë, nëse duhet pranuar se kjo lëvizje nuk ishte e veçantë për qiejt, por se toka rrotullohej nga perëndimi në lindje dhe nëse kjo do të shqyrtohej me kujdes në lidhje me ngritjen dhe vendosjen e dukshme të diellit, hënës dhe yjeve, do të zbulohej se kjo ishte situata reale.""
Nicolas Koperniku, Revolucionet e trupave qiellorë, 1543
Kalimi mund të përdoret si dëshmi se Koperniku ndryshonte nga filozofët natyrorë tradicionalë aristotelianë të kohës së tij, sepse ai sugjeroi se",Kozmosi është sferik,Toka është sferike,Kozmosi është gjeostatik,Toka nuk është e palëvizshme,D
"Përcaktoni përqendrimin H+(aq) në fenol 1.0 M, C6H5OH, zgjidhje. (Ka për fenol është 1 × 10^-10.)",1 × 10^-10 M,1 × 10^-9 m,1 × 10^-3 M,1 × 10^-5 M,D
"Cili nga faktorët e mëposhtëm do të konsiderohej si një faktor ""tërheqje"" për Rivën kur do të shqyrtohej një lëvizje nga India në Shtetet e Bashkuara?",Varfëria e skajshme,Punë më e mirë dhe paga më të larta,Sistemi i kastës së Indisë,Dhuna në lagjen e saj,B
"Krahasuar me partitë politike në vende të tilla si Anglia dhe Izraeli, që të dyja kanë sisteme shumëpartiake, partitë politike amerikane janë",Më pak të interesuar për të ndikuar në rezultatin e zgjedhjeve,Më pak të identifikuara qartë me ideologjitë politike të qëndrueshme,Më pak efektive në mbledhjen e parave nga mbështetësit politikë,më të aftë për të pasqyruar qëllimet e të gjithë zgjedhësve të tyre,B
"Një numër, i rrumbullakosur deri në njëmijë më të afërt, është 47.000. Cili numër mund të jetë numri që u rrumbullakos?","46,295","46,504","47,520","47,924",B
"Një tank është në formën e një prizmi trekëndor. Nëse baza trekëndore ka një sipërfaqe prej 116 metrash katrorë, dhe rezervuari është 30 metra i lartë, sa ujë do të përmbante rezervuari kur të jetë plot?",1725 ft^3,1740 ft^3,3480 ft^3,6960 ft^3,C
"Tensioni i induktuar në një induktor përfaqësohet si,",produkt i induktimit dhe rrymës së tij nëpërmjet tij.,raporti i induktancës së tij me rrymën përmes tij.,raporti i rrymës përmes saj me induktimin e tij.,produkt i induksionit të tij dhe shkalla e ndryshimit të rrymës përmes saj.,D
Cilat nga karakteristikat e mëposhtme janë përgjithësisht në përputhje me përdhunimin e datës?,Përdorimi i forcës së tepruar,Me paramendim,Të motivuar seksualisht,Përfshin përdorimin e një arme,C
Gjeni gjatësinë e lakores y = ln x midis pikave ku y = 1/2 dhe y = 1.,0.53,0.86,1.18,1.36,C
Gjej $-\dfrac{1}{-3}\cdot\cfrac{1}{~\frac{1}{-3}~}.$,1,-1,0,2,B
Cila perspektivë psikologjike ishte më popullore në fillim të shekullit të njëzetë në Evropën Perëndimore?,Neuroshkenca,Evolucionist,Behaviorist,Psikoanalitike,D
Paaftësia e mësuar ka shumë të ngjarë të lidhet drejtpërdrejt me,Efekti Barnum.,Paragjykimi vetëshërbyes.,Një karkaleca e jashtme kontrolli.,Konsideratë pozitive e pakushtëzuar.,C
Kërkimet e Garcia dhe Koelling në lidhje me aversionet e mësuara vendosën se cilat nga çiftet e mëposhtme UCS dhe CS janë më të fuqishmet dhe më të mësuarat më shpejt?,Kryerja e një detyre dhe marrja e një shpërblimi ushqimor,nausea dhe ushqim ose pije,Lëvizje dhe tronditje,Ndëshkimet dhe shpërblimet,B
"Një pjesë e ujit të Marsit është ngrirë në tokë dhe kapakët e akullit dhe disa humbën për shkak të zhveshjes së erës diellore, por një pjesë e madhe e ujit origjinal mendohet të ketë humbur nëpërmjet një mekanizmi tjetër. Çfarë ndodhi me këtë ujë ""të humbur""?",Ajo u zhvesh nga fusha magnetike kur u zvogëlua me shpejtësi në forcë,Ai u thye në hidrogjen dhe oksigjen nga drita ultravjollcë dhe hidrogjeni humbi nëpërmjet ikjes termike,Ajo u konsumua nga një qytetërim martianësh të etur,Ai u avullua gjatë një periudhe vullkanizmi intensiv dhe u humb nga hapësira nëpërmjet ikjes termike,B
"Duke udhëtuar me një shpejtësi fillestare prej 1.5 × 10^6 m/s, një proton hyn në një rajon të fushës magnetike konstante me magnitudë 1.5 T. Nëse vektori fillestar i shpejtësisë së protonit bën një kënd prej 30° me fushën magnetike, llogaritni shpejtësinë e protonit 4 s pas hyrjes në fushën magnetike.",5.0 × 10^6 m/s,7.5 × 10^6 m/s,1.5 × 10^6 m/s,3.0 × 10^6 m/s,C
"Energjia e çliruar nga prishja e fosfateve me energji të lartë, ATP dhe fosphocreatine, mund të mbajë ushtrimin maksimal të ushtrimit për rreth:",1-2 sekonda.,5-10 sekonda.,30-40 sekonda.,50-60 sekonda.,B
"Në një qark serish, nëse rryma në një llambë është 2 A, rryma në llambën pranë saj është","Gjysma, 1 A",2:00 AM,Varet se cila llambë është më afër baterisë,Nuk ka informacion të mjaftueshëm për të thënë,B
Cila nga këto ka më shumë gjasa të prodhojë një rritje ekonomike më të fortë me kalimin e kohës?,Konsumi më i shpejtë i burimeve natyrore.,Norma më të larta analfabetizmi të të rriturve.,Një stoqe në rënie e mallrave të kapitalit.,Kreditë e taksave të investimit.,D
Ekonomia është në një recesion të thellë. Duke pasur parasysh këtë situatë ekonomike cila nga deklaratat e mëposhtme rreth politikës monetare është e saktë?,Politika ekspansioniste vetëm sa do ta përkeqësonte recesionin.,Politika ekspansioniste rrit shumë kërkesën e përgjithshme nëse investimi është i ndjeshëm ndaj ndryshimeve të normës së interesit.,Politika kontraktuese është stimuli i duhur për investimin dhe konsumin.,Nëse kërkesa për para është krejtësisht elastike politika monetare ekspansioniste mund të jetë mjaft e efektshme.,B
"Bizneset angazhohen në kontabilitet social për shkak të kërkesave nga _________, në mënyrë që të identifikojnë ________, për të përmirësuar ___________ dhe për të inkurajuar _________ dhe ___________","Parties prenantes, risques, gestion des parties prenantes, responsabilisation, transparence","Parties prenantes, responsabilisation, transparenca, risques, gestion des parties prenantes","Parties prenantes, responsabilisation, risques, parties prenantes, gestion des parties prenantes","Parties prenantes, gestion des parties prenantes, transparenca, risques, responsabilisation",A
Një taksë e vendosur ndaj një furnizuesi ka më shumë gjasa t'i kalojë konsumatorit në formën e rritjes së çmimit nëse,Elasticiteti i çmimit të kërkesës është shumë elastik.,Elasticiteti i çmimit të kërkesës është shumë joelastik.,Elasticiteti i çmimit të kërkesës është njësia elastike.,Elasticiteti i pagës së kërkesës është shumë elastik.,B
Deklarata 1 | Në një grup (ab)^{-2} = b^{-2}a^{-2}. Deklarata 2 | Në një grup (ab)^n = a^nb^n.,"E vërtetë, e vërtetë","E rreme, e rreme","E vërtetë, e rreme","E rreme, e vërtetë",B
Cili është termi për masën në të cilën konkurrenca në një vend ndikohet nga konkurrenca në vende të tjera?,Tregtia ndërkombëtare,Ekonomia globale,Konkurrenca globale,Globalizimi,D
"Një programues e shkroi programin më poshtë. Programi përdor një listë numrash të quajtur numList. Programi ka për qëllim të shfaqë shumën e numrave në listë.
 Shuma ← numList [1]
 PËR ÇDO VLERË NË NUMList
 Shuma ← shuma + vlera
 Shuma e shfaqjes
 Për të testuar programin, programuesi nis numList në [0 , 1 , 4 , 5]. Programi shfaq 10, dhe programuesi arrin në përfundimin se programi funksionon ashtu siç është menduar. Cila nga këto është e vërtetë?",Përfundimi është i saktë; Programi funksionon ashtu siç është menduar.,"Përfundimi është i pasaktë; Programi nuk shfaq vlerën e saktë për rastin e provës [0, 1, 4, 5].","Përfundimi është i pasaktë; Përdorimi i rastit të provës [0, 1, 4, 5] nuk mjafton për të arritur në përfundimin se programi është i saktë.","Përfundimi është i pasaktë; Duke përdorur rastin e provës [0, 1, 4, 5] vetëm konfirmon se programi punon për listat në rend në rritje.",C
Pse Parfit kundërshton barazinë?,Ai argumenton se një shoqëri e pabarabartë është e pashmangshme.,"Ai pohon se duke u dhënë përparësi nevojave të të varfërve, ne mund të rrisim barazinë.",Ai pohon se ne jemi secili përgjegjës për varfërinë tonë.,Ai e kundërshton fare idenë e barazisë.,B
"Kjo pyetje i referohet informacionit të mëposhtëm.
""Në të vërtetë, ashtu si fatvat e [dijetarëve] të shquar që e bazojnë mendimin e tyre në arsyen dhe traditën ashtu edhe në konsensusin e komunitetit sunit bien dakord se detyrimi i lashtë i shfarosjes, shfarosjes dhe dëbimit të novacionit të keq duhet të jetë qëllimi i aspiratës sonë të lartësuar, sepse ""zelli fetar është një fitore për Besimin e Perëndisë të Gjithëmëshirshmit""; Pastaj, në përputhje me fjalët e Profetit (Paqja mbi të!) ""Kushdo që fut risinë e keqe në rendin tonë duhet të përjashtohet"" dhe ""Kushdo që bën fodullëk kundër urdhrit tonë duhet të përjashtohet,"" veprimi është bërë i nevojshëm dhe i ngutshëm...""
Letër nga sulltani osman Selim I për Safavid Shah Ismail I, 1514
Safavidët tërhoqën zemërimin e perandorive islamike të tilla si Perandoria Osmane dhe Mogule kryesisht për shkak se Safavidët",ishin një perandori ekspansioniste e vendosur gjeografikisht midis dy ekspansionistëve të tjerë,Hodhi poshtë parimet qendrore të Islamit,Të krishterët e skllavëruar dhe i shndërruan në luftëtarë safavidë,Ismaili e shpalli veten si kalif.,A
"Kjo pyetje i referohet informacionit të mëposhtëm.
Eci përkrah kolonës, pyes se çfarë po ndodh.
Një ushtar thotë thjesht: « Ata thërrasin më shumë çdo ditë.
""Disa prej nesh u dërguan në veri në Lumin e Verdhë në moshën pesëmbëdhjetë vjeçare,
Dhe tani në dyzet do të nisemi për në garnizonet në perëndim.
Në turneun tonë të parë, kreut të fshatit iu desh të lidhte fashat tona për ne.
Kur u kthyem, flokët tanë ishin të bardhë, por prapë ka më shumë trazira.
Garnizonet kufitare vrapojnë me gjak, të mjaftueshme për të mbushur një oqean,
Por ambiciet territoriale të perandorit ushtarak ende nuk kanë arritur të krekosen.
Në njëqind distriktet në lindje të maleve, në të gjithë vendin e Hanit,
Duhet të ketë dhjetë mijë fshatra që zihen tani.
Edhe nëse gratë janë aq të forta sa të mbajnë një hoe dhe plug,
Të mbjellat rriten në çdo drejtim, fushat janë të gjitha një rrëmujë.
Është më e vështirë për burrat Shanxi, me reputacionin e tyre si luftëtarë:
Ata janë të rrumbullakosur si qentë apo pulat, çdo mashkull i impresionuar.
""Por zotëri, edhe pse është mirë nga ju të pyesni,
Ankimi nuk është pjesë e detyrës së ushtarit.
Ne vetëm mund të tundim kokat tona. Merre këtë dimër:
Trupat Shanxi nuk u dërguan kurrë në shtëpi.
Oficerët e qarkut po kërkojnë taksën e tokës,
Por nga do të vijë? Nuk mund të marrësh gjak nga një gur!
Sinqerisht mendoj se është fat i keq të lindësh një djalë tani,
Është më mirë të kesh një vajzë: të paktën ajo mund të martohet
Dhe jetoni me fqinjët pranë.
Por një djalë do të përfundojë i shtrirë në ndonjë prairie të largët.»
Du Fu, «Balada e karrocave të ushtrisë», rreth vitit 750 të e.s.
Poema jep dëshmi se cila nga këto në vijim në lidhje me marrëdhëniet gjinore në shoqërinë Tang?",Marrëdhëniet konfuciane midis burrit dhe gruas ishin ende të forta në shoqërinë Tang.,Shkrimet perandorake theksuan lindjen e bijve të aftë mbi vajzat për të përmbushur kuotat e rekrutimit.,"Puna bujqësore mund të ndahet si nga gratë, ashtu edhe nga burrat.",Marrëdhëniet tradicionale gjinore kineze u përmbysën gjatë mbretërimit të perandoreshës Wu Zetian.,C
"Në xy-plane, grafiku i x^(log y) = y^log x është",Katërkëndëshi i parë i hapur,Një kurbë e mbyllur,Një rreze në katërkëndëshin e parë të hapur,Një pikë e vetme,A
Cili nga vendet e mëposhtme emetoi më shumë CO2 për frymë në vitin 2017?,Japonia,Kanadaja,Rusia,Irani,B
Çfarë është një sulm ripërsëritje?,Kur sulmuesi i përgjigjet një mesazhi që i është dërguar nga sistemi,"Një sulm që përsëritet vazhdimisht, duke hetuar për një dobësi",Një sulm që përdor mesazhet e vetë sistemit dhe kështu nuk mund të mbrohet kundër,"Sulmuesi rishfaq një mesazh të kapur, dhe faqja e pranon atë dhe përgjigjet në favor të sulmuesit",D
Fakti që frekuenca e absorbimit infra të kuq të klorurit të deuteriumit (DCl) zhvendoset nga ajo e klorurit të hidrogjenit (HCl) është për shkak të dallimeve në to,Shpërndarja e elektroneve,Moment dipole,Konstantja e forcës,Masë e reduktuar,D
"Efikasiteti kuantik i një detektori fotonesh është 0.1. Nëse 100 fotone dërgohen në detektor, njëra pas tjetrës, detektori do të zbulojë fotone","Mesatarisht 10 herë, me një devijim të RMS prej rreth 4","Mesatarisht 10 herë, me një devijim të RMS prej rreth 3","Mesatarisht 10 herë, me një devijim të RMS prej rreth 1","Mesatarisht 10 herë, me një devijim të RMS prej rreth 0.1",B
Cili nga grupet e mëposhtme të fijeve bit nuk mund të përshkruhet me një shprehje të rregullt?,"Të gjitha fijet bit, numri i zerove të të cilëve është një shumëfish prej pesë",Të gjitha fijet bit duke filluar me një zero dhe duke përfunduar me një,Të gjitha fijet bit me një numër të barabartë zerosh,Të gjitha fijet bit me më shumë se zero,D
Përshtatjet e bimëve për të minimizuar humbjen e ujit në mjedise me temperatura të larta përfshijnë cilën nga më poshtë?,Stomata të shumta,Prerëse të holla,Spines në vend të gjetheve,Raporte të mëdha sipërfaqe-vëllim,C
Mutacionet janë gabime në ADN që:,Janë gjithmonë të dëmshme.,Ndodh vetëm në prani të karcinogjenëve.,Rritja e rritjes së tumorit.,Ndodh spontanisht me një ritëm të ulët.,D
Cila nga këto është e vërtetë për hypothyroidism?,Humbje peshe,Myxoedema para-tibiale,Një nivel i ngritur TSH,Një neveri ndaj vendeve të ngrohta,C
"Vlerat e vlerësuara të shtëpive në një qytet kanë një mesatare prej 125,000 $ me një devijim standard prej 23,000 $. Për shkak të një kontrate të re mësuesish, qarkut shkollor i duhen 10% shtesë në fonde krahasuar me vitin e mëparshëm. Për të mbledhur këto para shtesë, qyteti udhëzon zyrën e vlerësimit të mbledhë të gjitha vlerat e vlerësuara të shtëpive me 5,000 dollarë. Cili do të jetë devijimi i ri standard i vlerave të vlerësuara të shtëpive në qytet?","23,000 dollarë ","25,300 dollarë ","28,000 dollarë ","30,300 dollarë ",A
" Në diskutimin e tij për diskriminimin në luftë, Valls sugjeron se",Nuk ka asnjë ndryshim midis luftëtarëve dhe jokombatantëve.,Dallimi midis luftëtarëve dhe jokombatantëve është një çështje e shkallës.,Dallimi midis luftëtarëve dhe jokombatantëve është kategorik dhe i qartë.,"""terrorizmi"" duhet të përkufizohet si dhunë pa dallim.",B
" Sipas Nussbaum, trajtimi i dikujt si objekt është",Të mjaftueshme për objektivizim seksual.,E nevojshme për objektivizim seksual.,Nuk është e nevojshme për objektivizim seksual.,Të gjitha këto më sipër.,C
"Për cilin nga këto dy skenarë personazhi kryesor (që përdor I/me/my) bën diçka qartësisht të gabuar moralisht, sipas standardeve të zakonshme morale në SHBA që nga viti 2020? Skenari 1 | Ndërsa prindërit po flinin, shkova duke bërë shaka. Skenari 2 | Derdha detergjent në lavatriçen plot me rrobat e shokut të dhomës.","Gabim, gabim","Gabim, jo gabim","Jo gabim, gabim","Jo gabim, jo gabim",D
"Për cilin nga këto dy skenarë personazhi kryesor (që përdor I/me/my) bën diçka qartësisht të gabuar moralisht, sipas standardeve të zakonshme morale në SHBA që nga viti 2020? Skenari 1 | Ndonjëherë përpiqem të them të vërtetën, nëse nuk më fut në telashe. Skenari 2 | E putha të dashurën time në shfaqjen magjike.","Gabim, gabim","Gabim, jo gabim","Jo gabim, gabim","Jo gabim, jo gabim",B
"Për cilin nga këto dy skenarë personazhi kryesor (që përdor I/me/my) bën diçka qartësisht të gabuar moralisht, sipas standardeve të zakonshme morale në SHBA që nga viti 2020? Skenari 1 | Vrapova mbi tapetin e freskët me një tog lëndinë. Skenari 2 | Urinova në dorë që ta testoja për infeksion.","Gabim, gabim","Gabim, jo gabim","Jo gabim, gabim","Jo gabim, jo gabim",A
"Për cilin nga këto dy skenarë personazhi kryesor (që përdor I/me/my) bën diçka qartësisht të gabuar moralisht, sipas standardeve të zakonshme morale në SHBA që nga viti 2020? Skenari 1 | Pashë të famshmin Elton John jashtë një arene koncertesh dhe i bëra një fotografi pa e pyetur. Skenari 2 | Raportova një roje tjetër që po fut fshehurazi drogën në një burg dhe ua shet të burgosurve.","Gabim, gabim","Gabim, jo gabim","Jo gabim, gabim","Jo gabim, jo gabim",D
"Për cilin nga këto dy skenarë personazhi kryesor (që përdor I/me/my) bën diçka qartësisht të gabuar moralisht, sipas standardeve të zakonshme morale në SHBA që nga viti 2020? Skenari 1 | U përplasa me pushimet e mia për të humbur topin kur hyri në rrugë. Skenari 2 | I mësova fëmijët e mi të luanin xylophone.","Gabim, gabim","Gabim, jo gabim","Jo gabim, gabim","Jo gabim, jo gabim",D
"Për cilin nga këto dy skenarë personazhi kryesor (që përdor I/me/my) bën diçka qartësisht të gabuar moralisht, sipas standardeve të zakonshme morale në SHBA që nga viti 2020? Skenari 1 | Kur frigoriferi i restorantit tim u prish, shërbeva mishin e ngrohtë edhe pse e dija se ishte shumë i pasigurt. Skenari 2 | Vendosa të ndez një zjarr në pyll.","Gabim, gabim","Gabim, jo gabim","Jo gabim, gabim","Jo gabim, jo gabim",A
"Konsumi më i madh i qumështit
",Është raportuar të jetë i lidhur me një incidencë më të lartë të thyerjes dhe vdekshmërisë më të lartë në disa studime,Gjatë pubertetit duket të jetë i lidhur me densitetin më të lartë mineral të kockave në jetën e mëvonshme,Është vazhdimisht i lidhur me një shkallë më të ulët të frakturave,Në vendet me shkallën më të lartë të thyerjes sugjeron se konsumi i qumështit është i dobishëm për skeletin.,A
"Cila nga deklaratat e mëposhtme për metabolizmin e glukozës është e saktë?
",Glucagon rrit shkallën e glycolysis,Glycolysis kërkon NADP+,"Në glycolysis, glukoza është shtrënguar në dy produkte tre-karboni",Produkti përfundimtar i glycolysis në qelizat e kuqe të gjakut është pyruvate,C
Nagel pohon se problemi i fatit moral është i lidhur ngushtë me problemin e:,Ekzistenca e Perëndisë.,Liria e vullnetit.,Egoizmi psikologjik.,Universalët.,B
