Question,A,B,C,D,Answer
Hver af þessum hryllingsmyndum skilaði flestum framhaldsmyndum?,"Öskra""","Kjálkar""","Hrekkjavaka""",Föstudagur 13.,D
Hver af þessum réttum er gerður úr þörmum svína?,Haggis,Svín,Grautur,Höggva Suey,B
Hvað er móðurmál leikarans Antonio Banderas?,Spænska,Rússneska,Þýska,Franska,A
Hvert er opinbert tungumál Hollands?,Danska,Sænska,Þýska,Hollenska,D
Í hvaða ástandi er kvikmyndin Magnolia frá 1999?,Kaliforníu,Suður-Karólína,Georgía,Texas,A
Stökkbreytingar sem valda achondroplasia hafa áhrif sem hægt er að flokka sem:,ríkjandi neikvætt.,ávinningur af virkni.,haploinnægency.,Skert virkni.,B
Þetta markaðs- og samskiptatól býður upp á beina hvatningu eða hvata til að hvetja viðskiptavini til að kaupa vöru/þjónustu:,Auglýsingar.,Almannatengsl.,Sölukynning.,Bein markaðssetning.,C
K-föld krossprófun er,línuleg í K,annars stigs í K,þrívídd í K,veldisfall í K,A
Miðaldra fullorðnir virðast vera _____ en eldri eða yngri fullorðnir,Myndandi,Taugaveiklaður,Þægilegt,Ákveðinn,A
Rökvilla laudatory persónuleika er ákveðin tegund af,Rökvilla slyssins,Fölsk vandamál,Spyr spurningarinnar,Hringlaga rökhugsun,A
"Þessi spurning vísar til eftirfarandi upplýsinga.
""Fræ alræðisstjórna eru ræktuð af eymd og vilja. Þeir breiðast út og vaxa í vondum jarðvegi fátæktar og deilna. Þeir ná fullum vexti þegar vonin um betra líf fólks er dáin. Við verðum að halda þeirri von lifandi. . . Mikil ábyrgð hefur verið lögð á okkur með skjótri framvindu atburða. . . . Ég er sannfærður um að þingið muni takast á við þessa ábyrgð af heilindum.""
Harry S. Truman forseti, 1947
Hugmyndirnar sem koma fram í kaflanum hér að ofan endurspegla mest beint hver af eftirfarandi samfellu í sögu Bandaríkjanna?",Umræður um samband þingsins og forsetans.,Umræður um beitingu hervalds við viðkvæmar aðstæður.,Deilur um hlutverk Bandaríkjanna í heimsmálum.,Umræður um hlutverk stjórnmálaflokka.,C
Sjúklingur þjáist af brotinn háls með skemmdum á mænu á vettvangi sjötta legháls hryggjarlið.,Þeir munu ekki geta andað án lífsstuðnings.,Þeir munu aðeins geta andað hljóðlega.,Það er ómögulegt að spá fyrir um áhrif á öndun.,Öndun verður óbreytt.,B
"Neikvætt, afgangssjálffylgni er gefið til kynna með hverju af eftirfarandi?",Hringlaga mynstur í leifunum,Breytilegt mynstur í leifunum,Algjört handahóf í leifunum,Leifar sem eru allar nálægt núlli,B
Þekkja fordæmi eftirfarandi skilyrts tilboðs: Býflugurnar vinna aðeins fyrsta leikinn sinn ef annað hvort Aardvarks eða Íkornarnir vinna ekki fyrstu leiki sína.,Aardvarks unnu ekki sinn fyrsta leik.,Býflugurnar unnu sinn fyrsta leik.,Íkornarnir vinna ekki fyrsta leikinn.,Annað hvort Aardvarks eða Chipmunks vinna ekki fyrstu leiki sína.,B
Nemendur stunda aðskilnaðaræfingu á litarefnum plantna sem krefst þess að þeir noti lokað litskiljunarhólf með litlu magni af asetoni í botni hólfsins. Í viðvörunarmerkingum fyrir aseton kemur fram að það sé ertandi fyrir augu og húð og að það séu eldfimar gufur. Af eftirfarandi'hvaða öryggisráðstafanir ættu nemendur að gera meðan þeir framkvæma æfinguna?,Setja á sig eldtefjandi hanska til að bera hólfið að reykhettu ef kviknar í asetoninu,"Að setja hólfið í lokaðan, myrkvaðan skáp meðan á aðskilnaði litarefnisins stendur",Nota leðurhanska og hylja nef og munn með agnagrímu,Nota hlífðargleraugu og hanska af nítrílgerð og halda öllum asetonílátum lokuðum,D
Hvert af þessu gerir það að verkum að ákvörðun á þróunarskyldleika mismunandi tegunda út frá amínósýruröð samgena prótína er almennt ónákvæmari en ákvarðanir á skyldleika byggðar á kirnaröðum samgena gena?,Þöglar stökkbreytingar,Tvítekning gena,Yfirfærsluatburðir sem breyta genaröðum,Víxlun,A
Er ólögmætt morð framið af ráðherra lands X erlendis verknaður jure imperii eða jure gestionis?,Slík hegðun er opinber athöfn (jure imperii),Slík hegðun laðar aldrei friðhelgi,Slík háttsemi er einkaathöfn (jure gestionis),Slík hegðun er opinber athöfn en nýtur friðhelgi,C
"Þessi spurning vísar til eftirfarandi upplýsinga.
Fyrst verðum við að gera athugasemd við að alheimurinn er kúlulaga að formi, að hluta til vegna þess að þetta form er fullkomin heild sem þarfnast engra liða, er fullkomnast allra, að hluta til vegna þess að það myndar rúmgóðasta formið, sem er best til þess fallið að geyma og varðveita allt; eða aftur vegna þess að allir hlutar alheimsins, það er sólin, tunglið og reikistjörnurnar, birtast í þessu formi; Eða vegna þess að allt leitast við að ná þessu formi, eins og birtist í tilfelli vatnsdropa og annarra vökvahlota ef þeir reyna að skilgreina sig. Svo enginn mun efast um að þetta form tilheyrir himneskum líkama. ...
Að jörðin sé einnig kúlulaga er því óumdeilt, vegna þess að hún þrýstir frá öllum hliðum að miðju sinni. Þótt ekki sé hægt að skilja fullkominn hring vegna hæðar fjallanna og lægðanna í dölunum, hefur það samt ekki áhrif á almennt kúlulaga eðli jarðarinnar. ...
Þar sem þegar hefur verið sýnt fram á að jörðin er í formi kúlu, verðum við að íhuga hvort hreyfing falli einnig saman við þetta form og hvaða sess jörðin hefur í alheiminum. ... Mikill meirihluti höfunda er auðvitað sammála því að jörðin standi kyrr í miðju alheimsins og telja óhugsandi og fáránlegt að gera ráð fyrir hinu gagnstæða. En ef málið er vandlega vegið, sést að málið er ekki enn útkljáð og því alls ekki hægt að líta á það af léttúð. Sérhver breyting á stað sem sést stafar af hreyfingu hlutarins sem athugaður er eða athugandans eða hreyfingu beggja. ... Nú er það frá jörðinni sem byltingu himinsins er fylgt og það er framleitt fyrir augu okkar. Þess vegna, ef jörðin fer ekki í neina hreyfingu, verður þessi hreyfing að eiga sér stað í öllu utan jarðarinnar, en í gagnstæða átt en ef allt á jörðinni hreyfðist, og af þessu tagi er dagleg bylting. Þetta virðist því hafa áhrif á allan alheiminn, það er að segja allt utan jarðar að jörðinni sjálfri undanskilinni. Ef hins vegar ætti að viðurkenna að þessi hreyfing væri ekki einkennandi fyrir himininn, heldur að jörðin snerist frá vestri til austurs, og ef þetta væri vandlega skoðað með tilliti til sýnilegrar upprásar og sólarlags, tungls og stjarna, kæmi í ljós að þetta væri raunverulegt ástand.
Nicolas Copernicus, Byltingar himintunglanna, 1543
Yfirferðina má nota sem sönnunargögn um að Kópernikus hafi verið frábrugðinn hefðbundnum, aristótelískum náttúruspekingum síns tíma vegna þess að hann lagði til að",Alheimurinn er kúlulaga,jörðin er kúlulaga,Cosmos er geostatic,Jörðin er ekki kyrrstæð,D
"Styrkur H+(aq) er ákvarðaður í 1,0 M fenóli, C6H5OH, lausn. (Ka fyrir fenól er 1 × 10^-10.)",1 × 10^-10 m,1 × 10^-9 m,1 × 10^-3 m,1 × 10^-5 m,D
"Hver af eftirfarandi þáttum myndi teljast ""draga"" þáttur fyrir Riva þegar íhugað er að flytja frá Indlandi til Bandaríkjanna?",Fátækt,Betra starf og hærri laun,Stéttakerfi Indlands,Ofbeldi í hverfinu hennar,B
"Í samanburði við stjórnmálaflokka í löndum eins og Englandi og Ísrael, sem báðir hafa fjölflokkakerfi, eru bandarískir stjórnmálaflokkar",minni áhuga á að hafa áhrif á úrslit kosninga,minna skýrt skilgreind með samkvæmri pólitískri hugmyndafræði,minna árangursríkt að afla peninga frá pólitískum stuðningsmönnum,betur í stakk búinn til að endurspegla markmið allra kjördæma sinna,B
"Samtala, námunduð að næsta þúsundi, er 47.000. Hvaða tala gæti verið sléttuð?","46,295","46,504","47,520","47,924",B
"Skriðdreki er í laginu eins og þríhyrningslaga prisma. Ef þríhyrningslaga grunnurinn hefur svæði 116 ferningur feet og tankurinn er 30 fet á hæð, hversu mikið vatn myndi tankurinn innihalda þegar hann er fullur?",1725 ft^3,1740 ft^3,3480 ft^3,6960 ft^3,C
"Spennan sem framkölluð er í span er táknuð sem,",afurð inductance þess og straums í gegnum það.,hlutfall inductance þess og straums í gegnum það.,hlutfall straums í gegnum það til inductance þess.,margfeldi inductance þess og hraða breytinga á straumi í gegnum það.,D
Hver af eftirfarandi einkennum eru almennt í samræmi við dagsetningarnauðgun?,Of mikilli valdbeitingu,að yfirlögðu ráði,Kynferðislegar hvatir,felur í sér notkun vopns,C
Finnum lengd ferilsins y = ln x milli punktanna þar sem y = 1/2 og y = 1.,0.53,0.86,1.18,1.36,C
Finna $-\dfrac{1}{-3}\cdot\cfrac{1}{~\frac{1}{-3}~}.$,1,-1,0,2,B
Hvaða sálfræðilega sjónarhorn var vinsælast um aldamótin tuttugustu í Vestur-Evrópu?,Taugavísindi,Þróun,atferlisfræðingur,Sálgreining,D
Lært hjálparleysi er líklegast í beinum tengslum við,Barnum áhrifin.,Hlutdrægni sem þjónar sjálfum sér.,ytra stjórnsvæði.,skilyrðislaus jákvæð kveðja.,C
Rannsóknir Garcia og Koelling varðandi lærða andúð staðfestu hver af eftirfarandi UCS og CS pörum eru öflugust og lærðust fljótast?,Að sinna verkefni og fá matarverðlaun,ógleði og matur eða drykkur,hreyfing og lost,Refsingar og verðlaun,B
"Sumt af vatni Mars er frosið í jarðvegi og íshellunum og sumt glataðist vegna sólargests en talið er að mikið af upprunalega vatninu hafi glatast með öðrum hætti. Hvað varð um þetta ""týnda"" vatn?",Það var fjarlægt af segulsviðinu þegar það minnkaði hratt að styrk,Það brotnaði í vetni og súrefni með útfjólubláu ljósi og vetnið tapaðist við varmaútstreymi,það var heltekið af siðmenningu þyrstra Marsbúa,Það gufaði upp á tímabili mikillar eldvirkni og týndist út í geim með hitauppstreymi,B
Þegar róteind ferðast á upphafshraða 1.5 × 10^6 m / s fer róteind inn á svæði með stöðugu segulsviði af stærðargráðunni 1.5 T. Ef upphafshraðavigur róteindarinnar myndar 30° horn við segulsviðið skaltu reikna hraða róteindarinnar 4 sekúndum eftir að hún hefur farið inn í segulsviðið.,"5,0 × 10^6 m/s","7,5 × 10^6 m/s","1,5 × 10^6 m/s","3,0 × 10^6 m/s",C
"Orkan sem losnar við niðurbrot háorkufosfatanna, ATP og fosfókreatíns, getur haldið uppi hámarks æfingu í u.þ.b.:",1-2 sekúndur.,5-10 sekúndur.,30-40 sekúndur.,50-60 sekúndur.,B
"Í raðrás, ef straumur í einum lampa er 2 A, er straumurinn í lampanum við hliðina á honum","hálfur, 1 A",02:00,Fer eftir því hvaða lampi er nær rafhlöðunni,Ekki nægar upplýsingar til að segja,B
Hvert af eftirfarandi er líklegast til að leiða til meiri hagvaxtar með tímanum?,Hraðari nýting náttúruauðlinda.,Hærra hlutfall ólæsis fullorðinna.,Minnkandi birgðir af fjárfestingarvörum.,Eignaskattaafslættir.,D
"Efnahagslífið er í djúpri kreppu. Í ljósi þessa efnahagsástands, hver af eftirfarandi fullyrðingum um peningastefnuna er rétt?",Þenslustefna myndi aðeins auka samdráttinn.,Þenslustefna eykur stórlega heildareftirspurn ef fjárfesting er næm fyrir vaxtabreytingum.,Samdráttarstefna er viðeigandi hvati fyrir fjárfestingu og neyslu.,Ef eftirspurn eftir peningum er fullkomlega teygjanleg gæti þensluhvetjandi peningastefna verið mjög áhrifarík.,B
"Fyrirtæki taka þátt í félagslegu bókhaldi vegna krafna frá _________, til að bera kennsl á ________, bæta ___________ og hvetja til _________ og ___________","Hagsmunaaðilar, áhættur, stjórnun hagsmunaaðila, ábyrgð, gagnsæi","Hagsmunaaðilar, ábyrgð, gagnsæi, áhætta, stjórnun hagsmunaaðila","Hagsmunaaðilar, ábyrgð, áhætta, hagsmunaaðilar, stjórnun hagsmunaaðila","Hagsmunaaðilar, stjórnun hagsmunaaðila, gagnsæi, áhætta, ábyrgð",A
Líklegra er að skattur sem lagður er á birgi skili sér til neytandans í formi verðhækkunar ef:,verð teygjanleiki eftirspurnar er mjög teygjanlegt.,Verðteygni eftirspurnar er mjög óteygjanleg.,verð teygjanleiki eftirspurnar er eining teygjanlegt.,launateygjanleiki eftirspurnar er mjög teygjanlegur.,B
Yfirlýsing 1 | Í hópi (ab)^{-2} = b^{-2}a^{-2}. Yfirlýsing 2 | Í hópi (ab)^n = a^nb^n.,"Satt, satt","Rangt, rangt","Satt, ósatt","Rangt, satt",B
Hvert er hugtakið yfir það að hve miklu leyti samkeppni í einu landi verður fyrir áhrifum af samkeppni í öðrum löndum?,Alþjóðaviðskipti,Hnattræn hagfræði,Alþjóðleg samkeppni,Hnattvæðing,D
"Forritari skrifaði forritið hér að neðan. Forritið notar lista yfir tölur sem kallast numList. Kerfinu er ætlað að birta summu talnanna á listanum.
 summa ← numList [1]
 FYRIR HVERT gildi Í numList
 summa ← summa + gildi
 BIRTA SAMTÖLU
 Til að prófa forritið frumstillir forritarinn numList í [0 , 1 , 4 , 5]. Forritið birtir 10 og forritarinn kemst að þeirri niðurstöðu að forritið virki eins og til er ætlast. Hvert af eftirfarandi er satt?",Niðurstaðan er rétt; Forritið virkar eins og til er ætlast.,"Niðurstaðan er röng; Forritið birtir ekki rétt gildi fyrir prófunartilvikið [0, 1, 4, 5].","Niðurstaðan er röng; Notkun prófunartilviksins [0, 1, 4, 5] nægir ekki til að álykta að forritið sé rétt.","Niðurstaðan er röng; Prófunartilvikið [0, 1, 4, 5] staðfestir aðeins að forritið vinnur fyrir lista í vaxandi röð.",C
Af hverju er Parfit á móti jafnrétti?,Hann heldur því fram að ójafnt samfélag sé óhjákvæmilegt.,Hann heldur því fram að með því að setja þarfir hinna fátæku í forgang getum við aukið jöfnuð.,Hann fullyrðir að við berum öll ábyrgð á fátækt okkar.,Hann hafnar hugmyndinni um jafnrétti alfarið.,B
"Þessi spurning vísar til eftirfarandi upplýsinga.
""Reyndar, þar sem bæði feiti virtra [fræðimanna] sem byggja skoðun sína á skynsemi og hefðum og samstaða súnní samfélagsins eru sammála um að hin forna skylda útrýmingar, útrýmingar og brottreksturs illrar nýsköpunar hljóti að vera markmið upphafinnar þrár okkar, því ""trúarlegur vandlæting er sigur fyrir trú Guðs hins góða""; þá, í samræmi við orð spámannsins (Friður yfir honum!) ""Hver sá sem kemur illri nýsköpun inn í skipan okkar verður rekinn úr landi"" og ""Hver sá sem brýtur gegn skipun okkar verður rekinn,"" aðgerðir eru orðnar nauðsynlegar og aðkallandi ...""
Bréf frá Ottoman Sultan Selim I til Safavid Shah Ismail I, 1514
Safavids vöktu reiði íslamskra heimsvelda eins og Ottómana og mógúlveldanna fyrst og fremst vegna þess að Safavids",voru útþenslusinnað heimsveldi landfræðilega staðsett á milli tveggja annarra útrásarsinna,hafnað helstu tenets íslams,"þrælað kristnir, og sneri þeim í Safavid bardagamenn",Ismail lýsti sjálfum sér sem kalífa,A
"Þessi spurning vísar til eftirfarandi upplýsinga.
Ég geng meðfram súlunni og spyr hvað sé um að vera.
Hermaður segir einfaldlega: ""Þeir hringja oftar á hverjum degi.
""Sum okkar voru send norður að Gulu ánni fimmtán ára gömul.
Og núna klukkan fertug höldum við til setuliðanna fyrir vestan.
Í fyrstu ferðinni okkar þurfti yfirmaður þorpsins að binda hljómsveitirnar okkar fyrir okkur.
Þegar við komum til baka var hárið á okkur hvítt en enn meiri órói.
Landamæravörslustöðvarnar eru blóði drifnar til að fylla hafið.
En svæðisbundinn metnaður herkeisarans hefur enn ekki aukist.
Í hundrað héruðunum hinumegin fjallanna, um allt land Hans,
Það hljóta að vera tíu þúsund þorp sem hrynja núna.
Jafnvel ūķtt eiginkonurnar séu nķgu sterkar til ađ höndla slöngu og plķg,
Uppskeran vex í allar áttir, akrarnir eru í rúst.
Það er erfiðast fyrir Shanxi mennina, með orðspor þeirra sem bardagamenn:
Ūeim er safnađ saman eins og hundum og hænum.
""En herra, ūķtt ūađ sé fallegt af ūér ađ spyrja,
Að kvarta er ekki hluti af verkefnum hermannsins.
Við getum bara hrist höfuðið. Tökum veturinn:
Shanxi hermennirnir voru aldrei sendir heim.
Sýslumennirnir krefjast þess að landskatturinn verði felldur niður.
En hvaðan kemur það? Þú getur ekki kreist blóð úr steini!
Ég held satt ađ segja ađ ūađ bođi ķgæfu ađ eignast son núna.
Það er betra að eignast dóttur: hún getur að minnsta kosti gifst
Og búa hjá nágrönnunum.
En sonur mun enda liggjandi á einhverri fjarlægri sléttu.""
Du Fu, ""Ballaða hervagnanna,"" um 750 e.Kr.
Ljóðið gefur vísbendingar um hvað af eftirfarandi með tilliti til samskipta kynjanna í Tang samfélaginu?",Konfúsíusarsambönd milli eiginmanns og eiginkonu voru enn sterk í Tang samfélaginu.,Í keisaralegum endurritum var lögð áhersla á fæðingu hæfra sona fram yfir dætur til að uppfylla herkvóta.,Landbúnaðarstörf gætu verið sameiginleg konum jafnt sem körlum.,Hefðbundnum kínverskum kynjasamskiptum var snúið við á valdatíma Wu Zetian keisaraynju.,C
Í xy-planinu er grafið af x^(log y) = y^log x,Opinn fyrsti fjórðungur,lokaður ferill,Geisli í opna fyrsta fjórðungi,Einn liður,A
Hvert eftirtalinna landa losaði mest CO2 á mann árið 2017?,Japan,Kanada,Rússland,Íran,B
Hvað er endurspilunarárás?,Þegar árásarmaðurinn svarar skilaboðum sem kerfið sendir honum,"Árás sem endurtekur sig í sífellu, leitar að veikleika",Árás sem notar eigin skilaboð kerfisins og er því ekki hægt að verjast,Árásarmaðurinn sendir aftur tekin skilaboð og vefurinn samþykkir þeirra og svarar í þágu árásarmannsins,D
Sú staðreynd að innrauð gleypnitíðni tvívetnisklóríðs (DCl) er færð frá tíðni vetnisklóríðs (HCl) er vegna mismunar á,dreifing rafeinda,Tvípóla augnablik,Stöðugi krafts,minnkaður massi,D
"Skammtaskilvirkni ljóseindaskynjara er 0.1. Ef 100 ljóseindir eru sendar inn í nemann, hver á eftir annarri, nemandinn nemur ljóseindir","að meðaltali 10 sinnum, með RMS fráviki um 4","að meðaltali 10 sinnum, með RMS fráviki um 3","að meðaltali 10 sinnum, með RMS fráviki um 1","að meðaltali 10 sinnum, með RMS fráviki um 0,1",B
Hver af eftirfarandi mengi bitastrengja ER EKKI hægt að lýsa með reglulegri segð?,Allir bitastrengir þar sem fjöldi núlla er margfeldi af fimm,Allir bitastrengir sem byrja á núlli og enda á einum,Allir bitastrengir með sléttri tölu núlla,Allir bita strengir með fleiri en núll,D
Aðlögun plantna til að lágmarka vatnstap í umhverfi með háan hita felur í sér hvert af eftirfarandi?,Fjölmargir munnvatn,Þunnar naglabönd,Hryggir í stað laufa,Stór hlutföll yfirborðs og rúmmáls,C
Stökkbreytingar eru villur í DNA sem:,eru alltaf skaðleg.,koma aðeins fram í nærveru krabbameinsvaldandi.,æxlisvöxt.,gerast sjálfkrafa á lágum hraða.,D
Hver af eftirfarandi á við um skjaldvakabrest?,Þyngdartap,Myxoedema á forstigi sköflungs,Hækkuð TSH-gildi,Andúð á heitum stöðum,C
"Fasteignamat húsa í borg hefur að meðaltali $ 125,000 með staðalfráviki $ 23,000. Vegna nýs kennarasamnings þarf skólahverfið 10% aukalega í fjárveitingar miðað við árið á undan. Til að afla þessa viðbótarfjár felur borgin Fasteignamati ríkisins að hækka allt fasteignamat um 5.000 krónur. Hvert verður hið nýja staðalfrávik fasteignamats húsa í borginni?","$ 23,000 ","$ 25,300 ","$ 28,000 ","$ 30,300 ",A
 Í umfjöllun sinni um mismunun í stríði bendir Valls á að,Það er enginn munur á hermönnum og óvígamönnum.,Munurinn á hermönnum og óvígamönnum er að vissu leyti.,Munurinn á hermönnum og óvígamönnum er afdráttarlaus og skýr.,"""Hryðjuverk"" ætti að skilgreina sem tilviljanakennt ofbeldi.",B
 Samkvæmt Nussbaum er það að meðhöndla einhvern sem hlut,nægilega til kynferðislegrar hlutgervingar.,nauðsynlegt fyrir kynferðislega hlutgervingu.,ekki nauðsynlegt fyrir kynferðislega hlutgervingu.,allt ofangreint.,C
"Fyrir hverja af þessum tveimur sviðsmyndum gerir aðalpersónan (sem notar ég/mig/minn) eitthvað greinilega siðferðilega rangt, samkvæmt venjulegum siðferðisstöðlum í Bandaríkjunum frá og með 2020? Sviðsmynd 1 | Þegar foreldrar mínir voru sofnaðir fór ég út að skokka. Sviðsmynd 2 | Ég hellti þvottaefni í þvottavélina fulla af fötum herbergisfélaga míns.","Rangt, rangt","Rangt, ekki rangt","Ekki rangt, rangt","Ekki rangt, ekki rangt",D
"Fyrir hverja af þessum tveimur sviðsmyndum gerir aðalpersónan (sem notar ég/mig/minn) eitthvað greinilega siðferðilega rangt, samkvæmt venjulegum siðferðisstöðlum í Bandaríkjunum frá og með 2020? Sviðsmynd 1 | Ég reyni stundum að segja sannleikann, nema það komi mér í vandræði. Sviðsmynd 2 | Ég kyssti kærustuna mína á töfrasýningunni.","Rangt, rangt","Rangt, ekki rangt","Ekki rangt, rangt","Ekki rangt, ekki rangt",B
"Fyrir hverja af þessum tveimur sviðsmyndum gerir aðalpersónan (sem notar ég/mig/minn) eitthvað greinilega siðferðilega rangt, samkvæmt venjulegum siðferðisstöðlum í Bandaríkjunum frá og með 2020? Sviðsmynd 1 | Ég keyrði yfir teppið með sláttuvél. Sviðsmynd 2 | Ég pissaði í höndina á mér svo ég gæti prófað hvort ég væri með sýkingu.","Rangt, rangt","Rangt, ekki rangt","Ekki rangt, rangt","Ekki rangt, ekki rangt",A
"Fyrir hverja af þessum tveimur sviðsmyndum gerir aðalpersónan (sem notar ég/mig/minn) eitthvað greinilega siðferðilega rangt, samkvæmt venjulegum siðferðisstöðlum í Bandaríkjunum frá og með 2020? Sviðsmynd 1 | Ég sá hinn fræga Elton John fyrir utan tónleikahöll og tók mynd af honum án þess að spyrja hann. Sviðsmynd 2 | Ég tilkynnti annan vörđ sem laumađi fíkniefnum inn í fangelsi og seldi föngum.","Rangt, rangt","Rangt, ekki rangt","Ekki rangt, rangt","Ekki rangt, ekki rangt",D
"Fyrir hverja af þessum tveimur sviðsmyndum gerir aðalpersónan (sem notar ég/mig/minn) eitthvað greinilega siðferðilega rangt, samkvæmt venjulegum siðferðisstöðlum í Bandaríkjunum frá og með 2020? Sviðsmynd 1 | Ég skellti á hléum mínum til að missa af boltanum þegar hann kom inn á veginn. Sviðsmynd 2 | Ég kenndi börnunum mínum að spila á sílófón.","Rangt, rangt","Rangt, ekki rangt","Ekki rangt, rangt","Ekki rangt, ekki rangt",D
"Fyrir hverja af þessum tveimur sviðsmyndum gerir aðalpersónan (sem notar ég/mig/minn) eitthvað greinilega siðferðilega rangt, samkvæmt venjulegum siðferðisstöðlum í Bandaríkjunum frá og með 2020? Sviðsmynd 1 | Þegar frystir veitingastaðarins bilaði bar ég fram heitt kjötið þó ég vissi að það væri mjög hættulegt. Sviðsmynd 2 | Ég ákvað að kveikja eld í skóginum.","Rangt, rangt","Rangt, ekki rangt","Ekki rangt, rangt","Ekki rangt, ekki rangt",A
"Meiri mjólkurneysla
",Tilkynnt hefur verið um tengsl við hærri tíðni beinbrota og hærri dánartíðni í nokkrum rannsóknum,Á kynþroska virðist tengjast hærri beinþéttni síðar á ævinni,Er ítrekað tengt lægri tíðni beinbrota,Í löndum með hæsta tíðni beinbrota bendir til þess að mjólkurneysla sé gagnleg fyrir beinagrindina.,A
"Hver af eftirfarandi fullyrðingum um efnaskipti glúkósa er rétt?
",Glúkagon eykur hraða glýkólýsu,Glýkólýsa krefst NADP +,Við glýkósundrun er glúkósi klofinn í tvær þriggja kolefnisafurðir,Lokaafurð glýkólýsu í rauðum blóðkornum er pýrúvat,C
Nagel heldur því fram að vandamál siðferðilegrar heppni sé nátengt vandamálinu:,tilvist Guðs.,frelsi viljans.,Sálfræðileg eigingirni.,Alhliða.,B
Samkvæmt Singer krefst þess að farið sé að meginreglu hans:,"lítilsháttar breytingar á persónulegum venjum okkar, en ekki á samfélaginu í heild.","hóflegar breytingar á persónulegum venjum okkar, sem og samfélaginu.","róttækar breytingar á persónulegum venjum okkar, en ekki á samfélagi okkar.",róttækar breytingar á bæði persónulegum venjum okkar og samfélagi okkar.,D
Hver af eftirfarandi er síðast hernuminn af mönnum?,Nýja-Gínea,Ástralía,Nýja Sjáland,Tímor,C
Núbísk siðmenning:,rándýr og ýtti undir uppgang egypskrar menningar.,var afleiðing landnáms Mesópótamíu í suðri.,"þróað til að bregðast við, en ekki til eftirlíkingar, egypskrar menningar.",hafði engin samskipti við nágrannalöndin menningu.,C
Er gerð krafa um að opinber eining fylgi yfirliti um sjóðstreymi í hvaða eftirfarandi reikningsskilum?,Reikningsskil ríkissjóðs.,Ársreikningar hins opinbera.,Ársreikningar eigin sjóða.,Reikningsskil sjóðsins.,C
Hver eftirfarandi fullyrðinga er rétt að því er varðar breytingar á reikningshaldslegu mati?,Flestar breytingar á reikningshaldslegu mati eru færðar afturvirkt.,Þegar ómögulegt er að ákvarða hvort breyting á mati eða breyting á reikningsskilavenju hafi átt sér stað skal líta á breytinguna sem meginreglu til breytingu.,Þegar ómögulegt er að ákvarða hvort breyting á reikningshaldslegu mati eða breyting á reikningsskilavenju hafi átt sér stað skal líta á breytinguna sem breytingu á mati.,Auðveldara er að greina á milli breytingar á reikningshaldslegu mati og breytingu á reikningsskilareglu en að greina á milli breytingar á reikningshaldslegu mati og leiðréttingar á skekkju.,C
