Question,A,B,C,D,Answer
Эдгээр аймшгийн кинонуудаас аль нь хамгийн их дараалал үүсгэсэн бэ?,Хашхирах,Эрүү',Хэллоуин',13-ны Баасан гараг',D
Эдгээр аяга тавагны алийг нь гахайн гэдэснээс хийдэг вэ?,хаггис,читлинүүд,тэвчээр,chop suey,B
Жүжигчин Антонио Бандерас эх хэл гэж юу вэ?,Испани хэл,Орос хэл,Герман хэл,Франц хэл,A
Нидерландын албан ёсны хэл нь юу вэ?,Дани хэл,Швед хэл,Герман хэл,Герман хэл,D
1999 онд гарсан Magnolia' киноны ямар мужид тавигдсан бэ?,Калифорни,Өмнөд Каролина,Гүрж,Техас,A
Achondroplasia үүсгэдэг мутацууд нь дараах байдлаар ангилж болох нөлөө үзүүлдэг:,давамгайлах сөрөг.,функцийг олж авдаг.,haploins хангалуун байдал.,алдагдал-функц.,B
"Энэхүү маркетинг, харилцаа холбооны хэрэгсэл нь үйлчлүүлэгчдийг бараа бүтээгдэхүүн/үйлчилгээ худалдан авахад нь урамшуулан дэмжих шууд урамшуулал эсвэл урамшууллыг санал болгодог. Үүнд:",Зар сурталчилгаа.,Олон нийттэй харилцах.,Борлуулалтын урамшуулал.,Шууд маркетинг.,C
К-фолд к-фросс-баталгаажуулах нь,К-д шугаман,К-д кварц,К-д куб,К-д экспоненциал,A
Дунд насны насанд хүрэгчид ____ нь нас ахимаг болон залуу насанд хүрэгчдийг бодвол илүү байдаг бололтой,Ивээг,Мэдрэлийн эмч,Зөвшөөрөгддөг,Тодорхой,A
Магтаалын зан чанар нь тодорхой төрлийн,Ослын буруу,Хуурамч асуудал,Асуултыг гуйж байна,Дугуйт сэтгэн бод,A
"Энэ асуулт нь дараах мэдээллийг хэлнэ.
""Тоталитар дэглэмийн үрийг зовлон зүдгүүр, хүсэлд хүмүүжүүлдэг. Тэд ядуурал, хэрүүл маргааны бузар хөрсөнд тарж, өсдөг. Хүмүүс нь сайн сайхан амьдрах найдвараа алдахад тэд өсөж томроо бүрэн дүүрэн өсдөг. Бид энэ найдварыг амьд байлгах ёстой... Үйл явдлын түргэн шуурхай хөдөлгөөнөөс болж бидэнд асар их үүрэг хариуцлага онхолджээ... Конгресс эдгээр үүрэг хариуцлагатай шууд тулгарна гэдэгт би итгэлтэй байна.""
Ерөнхийлөгч Харри С.Труман, 1947
Дээрх хэсэгт илэрхийлэгдсэн санаанууд нь АНУ-ын түүхэн дэх дараах үргэлжлэлүүдийн алийг нь хамгийн шууд тусгасан байдаг вэ?",Конгресс болон ерөнхийлөгч хоорондын харилцааны талаарх маргаан.,Эмх замбараагүй нөхцөлд цэргийн хүч хэрэглэх тухай маргаан.,Дэлхийн үйл хэрэгт АНУ-ын гүйцэтгэх үүргийн талаарх маргаан.,Улс төрийн намуудын зохих үүргийн талаарх маргаан.,C
Өвчтөн 6-р умайн хүзүүний үе мөчний түвшинд нуруу нугасны гэмтэлтэй хүзүү нь хугарч өвчилж байна.,Тэд амьдралын дэмжлэггүйгээр амьсгалж чадахгүй.,Тэд зөвхөн чимээгүй амьсгалж чадна.,Амьсгалахад нөлөөлөхийг урьдчилан тааварлах боломжгүй.,Амьсгалд нөлөөлөхгүй.,B
Сөрөг үлдэгдэл автокорреляци нь дараах зүйлсийн аль нэгээр нь заасан байдаг вэ?,Үлдэгдэлд циклийн загвар,Үлдэгдэл дэх өөр загвар,Үлдэгдэлд бүрэн тохиолдлын,Бүгд 0-д ойр байдаг үлдэгдэл,B
Дараах нөхцөлтэй саналуудын аль нэгийг нь тодорхойл: Аардваркс эсвэл Чипмункс аль аль нь эхний тоглолтондоо хожихгүй тохиолдолд л Bees анхны тоглолтоо хождог.,Аардваркууд анхны тоглолтоо хийдэггүй.,"""Bees"" анхны тоглолтоо хийж ялалт байгууллаа.",Чипмункс анхны тоглолтоо хийдэггүй.,"Аардваркс ч юм уу, Чипмункууд эхний тоглолтондоо хожоогүй.",B
"Сурагчид ургамлын пигментийг тусгаарлах дасгал хийж байна. Тэд танхимын доод хэсэгт бага хэмжээний ацетон бүхий хаалттай хроматографийн өрөөг ашиглах шаардлагатай. Ацетоны аюулгүй байдлын сэрэмжлүүлэгт нүд, арьсны уур уцаартай, шатамхай агаартай гэсэн мэдэгдэл ордог. Суралцагчид дасгалыг хийж байхдаа аюулгүй байдлын ямар урьдчилан сэргийлэх арга хэмжээ авах ёстой вэ?",Ацетон гал асаавал өрөөг фум хантаазанд авч явахын тулд гал унтраагч бээлий өмсөх,"Өрөөг пигментийн тусгаарлалтын хугацаанд хаалттай, харанхуй шүүгээнд байрлуулах","Арьсан бээлий өмсөж, хамар, амыг жижиг хэсгийн маскаар бүрхэх","Нүдний шил, нитрилийн төрлийн бээлий өмсөж, бүх ацетон савыг хаалттай байлгах",D
Эдгээрийн аль нь ижил хүйстэнтэйгээ явалдах генийн нуклеотидын дараалал дээр үндэслэсэн харилцан хамааралыг тодорхойлохоос ерөнхийдөө бага оновчтой болгодог вэ?,Чимээгүй мутацууд,Жин хуулбарлах,Генийн дарааллыг өөрчлөх транслокацийн үйл явдлууд,Гатлах,A
Гадаадад байгаа Х сайдын хууль бус аллагыг үйлдэх нь империд буюу журе дохио зангаа мөн үү?,Ийм үйлдэл нь олон нийтийн үйлдэл (jure imperii),Ийм үйлдэл дархлааг хэзээ ч татдаггүй,Ийм үйлдэл нь хувийн үйлдэл (jure gestionis),Ийм үйлдэл нь олон нийтийн үйлдэл боловч дархлаагаар хамгаалагддаг,C
"Энэ асуулт нь дараах мэдээллийг хэлнэ.
Эхлээд бид сансар огторгуй хэлбэр нь spherical байна гэдгийг анхаарах ёстой. Яагаад гэвэл энэ хэлбэр нь ямар ч үе мөч шаарддаг төгс бүхэл бүтэн байх нь хамгийн бүрэн бүтэн байдаг, нэг хэсэг нь хамгийн их акцик хэлбэртэй болгодог, энэ нь бүх зүйлийг агуулж, хадгалахад хамгийн тохиромжтой байдаг; эсвэл дахин учир нь орчлонгийн бүх бүрэлдэхүүн хэсгүүд, тэр нь нар, сар, гаригууд энэ хэлбэрээр гарч ирдэг; эсвэл бүх зүйл энэ хэлбэрт хүрэхийг хичээдэг учраас, хэрэв тэд өөрсдийгөө тодорхойлохыг оролдвол усны дусал болон бусад шингэн биед илэрдэг. Тэгэхлээр, энэ хэлбэр тэнгэрийн эрхсийнх гэдэгт эргэлзэх хүн гарахгүй. ...
Тиймээс дэлхий бүх талаас нь төв дээрээ шахдаг учраас эргэлзэхийн аргагүй юм. Хэдийгээр уулсын өндрөөс болон хөндийд сэтгэл гутралын улмаас төгс тойрог гэж ойлгож болохгүй ч энэ нь дэлхийн ерөнхий сперитик мөн чанарт нөлөөлдөггүй. ...
Дэлхий бөмбөрцөг хэлбэртэйг аль хэдийн харуулсан шиг хөдөлгөөн нь бас энэ хэлбэртэй давхцаж байгаа эсэхийг, мөн дэлхий орчлонт ертөнцөд ямар байр суурь эзэлдэгийг авч үзэх хэрэгтэй. ... Мэдээж зохиогчдын дийлэнх нь дэлхий орчлонгийн төвд байсаар байгаа гэдэгтэй санал нийлж, эсрэгээр нь төсөөлөхийн аргагүй, инээдтэй гэж үзжээ. Гэхдээ асуудлыг анхааралтай авч үзвэл, асуудлыг хараахан шийдээгүй байгаа учраас огт хөнгөн хуумгай хандахгүй байгаа нь харагдана. Ажиглагдсан газрын өөрчлөлт бүр нь ажиглагдсан биетийн эсвэл ажиглагчийн хөдөлгөөн, эсвэл хоёулангийнх нь хөдөлгөөнд байх ёстой. ... Одоо дэлхийгээс л тэнгэрийн хувьсгал ажиглагдаж, бидний нүдэнд бий болдог. Тиймээс хэрэв дэлхий ямар ч хөдөлгөөнгүй бол энэ хөдөлгөөн дэлхийн гаднах бүх зүйлд болох ёстой. Харин дэлхий дээрх бүх зүйл хөдөлснөөс эсрэг зүгт явагдах ёстой бөгөөд иймэрхүү хөдөлгөөн нь өдөр тутмын хувьсгал юм. Тэгэхлээр энэ нь бүх орчлонт ертөнц буюу дэлхийгээс гадуурх бүх зүйлд нөлөөлж байгаа бололтой. Харин энэ хөдөлгөөн нь тэнгэртэй огтлолцоогүй, харин дэлхий баруунаас зүүн тийш эргэсэн гэдгийг хүлээн зөвшөөрөх хэрэгтэй. Хэрэв нар, сар, одны мандаж, жаргахтай холбоотой энэ хөдөлгөөнийг анхааралтай авч үзвэл энэ нь бодит нөхцөл байдал байсан нь илрэх болно"" гэж хэлсэн байна.
Николас Коперник, Тэнгэрлэг биесийн хувьсгал, 1543
Энэ хэсгийг Коперник тухайн үеийнхээ уламжлалт, Аристотелийн байгалийн философичдоос ялгаатай байсныг нотлох баримт болгон ашиглаж болох юм. Учир нь тэрээр үүнийг санал болгосон байна",огторгуй нь spherical,дэлхий бол сперитик,огторгуй нь геостатик,дэлхий зогсолтгүй,D
"H+(aq) концентрацийг 1.0 М фенол, C6H5OH, шийдэлд тодорхойлно. (Фенолын Ка нь 1 × 10^-10 байна.)",1 × 10^-10 М,1 × 10^-9 М,1 × 10^-3 М,1 × 10^-5 М,D
"Энэтхэгээс АНУ руу нүүх талаар бодохдоо Ривагийн хувьд дараах хүчин зүйлсийн аль нь ""пулл"" хүчин зүйл гэж үзэх вэ?",Абжект ядуурал,"Илүү сайн ажил, өндөр цалинтай",Энэтхэгийн кастын систем,Ойр хавьд нь хүчирхийлэл,B
"Англи, Израиль зэрэг орнуудын улс төрийн намуудтай харьцуулахад, аль аль нь олон талт тогтолцоотой, Америкийн улс төрийн намууд",сонгуулийн үр дүнд нөлөөлөх сонирхол багатай,тогтмол улс төрийн үзэл сурталтай тодорхой тодорхой бус,улс төрийн дэмжигчдээс мөнгө цуглуулахад үр дүн багатай,бүх сонгуулийнхаа зорилгыг илүү сайн тусгаж чаддаг,B
Хамгийн ойрын мянгад хүрсэн тоо нь 47 000. Аль дугаар нь бөөрөнхий байсан байж болох вэ?,"46,295","46,504","47,520","47,924",B
"Танк нь гурвалжин призм хэлбэртэй байдаг. Гурвалжингийн бааз нь 116 м2 талбайтай, танк нь 30 метр өндөр байвал сав дүүрсэн үед хэр их ус агуулах вэ?",1725 ft^3,1740 ft^3,3480 ft^3,6960 ft^3,C
Индукцид индукцийн индукцийг,түүний индукцийн болон урсгалын бүтээгдэхүүн түүгээр дамжуулан.,түүний индукцийн харьцаа нь түүгээр дамжин урсгалтай.,урсгалын харьцаа нь түүний индукцтэй.,"түүний индукцийн үр дүн, түүгээр дамжуулан урсгалын өөрчлөлтийн хурд.",D
Ер нь болзоо хүчиндэхтэй ер нь ямар шинж чанарууд нийцэж байна вэ?,хэт их хүч хэрэглэх,урьдчилан төлөвлөсөн,бэлгийн сэдэлтэй,зэвсэг хэрэглэхийг хэлнэ,C
y = 1/2 ба y = 1 гэсэн цэгүүдийн хооронд муруй y = ln x-ийн уртыг ол.,0.53,0.86,1.18,1.36,C
$-\dfrac{1}{-3}\cdot\cfrac{1}{~\frac{1}{-3}~}.$,1,-1,0,2,B
Баруун Европт хорьдугаар зууны эхээр сэтгэл зүйн ямар үзэл бодол хамгийн их тархсан байсан бэ?,мэдрэлийн шинжлэх ухаан,эволюцийн онол,зан төлөв судлаач,сэтгэл зүйн эмч,D
Сурсан арчаагүй байдал нь шууд холбоотой байх магадлалтай,Барнумын эффект.,өөртөө үйлчлэх тал тохой татах.,хяналтын гадаад локус.,нөхцөл болзолгүй эерэгээр хандах.,C
"Гарсиа, Коэллинг нарын сурсан үзэн яддаг зүйлсийн талаарх судалгаа нь дараах UCS болон CS хосын аль нь хамгийн хүчирхэг, хамгийн хурдан сурдаг болохыг тогтоосон?","даалгавар гүйцэтгэх, хоол хүнсний шагнал авах","дотор муухайрч, хоол хүнс, уух юм уу","хөдөлгөөн, цочрол","шийтгэл, шагнал",B
"Марсын зарим ус хөрсөнд хөлдөж, мөсөн бүрхүүлтэй болж, зарим нь нарны салхи тайлснаас болж алдагдсан ч анхны усны ихэнх хэсэг нь өөр механизмаар алдагдсан гэж үздэг. Энэ ""алга болсон"" ус яасан бэ?",хүч чадал нь хурдан буурахад соронзон орон түүнийг тайлсан,"хэт ягаан туяагаар устөрөгч, хүчилтөрөгч болон задарч, устөрөгчийг халуун оргосноор алдсан",цангасан мартийн соёл иргэншилд идэгдсэн,"хүчтэй галт уулын үед агааржуулан, халуунаас зугтах замаар сансарт алдагдсан",B
"Протон нь 1,5 × 10^6 м/с хурдлахдаа 1.5 Т-ийн байнгын соронзон орны бүсэд нэвтрэн ордог. Хэрэв протоны анхны хурдны вектор соронзон талбартай 30°-ийн өнцгийг хийдэг бол соронзон орон руу орсны дараа протоны хурд 4 с-ийг тооцоол.",5.0 × 10^6 м/с,7.5 × 10^6 м/с,1.5 × 10^6 м/с,3.0 × 10^6 м/с,C
"Өндөр хүчдэлийн фосфат, АТП, фосфокреатины задралаас ялгардаг энерги нь хамгийн их хүчин чармайлт гаргах дасгалыг ойролцоогоор тэтгэх боломжтой:",1-2 секунд.,5-10 секунд.,30-40 секунд.,50-60 секунд.,B
Цуваа тойрог дотор нэг дэнлүүний урсгал 2 А байвал хажууд нь байгаа чийдэнгийн урсгал,"хагас, 1 А",2:00 ЦАГ,Аль дэнлүү нь батарейтай илүү ойр байхаас шалтгаална,Хэлэх хангалттай мэдээлэл байхгүй,B
Дараах зүйлсийн аль нь цаг хугацаа өнгөрөх тусам эдийн засгийн илүү хүчтэй өсөлтийг бий болгох вэ?,Байгалийн нөөц баялгийг илүү хурдан ашиглах.,Насанд хүрэгчдийн бичиг үсэгт тайлагдаагүй байдлын өндөр үзүүлэлт.,Капиталын барааны уналт.,Хөрөнгө оруулалтын татварын зээл.,D
Эдийн засаг гүн хямралд орж байна. Эдийн засгийн энэ нөхцөл байдлыг харгалзан үзвэл мөнгөний бодлогын талаарх дараах мэдэгдлүүдийн аль нь оновчтой вэ?,Өргөтгөсөн бодлого нь хямралыг улам дордуулах байв.,Хэрэв хөрөнгө оруулалт зээлийн хүүгийн өөрчлөлтөд мэдрэмтгий байвал өргөтгөсөн бодлого нийт эрэлтийг ихээр нэмэгдүүлдэг.,"Концессын бодлого нь хөрөнгө оруулалт, хэрэглээнд тохирсон урамшуулал юм.",Хэрэв мөнгөний хэрэгцээ маш элбэг дэлбэг байвал мөнгөний бодлого нэлээд үр дүнтэй байж болох юм.,B
"Бизнес эрхлэгчид _________ шаардлагын улмаас нийгмийн ________ тодорхойлох, ___________ сайжруулах, _________, ___________ урамшуулах зорилгоор нийгмийн нягтлан бодох","Хувьцаа эзэмшигчид, Эрсдэл, Гадасны менежмент, Хариуцлага, Ил тод байдал","Хувьцаа эзэмшигчид, Хариуцлага, Ил тод байдал, Эрсдэл, Гадасны менежмент","Хувьцаа эзэмшигчид, Хариуцлага, Эрсдэл, Хувьцаа эзэмшигчид, Хувьцаа эзэмшигчийн менежмент","Хувьцаа эзэмшигчид, Хувьцаа эзэмшигчийн менежмент, Ил тод байдал, Эрсдэл, Хариуцлага",A
Нийлүүлэгчид ногдуулсан татварыг үнэ нэмэх хэлбэрээр хэрэглэгчдэд илүү дамжуулна,эрэлтийн үнийн уянгыг маш элбэг байдаг.,эрэлтийн үнийн уян нөөшилт өндөр.,эрэлтийн үнэ нь нэгж эластик юм.,эрэлтийн цалин маш элбэг байдаг.,B
Мэдэгдэл 1 | Хамтлагт (ab)^^{-2} = b^{-2}a^{-2}. Мэдэгдэл 2 | Хамтлагт (ab)^n = a^nb^n.,"Үнэн, Үнэн","Худал, худал","Үнэн, Худал","Худал, Үнэн",B
Нэг улсад өрсөлдөөн бусад оронд хэр зэрэг нөлөөлдөг вэ?,Олон улсын худалдаа,Дэлхийн эдийн засаг,Дэлхий дахины өрсөлдөөн,Глобалчлал,D
"Програмист доорх програмыг бичсэн байна. Програм нь numList нэртэй тоонуудын жагсаалтыг ашигладаг. Програм нь тухайн жагсаалтад байгаа тоонуудын нийлбэрийг харуулах зорилготой.
 sum ← numList [1]
 ҮНЭ ЦЭНЭ БҮРТ НЬ ҮНЭ ЦЭНЭ IN NumList
 мөнгөн дүн ← нийлбэр + үнэ цэнэ
 DISPLAY мөнгөн дүн
 Програмыг туршихын тулд програмист numList-ийг [0 , 1 , 4 , 5] хүртэл эхлүүлэгчид олгодог. Программ нь 10-ыг үзүүлдэг бөгөөд программист нь уг програмыг зориулалтын дагуу ажилладаг гэж дүгнэдэг. Дараах зүйлсийн аль нь үнэн бэ?",Дүгнэлт нь зөв; хөтөлбөр нь төлөвлөсний дагуу ажиллана.,"Дүгнэлт нь буруу; программ нь шалгалтын хэргийн зөв үнэ цэнийг харуулдаггүй [0, 1, 4, 5].","Дүгнэлт нь буруу; тестийн хэргийг [0, 1, 4, 5] ашиглан программыг зөв гэж дүгнэхэд хангалттай биш.","Дүгнэлт нь буруу; шалгалтын хэргийг [0, 1, 4, 5] ашиглан програм нь дэг журмыг нэмэгдүүлэх жагсаалтуудад ажилладаг гэдгийг л баталж байна.",C
Парфит яагаад тэгш байдлыг эсэргүүцдэг вэ?,Тэрээр тэгш бус нийгмээс илүү зайлшгүй гэж үздэг.,Ядуусын хэрэгцээг эн тэргүүнд тавьж чадвал бид тэгш байдлыг нэмэгдүүлж чадна гэж тэр хэлдэг.,Тэрбээр ядуурлынхаа хариуцлагыг хүн бүр хүлээдэг гэж батлан хэлдэг.,Тэрээр тэгш эрхийн үзэл санааг бүрмөсөн эсэргүүцдэг.,B
"Энэ асуулт нь дараах мэдээллийг хэлнэ.
""Үнэндээ, өөрсдийн үзэл бодлыг учир шалтгаан, уламжлал дээр тулгуурладаг, суннитчуудын санал нэгдлүүд дээр тулгуурладаг нэр хүндтэй [эрдэмтдийн] аль аль нь муу муухай шинэчлэлийг хөөн гаргах, устгах, хөөн гаргах эртний үүрэг нь бидний өргөмжлөгдсөн хүсэл эрмэлзлийн зорилго байх ёстой гэдэгтэй санал нийлдэг. Учир нь ""Шашны хичээл зүтгэл бол Бурханы итгэлийн төлөөх ялалт юм""; Дараа нь, Бошиглогчийн үгийн дагуу (Түүн дээр амар амгалан!) ""Бидний дэг журамд хорон муу шинэчлэлийг нэвтрүүлсэн хэн ч гэсэн хөөгдөх ёстой"", ""Бидний тушаалын эсрэг заасан хэн боловч хөөгдөх ёстой"", үйл ажиллагаа нь зайлшгүй, туйлшралтай болсон...""
I Оттоманы Султан Селимээс Сафавид Шах Исмаил I-д илгээсэн захидал, 1514
Сафавидчууд Осман, Мугалын эзэнт гүрнүүд зэрэг Исламын эзэнт гүрнүүдийн уур хилэнг хөдөлгөсөн нь үндсэндээ Сафавидчууд",газарзүйн хувьд өөр хоёр өргөгчдийн хооронд орших өргөгчдийн эзэнт гүрэн байсан юм.,Исламын төв үзлийг эсэргүүцсэн,"Христэд итгэгчдийг боолчлогдож, тэднийг Сафавид тулаанчид болгон хувиргасан",Исмаил өөрийгөө Халиф хэмээн тунхаглажээ,A
