Question,A,B,C,D,Answer
Бул үрөй учурарлык фильмдердин кайсынысы эң көп секвестрлерди пайда кылды?,Кыйкырык',Жаактар',Хэллоуин',Жума 13',D
Бул тамактардын кайсынысы чочко ичектеринен жасалган?,хаггис,читлиндер,жөжөлөр,чоп суей,B
Актер Антонио Бандерас түпкү тил деген эмне?,Испанча,Орусча,Немисче,Французча,A
Нидерландиянын расмий тили кандай?,Даниялыктардын  тили,Шведче,Немисче,Нидерландча,D
1999-жылдагы Магнолия тасмасы кайсы абалда?,Калифорния,Түштүк Каролина,Грузия,Техас,A
Ахондроплазияга себеп болгон мутациялар төмөнкүлөр катары классификацияланышы мүмкүн болгон таасирин тийгизет:,басымдуу терс.,функциянын пайдасы.,хаплоинсфектура.,функцияны жоготуу.,B
 Бул маркетинг жана байланыш куралы түздөн-түз индукция же кардарларды продукт / кызмат сатып алууга үндөгөн стимул сунуш кылат:,Жарнама.,Коомдук мамилелер.,Сатууну илгерилетүү.,Түздөн-түз маркетинг.,C
К-бүктөлгөн айкаш текшерүү болуп саналат,К сызыгы,К квадратикасы,К боюнча кубтук,К-да экспоненциалдуу,A
Орто жаштагы чоңдор улгайган же жаш курактагыларга караганда ____ көбүрөөк көрүнөт,Генератор,Невротикалык,Макулдашылган,Албетте,A
Мактоого татырлык инсандыктын жаңылышдыгы — белгилүү бир түрү,Кырсыктын жаңылышдыгы,Жалган дилемма,Суроону сурануу,Тегерек ой жүгүртүү,A
"Бул суроо төмөнкү маалыматка тиешелүү.
""Тоталитарлық режимдердин уруктары азап-кайгы жана каалоо менен тарбияланат. Алар жакырчылыктын жана чыр-чатактын каардуу топурагында жайылып, өсүшөт. Алар элдин жакшы жашоого болгон үмүтү өлүп калганда толук өсүшүнө жетишет. Биз бул үмүттү сакташыбыз керек . . . Окуялардын тез жүрүшү бизге чоң жоопкерчиликтерди берди . . . Конгресс бул милдеттерди түздөн-түз кабыл аларына ишенем"".
Президент Гарри С. Трумэн, 1947-жыл
Жогорудагы өтүүдө көрсөтүлгөн идеялар, негизинен, АКШнын тарыхындагы төмөнкү үзгүлтүксүздүктөрдүн кайсынысын түздөн-түз чагылдырат?",Конгресс менен президенттин ортосундагы мамилелер жөнүндө талаш-тартыштар.,Туруксуз жагдайларда аскер күчүн колдонуу жөнүндө талаш-тартыштар.,Америка Кошмо Штаттарынын дүйнөлүк иштердеги ролу жөнүндө талаш-тартыштар.,Саясий партиялардын туура ролу жөнүндө талаш-тартыштар.,C
Оорулуу алтынчы мойну омуртка деңгээлинде жүлүн жипти жабыркатуу менен мойну сынган.,Алар өмүрдү камсыз кылбастан дем ала алышпайт.,Алар тынч гана дем ала алышат.,Дем алууга таасирин алдын ала айтуу мүмкүн эмес.,Дем алуу таасир этпейт.,B
Терс калдык автокорреляция төмөнкүлөрдүн кайсынысы менен көрсөтүлөт?,Калдыктардагы циклдык үлгү,Калдыктардагы кезектешип үлгү,Калдыктардагы толугу менен кокустук,Баары нөлгө жакын калдыктар,B
Төмөнкү шарттуу пропозициянын антектентин аныктоо: Аарылар биринчи оюнун ардварктар же чипмунктар биринчи оюндарында жеңишке жетпеген учурда гана утуп алышат.,Ардварктар биринчи оюнда жеңишке жетишпейт.,Аарылар биринчи оюнда жеңишке жетишет.,Чипмунктар биринчи оюнда жеңишке жетпейт.,"Ардварктар да, чипмунктар да биринчи оюндарында жеңишке жетпейт.",B
Студенттер камеранын түбүндө аз өлчөмдө ацетон менен жабык хроматография камерасын колдонууну талап кылган өсүмдүк пигменттерин бөлүштүрүү көнүгүүлөрүн өткөрүшөт. Ацетон үчүн коопсуздук эскертүүлөр көз жана тери кыжырданткан жана күйүп турган буулары бар деген билдирүүнү камтыйт. Төмөнкүлөрдүн ичинен студенттер көнүгүүлөрдү өткөрүүдө кандай коопсуздук чараларын көрүшү керек?,"Ацетон өрттөлсө , камераны буу капчыкка алып баруу үчүн оттан сактаган мээлейлерди кийүү","Камераны пигмент бөлүштүрүү учурунда жабык, караңгыланган кабинетке жайгаштыруу","Булгаары мээлей кийип , мурду менен оозун бөлүкчө маскасы менен жаап","Көз айнек жана азот түрүндөгү мээлей кийип , бардык ацетон идиштерин жабык сактоо",D
"Алардын кайсынысы гомологдук белоктордун амин кислотасынын ырааттуулугуна негизделген ар кандай түрлөрдүн эволюциялык байланышын аныктоону, адатта, гомологдук гендердин нуклеотиддик ырааттуулугуна негизделген байланышты аныктоого караганда так эмес кылат?",Үнсүз мутациялар,Ген дубликаттары,Гендердин ырааттуулугун өзгөртө турган транслокациялык окуялар,Өтүү,A
Чет өлкөдө X өлкө министри тарабынан жасалган мыйзамсыз киши өлтүрүү империи же юр гестиону иш-аракет болуп саналат?,Мындай жүрүм-турум коомдук акт болуп саналат (юр империи),Мындай жүрүм - турум эч качан иммунитетти тартпайт,Мындай жүрүм-турум жеке иш-аракет болуп саналат (юр гестион),"Мындай жүрүм - турум коомдук иш болуп саналат , бирок иммунитет менен корголгон",C
"Бул суроо төмөнкү маалыматка тиешелүү.
Адегенде космос формада сфералык экенин белгилешибиз керек, жарым-жартылай, анткени бул форма эч кандай муундарды талап кемчиликсиз бүтүндөй болуп саналат, баарынан толук болуп саналат, жарым-жартылай, анткени ал баарын сактоого жана сактоого эң ылайыктуу эң жөндөмдүү форманы түзөт; же дагы бир жолу ааламдын бардык курама бөлүктөрү, бул Күн, Ай жана планеталар бул формада пайда болгондуктан; же баары өздөрүн аныктоого аракет болсо, суу тамчылары жана башка суюктук денелер учурда пайда болгондой эле, бул формага жетүүгө умтулгандыктан. Ошентип, бул форманын асмандагы денелерге таандык экенине эч ким күмөн санабайт. ...
Ошондуктан жердин да сфералык экени шексиз, анткени ал өз борборунда ар тараптан басылат. Тоолордун бийиктиктеринен жана өрөөндөрдүн депрессияларынан улам кемчиликсиз тегеректи түшүнүү мүмкүн эмес болсо да, бул жердин жалпы сфералык табиятына таасир этпейт. ...
Жердин сфера формасы бар экени буга чейин көрсөтүлгөндөй, биз бир кыймылдын да бул формага дал келер-келбесин жана Ааламда Жердин кайсы жерди ээлегенин карап чыгууга тийишпиз. ... Авторлордун басымдуу көпчүлүгү, албетте, жер ааламдын борборунда турат дегенге макул, жана тескерисинче деп ойлоо акылга сыйбаган жана күлкүлүү деп эсептешет. Бирок, эгерде маселе кылдат таразаланса, суроо али чечилбегендиктен жана ошондуктан эч кандай жолдор менен жеңил каралбагандыгы байкалат. Байкалган жердин ар бир өзгөрүүсү, атап айтканда, байкалган объектинин же байкоочунун кыймылына же экөөнүн тең кыймылдарына байланыштуу. ... Эми асман төңкөрүшү байкалып, ал биздин көзүбүз үчүн өндүрүлгөн жер бетинен. Ошондуктан жер эч кандай кыймылдан өтпөсө, бул кыймыл жердин сыртындагы бардык нерседе болушу керек, бирок жер бетиндеги бардык нерсе көчүп кеткенге караганда карама-каршы багытта болушу керек, жана мындай кыймыл күнүмдүк революция болуп саналат. Ошентип, бул бүт ааламга таасир эткендей көрүнөт, демек, жердин өзүн эске албаганда, жердин сыртындагы нерселердин баары. Бирок, эгерде бул кыймыл асман үчүн өзгөчө эмес экенин, бирок жер батыштан чыгышка айланганын моюнга алуу керек болсо, жана эгер бул Күндүн, Айдын жана жылдыздардын көрүнүктүү көтөрүлүшүнө жана батып кетишине байланыштуу кылдат каралса, бул реалдуу жагдай экени аныкталат."".
Николя Коперникус, Асман денелеринин төңкөрүштөрү, 1543
Өткөөл Коперниктин өз мезгилинин салттуу, аристотелиялык табигый философторунан айырмалангандыгынын далили катары колдонулушу мүмкүн, анткени ал муну сунуштады",космос — сфералык,Жер — сфералык,космос — геостатик,Жер туруктуу эмес,D
"1.0 М фенол, C6H5OH, чечимде H +(aq) концентрациясын аныктоо. (Фенол үчүн Ка — 1 × 10^-10.)",1 × 10^-10 М,1 × 10^-9 М,1 × 10^-3 М,1 × 10^-5 М,D
"Индиядан АКШга өтүү жөнүндө ойлонуп жатканда төмөнкү факторлордун кайсынысы Рива үчүн ""тартылуу"" фактору болуп эсептелет?",Жакырчылык,Жакшы жумуш жана жогорку эмгек акы,Индиянын каста системасы,Кошунасындагы зордук - зомбулук,B
"Англия жана Израиль сыяктуу өлкөлөрдөгү саясий партиялар менен салыштырганда, экөөнүн тең көп тараптуу системалары бар, америкалык саясий партиялар",шайлоонун жыйынтыктарына таасир этүүгө аз кызыкдар,ырааттуу саясий идеологиялар менен азыраак так аныкталган,саясий жактоочулардан акча чогултууда натыйжалуулугу аз,алардын бүт сайлау округторунун максаттарын жакшыраак чагылдыра алат,B
"Жакынкы миңге чейин дөңгөлөктүү бир катар 47,000 болуп саналат. Дөңгөлөктүү сан кайсы сан болушу мүмкүн?","46,295","46,504","47,520","47,924",B
"Бир танк үч бурчтуу призма калыпта. Үч бурчтуу база 116 чарчы метр аянты бар болсо, жана танк бийиктиги 30 фут болсо, ал толгондо танк канча суу камтыйт?",1725 фт^3,1740 фут^3,3480 фут^3,6960 фут^3,C
"Индуктордо индукцияланган кернеу катары көрсөтүлөт,",ал аркылуу анын индукциялык жана учурдагы продукту.,анын индукциясынын ал аркылуу учурдагыга катышы.,ал аркылуу учурдагы агымдын анын индукциясына катышы.,анын индукциясынын жана ал аркылуу учурдагы өзгөрүү ылдамдыгынын продукту.,D
"Төмөнкү өзгөчөлүктөрдүн кайсынысы, адатта, дата зордуктоо менен шайкеш келет?",ашыкча күч колдонуу,алдын ала ойдон чыгарылган,жыныстык түрткү,курал колдонууну камтыйт,C
y = 1 / 2 жана y = 1 пункттарынын ортосунда ийри y = ln x узундугун табуу.,0.53,0.86,1.18,1.36,C
$-dfrac{1}{-3}cfrac{1}{\frac{1}{-3}}$$ табуу,1,-1,0,2,B
Батыш Европада Жыйырманчы кылымдын башында кайсы психологиялык көз караш эң популярдуу болгон?,нейроғылым,эволюция,жүрүм-туруму,психоаналитикалык,D
Үйрөнгөн жардамсыздык менен түздөн - түз байланышта болушу мүмкүн,Барнум эффекти.,өзүмчүл бейкалыстык.,башкаруунун тышкы локустары.,сөзсүз оң көзкараш.,C
Гарсия менен Коэллингдин үйрөнгөн жек көрүндүлөргө байланыштуу изилдөөлөрү төмөнкү УКС жана CS жуптарынын кайсынысы эң күчтүү экенин жана эң тез үйрөнгөнүн аныктады?,тапшырманы аткаруу жана тамак-аш сыйлыгын алуу,"жүрөк оорусу, тамак-аш же ичимдик",кыймылы жана шок,жазалар жана сыйлыктар,B
"Марстын сууларынын кээ бирлери топуракта тоңуп, муз каптары жана кээ бирлери күн шамалын тазалоодон улам жоготулган, бирок баштапкы суулардын көбү башка механизм аркылуу жоготулган деп эсептелет. Бул ""жоготулган"" сууга эмне болду?",күч - кубаты тез азайганда магнит талаасы аны алып салган,"ультракүлгін жарык менен суутекке жана кычкылтекке бөлүнүп , жылуулук качуу аркылуу суутек жоготулган",суусаган марстыктардын цивилизациясы аны жеген,"ал катуу вулканизм учурунда бууланып , жылуулук качуу аркылуу мейкиндикке жоготулган",B
"1,5 × 10^6 м / с баштапкы ылдамдыкта саякаттап, протон 1,5 Т өлчөмүндөгү туруктуу магнит талаасынын аймагына кирет. Протондун баштапкы ылдамдыгы вектор магнит талаасы менен 30 ° бурч жасаса, магнит талаасына киргенден кийин протондун ылдамдыгын 4 с эсептөө.",5.0 × 10^6 м / с,7.5 × 10^6 м / с,"1,5 × 10^6 м / с",3.0 × 10^6 м / с,C
"Жогорку энергетикалык фосфаттардын, АТПнын жана фосфокреатиндин талкаланышынан чыгарылган энергия жөнүндө максималдуу күч-аш көнүгүүлөрүн уланта алат:",1-2 секунд.,5-10 секунд.,30-40 секунд.,50-60 секунд.,B
"бир катар райондук, бир чырак агымы 2 А болсо, жанындагы чырактагы агым","жарымы, 1 А",2:00 ЖАТАМ,Аккумулятор батареясына кайсы чырак жакыныраак экенине жараша,Айтууга жетиштүү маалымат жок,B
Төмөнкүлөрдүн кайсынысы убакыттын өтүшү менен экономикалык өсүштүн күчтүүрөөк болушуна алып келиши мүмкүн?,Жаратылыш ресурстарын тезирээк керектөө.,Чоңдордун сабатсыздык деңгээли жогору.,Капиталдык товарлардын төмөндөп бараткан запасы.,Инвестициялык салыктык кредиттер.,D
"Экономика терең рецессияга дуушар болуп жатат. Бул экономикалык жагдайды эске алганда, акча-кредит саясаты жөнүндө төмөнкү билдирүүлөрдүн кайсынысы так?",Кеңейтүү саясаты рецессияны гана начарлатат.,"Эгерде инвестициялар пайыздык чендеги өзгөрүүлөргө сезгич болсо, кеңейтүү саясаты жалпы суроо-талапты бир топ жогорулатат.",Консистенциялык саясат – бул инвестиция жана керектөө үчүн ылайыктуу стимул.,"Эгерде акчага болгон суроо-талап жеткилең серпилгич кеңейтүүчү акча-кредит саясаты болсо, бул абдан натыйжалуу болушу мүмкүн.",B
"Бизнес ________ аныктоо, ___________ жакшыртуу жана _________ жана ___________ ынталандыра турган _________ талабынан улам социалдык бухгалтердик эсеп менен алектенет","Катышуучулар, тобокелдиктер, катышуучуларды башкаруу, отчеттуулук, ачыктык","Катышуучулар, отчеттуулук, ачыктык, тобокелдиктер, катышуучуларды башкаруу","Катышуучулар, отчеттуулук, тобокелдиктер, катышуучулар, катышуучуларды башкаруу","Катышуучулар, катышуучуларды башкаруу, ачыктык, тобокелдиктер, отчеттуулук",A
"Берүүчүгө коюлган салык керектөөчүгө баанын өсүшү түрүндөгү берилиши ыктымалдыгы көбүрөөк болот, эгерде",суроо-талаптын баа серпилгичтиги абдан серпилгич болуп саналат.,суроо-талаптын баа серпилгичтиги абдан ажырагыс болуп саналат.,суроо-талаптын баа серпилгичтиги бирдик серпилгич болуп саналат.,суроо-талаптын эмгек акы серпилгичтиги абдан серпилгич болуп саналат.,B
1 - билдирүү | Топто (ab)^{-2} = b^{-2}a^{-2}. Билдирүү 2 | Топто (ab)^n = a^nb^n.,"Туура, туура","Жалган, жалган","Туура, жалган","Жалган, чын",B
Бир өлкөдө атаандаштыкка башка өлкөлөрдөгү атаандаштык канчалык деңгээлде таасир этет деген термин кандай?,Эл аралык соода,Глобалдык экономика,Глобалдык атаандаштык,Жаһан,D
"Программаны төмөндө программчы жазган. Программада numList деп аталган сандардын тизмеси колдонулат. Программа тизмедеги сандардын суммасын көрсөтүүгө арналган.
 сумма ← сан тизмеси [1]
 НУМЛИСТТЕГИ АР БИР БААЛУУЛУК ҮЧҮН
 сумманын суммасы + наркы ←
 ДИСПЛЕЙ суммасы
 Программаны текшерүү максатында программист numList-ты [0, 1, 4, 5] деп иниализациялайт. Программада 10 көрсөтүлөт, ал эми программчу программа максаттуу иштейт деген жыйынтыкка келет. Төмөнкүлөрдүн кайсынысы туура?",Корутунду туура; программа максаттуу иштейт.,"Корутунду туура эмес; программа сыноо иши үчүн туура мааниге ээ эмес [0, 1, 4, 5].","Корутунду туура эмес; тесттик ишти колдонуу менен [0, 1, 4, 5] программа туура деген жыйынтыкка келүү жетишсиз.","Корутунду туура эмес; тесттик ишти колдонуу менен [0, 1, 4, 5] программанын көбөйүү тартибинде тизмелер үчүн иштегенин гана тастыктайт.",C
Эмне үчүн Парфит теңдикке каршы?,Ал тең эмес коомго караганда сөзсүз деп ырастайт.,Ал жакырлардын муктаждыктарына артыкчылык берүү менен теңдикти жогорулата алабыз деп ырастайт.,Ал жакырчылыгыбыз үчүн ар бирибиз жооптуубуз деп ырастайт.,Ал теңдик идеясын толугу менен четке кагат.,B
