Question,A,B,C,D,Answer
Herpes virusları hansı xəstəliyə səbəb olmur?,İnfanil iflici,Ensefalit,Cinsi yolla keçən xəstəlik,Xərçəng,A
İkiqat kor və ya ikiqat maskalanmış araşdırmanın məqsədi aşağıdakılardan ibarətdir:,Müalicə olunan və müalicə olunmayan mövzuların müqayisəliliyinə nail olmaq,Sampling variasiyasının təsirini azaldın,Müşahidəçi və mövzu qərəzli yanaşma,Müşahidəçinin qərəzli yanaşmayın və müxtəlifliklərə riayət etməyin,B
" ""Daodejing"" klassik mətni ingilis dilində hansı titulla tanınır?",Dəyişikliklərin klassikası,Yol və qüvvə klassikası,Qadın klassikası,Fəlsəfənin klassikası,B
 Communidades de Base aşağıdakılardan hansı ilə əlaqəlidir?,Yepiskop Oskar Romero,Müqavimət və yenilənmə,Bütün insanların ləyaqəti,Yuxarıda göstərilənlərin hamısı,D
Baş prokuror aşağıdakı orqanlardan hansının rəhbəridir?,Senatın İntizam Komitəsi,Ədliyyə Nazirliyi,Dövlət Departamenti,Hakim Müdafiə generalının korpusu,B
Cari daşıyıcı tel forması haqqında magistral xəttlər,dairələr,radial xətlər,eddy axınları,enerji döngələri,A
«Çili kon karne» sözü nə ilə bağlı idi?,paxlalar,ət,pendir,çili bibərləri,B
Aşağıdakılardan hansı inelastik tələbat olan məhsulun üzərində qiymət qaldırıldıqdan sonra vəziyyəti ən yaxşı şəkildə təsvir edir?,Tələb olunan miqdar dəyişməyəcək.,Tələb olunan miqdar artacaq.,Ümumi gəlir azalacaq.,Ümumi gəlir dəyişməyəcək.,A
Müasir kompüter mikroçipləri əsasən hansı elementdən ibarətdir?,Sodium,Silikon,Alüminium,Gümüş,B
