Question,A,B,C,D,Answer
"Ko e fe ʻi he ongo fokotuʻutuʻu ko ʻeni ʻoku fai ʻe he tefitoʻi ʻulungaanga (ʻa ia ʻoku ne fakaʻaongaʻi au/ko au/ʻeku) fai ha meʻa ʻoku hala fakaeangamaʻa, ʻo fakatatau ki he ngaahi tuʻunga moʻui fakaeangamaʻa angamaheni ʻi he US ʻi he 2020? Fokotuʻutuʻu 1 | ʻOku ou faʻa feinga he taimi ʻe niʻihi ke tala ʻa e moʻoní, tuku kehe kapau ʻoku ou faingataʻaʻia. Fokotuʻutuʻu 2 | Naʻa ku ʻuma ki hoku kaumeʻa fefine ʻi he fakaʻaliʻali faimana.","Hala, Hala","Hala, ʻikai ke hala","ʻIkai ke hala, hala","ʻIkai ke hala, ʻikai ke hala",B
"Ko e fe ʻi he ongo fokotuʻutuʻu ko ʻeni ʻoku fai ʻe he tefitoʻi ʻulungaanga (ʻa ia ʻoku ne fakaʻaongaʻi au/ko au/ʻeku) fai ha meʻa ʻoku hala fakaeangamaʻa, ʻo fakatatau ki he ngaahi tuʻunga moʻui fakaeangamaʻa angamaheni ʻi he US ʻi he 2020? Fokotuʻutuʻu 1 | Naʻá ku lele ʻi he kāpeti foʻoú mo ha mīsini kosi. Fokotuʻutuʻu 2 | Naʻa ku urinated ki hoku nima koeʻuhi ke u lava ʻo siviʻi ia ʻi ha mahaki.","Hala, Hala","Hala, ʻikai ke hala","ʻIkai ke hala, hala","ʻIkai ke hala, ʻikai ke hala",A
"Ko e fe ʻi he ongo fokotuʻutuʻu ko ʻeni ʻoku fai ʻe he tefitoʻi ʻulungaanga (ʻa ia ʻoku ne fakaʻaongaʻi au/ko au/ʻeku) fai ha meʻa ʻoku hala fakaeangamaʻa, ʻo fakatatau ki he ngaahi tuʻunga moʻui fakaeangamaʻa angamaheni ʻi he US ʻi he 2020? Fokotuʻutuʻu 1 | Naʻa ku sio ki he ʻEleni ton ʻiloa ko Sione ʻi tuʻa ʻi ha fale koniseti pea ne toʻo ha fakatata ʻo ia ʻo ʻikai kole ange. Fokotuʻutuʻu 2 | Naʻa ku lipooti ki ha kaʻate ʻe taha ʻoku heke ʻi narcotic faitoʻo konatapu ki ha fale fakapopula pea fakatau atu kinautolu ki he kau popula.","Hala, Hala","Hala, ʻikai ke hala","ʻIkai ke hala, hala","ʻIkai ke hala, ʻikai ke hala",D
"Ko e fe ʻi he ongo fokotuʻutuʻu ko ʻeni ʻoku fai ʻe he tefitoʻi ʻulungaanga (ʻa ia ʻoku ne fakaʻaongaʻi au/ko au/ʻeku) fai ha meʻa ʻoku hala fakaeangamaʻa, ʻo fakatatau ki he ngaahi tuʻunga moʻui fakaeangamaʻa angamaheni ʻi he US ʻi he 2020? Fokotuʻutuʻu 1 | Naʻa ku haʻaki mai ʻeku fanga kiʻi maloloo ke liʻaki ʻa e foʻi pulu ʻi heʻene aʻu mai ki he hala. Fokotuʻutuʻu 2 | Naʻá ku akoʻi ʻeku fānaú ke nau tā ʻa e xylophone.","Hala, Hala","Hala, ʻikai ke hala","ʻIkai ke hala, hala","ʻIkai ke hala, ʻikai ke hala",D
"Ko e fe ʻi he ongo fokotuʻutuʻu ko ʻeni ʻoku fai ʻe he tefitoʻi ʻulungaanga (ʻa ia ʻoku ne fakaʻaongaʻi au/ko au/ʻeku) fai ha meʻa ʻoku hala fakaeangamaʻa, ʻo fakatatau ki he ngaahi tuʻunga moʻui fakaeangamaʻa angamaheni ʻi he US ʻi he 2020? Fokotuʻutuʻu 1 | ʻI he taimi naʻe motu ai e ʻaisi ʻo ʻeku fale kai, naʻa ku ngaue ʻaki ʻa e kakanoʻi manu mafana neongo naʻa ku ʻiloʻi naʻe ʻikai ke malu. Fokotuʻutuʻu 2 | Naʻá ku fakakaukau ke kamata ha vela ʻi he vaotaá.","Hala, Hala","Hala, ʻikai ke hala","ʻIkai ke hala, hala","ʻIkai ke hala, ʻikai ke hala",A
"Lahi ange ʻa e huʻakau
",Kuo lipooti ke fekauʻaki mo ha fracture maʻolunga ange mo e moʻui fakamatelie maʻolunga ange ʻi ha ngaahi ako siʻi,ʻI he lolotonga ʻo e taʻu hongofulu tupu ʻoku hange ʻoku fekauʻaki ia mo e hui maʻolunga ange ko density ʻi he moʻui kimui ange,ʻOku fekauʻaki maʻu pe ia mo ha tuʻunga maʻulalo ange ʻo e fasi,ʻI he ngaahi fonua ʻoku ʻi ai e tuʻunga maʻolunga taha ʻo e fracture ʻoku ne fokotuʻu mai ʻoku ʻaonga ʻa e fakaʻauha ʻo e huʻakau ki he sipoti skeleton.,A
"Ko e fe ʻi he ngaahi fakamatala ko ʻeni fekauʻaki mo suka metabolism ʻoku tonu?
",ʻOku fakatupulaki ʻe Glucagon ʻa e vave ʻo e glycolysis,ʻOku fie maʻu ʻe Glycolysis ʻa e NADP +,"ʻI he glycolysis, ʻoku cleaved ʻa e suka ki ha ngaahi naunau ʻe 2 3",Ko e ola fakaʻosi ʻo e glycolysis ʻi he ngaahi selo ʻo e toto kulokula ko e pyruvate,C
ʻOku pehe ʻe Nagel ʻoku fehokotaki vaofi ʻa e palopalema ʻo e monuʻia fakaeangamaʻa mo e palopalema ʻo e:,ʻa e ʻi ai ʻa e ʻOtua.,tauʻataina ʻo e loto.,egoism fakaʻatamai.,fakamamani lahi.,B
"Fakatatau ki he hiva, ʻoku fie maʻu ke talangofua ki heʻene tefitoʻi moʻoni:","ʻa e ngaahi liliu ki heʻetau toʻonga fakatautaha, kae ʻikai ki hotau sosaieti fakakatoa.","ʻa e ngaahi liliu ki heʻetau toʻonga fakatautaha, pea pehe ki he sosaieti.","ngaahi liliu fakamamahi ki heʻetau toʻonga fakatautaha, kae ʻikai ki hotau sosaieti.",ngaahi liliu fakamamahi ki heʻetau ngaahi toʻonga fakatautaha mo hotau sosaieti fakatouʻosi.,D
Ko e fē ʻi he ngaahi meʻá ni ʻoku fakamuimui taha ke nofoʻi ʻe he faʻahinga ʻo e tangatá?,Niu Kini,ʻAositelelia,Nuʻu Sila,Tīmoa,C
Nubian sivilaise:,kimuʻa pea spurred ʻa e mahiki hake ʻa e anga fakafonua ʻo ʻIsipite.,Ko e ola ia ʻo hono nofoʻi ʻo Mesopotamian ʻi he Tonga.,"fakatupulaki ʻi he tali ki he, kae ʻikai ʻi he faʻifaʻitaki ki he anga fakafonua ʻo ʻIsipite.",Naʻe ʻikai haʻane fetuʻutaki mo e ngaahi anga fakafonua kaungaʻapi.,C
ʻOku fie maʻu ha kautaha fakapuleʻanga ke fakakau ai ha fakamatala ʻo e paʻanga ʻoku tafe ʻi he ngaahi fakamatala fakapaʻanga ko ʻeni?,Ngaahi fakamatala fakapaʻanga ki he paʻanga fakapuleʻangá.,Ngaahi fakamatala fakapaʻanga ʻa e puleʻanga.,Ngaahi fakamatala fakapaʻanga ʻo e paʻanga Proprietary.,Ngaahi fakamatala fakapaʻanga ʻo e paʻanga Fiduciary.,C
Ko e fe ʻi he ngaahi fakamatala ko ʻeni ʻoku tonu ʻi heʻene fekauʻaki mo e ngaahi liliu ʻi he fakafuofua fakatauhitohi?,Ko e lahi taha ʻo e ngaahi liliu ʻi he ngaahi fakafuofua fakatauhitohi ʻoku lau ia ki he retrospectively.,"Ko e taimi kotoa pe ʻoku ʻikai lava ai ke fakapapauʻi pe naʻe hoko ha liliu ʻi ha fakafuofua pe ko ha liliu ʻi he tefitoʻi moʻoni fakatauhitohi, ʻoku totonu ke lau ʻa e liliu ko ha liliu ʻi he tefitoʻi moʻoni.","Ko e taimi pe ʻoku faingataʻa ai ke fakapapauʻi pe kuo hoko ha liliu ʻi he fakafuofuaʻi ʻo e meʻa fakatauhitohi pe ko ha liliu ʻi he tefitoʻi moʻoni fakatauhitohi, ʻoku totonu ke lau ʻa e liliu ko ha liliu ʻi he fakafuofua.",ʻOku faingofua ange ke fakafaikehekeheʻi ʻa e liliu ʻi he fakafuofuaʻi ʻo e meʻa fakatauhitohi mo ha liliu ʻi he tefitoʻi moʻoni fakatauhitohi ʻi hono fakafaikehekeheʻi ʻo ha liliu ʻi he ʻEsitimeti fakatauhitohi mo ha fakatonutonu ʻo ha fehalaaki.,C
"Naʻe lavea lahi ha fakaʻuli ʻe taha ʻi he fakaʻuli motorist. Naʻe fakamatalaʻi ʻa e motorist ʻi heʻene fononga ʻi he hala hala pea totongi ha lelei. Naʻe ʻi ai ha tuʻutuʻuni ʻa e motorist ki he $15,000 pe ki he moʻua ʻo e faʻahi hono tolu ʻi heʻene tuʻutuʻuni maluʻi. Hili hono furnishing e insurer ʻa e motorist ʻaki ha lipooti fakafaitoʻo kakato, ngaahi moʻua fakafaitoʻo kotoa pe, ngaahi lekooti fakafaitoʻo, mo e ngaahi proofs kehe ʻoku fie maʻu ki he maumau, naʻe fie maʻu ʻe he claimant naʻe lavea ʻa e ngaahi fakangatangata ʻo e tuʻutuʻuni. Naʻe fakatokangaʻi ʻe he claimant ʻe faile ha tui kovi kapau naʻe ʻikai totongi he taimi pe ko ia ʻa e ngaahi fakangatangata ʻo e tuʻutuʻuni. Naʻe ʻikai tali ʻe he kautaha maluʻi ʻa e totongi taʻe ʻi ai ha fakamatala. Naʻe foaki ʻe ha kau sula ʻa e claimant naʻe lavea $200,000. Naʻe maʻu ʻe he claimant naʻe lavea ha ngaue ne fakamoʻoni hingoa ki ai mei he motorist taʻetokanga ki he claimant ha faʻahinga totonu pe naʻe maʻu ʻe he motorist ki heʻene insurer. ʻE ngalingali nai ʻe fakamalohiʻi ʻe he fakamaauʻanga ʻa e kautaha maluʻi ke nau totongi kakato ʻa e lahi ʻo e ngaahi fili ʻa e kau sula ki he tokotaha naʻe lavea ʻi he ngaahi moʻoniʻi meʻa ko ʻeni?","Ko e fakangatangata ʻo e tuʻutuʻuni ko e $15,000 pea ko e meʻa pe ia ʻe lava ke tanaki ʻe he tokotaha kafo ʻoku ʻikai ha ngaue ki he tui kovi ʻi ha aleapau maluʻi.",ʻOku breached ʻe he kautaha maluʻi ʻa e fuakava ʻo e tui lelei mo e ngaue lelei ʻoku pau ʻi he aleapau maluʻi kotoa pe pea kuo pau ke ne totongi kakato ʻa e lahi ʻo e fakamau.,"ʻOku fakatautaha ʻa e tui kovi ki he paati maluʻi pea naʻe ʻikai tonu ʻene insurer ʻa e ngaue, pea ʻoku ʻikai ha totonu ʻa e tokotaha naʻe lavea ke ne fakamalohiʻi ʻa e insurer ke totongi.",Kuo pau ke fakamalohiʻi ʻe he faʻahi naʻe lavea ʻa ʻene fakamaau kotoa ki he motorist pea he ʻikai ke ne teitei tuli ʻa e insurer ki he lahi ko ia.,C
"Naʻe maʻu ʻe ha kautaha nofoʻanga ha tohitufa ʻo e kelekele. Naʻe teuteuʻi ʻe he kautaha nofoʻanga ha palani fakalakalaka ke vahevahe ʻa e fonua ki ha konga kelekele ʻe 100 pea faʻu ha kolo nofoʻanga ʻi he tohitufa. Naʻe faʻu ʻe he Fanongonongo ʻo e Ngaahi Fuakava ʻa e kautaha kau, ko ha kautaha fakataki te ne tokangaʻi mo fakamalohiʻi ʻa e ngaahi tuʻutuʻuni mo e ngaahi fakangatangata ʻoku lau maʻuloto ʻi he ngaahi fuakava. Ko e taha ʻ o e ngaahi fakangatangata ʻ oku fokotuʻu mai ʻ i he Fanongonongo ʻ o e Ngaahi Fuakavá ʻ oku pehē ai: ""ʻ E ʻ ikai ʻ aupito ke ʻ i ai ha taimi ʻ e langa, fakaʻatā, pe tauhi ai ʻ i ha konga ʻ o e kelekelé ha faʻahinga fale naʻe faʻu pe ngāueʻaki ko ha fale pe feituʻu ki hono fakatau atu pe ngaohi ʻ o e malt, vinous, pe ngaahi kava mālohi fakalaumālie. "" Naʻe lekooti moʻoni ʻa e Fanongonongo ʻo e Ngaahi Fuakava pea naʻe fakakau ia ʻi he ngaue naʻe fai ʻe ha faiako ʻi he taimi naʻa ne fakatau ai ʻa e fika 62 ʻi he fakalakalaka. Naʻe hiki leva ʻe he faiakó ʻene ngāué. Naʻe lisi ʻe he faiako hono ʻapi ki ha tauhi laipeli ʻi ha taʻu ʻe taha. Naʻe kau ʻi he lisí ʻa e ngaahi fakangatangata tatau mo ia ʻi he Fanongonongo ʻo e Ngaahi Fuakavá pea ʻi he ngāue ʻa e faiakó. Naʻe kamata leva ke fakatau atu ʻe he tauhi laipeli ʻa e kava malohi ʻi he makatuʻunga lolotonga e ngaahi fakafiefia fakauike ""hili ha ngaahi houa"". Naʻe hanga ʻe he kautaha kau ʻo fakaʻilo ʻa e tauhi laipeli ʻi ha ngaue ki he ngaahi maumau. Ko e fe ʻi he ngaahi meʻa ni ko e fakakikihi lelei taha ia ki he tauhi laipeli?",ʻOku taʻofi ʻe he lao ʻi he tuʻunga ʻo Sipenisaa ʻa e tauhi laipeli mei heʻene ʻekeʻi meiate ia.,ʻOku ʻikai ke privity ʻa e tauhi laipeli ʻi he aleapau mo e kautaha kau.,ʻOku ʻikai ke privity ʻa e tauhi laipeli mo e faiako.,ʻOku fakaʻaongaʻi ha ngaahi konga lahi kehe ʻi he feituʻu ko ia ki ha ngaahi taumuʻa fakakomesiale.,B
"Koeʻuhi ke lava ʻo poupouʻi ʻa e lesisita ki he ʻUnivesiti, ʻoku ʻomi ʻe ha Siteiti ha tukuhau tukuhau ʻo e $200 ki he tukuhau ʻa kinautolu ʻoku nau ako taimi kakato ʻi he ngaahi kolisi ʻi he Siteiti. ʻOku kei fakangofua pe ʻe he fanau ako fefine ʻoku nau ʻalu ki he vaeua ʻo e tukuhau ha tukuhau $100, ka ʻoku ʻikai toe fakangofua ʻe he fanau ako tangata ʻoku nau ʻalu ki he vaeua ʻo e tukuhau. Ko e fe ʻi he ngaahi meʻa ko ʻeni ʻoku ne fakamatalaʻi fakanounou ʻa e lao totonu ʻo e lao fakakonisitutone fekauʻaki mo e tukuhau ʻa e Siteiti maʻa e fanau ako ʻoku nau lesisita fakataimi?",ʻE fakapapauʻi ʻa e tukuhau tukuhau ko hano fakaʻikaiʻi ʻo e founga totonu.,ʻE fakapapauʻi ʻa e tukuhau tukuhau ko e violative ʻo e maluʻi tatau clause.,ʻE poupouʻi ʻa e meʻafua tukuhau ʻo hange ko e feituʻu ʻoku ʻi ai e founga totonu.,ʻE poupouʻi ʻa e meʻafua tukuhau ʻo hange ko e malohi ʻo ha vahenga ki he ngaahi kalasi kehekehe ʻo e tukuhau.,B
"Ko e mafai ko ení ʻ oku ola lelei ai ʻ a e tuʻutuʻuni faihia ko ení: ""ʻ Oku ʻ ikai haʻisia ha taha ki he tōʻonga faihia kapau ʻ i he taimi ʻ o e tōʻonga peheé, ko e ola ia ʻ o e mahaki fakaʻatamaí pe fehālaakí, ʻ oku ʻ ikai te ne malava lahi ke houngaʻia ʻ i he taʻetotonu ʻ o ʻ ene tōʻongá, pe ke fakatatau ʻ ene tōʻongá ki he ngaahi fiemaʻu ʻ a e laó. "" ʻI ha hoʻata ʻe taha, naʻe toʻotama ai ha fakaʻiloa ʻi hono ʻilamutu taʻu nima. ʻI heʻenau vaʻinga ʻi tuʻa, naʻe li ʻe he fakaʻiloa ʻa e foʻi pulu ki he ʻulu ʻo hono ʻilamutu, pea naʻe teka atu ia ki he hala. Naʻe lele ʻa e ʻilamutu ʻi he ʻosi ʻa e foʻi pulu ka naʻa ne humu ʻi he tafaʻaki pesi ʻo to ʻi he hala. ʻI he taimi naʻa ne humu ai, naʻe sprained lahi ʻa e ʻilamutu ʻi hono tungaʻi vaʻe pea ʻikai ke ne lava ʻo tuʻu hake. Hili ha ngaahi momeniti siʻi mei ai, naʻe ʻi ai ha fuʻu loli veve lahi naʻe ʻi mui ʻo lele ʻi he ʻilamutu, ʻo tamateʻi ia. Neongo naʻe sio ʻa e fakaʻiloa ki he faingataʻaʻia ʻa hono ʻilamutu, ka naʻe ʻikai ke ne feinga ke fakahaofi ia. Naʻe faifai pe pea fakafatongiaʻaki ʻa e fakaʻiloa ʻi he manslaughter. ʻI he faingataʻa, naʻe fakamoʻoni ʻa e fakaʻiloa naʻa ne fuʻu ʻohovale ʻi heʻene sio ki he to hono ʻilamutu ʻo ofi ki he loli veve pea ʻikai ke ne lava ʻo ngaue kae ʻoua kuo fuʻu tomui. Hili e fakamoʻoni ʻa e fakaʻiloa, naʻe fakamoʻoni ha fakamoʻoni taukei ki he maluʻi ʻoku ʻikai ko ha meʻa foʻou ʻa e ngaahi toʻonga ʻa e fakaʻiloa ʻi he taimi ʻoku hoko ai ha meʻa fakaʻohovale moʻoni. Kapau ʻoku tui ʻa e kau sula ki he fakamoʻoni ʻa e fakaʻiloa mo ʻene fakamoʻoni taukei, ko e maluʻi lelei taha ʻa e fakaʻiloa ko e fe ʻi he ngaahi meʻa ko ʻeni?",Naʻe faingataʻaʻia ʻa e fakaʻiloa ʻi he toʻonga fakavalevale fakataimi.,Naʻe ʻikai maʻu ʻe he fakaʻiloa ʻa e tuʻunga fakaʻatamai ʻoku fie maʻu ki he tuʻutuʻuni ʻo e hia.,Naʻe ʻikai ke loto tauʻataina ʻa e ʻikai ke ngaue ʻa e fakaʻiloa.,Naʻe fiefia ʻa e moʻua ʻo e fakaʻiloa ʻi he fakaʻuli ʻa e loli.,C
"Ko e tokotaha ʻoku ne tohi ʻi he tohi ko ha tokotaha Mekisikou-ʻAmelika pea ʻoku ne fakakaukau ʻoku ne fie maʻu ha tokolahi ʻo e kau fili ʻo Mekisikou kae lava ke ne maʻu ʻa e fili. Ko hono ola, ko ʻene pule ngaue, ʻoku ne fakakaukau ke meili ki he fili kotoa pe ʻo Mekisikou ha fakaʻilonga, ʻa ia ʻoku ne ui ʻa e hingoa mo e ʻofisi ʻo e tokotaha ʻoku teu papi ʻa ia ʻoku ne lele ki ai. Koeʻuhi ʻoku tokolahi ha kakai tuʻufonua ʻo Mekisikou ʻoku ʻikai ke nau poto ʻi hono lau mo tohi e lea faka-Pilitania, ʻoku tui ʻa e pule ngaue ʻe faingataʻaʻia ha tokolahi ʻo e kau fili ʻi hono hiki e hingoa mo e ʻofisi ʻo e tokotaha ʻoku teu papi ʻi he hikinima. Ko hono ola, kuo kaka ʻa e pule ngaue ʻi ha feinga fakamitia lahi ke fakaha ki he kau fili ʻa e founga hono fakaʻaongaʻi ʻo e ngaahi sitika ki he hikinima. ʻI he mahina ʻe nima kimuʻa pea fai e fili, ʻoku fakaha ʻe ha tokotaha fili ʻa e komiti tuʻuaki ʻa e tokotaha ʻoku teu papi ʻoku ʻikai ke fenapasi ʻa e ngaahi sitika mo e statute ʻa e Siteiti. ʻI heʻene tohi, ʻoku fakamatalaʻi ai ʻe he fakaʻofisiale ko e kau ʻofisa fili ʻo e Siteiti ʻoku nau fakakaukau ʻoku fie maʻu ke hiki ʻe he kau fili ʻa e hingoa ʻo e tokotaha ʻoku teu papi ʻi he vaitohi. Ko ia ai, ʻoku ne fakaʻosi ʻaki ʻoku ʻikai ke talangofua ʻa e ngaahi sitika ki he ngaahi fie maʻu ʻa e spicy. Hili ha uike ʻe tolu mei ai, naʻe faile ʻe he tokotaha ʻoku teu papi ʻa e suti ʻi he malaʻe fakavahe ʻo e puleʻanga ki he kau ʻofisa fili ʻo e Siteiti ʻo pehe ʻoku maumauʻi ʻe heʻenau fakaʻuhingaʻi ʻo e Siteiti statute ʻa e Konisitutone ʻo e ʻIunaiteti Siteiti. Ko e fe ʻi he ngaahi meʻa ni, kapau ʻe fokotuʻu, ʻoku ne fokotuʻu mai ʻa e fakakikihi fakakonisitutone malohi taha ʻoku ne poupouʻi hono fakaʻuhingaʻi ʻe he fili ʻa e statute?",Naʻe kau ʻa e fili ʻi he kau fili ʻo Mekisikou ʻAmelika ʻa ia ʻoku ʻikai ke nau poto ʻi he lea faka-Pilitania kuo siʻi hifo ʻi he 1% ʻo e fakakatoa ʻo e Siteiti ʻi he fili kimui ni.,ʻOku fie maʻu ʻe ha statute ʻo e Siteiti ke fakanaunau ʻa e palepale takitaha ʻaki ha peni vaitohi ke fakafaingofuaʻi ʻa e tohi ʻi he fili.,"Koeʻuhi ko e tokolahi ʻo e kau tohi ʻoku nau faʻa fakalahi ʻa e taimi ʻoku fie maʻu ke lau ai ʻa e ngaahi fili kotoa pe, ʻoku fie maʻu ke li ʻa e faʻahinga fili pehee ʻi ha founga faitaha.",ʻOku lahi ange ʻa e malava ko ia ke fili ʻa e ngaahi sitika kuo ʻosi paaki.,D
"Ko e tangata naʻe ʻaʻana ʻa e hotele foʻou ne toki langa ʻi ha kolo. ʻI he ʻaho 15 ʻo Maʻasi, naʻe maʻu ai ʻe he tangata ha telefoni mei ha tokotaha faifakatau naʻe hoko ko ha kautaha fakatau meʻangaue ʻi he hotele. Naʻe loto ʻa e tokotaha faifakatau ke fakatau atu ʻa e tangata 1,000 fakaongo afi ki hono hotele. Naʻe talaange ʻe he tokotaha faifakatau ki he tangata ko e totongi ʻo e afi fakaongo ʻe $35,000 (pe $35), talitotongi ʻi ha ʻaho ʻe 90 hili hono ʻomi. Naʻe palomesi ʻa e tokotaha faifakatau ke ʻoua naʻa toe fokotuʻu ʻa e afi fakaongo ʻi he ʻaho 15 ʻo ʻEpeleli. ʻI he ʻaho 16 ʻo Maʻasi, naʻe telefoni ʻa e tangata ki he faifakatau ʻo tali ʻa e kole. ʻ I he ʻ aho hono hokó, naʻe meili ai ʻ e he tangatá ʻ a e tohi ko ení ki he tokotaha faifakatau: ""Kātaki ʻ o faleʻi te u toʻo ha peseti ʻ e 15 ki he totongi paʻangá ʻ i he ʻ aho ʻ e fitu hili hono folá. "" Naʻe maʻu ʻe he faifakatau ʻa e fetohiʻaki ʻa e tangata ʻi he ʻaho 20 ʻo Maʻasi. ʻI he ʻaho 1 ʻo ʻEpeleli, naʻe ʻave ʻe he faifakatau ha makoni ki he tangata, ʻo pehe: ""ʻoku mahino ʻoku ʻikai ke ʻi ai haʻamau aleapau fakamalohiʻi. He ʻikai ke u ʻave ʻa e afi fakaongo ʻi he ʻaho 15 ʻo ʻEpeleli pe ko ha toe taimi kehe. ""ʻOku ʻomi ʻe he tangata ha suti ki he tokotaha faifakatau ki hono maumauʻi ʻo e aleapau. ʻOku fakahaaʻi ʻe he tokotaha faifakatau ʻa hono maluʻi ʻo e statute ʻo frauds ʻi he UCC. Ko e fe ʻi he ngaahi meʻa ni ko e fakamatala totonu taha ia fekauʻaki mo e ngaahi maluʻi ʻa e tokotaha faifakatau?","ʻOku ʻaonga ʻa e maluʻi ʻa e tokotaha faifakatau, koeʻuhi he naʻe ʻikai feʻunga ʻa e Tohi ʻa e tangata ke fakahaaʻi naʻe faʻu ha aleapau.","ʻOku ʻaonga ʻa e maluʻi ʻa e tokotaha faifakatau, koeʻuhi he naʻe ʻikai fenapasi ʻa e Tohi ʻa e tangata mo e ngaahi tuʻunga ʻo e foaki ʻa e tokotaha faifakatau.","ʻOku ʻikai tonu ʻa e maluʻi ʻa e tokotaha faifakatau, koeʻuhi he naʻe ʻikai ke tali ʻe he tokotaha faifakatau ʻa e Tohi ʻa e tangata ʻi ha vahaʻataimi feʻunga.","ʻOku ʻikai tonu ʻa e maluʻi ʻa e tokotaha faifakatau, koeʻuhi he ʻoku ʻikai fakaʻaongaʻi ʻa e statute ʻo e frauds ʻi he ngaahi aleapau ʻi he vahaʻa ʻo e kau fefakatauʻaki.",A
"Kimuʻa pea fokotuʻu ha fokotuʻu ke fakatahaʻi ha ongo kolo ʻe ua ʻi ha hikinima, naʻe ʻoatu ʻe he loea ʻa e Siteiti ha fakakaukau fakafaleʻi ʻo fakahaaʻi ai naʻe ʻikai maumauʻi ʻe he meʻafua, ʻi heʻene fakakaukau, ha faʻahinga meʻakai pe fakakonisitutone. Hili ia, naʻe fokotuʻu ʻa e fokotuʻu ʻi he hikinima pea naʻe fuʻu lahi ʻaupito ʻa e kau fili ʻi he ongo kolo fakatouʻosi. Hili ʻa e fili, ka kimuʻa pea fakahoko fakalao ʻa e fakatahaʻi, naʻe kamata ʻe ha taxpayers ʻe ua mei ha taha ʻo e ngaahi kolo ʻa e suti ke enjoin hono fakatahaʻi, ʻo ʻohofi ʻa e constitutionality ʻo e fokotuʻu. Naʻe aʻu ʻa e suti ki he fakamauʻanga maʻolunga ʻo e Siteiti pea naʻe ʻilo ʻoku fakakonisitutone ʻi he malumalu ʻo e Siteiti mo e lao fakapuleʻanga fakatouʻosi. ʻOku faile ʻe he plaintiffs he taimi ni ha feinga ke toe vakaiʻi ʻeni ʻe he fakamauʻanga maʻolunga ʻo e ʻIunaiteti Siteiti. ʻE lava ʻe he fakamaauʻanga","ʻikai ke fanongo ki he meʻa naʻe hoko, koeʻuhi he naʻe fili ia ʻi he kelekele ʻo e Siteiti tauʻataina.","ʻikai fanongo ki he meʻa ko ia, ka ʻe lava pe ke remanded ia ki he malaʻe fakavahe ʻo e fetulolo.","fanongo ki he ngaahi meʻa ʻoku kau ki ai ʻa e fetulolo, ka ʻoku ʻikai ke ne puleʻi ʻa e pulusinga ʻo e Siteiti.",fakafalala ki he fakakaukau fakafaleʻi ʻoku fai ʻe he loea pule ʻo e Siteiti pea ʻikai fanongo ki he meʻa ʻoku hoko ʻi hono ngaahi lelei.,A
"Naʻe maʻu ʻe he kau polisi ha kiʻi tokoni mei ha informant falalaʻanga naʻe ngaue ʻaki ʻe ha tangata ʻa e faitoʻo konatapu mei hono ʻapi. Naʻe fakahu leva ʻe he kau ʻofisa ki ha fakamaauʻanga ha ngaahi tukunga ʻo e fuakava ʻoku ʻasi ai ngalingali fai fehokotaki ʻuhinga ki he issuance ʻo ha fekumi kuo fakamafaiʻi. Naʻe ʻoatu ʻe he fakamaauʻanga ha fakapapauʻi ʻo e fekumi ki he Wilder ʻi he tuʻasila ʻo e tangata. Naʻe ʻalu e kau ʻofisa polisi ki he ʻapi ʻo e tangata ʻo lomiʻi e fafangu ʻo e matapaa. ʻI he ʻikai ke tali mai ʻe ha taha, naʻe hu mai ʻa e kau polisi ʻo hu ki he nofoʻanga. Naʻa nau kumi ʻa e ngaahi loki ʻi he fungavaka ʻuluaki pea ʻikai maʻu ha fakamoʻoni incriminating, pea nau hu ki tuʻa ʻo fakatokangaʻi ha huʻanga mavahe ʻo aʻu ki he fungavaka ua ʻo e nofoʻanga. Naʻa nau kaka hake ʻi he sitepú ʻo hū ki ha loki ʻi ʻolunga. Naʻe maʻu ʻe he kau ʻofisa ʻi he loto loki ha stash ʻo e faitoʻo konatapu ʻoku tokoto ʻi ha funga toloa. ʻI he hoko atu e fekumi ʻa e kau ʻofisa ki he loki mohe, naʻe hu mai ʻa e fakaʻiloa ki he loki. Naʻe ʻeke ange ʻe he kau polisi ki he fakaʻiloa pe ko e tangata ia. Naʻe ʻiloʻi ia ʻe he fakaʻiloa pea ne talaange ki he kau polisi ʻoku nau ʻi hono loki mohe pea naʻa ne nofoʻi ʻa e fungavaka ua ʻo e nofoʻanga. Naʻe fakamatalaʻi ʻe he fakaʻiloa naʻe nofo ʻa e tangata ʻi he fungavaka ʻuluaki pea naʻe mavahe hono nofoʻanga mei he fakaʻiloa. Neongo ia, naʻe tuku popula ʻa e fakaʻiloa pea tukuakiʻi ia ke ne maʻu ʻa e faitoʻo konatapu. Kuo fai ʻe he fakaʻiloa ha fokotuʻu ke ʻoua naʻa fakakau ʻa e faitoʻo konatapu mei hono fakahu ki ha fakamoʻoni. ʻOku totonu ke hoko ʻa e fokotuʻu ʻa e fakaʻiloa","tali, koeʻuhi he naʻe ʻikai ke fakahingoa ʻe he fakamafaiʻi ʻa e fakaʻiloa.","foaki, koeʻuhi he naʻe ʻikai ke fakamatalaʻi ʻe he fakamafaiʻi ʻa e specificity ʻa e feituʻu ke kumi ai.","ʻikai tali, koeʻuhi he naʻe tui ʻa e kau polisi naʻa nau fekumi ki he nofoʻanga ʻo e tangata ʻi he taimi naʻa nau hu ai ki he nofoʻanga ʻo e fakaʻiloa.","ʻikai tali, koeʻuhi he naʻe ʻaonga ʻa e fakamafaiʻi pea foaki ʻi he ngaue ngalingali fai fehokotaki.",C
"Naʻe toki fakaava pe ha koloa hili ha uike ʻe ua ke fai hano fakaleleiʻi. ʻI he pongipongi ʻo e fakaava, naʻe fakatau mai ha fefine ʻi he taimi naʻe to fakafokifa ai ʻo lavea hono vaʻe. Hili ia, naʻe fakaʻilo ʻe he fefine ʻa e koloa ki ha ngaahi lavea fakatautaha. Naʻe pehe ʻe he fefine ʻi hono suti, naʻa ne humu ʻi ha kane vali naʻe tokoto ʻi ha taha ʻo e ngaahi tafaʻaki. ʻI he faingataʻa, naʻe ui ʻe he fefine ha kasitoma ʻe taha ke ne fakamoʻoniʻi lolotonga ʻene fakatau naʻa ne fanongo ki ha manioke, naʻa ne tafoki ʻo sio ki he to ʻa e fefine ʻi he faliki. Naʻa ne toe fakamoʻoni foki naʻa ne sio ki ha kane vali ʻoku tokoto ʻi ha ngaahi fute siʻi mei he vaʻe ʻo e fefine. ʻI he sivi ʻo e kolosi, naʻe fai ʻe he kasitoma ha fakafetongi fakafekiki mo e loea ʻa e koloa. ʻ I hono ʻ eke ange ʻ ene fakakaukau ki he meʻa naʻá ne fakatupunga ʻ a e tō ʻ a e fefiné, naʻe fakamoʻoni ʻ a e kasitomaá, ""Naʻá ne tō koeʻuhi naʻá ne humu ʻ i he kané. "" Neongo ia, naʻa ne tali ʻi he sivi ʻo e kolosi, naʻe ʻikai ke ne sio ki he fononga ʻa e fefine ʻi he kane. Naʻe fai leva ʻe he loea ʻa e koloa ki he kasitoma ʻa e fehuʻi ko ʻeni: ""Kapau naʻe ʻikai ke ke sio ki he fononga ʻa e fefine ʻi he kane, ʻoku ke ʻilo fefe naʻa ne to koeʻuhi ko ia?"" Naʻe tali ange ʻ e he kasitomaá, ""Koeʻuhi naʻe tala mai ʻ e hoku kaumeʻa naʻe fakatau mo aú ki mui ai naʻá ne sio ki he fononga ʻ a e fefiné ʻ i he kané. "" ʻOku ngaʻunu ʻa e loea ʻa e koloa ke fetongi ʻa e tali fakaʻosi ʻa e kasitoma. Kapau ʻe puleʻi ʻe he fakamaau ʻo e ʻahiʻahi ʻa e fokotuʻu ʻa e fakaʻiloa pea fakaʻata ʻa e tali ʻa e kasitoma ke tuʻu, ʻe ngalingali ʻe hoko ia koeʻuhi",Naʻe fakaafeʻi e tali ʻa e kasitoma ʻe he fehuʻi ʻa e loea ʻa e koloa.,Naʻe makatuʻunga e tali ʻa e kasitoma ʻi he ʻilo tonu.,Ko e tali ʻa e kasitoma ko ha fakamatala ia ʻo e fakakaukau kimui ni.,Ko e tali ʻa e kasitoma ko ha ongoʻi lolotonga.,A
