Question,A,B,C,D,Answer
Кое от следните най-добре описва етичните насоки по отношение на сексуалните интимности с бивши клиенти на терапията?,На психолозите е забранено да имат сексуални интимности с бивши клиенти на терапията при никакви обстоятелства.,На психолозите е забранено да имат сексуални интимности с бивши клиенти на терапията в продължение на най-малко една година след прекратяването на терапията.,"На психолозите е забранено да имат сексуални интимности с бивши клиенти на терапията при определени обстоятелства (например, когато съществува риск от експлоатация).",На психолозите не е забранено да имат сексуални интимности с бивши клиенти на терапията.,C
"Изследване на усвояването на втори език показа кое от следните за децата, които усвояват втори език",Когнитивното им развитие се забавя,"Те имат по-добра артикулация от децата, които не са двуезични",Владеенето на родния им език не оказва влияние върху скоростта на усвояване на втория език,Те имат повишена когнитивна гъвкавост,D
В коя област на връзките с обществеността е вероятно да се включи лобиране?,Корпоративен,Финансови отношения,Връзки с обществеността,Бизнес към бизнес,C
"В контекста на глобализацията, как най-добре можем да дефинираме термина ""развитие""?","Терминът развитие се отнася до човешкото състояние, в което има свобода от страх и нужда; Има достатъчно ресурси за поддържане на живота и този живот може да съществува в състояние, свободно от заплахата или възприеманата заплаха от внезапно прекъсване.","За да бъде считана за развита, една нация трябва да е постигнала определен икономически и политически статус в рамките на глобалната държавна система; По този начин критерият за това какво представлява ""развито"" състояние се определя от тези изисквания за взаимодействие в тази система.","Развитието е средство за справяне с неравенствата, които съпътстват неолибералната глобализация. В този контекст развитието се отнася до способността на населението или общността да използва ефективно ресурсите и да повишава ефективността в производството и разпределението, насърчавайки по-справедливото разпределение на доходите в обществото.","Развитието на една общност се отнася до идеологическите и етични ценностни системи, към които се присъединява нейното население. В глобализираната международна система това се отнася до приемането на западната либерална демократична идеология и свободната пазарна икономика.",C
Кое от следните най-добре описва евроцентризма?,"Евроцентризмът е стил на анализ, при който европейските общества се сравняват с неевропейските общества, за да се получи безпристрастно сравнение на относителните достойнства на всяко от тях.","Евроцентризмът е стил на мислене, в който оценката и оценката на неевропейските общества е формулирана от гледна точка на културните предположения и пристрастия на европейците.","Евроцентризмът описва изследвания или научна работа, които разглеждат само европейските политически или икономически системи.",Всички тези опции.,B
"Коя от следните теории се фокусира върху това как обществото успява да извършва дейностите, необходими за поддържане на реда и стабилността?",Функционализъм,Интеракционизъм,Теория на рационалния избор,Теория на конфликтите,A
Кое от следните е личен документ със затворен достъп?,"Правителствена ""Бяла книга""",Поверителни медицински досиета,Счетоводна книга за домакинствата,регистъра на акциите на дадено предприятие,C
Коя от следните точки подкрепя аргумента за американския унилатерализъм?,Доброжелателна хегемония,Неефективност на мултилатерализма,Американската мощ,Всичко по-горе,D
Какво заболяване не причиняват херпесните вируси?,Детска парализа,Енцефалит,Полово предавани болести,Рак,A
Целта на двойно-сляпо или двойно маскирано проучване е:,Постигане на сравнимост на лекуваните и нелекуваните лица,Намаляване на ефектите от вариацията на пробите,Избягвайте пристрастията на наблюдателя и субекта,Избягвайте пристрастията на наблюдателя и вариациите в извадката,B
 Класическият текст Daodejing е известен с какво заглавие на английски език?,Класика на промените,Класика на пътя и силата,Класика на жените,Класика на философията,B
 Communidades de Base е свързана с кое от следните?,епископ Оскар Ромеро,Устойчивост и обновяване,Достойнството на всички човешки същества,Всичко по-горе,D
Главният прокурор е ръководител на кое от следните образувания?,Сенатската юридическа комисия,Министерството на правосъдието,Държавният департамент,Корпусът на генералния адвокат на съдията,B
"Линиите на магнитното поле около формата на проводник, носещ ток",Кръгове,радиални линии,Вихрови токове,енергийни контури,A
"Терминът ""чили кон карне"" се отнася до чили с какво?",фасул,месо,сирене,люти чушки,B
"Кое от следните най-добре описва ситуацията след повишаване на цената на продукт, който има нееластично търсене?",Търсеното количество няма да се промени.,Търсеното количество ще се увеличи.,Общите приходи ще намалеят.,Общите приходи няма да се променят.,A
