Question,A,B,C,D,Answer
"Ko ha tangata faama ʻ oku lolotonga ʻ i ai ʻ a e lēkooti ʻ o ha konga kelekele naʻe vaheʻi ko e ""A. "" Ko e māʻolunga ange ia ʻ i he ongo koloa kaungāʻapi ʻ i ha moʻunga. Ko e tangata fama ko e tokotaha ia ʻoku ʻaʻana ʻa e konga kelekele ""B,"" ʻa ia ʻoku tuʻu maʻulalo ange ʻi he ""A"" ʻi he tafa moʻunga. ʻI he 2000, naʻe langa ʻe he tangata faama, ʻa ia naʻa ne maʻu ʻa e ongo konga kelekele fakatouʻosi, ha founga fakatafe fakatautaha. Naʻe kau ʻi he polokalama ko ʻeni ha pipeline ʻi lalofonua ʻa ia naʻe mafola atu ʻi he ongo konga kelekele fakatouʻosi. Ko e vahe mei he konga kelekele ""ko ha"" ongosia ʻi he polokalama ki ha sewer fakakolo, ʻa ia naʻe tuʻu ʻi he takele ʻo e moʻunga. ʻI he 2005, naʻe fakatau atu ʻe he tangata faama ʻa e konga kelekele ""B"" ki he tangata fama. Naʻe ʻikai ha lau ʻa e ngaue ki he tangata fama ki he founga fakatafe ʻo e tangata faama. ʻOku tuʻu ʻi he ngaahi konga kelekele takitaha ha ngaahi ʻapi lalahi ʻoku nofoʻi ʻe he kau maʻu. Ki muí ni mai, kuo kamata ke ʻ ai ʻ e he pesoni tafitafí ha nanamu taʻefakafiemālie ʻ i he konga kelekele ko e ""B. "" ko hono olá, naʻe fakaʻilo ai ʻ e he tokotaha fāmá ʻ a e tangata faama ʻ i he faihalá ʻ o lotu ki he ngaahi maumau naʻe fakatupunga ʻ e he fakatafeʻanga vaí. ʻOku totonu ke fai ʻa e fakamāú ki he","ʻa e tangata faama, koeʻuhi he naʻe ʻikai ke kau ʻi he ngaue ʻa e tangata fama ha ngaahi fuakava naʻa ne taʻofi hono fakaʻaongaʻi ʻe he tangata faama ʻa e kelekele.","ʻa e tangata faama, koeʻuhi he ko e tupuʻanga totonu ʻo e ngaue ʻa e tangata fama ko e fakamoveuveu, kae ʻikai ko e faihala.","ʻa e tangata fama, koeʻuhi he ko e founga fakatafe ko e tupuʻanga proximate ia ʻo e ngaahi maumau ʻa e plaintiff ko ha lao.","ʻa e tangata fama, koeʻuhi he naʻe ʻikai maʻu ʻe he tangata faama ʻa e totonu ke fakaleleiʻi hono kelekele ʻi ha founga naʻe fakatupu maumau ai ki ha taha kehe.",B
"ʻOku haʻu ha fefine taʻu 54 ki he ʻofisi koeʻuhi he naʻa ne toutou oloʻi ʻa e mamahi ʻi hono kouʻahe toʻomataʻu mo hono kaungao lolotonga e uike ʻe 3 kuo hili. ʻOku tolonga ʻa e tukunga takitaha ʻo e mamahi ʻi ha sekoni ʻe 1 pe siʻi ange. ʻOku faʻa fakatupu ʻa e mama ʻe he ʻea momoko, mama, ala ʻoku fakaʻaiʻai, mo fulunifo hono nifo. Naʻe ʻikai haʻane lavea ki he mata pe ʻulu. ʻOku fakaofo ʻa e hisitolia fakafaitoʻo ki he langa ʻulu, obesity, mo e tafa gastric. ʻOku ne senitimita ʻe 165 (5 FT 5 ʻi he) maʻolunga pea kilo ʻe 62 (137 lb); KO E BMI ko e kilo ʻe 23/m2. ʻOku angamaheni ʻaki pe ʻa e ngaahi fakaʻilonga mahuʻinga. He ʻikai lava ʻe he mahaki ʻo katakiʻi ʻa e ala ki he tafaʻaki toʻomataʻu ʻo e mata. ʻOku ʻikai ha vaivai pe mole ʻa e ongo. ʻOku ʻikai ha abnormalities ʻi he toenga ʻo e sivi fakatuʻasino. CT scan ʻo e ʻulu pea ʻikai ha fakafehoanaki ʻoku ʻikai ha abnormalities. Ko e fe ʻi he ngaahi meʻa ni ko e pharmacotherapy lelei taha ia ʻi he taimi ko ʻeni?",Carbamazepine,Lamotrigine,Levetiracetam,Topiramate,A
Naʻe fakahaaʻi ʻe he ngaahi ako ki he etiology ʻo Schizophrenia ha ngaahi meʻa tukufakaholo ki he tuʻunga ko ia ka ʻoku kau ai ha ngaahi meʻa kehe. Mei hoʻo ʻilo ki he kaveingá ke ke ʻiloʻi pe ko e fē ʻi he ngaahi fakamatala ko ʻení ʻoku halá.,ʻE lava ke hoko ʻa e dopamine pe ongoʻingofua ʻo e dopamine ko ha meʻa contributory.,ʻOku symptomatic ange ʻa e kau mahaki hinehina.,Ko e fakamolemole mei he tuʻunga ʻi he mamani hono tolu ko e 65%.,Naʻe ʻilo ʻe ha schizophrenia maʻulalo ange ʻi he lotolotonga ʻo ʻAfilika ʻAmelika.,D
"ʻOku ʻilo ʻe ha tokotaha ngaue ʻi he kautaha ngaohiʻanga koloa lahi ʻa e ngaue ʻoku taʻeoli, pea ne fua pe ʻa e ngaue ki he paʻanga. ʻOku minimally ʻa e tokotaha ngaue, pea ʻoku ʻikai fakaʻaiʻai ia ke ne ʻomi ha tuʻunga maʻolunga taha pe lelei ange. Fakatatau ki he fakakaukau ʻa F. Herzberg, ko e founga lelei taha ʻe 10 ʻe fakatupulaki ai e fakaʻaiʻai ʻa e tokotaha ngaue ko ʻeni ke",fai ha totongi mo ha fakaʻaiʻai ki ha ola lahi ange,toe fokotuʻutuʻu foʻou ʻa e ngaue ke ʻomi ha faingataʻa mo ha ongoʻi lavameʻa,fakalahi e ngaahi faingamalie ki he feohi fakasosiale,ʻoange ki he tokotaha ngaue ha ngaue ʻoku ne toʻotoʻo ha ngeia lahi ange,B
Ko e fe ʻi he ngaahi meʻa ko ʻeni ʻoku ne fakamatalaʻi lelei taha ʻa e ngaahi fakahinohino fekauʻaki mo e feohi fafale fakasekisuale mo e kau kasitomaa kimuʻa?,ʻOku ʻikai ngofua ke ʻomi ʻa e ngaahi feohi fafale fakasekisuale mo e kau kasitomaa kimuʻa ʻi ha faʻahinga tukunga pe.,ʻOku ʻikai ngofua ke ʻomi ʻa e ngaahi feohi fafale fakasekisuale mo e kau kasitomaa kimuʻa ʻi ha taʻu ʻe taha hili hono fakangata ʻo e fakamalohisino.,"ʻOku ʻikai ngofua ke ʻomi ʻa e ngaahi feohi fafale fakasekisuale mo e kau kasitomaa kimuʻa ʻi ha ngaahi tukunga pau (e.g., ʻi he taimi ʻoku ʻi ai ha fakatuʻutamaki ʻo e ngaohikovia).",ʻOku ʻikai taʻofi ʻa e ʻomi mei he feohi fafale fakasekisuale mo e kau kasitomaa kimuʻa.,C
Kuo fakahaaʻi ʻe he fekumi ʻi he lea fakafonua hono ua ʻa e ngaahi meʻa ko ʻeni fekauʻaki mo e fanau ʻoku nau maʻu ha lea fakafonua hono ua,ʻOku toe toloi ʻenau fakalakalaka fakaʻatamai,ʻOku lelei ange ʻenau articulation ʻi he fanau ʻoku ʻikai ke nau lea,ʻOku ʻikai ha ola ʻo ʻenau poto he lea fakafonua ʻi he vave hono maʻu ʻo e lea fakafonua hono ua,Kuo nau fakatupulaki e feliliuaki fakaʻatamai,D
Ko e fe ʻa e feituʻu ʻo e fetuʻutaki mo e kakai ʻoku ngalingali ʻe kau ai hano fakalotoa?,Fakafekauʻaki,Fetuʻutaki fakapaʻangá,Fetuʻutaki mo e Kakaí,Pisinisi ki he pisinisi,C
"ʻI he puipuituʻa ʻo e globalization, ʻe lava fefe ke tau fakaʻuhingaʻi lelei taha ʻa e foʻi lea ko e ʻ fakalakalaka ʻ?","ʻOku ʻuhinga ʻa e foʻi lea fakalakalaka ki he tuʻunga ʻo e faʻahinga ʻo e tangata ʻa ia ʻoku ʻi ai ʻa e tauʻataina mei he manavahee mo e fie maʻu; ʻoku ʻi ai ha ngaahi maʻuʻanga tokoni feʻunga ke paotoloaki ʻaki e moʻui pea ʻe lava ke maʻu ʻa e moʻui ni ʻi ha tuʻunga ʻoku tauʻataina mei he fakamanamana, pe fakamanamana, ʻo e fakahohaʻasi fakafokifa.","Ke fakakaukauʻi ʻo hange ko hono fakatupulaki, kuo pau ke aʻusia ʻe ha puleʻanga ha tuʻunga fakaʻekonomika mo fakapolitikale pau ʻi he polokalama fakaemamani lahi; Ko e tukunga ki he meʻa ʻoku hoko ko ha tuʻunga ʻ fakatupulaki ʻ ʻoku fakaʻuhingaʻi ia ʻe he ngaahi fie maʻu ko ia ʻo e fengaueʻaki ʻi he polokalama ni.","Ko e fakalakalaka ko ha founga ia ke lea ai ki he inequalities ʻoku ʻalu fakataha mo neoliberal globalization. ʻI he tuʻunga ko ʻeni, ʻoku ʻuhinga ʻa e fakalakalaka ki he malava ʻe ha kakai pe kolo ke fakaʻaongaʻi lelei ʻa e ngaahi maʻuʻanga tokoni mo fakatupulaki ʻa e lavameʻa ʻi hono ngaohi mo tufaki, ʻo poupouʻi ʻa e equitable lahi ange ʻo e paʻanga hu mai ʻi he sosaieti.",ʻOku ʻuhinga ʻa e fakalakalaka ʻo ha kolo ki he ngaahi founga ideological mo e tuʻunga ʻulungaanga mahuʻinga ʻoku maʻu ʻe hono kakai. ʻI he polokalama fakavahaʻapuleʻanga globalised ʻoku ʻuhinga ʻeni ki hono ohi ʻo e ngaahi fakakaukau Fakatemokalati ʻo e Hihifo mo e ʻekonomika ʻo e maketi.,C
Ko e fe ʻi he ngaahi meʻa ko ʻeni ʻoku ne fakamatalaʻi lelei taha Eurocentrism?,Ko e Eurocentrism ko ha founga ia ʻo e fakaikiiki ʻa ia ʻoku fakafehoanaki ai ʻa e ngaahi sosaieti ʻi ʻIulope ki he ngaahi sosaieti ʻoku ʻikai ʻi ʻIulope ke maʻu ha fakafehoanaki taʻefilifilimanako ʻo e ngaahi lelei ʻo e tokotaha takitaha.,Ko e Eurocentrism ko ha founga fakakaukau ia ʻoku ʻi ai ʻa e fakafuofuaʻi mo e fakafuofuaʻi ʻo e ngaahi sosaieti ʻoku ʻikai ʻi ʻIulope ʻi he ngaahi fakaʻuhinga fakafonua mo e pe ʻaʻata ʻo Europeans.,ʻOku fakamatalaʻi ʻe Eurocentrism ʻa e ngaahi ako pe ngaue fakaako ʻoku nau fakakaukauʻi pe ʻa e ngaahi founga fakapolitikale pe fakaʻekonomika ʻi ʻIulope.,Ngaahi fili kotoa ko ʻeni.,B
Ko e fē ʻi he ngaahi fakakaukau ko ʻení ʻoku nofotaha ʻi he founga ʻoku puleʻi ʻaki ʻe he sosaietí hono fakahoko ʻo e ngaahi ʻekitivitī ʻoku fie maʻu ki hono tauhi ʻo e māú mo e tuʻu maʻú?,Functionalism,Interactionism,Fakakaukau ki he fili fakapoto,Fakakaukau ki he fepakipaki,A
Ko e fe ʻi he ngaahi meʻa ni ko ha fakamatala fakatautaha ʻoku lava ke hu ki ai?,pepa hinehina ʻa e puleʻanga ʻ,ngaahi lekooti fakafaitoʻo ʻoku ʻikai fakahāhāhol,tohi ʻakauni ʻa e fāmilí,ʻa e lesisita ʻo ha pisinisi,C
Ko e fe ʻi he ngaahi meʻa ko ʻeni ʻoku ne poupouʻi ʻa e fakakikihi ki he unilateralism ʻAmelika?,Angaʻofa hegemony,ʻIkai ke ola lelei ʻa e multilateralism,Malohi ʻo ʻAmelika,Kotoa e ngaahi meʻa ʻi ʻolungá,D
Ko e ha ʻa e mahaki herpes vailasi ʻikai fakatupu?,Fakatamasiʻi mamatea,Ko e Encephalitis,Mahaki ʻoku ʻave fakasekisuale,Kanisaa,A
Ko e taumuʻa ʻo ha ako ʻoku kui tuʻo ua pe masked ke:,Aʻusia comparability ʻo e ngaahi kaveinga ʻoku ngaohi mo faitoʻo,Fakasiʻisiʻi e ngaahi nunuʻa ʻo e faikehekehe ʻi he sipinga,Fakaʻehiʻehi mei he mamata mo e kaveinga ʻoku taʻefaitotonu,Fakaʻehiʻehi mei he taʻefaitotonu mo e sipinga ʻo e faikehekehe,B
 Ko e fakamatala fungani Daodejing ʻoku ʻiloa ia ʻi he hingoa ʻi he lea faka-Pilitania?,Fungani ʻo e ngaahi liliu,Talafungani ʻo e Hala mo e Malohi,Talafungani ʻo e kakai fefine,Talafungani ʻo e filosofia,B
 ʻOku fekauʻaki ʻa e Communidades ti Base mo e fe ʻi he ngaahi meʻa ni?,Pīsope ʻOsikā Lomelo,Fakafepaki mo e fakafoʻou,Fakaʻeiʻeiki ʻo e faʻahinga kotoa ʻo e tangatá,Kotoa e ngaahi meʻa ʻi ʻolungá,D
Ko e seniale loea ko e ʻulu ia ʻo e ngaahi kautaha ko ʻeni?,Ko e komiti ʻa e Senato fakamau iku noa,Ko e Potungaue ʻo e fakamaau totonu,Ko e Potungaue ʻo e Siteiti,Ko e fakamau ko e kautau ʻa e seniale,B
Ko e ngaahi laine hiki fakamakinito fekauʻaki mo ha foomu uaea ʻoku lolotonga toʻotoʻo,ngaahi siakalé,ngaahi laine radial,ʻau ʻa ʻEti,pelu fakafuopotopoto ʻo e ivi,A
ʻOku ʻuhinga ʻa e foʻi lea ko e ʻ chili ʻa e kau Nifai ʻ ki he polo ʻaki ʻa e ha?,Piini,kakanoʻi manu,siisi,polo polo,B
Ko e fe ʻi he ngaahi meʻa ko ʻeni ʻoku ne fakamatalaʻi lelei taha ʻa e tukunga hili hono ʻohake ʻo e totongi ʻi ha koloa ʻoku ʻi ai ha fie maʻu inelastic?,He ʻikai liliu e lahi ʻo e meʻa ʻoku fie maʻu.,ʻE tupulaki ʻa e lahi ʻo e meʻa ʻoku fie maʻu.,ʻE holo e fakakatoa ʻo e paʻanga hu mai.,He ʻikai liliu e fakakatoa ʻo e paʻanga hu mai.,A
